entity,source_or_target,entity_type,initial_matching,lexical_matching,graphical_matching
source:Multi-author_Volume,Source,Class,multi author volume,"In the context of a conference, a multi-author volume refers to a publication or collection of papers or articles that are written by multiple authors. These volumes are often compiled and published as proceedings or proceedings books for conferences, where each author contributes a paper or article related to the conference theme or topic. The multi-author volume allows for the dissemination of research and knowledge presented at the conference to a wider audience.",The Multi-author Volume is disjoint with the Review. The Multi-author Volume is disjoint with the Programme Brochure. The Multi-author Volume is disjoint with the Paper. The Multi-author Volume is disjoint with the Web Site. A multi-author volume is disjoint with a flyer. A Multi-author Volume is a subclass of Document. Review is disjoint with Multi-author_Volume. A web site is disjoint with a multi-author volume. Proceedings are a subclass of Multi-author Volume. The Programme Brochure is disjoint with the Multi-author Volume. A flyer is disjoint with a multi-author volume. Paper is disjoint with Multi-author Volume. 
source:Individual_Presentation,Source,Class,individual presentation,"In the context of a conference, an Individual Presentation refers to a session where a single presenter delivers a talk or presentation on a specific topic or research. It typically involves one person sharing their knowledge, findings, or insights with the audience. The presenter may use visual aids such as slides, charts, or videos to support their presentation. Individual presentations are common in academic conferences, professional conferences, and other events where individuals are given the opportunity to showcase their work or expertise.",Individual Presentation is disjoint with Workshop. Individual Presentation is a subclass of Scientific Event. An invited talk is a subclass of individual presentation. A workshop is disjoint with an individual presentation. A Contributed Talk is a subclass of Individual Presentation. Tutorial is a subclass of Individual Presentation. The presentationOfPaper is a domain of Individual_Presentation. The paper is presented as an individual presentation. 
source:OC_Chair,Source,Class,oc chair,"In the context of a conference, OC_Chair typically refers to the Organizing Committee Chair. This person is responsible for overseeing and coordinating the various aspects of organizing the conference, including selecting the venue, managing the budget, coordinating with speakers and presenters, and ensuring the smooth execution of the event. The OC_Chair is usually a senior member of the organizing committee and plays a crucial role in the success of the conference.",OC_Chair is a subclass of OC_Member. 
source:Conference_Banquet,Source,Class,conference banquet,"Conference_Banquet refers to a formal meal or dinner that is organized as part of a conference or event. It is usually held in a banquet hall or a designated area within the conference venue. The purpose of a conference banquet is to provide attendees with an opportunity to network, socialize, and enjoy a meal together in a more relaxed and informal setting. It often includes speeches, presentations, and entertainment, and is considered a highlight of the conference program.",A Conference Banquet is a subclass of Social Event. 
source:Workshop_Chair,Source,Class,workshop chair,"In the context of a conference, a Workshop Chair refers to an individual who is responsible for organizing and overseeing the workshops that take place during the conference. They are typically in charge of selecting workshop proposals, coordinating with workshop presenters, scheduling the workshops, and ensuring that everything runs smoothly during the conference. The Workshop Chair may also be involved in promoting the workshops and managing any logistical aspects related to the workshops.",A Workshop Chair is a subclass of Conference Participant. A Workshop Chair is a subclass of PC Member. The Workshop Chair is disjoint with the PC Chair. The PC Chair is disjoint with the Workshop Chair. 
source:Conference_Proceedings,Source,Class,conference proceedings,"Conference proceedings refer to a collection of papers or articles that are presented at a conference or symposium. These proceedings typically include the full text or abstracts of the papers, as well as any additional materials such as posters or presentations. Conference proceedings are often published either in print or digital format and serve as a record of the research and discussions presented at the conference. They are a valuable resource for researchers and scholars in a particular field to stay updated on the latest developments and findings.",Conference Proceedings are a subclass of Proceedings. 
source:Session_Chair,Source,Class,session chair,"In the context of a conference, a Session Chair refers to an individual who is responsible for moderating and overseeing a specific session or panel discussion. The Session Chair introduces the speakers, manages the time allotted for each presentation, facilitates audience questions and discussions, and ensures that the session runs smoothly according to the conference schedule. They play a crucial role in maintaining the flow and organization of the conference program.",A Session Chair is a subclass of PC Member. A Session Chair is a subclass of Conference Participant. 
source:Early-Registered_Participant,Source,Class,early registered participant,"In the context of a conference, an Early-Registered Participant refers to an individual who has registered for the conference before a specified deadline or early registration period. Typically, conferences offer discounted registration fees or other benefits for participants who register early. Early-registered participants are often given priority for certain conference activities, such as selecting preferred sessions or workshops.",An early-registered participant is a subclass of conference participant. Early-Registered_Participant is disjoint with Late-Registered_Participant. Late-Registered_Participant is disjoint with Early-Registered_Participant. 
source:Late-Registered_Participant,Source,Class,late registered participant,"In the context of a conference, a Late-Registered Participant refers to an individual who registers for the conference after the designated deadline or cutoff date for registration. They are participants who have signed up for the conference later than the majority of attendees.",A late-registered participant is a subclass of conference participant. Late-Registered_Participant is disjoint with Early-Registered_Participant. Early-Registered_Participant is disjoint with Late-Registered_Participant. 
source:University,Source,Class,university,"In the context of a conference, the term ""University"" typically refers to an institution of higher education that offers undergraduate and postgraduate programs. Universities are often involved in organizing conferences, hosting academic events, and presenting research findings. They serve as venues for scholars, researchers, and experts to share knowledge, collaborate, and discuss various topics within their respective fields.",A university is a subclass of an academic institution. 
source:Possible_Reviewer,Source,Class,possible reviewer,"In the context of a conference, a Possible_Reviewer refers to an individual who is being considered or suggested as a potential reviewer for a submitted paper or proposal. They may possess the expertise or knowledge relevant to the topic of the submission and are being evaluated for their suitability to provide a review or evaluation of the work.",Possible reviewers are a subclass of persons. PC Member is a subclass of Possible Reviewer. Reviewer Possible_Reviewer is a reviewer of the domain Paper. The reviewWrittenBy range is Possible_Reviewer. The hasReviewer property has a range of Possible_Reviewer. 
source:Student,Source,Class,student,"In the context of a conference, a student typically refers to an individual who is currently enrolled in an educational institution, such as a high school, college, or university. They are often attending the conference to gain knowledge, network with professionals, present research or projects, or participate in discussions related to their field of study.",A student is a subclass of a person. 
source:Invited_Speaker,Source,Class,invited speaker,"In the context of a conference, an Invited Speaker refers to a person who is specifically invited by the conference organizers to give a presentation or deliver a talk at the event. These speakers are typically experts or influential individuals in their respective fields and are invited to share their knowledge, insights, or research with the conference attendees. Invited speakers are often chosen based on their expertise, reputation, and relevance to the conference theme or topic.",An invited speaker is a subclass of presenter. 
source:Presenter,Source,Class,presenter,"In the context of a conference, a presenter refers to an individual who delivers a speech, presentation, or lecture on a specific topic or subject. The presenter is responsible for sharing information, insights, or research findings with the audience. They may use visual aids, such as slides or multimedia, to enhance their presentation and engage the attendees. The presenter is typically an expert or knowledgeable person in their field, chosen to provide valuable content and contribute to the overall conference program.",A presenter is a subclass of conference participant. An invited speaker is a subclass of presenter. 
source:SC_Member,Source,Class,sc member,"In the context of a conference, SC_Member typically refers to a Steering Committee Member. The Steering Committee is a group of individuals responsible for overseeing and guiding the conference's planning and execution. SC_Members are usually experts or key stakeholders in the field or industry related to the conference's theme. They provide strategic direction, make important decisions, and ensure the conference's success.",SC_Member is a subclass of PC_Member. 
target:Hotel,Target,Class,hotel,"In the context of a conference, a hotel refers to a commercial establishment that provides lodging, accommodation, and often other services such as meeting rooms, banquet facilities, and catering for conferences and events. It is a venue where attendees can stay overnight and where the conference may be held or hosted.",A hotel is a subclass of a place. 
target:Place,Target,Class,place,"In the context of a conference, ""place"" refers to the physical location or venue where the conference is being held. It could be a specific building, hotel, convention center, or any other designated space where attendees gather to participate in the conference activities.",A hotel is a subclass of a place. A conference hall is a subclass of place. The main office is a subclass of place. Can stay in range place. 
target:Abstract,Target,Class,abstract,"In the context of a conference, an abstract refers to a brief summary or overview of a research paper, presentation, or project that is submitted for consideration. It typically includes the main objectives, methods, findings, and conclusions of the work. Abstracts are often used to evaluate the relevance and quality of the research and to help conference organizers determine which submissions should be accepted for presentation.",An abstract is a subclass of a document. 
target:Document,Target,Class,document,"In the context of a conference, a document refers to any written or printed material that is used for reference, presentation, or distribution during the event. This can include research papers, presentations, agendas, schedules, handouts, brochures, or any other written material that provides information or supports the discussions and presentations at the conference.",An abstract is a subclass of a document. Review is a subclass of Document. Paper is a subclass of Document. The presentation is presented by the Document. The presentation range of the document. Submit the document until the specified domain. 
target:Deadline_Abstract_Submission,Target,Class,deadline abstract submission,"In the context of a conference, ""Deadline_Abstract_Submission"" refers to the final date by which participants or presenters must submit their abstracts for consideration. An abstract is a summary or brief description of the research or presentation that will be given at the conference. The deadline serves as a cutoff point after which no more abstracts will be accepted for review.",The deadline for abstract submission is a subclass of the general deadline. 
target:Best_Applications_Paper_Award,Target,Class,best applications paper award,The Best Applications Paper Award in the context of a conference refers to an accolade given to the paper that demonstrates the most innovative and practical application of research findings or technology in a specific field. This award recognizes the paper that showcases the most impactful and effective implementation of theoretical concepts or methodologies in real-world scenarios. It acknowledges the paper's contribution to advancing knowledge and its potential for practical use in the industry or academia.,The Best Applications Paper Award is a subclass of Award. 
target:Award,Target,Class,award,"In the context of a conference, an award refers to a recognition or honor given to individuals, organizations, or projects for their outstanding achievements, contributions, or excellence in a particular field or category. Awards are often presented during conferences to acknowledge and celebrate the accomplishments of participants, speakers, researchers, or companies. They can be given in various forms, such as certificates, trophies, plaques, or monetary prizes. Awards in conferences serve as a way to motivate and inspire individuals or entities to continue their exceptional work and to showcase their success to the conference attendees.",The Best Applications Paper Award is a subclass of Award. The Best Student Paper Award is a subclass of Award. The Best Research Paper Award is a subclass of Award. Obtain the range of the award. The award is awarded by the entity. The award range of the Award. 
target:Deadline_Paper_Submission,Target,Class,deadline paper submission,Deadline_Paper_Submission refers to the final date by which authors or researchers must submit their papers or abstracts for consideration and review by the conference organizers. It is the deadline for submitting written work to be considered for presentation at the conference.,The deadline for paper submission is a subclass of deadline. 
target:Deadline,Target,Class,deadline,"In the context of a conference, a deadline refers to the date or time by which certain tasks, submissions, or actions need to be completed or submitted. It is a fixed point in time that serves as a cutoff for specific conference-related activities, such as submitting abstracts, registering for the conference, or making changes to presentations. Missing a deadline may result in exclusion from the conference or additional fees.",The deadline for paper submission is a subclass of deadline. The deadline for author notification is a subclass of deadline. The deadline for abstract submission is a subclass of deadline. The domain of 'designed_by' is 'Deadline'. Submit until the deadline. The design range has a deadline. The date domain has a deadline. 
target:Deadline_Author_notification,Target,Class,deadline author notification,"In the context of a conference, ""Deadline_Author_notification"" refers to the date by which the conference organizers will notify authors about the acceptance or rejection of their submitted papers or proposals. It is the deadline for the conference committee to inform the authors about the status of their submissions.",The deadline for author notification is a subclass of deadline. The notification until range is the deadline for author notification. 
target:Webmaster,Target,Class,webmaster,"In the context of a conference, a webmaster refers to an individual responsible for managing and maintaining a website. They are typically in charge of website design, development, content creation, and ensuring the website's functionality and performance. In a conference setting, a webmaster may be responsible for creating and updating the conference website, managing online registration systems, and handling any technical aspects related to the conference's online presence.",Webmaster is a subclass of Organizator. 
target:Organizator,Target,Class,organizator,"In the context of a conference, the term ""organizator"" is likely a misspelling or a variation of the word ""organizer."" An organizer refers to the person or entity responsible for planning, coordinating, and managing the various aspects of a conference, including logistics, scheduling, venue arrangements, and participant registration. The organizer ensures that the conference runs smoothly and efficiently.",An organizator is a subclass of person. Webmaster is a subclass of Organizator. The Program Chair is a subclass of Organizator. The General Chair is a subclass of Organizator. A Program_Committee_member is a subclass of Organizator. An Organizing_Committee_member is a subclass of Organizator. 
target:Author_of_paper_student,Target,Class,author of paper student,"In the context of a conference, ""Author_of_paper_student"" refers to a student who has authored a paper that will be presented or discussed at the conference. This term is used to identify the student as the author of the paper, distinguishing them from other authors who may be professionals or researchers.",The author of a paper student is a subclass of an author. 
target:Best_Student_Paper_Award,Target,Class,best student paper award,"The Best_Student_Paper_Award in the context of a conference refers to an accolade or recognition given to the student who has presented the most outstanding paper or research work at the conference. It is typically awarded to a student who has demonstrated exceptional research skills, innovative ideas, and high-quality presentation skills. This award aims to encourage and acknowledge the achievements of young researchers and students in their respective fields.",The Best Student Paper Award is a subclass of Award. 
target:Author,Target,Class,author,"In the context of a conference, an author typically refers to an individual or a group of individuals who have contributed to the creation of a research paper, article, or presentation that is being presented or discussed at the conference. The author(s) are responsible for conducting the research, analyzing the data, and writing the paper. They are recognized as the original creators and contributors of the work.",The author is a subclass of the speaker. The author of a paper student is a subclass of an author. The author of a paper is a subclass of an author. The domain of the triple is Author. The domain of submit is Author. The notification until domain is Author. 
target:ACM_SIGKDD,Target,Class,acm sigkdd,"ACM_SIGKDD refers to the Association for Computing Machinery's Special Interest Group on Knowledge Discovery and Data Mining. It is a professional organization that focuses on the field of data mining and knowledge discovery. ACM_SIGKDD organizes the annual KDD conference, which is one of the premier conferences in the field, bringing together researchers, practitioners, and industry professionals to discuss the latest advancements and trends in data mining and knowledge discovery.",ACM_SIGKDD is held by range. ACM_SIGKDD holds the domain of graphical entities. The designed_by range is ACM_SIGKDD. The search domain is ACM_SIGKDD. The design domain of ACM_SIGKDD is graphical. ACM_SIGKDD is searched by range. 
target:Conference,Target,Class,conference,"In the context of a conference, the term ""conference"" refers to a formal meeting or gathering of individuals who come together to discuss and exchange information, ideas, and opinions on a specific topic or field of interest. Conferences often involve presentations, panel discussions, workshops, and networking opportunities, allowing participants to learn from experts, share their own knowledge, and establish professional connections. Conferences can be organized by various institutions, such as academic institutions, professional associations, or businesses, and they can cover a wide range of subjects, including science, technology, business, education, and more.",The domain of 'holded_by' is 'Conference'. Hold a conference within a specific range. The name of the conference is Domain Conference. The conference has started. The city of the conference is Conference. The conference has ended. 
target:Sponzor,Target,Class,sponzor,"In the context of a conference, a ""sponzor"" is a misspelling of the word ""sponsor."" A sponsor is an individual, organization, or company that provides financial or other support to an event, such as a conference, in exchange for advertising or promotional opportunities. Sponsors often contribute funds, resources, or services to help cover the costs of organizing and hosting the conference. In return, they receive recognition, branding, and exposure to the conference attendees.",An exhibitor is a subclass of a sponsor. A Bronze Supporter is a subclass of Sponzor. A Platinum Supporter is a subclass of Sponzor. A Gold Supporter is a subclass of Sponzor. The Best Student Paper Supporter is a subclass of Sponsor. A Silver Supporter is a subclass of Sponzor. The search range is sponsored by Sponzor. Sponzor is searched by domain. The domain of Name_of_sponsor is Sponzor. 
target:Exhibitor,Target,Class,exhibitor,"In the context of a conference, an exhibitor refers to a company, organization, or individual who showcases their products, services, or ideas at a designated booth or space within the conference venue. Exhibitors typically set up displays, demonstrations, and promotional materials to attract attendees and potential customers. They use this opportunity to network, generate leads, and create awareness about their offerings.",An exhibitor is a subclass of a sponsor. 
target:Registration_SIGMOD_Member,Target,Class,registration sigmod member,"In the context of a conference, ""Registration_SIGMOD_Member"" refers to the registration category or type specifically for members of the SIGMOD (Special Interest Group on Management of Data) community. It indicates that individuals who are members of SIGMOD can register for the conference under this category, which may offer certain benefits or discounts exclusive to SIGMOD members.",Registration_SIGMOD_Member is a subclass of Registration_fee. 
target:Registration_fee,Target,Class,registration fee,"In the context of a conference, the registration fee refers to the amount of money that participants are required to pay in order to attend or register for the conference. It is a fee charged by the organizers to cover the costs associated with organizing and hosting the event, such as venue rental, speaker fees, materials, meals, and other logistical expenses. The registration fee is typically set at a fixed amount and may vary depending on factors such as early bird discounts, student rates, or additional options like workshops or social events.",The registration fee is a subclass of fee. Registration_SIGMOD_Member is a subclass of Registration_fee. Registration_Non-Member is a subclass of Registration_fee. Registration_SIGKDD_Member is a subclass of Registration_fee. Registration_Student is a subclass of Registration_fee. The pay range has a registration fee. The registration fee is paid by the domain. The price of domain registration is the registration fee. The registration fee for the currency domain. 
target:Person,Target,Class,person,"In the context of a conference, a person refers to an individual who is attending or participating in the conference. This can include attendees, speakers, organizers, sponsors, or any other individual involved in the event.",An organizator is a subclass of person. A speaker is a subclass of a person. Listener is a subclass of Person. A person pays. A person can stay in a domain. The 'payed_by' property has a range of 'Person'. A person belongs to a nation. The name of the person is domain. The e-mail domain belongs to the person. 
target:Bronze_Supporter,Target,Class,bronze supporter,"In the context of a conference, a Bronze Supporter typically refers to a level of sponsorship or support provided by an organization or individual. It indicates that the supporter has contributed at a certain level, usually lower than higher tiers such as Silver or Gold, to help fund or support the conference. The specific benefits or recognition associated with being a Bronze Supporter may vary depending on the conference and its sponsorship packages.",A Bronze Supporter is a subclass of Sponzor. 
target:Committee,Target,Class,committee,"In the context of a conference, a committee refers to a group of individuals who are appointed or elected to perform specific tasks or make decisions related to the organization and management of the conference. Committees are typically responsible for various aspects such as program planning, logistics, finance, publicity, and other important areas. They work together to ensure the smooth execution of the conference and to achieve its objectives.",The Best Paper Awards Committee is a subclass of Committee. The Program_Committee is a subclass of Committee. The Organizing_Committee is a subclass of Committee. 
