entity,source_or_target,entity_type,initial_matching,lexical_matching,graphical_matching
source:Event,Source,Class,event,"In the context of a conference, an event refers to a specific activity or occurrence that takes place during the conference. It can include various activities such as keynote speeches, panel discussions, workshops, networking sessions, social events, exhibitions, and presentations. Events are organized to provide attendees with opportunities to learn, share knowledge, network, and engage with other participants.",Events are disjoint with persons. A person is disjoint with an event. Scientific Event is a subclass of Event. A social event is a subclass of event. The event is on the list. The inverse of partOf_7 is an event. partOfEvent is a property that has domain Event. The partOfEvent property has a range of Event. The listsEvent range Event. The domain of hasEvent is Event. The range of hasEvent is Event. The event is organised by the domain. The location of the range event is unknown. The event is held in a specific domain. The range organises the Event. 
source:Person,Source,Class,person,"In the context of a conference, a person refers to an individual who is attending or participating in the conference. This can include attendees, speakers, organizers, sponsors, or any other individual involved in the event.",A person is disjoint with a location. A person is disjoint with a document. A person is disjoint with an organisation. A person is disjoint with an event. An event is disjoint with a person. A Paper_Author is a subclass of Person. An Agency Staff Member is a subclass of Person. An organisation is disjoint with a person. A conference participant is a subclass of a person. Location is disjoint with Person. A possible reviewer is a subclass of person. A student is a subclass of a person. The document is disjoint with the person. The writtenBy property has a range of Person. The authorOf domain is Person. 
source:Accepted_Paper,Source,Class,accepted paper,"In the context of a conference, an Accepted_Paper refers to a paper that has been reviewed and deemed suitable for presentation at the conference. It means that the paper has successfully passed the review process and has been accepted by the conference organizers. However, it is important to note that the Accepted_Paper is not the final version that will be included in the conference proceedings. The authors of the accepted paper are usually required to make revisions and submit a camera-ready version, which is the final version that will be published in the conference proceedings.",Accepted Paper is disjoint with Rejected Paper. Accepted Paper is disjoint with Camera Ready Paper. Accepted Paper is a subclass of Evaluated Paper. A camera-ready paper is disjoint with an accepted paper. The concept of Rejected_Paper is disjoint with the concept of Accepted_Paper. 
source:Rejected_Paper,Source,Class,rejected paper,"In the context of a conference, a ""Rejected_Paper"" refers to a research paper or submission that has been reviewed by the conference organizers or program committee and deemed unsuitable for acceptance. It means that the paper did not meet the criteria or standards set by the conference for inclusion in the proceedings or presentation at the event.",Rejected_Paper is disjoint with Accepted_Paper. A rejected paper is a subclass of an evaluated paper. Accepted Paper is disjoint with Rejected Paper. 
source:Evaluated_Paper,Source,Class,evaluated paper,"In the context of a conference, an Evaluated_Paper refers to a research paper that has undergone a rigorous evaluation process by experts in the field. This evaluation typically involves a peer review process, where the paper is reviewed by other researchers or scholars who assess its quality, originality, methodology, and contribution to the field. The evaluation helps determine whether the paper meets the standards and criteria set by the conference organizers for acceptance and presentation at the conference.",Evaluated_Paper is disjoint with Camera_Ready_Paper. Evaluated Paper is a subclass of Assigned Paper. Accepted Paper is a subclass of Evaluated Paper. Camera Ready Paper is disjoint with Evaluated Paper. A rejected paper is a subclass of an evaluated paper. 
source:Camera_Ready_Paper,Source,Class,camera ready paper,"In the context of a conference, a Camera-Ready Paper refers to the final version of a research paper that has been accepted for presentation at the conference. After the initial submission and review process, authors are typically required to make revisions and improvements based on the feedback received. Once these revisions are made, the final version of the paper is considered ""camera-ready"" and is ready to be included in the conference proceedings or program. The term ""camera-ready"" originated from the practice of physically printing the papers for distribution, where the final version was ready to be photographed or copied for publication. Nowadays, it usually refers to the digital version of the paper that is ready for publication.",A Camera Ready Paper is a subclass of Paper. A camera-ready paper is disjoint with a submitted paper. A camera-ready paper is disjoint with an accepted paper. Camera Ready Paper is disjoint with Evaluated Paper. Accepted Paper is disjoint with Camera Ready Paper. Evaluated_Paper is disjoint with Camera_Ready_Paper. Submitted Paper is disjoint with Camera Ready Paper. 
source:Positive_Review,Source,Class,positive review,"In the context of a conference, a Positive_Review typically refers to a favorable evaluation or assessment of a presentation, paper, or session given by an attendee or reviewer. It indicates that the content, delivery, or overall quality of the presentation was well-received and met or exceeded expectations.",Positive Review is disjoint with Negative Review. Positive reviews and neutral reviews are mutually exclusive. A positive review is a subclass of review. A neutral review is disjoint with a positive review. A negative review is disjoint with a positive review. 
source:Workshop_Paper,Source,Class,workshop paper,"In the context of a conference, a Workshop_Paper refers to a paper that is submitted and presented at a workshop session within the conference. Workshops are typically smaller, more focused sessions that allow for in-depth discussions and interactions among participants. Workshop papers often explore specific topics or themes related to the conference's main theme and provide an opportunity for researchers and practitioners to present their work, receive feedback, and engage in collaborative discussions.",A workshop paper is disjoint with an industrial paper. A workshop paper is disjoint with a conference paper. A Workshop Paper is a subclass of Paper. A conference paper is disjoint with a workshop paper. Industrial Paper is disjoint with Workshop Paper. 
source:Industrial_Paper,Source,Class,industrial paper,"In the context of a conference, ""Industrial_Paper"" typically refers to a type of presentation or research paper that focuses on topics related to industrial processes, manufacturing, technology, or engineering. It may cover areas such as industrial automation, supply chain management, production optimization, quality control, or any other aspect related to industrial operations.",Industrial Paper is a subclass of Paper. Industrial Paper is disjoint with Poster Paper. Industrial Paper is disjoint with Regular Paper. Industrial Paper is disjoint with Workshop Paper. Industrial Paper is disjoint with Demo Paper. A workshop paper is disjoint with an industrial paper. Regular paper is disjoint with industrial paper. A poster paper is disjoint with an industrial paper. The concept of Demo_Paper is disjoint with the concept of Industrial_Paper. 
source:Paper,Source,Class,paper,"In the context of a conference, a paper refers to a written document that presents research findings, analysis, or a specific topic related to the conference theme. It is typically submitted by researchers, scholars, or experts in the field and is often peer-reviewed before being accepted for presentation at the conference. Papers are usually presented orally or in poster format during specific sessions or workshops at the conference.",Paper is disjoint with Programme Brochure. Paper is disjoint with Multi-author Volume. Paper is disjoint with Flyer. Paper is disjoint with Proceedings. Paper is disjoint with Web Site. Paper is disjoint with Review. Paper is a subclass of Document. A Workshop Paper is a subclass of Paper. A Camera_Ready_Paper is a subclass of Paper. A conference paper is a subclass of a paper. Industrial Paper is a subclass of Paper. The paper is disjoint with the review. A Regular Paper is a subclass of Paper. The Multi-author Volume is disjoint with the Paper. Submitted_Paper is a subclass of Paper. A web site is disjoint with a paper. Proceedings are disjoint with Paper. A Poster Paper is a subclass of Paper. The Programme Brochure is disjoint with the Paper. A flyer is disjoint with a paper. A Demo_Paper is a subclass of Paper. A Paper has a Review. The reviewer is the range of the property 'reviewerOfPaper' which is a Paper. A review of the paper is a type of paper. A Paper has a Reviewer. 
source:Conference_Paper,Source,Class,conference paper,"In the context of a conference, a Conference_Paper refers to a written document that presents research, findings, or ideas related to a specific topic or theme. It is typically submitted by researchers, scholars, or experts in their respective fields to be presented at a conference. Conference papers are often peer-reviewed and selected based on their quality and relevance to the conference's objectives. They serve as a means for researchers to share their work, receive feedback, and engage in discussions with other participants at the conference.",A conference paper is disjoint with a workshop paper. A conference paper is a subclass of a paper. A workshop paper is disjoint with a conference paper. 
source:Industrial_Session,Source,Class,industrial session,"In the context of a conference, an Industrial Session refers to a specific session or track that focuses on topics related to industry-specific issues, challenges, and advancements. It typically involves presentations, discussions, and panels led by experts from various industries, sharing their insights, research, and experiences. Industrial Sessions aim to provide a platform for industry professionals to exchange knowledge, network, and explore potential collaborations.",An Industrial Session is a subclass of Conference Session. 
source:Conference_Session,Source,Class,conference session,"In the context of a conference, a Conference_Session refers to a specific period of time during the conference program where a particular topic or theme is discussed or presented. It is a scheduled segment of the conference that typically includes presentations, panel discussions, workshops, or other interactive sessions related to a specific subject. Conference sessions are designed to provide attendees with opportunities to learn, share knowledge, exchange ideas, and engage in discussions with experts and peers in their field of interest.",A conference session is disjoint with a workshop session. A Conference Session is a subclass of Session. An Industrial Session is a subclass of Conference Session. A workshop session is disjoint with a conference session. 
source:Regular_Session,Source,Class,regular session,"In the context of a conference, a Regular_Session refers to a scheduled session or presentation that is part of the standard program or agenda. It typically involves a speaker or a panel of speakers delivering talks or presentations on a specific topic within the conference's theme or subject area. Regular sessions are usually open to all conference attendees and are designed to provide valuable information, insights, and discussions related to the conference's main focus.",Regular_Session is disjoint with Poster_Session. Regular_Session is disjoint with Demo_Session. A Regular_Session is a subclass of Session. Demo_Session is disjoint with Regular_Session. A Poster Session is disjoint with a Regular Session. 
source:Poster_Session,Source,Class,poster session,"A poster session is a specific format of presenting research or projects at a conference. It involves the creation of a poster that visually summarizes the key points, findings, or objectives of the research or project. During the session, participants display their posters on designated boards or walls, and attendees can walk around and engage in discussions with the presenters. It provides an opportunity for researchers to showcase their work, receive feedback, and network with other attendees.",A Poster Session is disjoint with a Regular Session. A Poster Session is disjoint with a Demo Session. A Poster Session is a subclass of Session. Regular sessions are disjoint with poster sessions. Demo_Session is disjoint with Poster_Session. 
source:Demo_Session,Source,Class,demo session,"In the context of a conference, a Demo_Session refers to a session or presentation where a demonstration of a product, technology, or software is given. It is an opportunity for the presenter to showcase the features, functionality, and benefits of their product to the audience. The session typically involves a live demonstration, allowing attendees to see the product in action and ask questions.",Demo_Session is disjoint with Poster_Session. Demo_Session is disjoint with Regular_Session. A Demo_Session is a subclass of Session. Regular_Session is disjoint with Demo_Session. A Poster Session is disjoint with a Demo Session. 
source:Session,Source,Class,session,"In the context of a conference, a session refers to a scheduled period of time during which a specific topic or theme is discussed or presented. It typically involves a group of speakers or presenters who share their knowledge, research, or insights on a particular subject. Sessions can vary in length, ranging from a few minutes to several hours, and may include presentations, panel discussions, workshops, or interactive activities.",A session is disjoint with a conference. Session is disjoint with Contributed Talk. A session is disjoint with an invited talk. A session is disjoint with a workshop. Session is disjoint with Tutorial. A session is disjoint with a track. A session is a subclass of a scientific event. A Regular_Session is a subclass of Session. A Demo_Session is a subclass of Session. A Workshop Session is a subclass of Session. The track is disjoint with the session. A Poster Session is a subclass of Session. An invited talk is disjoint with a session. A workshop is disjoint with a session. A contributed talk is disjoint with a session. A Conference Session is a subclass of Session. Tutorial is disjoint with Session. A conference is disjoint with a session. 
source:Abstract,Source,Class,abstract,"In the context of a conference, an abstract refers to a brief summary or overview of a research paper, presentation, or project that is submitted for consideration. It typically includes the main objectives, methods, findings, and conclusions of the work. Abstracts are often used to evaluate the relevance and quality of the research and to help conference organizers determine which submissions should be accepted for presentation.",An abstract is a subclass of a document. The Tutorial_Abstract class is a subclass of the Abstract class. An Invited Talk Abstract is a subclass of Abstract. 
source:Document,Source,Class,document,"In the context of a conference, a document refers to any written or printed material that is used for reference, presentation, or distribution during the event. This can include research papers, presentations, agendas, schedules, handouts, brochures, or any other written material that provides information or supports the discussions and presentations at the conference.",The document is disjoint with the person. An abstract is a subclass of a document. A person is disjoint with a document. Review is a subclass of Document. A Multi-author Volume is a subclass of Document. A web site is a subclass of a document. A Programme Brochure is a subclass of Document. A flyer is a subclass of a document. Paper is a subclass of Document. The document is written by someone. Document has an updated version. The range of hasUpdatedVersion is Document. The updated version of the document is in the domain of Document. The updated version of the range document. The authorOf range is Document. 
source:Paper_Author,Source,Class,paper author,"In the context of a conference, a Paper_Author refers to an individual who has contributed to the creation of a research paper that is being presented or published at the conference. The Paper_Author is typically one of the main contributors to the research, and their name is listed as an author on the paper.",A Paper_Author is a subclass of Person. 
source:Conference_Trip,Source,Class,conference trip,"In the context of a conference, a Conference_Trip refers to a journey or travel undertaken by individuals or a group of people to attend a conference. It typically involves traveling to a specific location where the conference is being held, staying for the duration of the event, and then returning to the original location. The purpose of the Conference_Trip is to participate in the conference, attend presentations, workshops, networking sessions, and engage with other attendees to exchange knowledge and ideas.",A conference trip is a subclass of social event. 
source:Social_Event,Source,Class,social event,"In the context of a conference, a social event refers to any planned gathering or activity that allows attendees to interact and socialize with each other outside of the formal conference sessions. These events are typically organized to provide networking opportunities, build relationships, and foster a sense of community among conference participants. Social events can include activities such as cocktail receptions, dinners, parties, outings, or any other social gathering that encourages attendees to engage in informal conversations and connect with one another.",A social event is disjoint with a contributed talk. A social event is disjoint with a conference. A social event is not the same as an invited talk. A social event is disjoint with a track. A social event is disjoint with a workshop. A social event is disjoint with a tutorial. A social event is a subclass of event. A conference trip is a subclass of social event. The track is disjoint with the social event. An invited talk is disjoint with a social event. A Conference Banquet is a subclass of Social Event. A workshop is disjoint with a social event. A contributed talk is disjoint with a social event. Tutorial is disjoint with Social Event. A conference is disjoint with a social event. 
source:Tutorial_Abstract,Source,Class,tutorial abstract,"In the context of a conference, a Tutorial_Abstract refers to a summary or abstract of a tutorial session that will be conducted during the conference. It provides an overview of the tutorial's content, objectives, and key takeaways. The Tutorial_Abstract helps attendees understand the scope and relevance of the tutorial and decide whether they want to participate in it.",The Tutorial_Abstract class is a subclass of the Abstract class. 
source:Conference_Participant,Source,Class,conference participant,"In the context of a conference, a Conference_Participant refers to an individual or entity that attends or takes part in the conference. They may be speakers, presenters, panelists, attendees, organizers, sponsors, or any other role involved in the conference.",A conference participant is a subclass of a person. A demo chair is a subclass of conference participant. The tutorial chair is a subclass of conference participant. An OC Member is a subclass of Conference Participant. A Workshop Chair is a subclass of Conference Participant. A Session Chair is a subclass of Conference Participant. An early-registered participant is a subclass of conference participant. The PC Chair is a subclass of Conference Participant. A late-registered participant is a subclass of conference participant. A presenter is a subclass of conference participant. 
source:Submitted_Paper,Source,Class,submitted paper,"In the context of a conference, a Submitted_Paper refers to a research paper or article that has been submitted by an author or researcher for consideration and review by the conference organizers. The paper is typically related to the conference theme or topic and undergoes a peer-review process to determine its suitability for presentation at the conference.",Submitted_Paper is a subclass of Paper. Submitted Paper is disjoint with Camera Ready Paper. A camera-ready paper is disjoint with a submitted paper. Assigned Paper is a subclass of Submitted Paper. 
source:Assigned_Paper,Source,Class,assigned paper,"In the context of a conference, ""Assigned_Paper"" refers to a research paper that has been allocated or designated to a specific individual or group for presentation or discussion at the conference. It implies that the paper has been assigned to a particular presenter or session within the conference program.",Assigned Paper is a subclass of Submitted Paper. An evaluated paper is a subclass of an assigned paper. 
source:Negative_Review,Source,Class,negative review,"In the context of a conference, a Negative_Review refers to a critical evaluation or feedback provided by a participant or attendee regarding a particular aspect of the conference. It could include dissatisfaction with the organization, content, speakers, facilities, or any other aspect of the event. Negative reviews are often used to highlight areas for improvement and help organizers make necessary changes for future conferences.",A Negative_Review is a subclass of Review. A negative review is disjoint with a neutral review. A negative review is disjoint with a positive review. Positive Review is disjoint with Negative Review. Neutral_Review is disjoint with Negative_Review. 
source:Review,Source,Class,review,"In the context of a conference, a review typically refers to a critical evaluation or assessment of a research paper, presentation, or session. It involves analyzing the content, methodology, findings, and overall quality of the work presented. Reviews are often conducted by experts in the field who provide feedback, suggestions, and recommendations to the authors or presenters. The purpose of reviews is to ensure the rigor, validity, and relevance of the research or presentation and to help improve its quality.",The paper is disjoint with the review. Review disjointWith Proceedings. The Programme Brochure is disjoint with the Review. Review is disjoint with Flyer. The Web_Site class is disjoint with the Review class. Review is disjoint with Multi-author_Volume. Review is a subclass of Document. A positive review is a subclass of review. A neutral review is a subclass of review. The Multi-author Volume is disjoint with the Review. A web site is disjoint with a review. Proceedings are disjoint with Review. A Negative_Review is a subclass of Review. The Programme Brochure is disjoint with the Review. A flyer is disjoint with a review. Paper is disjoint with Review. The hasReview property has a range of Review. The reviewOfPaper domain is Review. A review is written by a person. 
source:Neutral_Review,Source,Class,neutral review,"In the context of a conference, the term ""Neutral_Review"" typically refers to a process where a submitted paper or research work is evaluated by an impartial reviewer who does not have any conflicts of interest or bias towards the authors or their work. The neutral review aims to provide an unbiased assessment of the quality, relevance, and contribution of the submission to the conference.",A neutral review is a subclass of review. Neutral_Review is disjoint with Negative_Review. A neutral review is disjoint with a positive review. A positive review is disjoint with a neutral review. A negative review is disjoint with a neutral review. 
source:Research_Topic,Source,Class,research topic,"In the context of a conference, a research topic refers to the subject or area of study that a researcher or presenter focuses on. It is the specific theme or subject matter that the research or presentation revolves around. Research topics are typically chosen based on their relevance, significance, and potential contribution to the field of study.",The research topic covers the range of Research_Topic. The topic covered by the domain Research_Topic is topicCoveredBy. 
source:Organising_Agency,Source,Class,organising agency,"In the context of a conference, the term ""Organising Agency"" refers to the entity or organization responsible for planning, coordinating, and managing the conference. This agency is typically in charge of various aspects such as selecting the venue, setting the conference theme, inviting speakers, managing registrations, arranging logistics, and overseeing the overall execution of the event. The organizing agency plays a crucial role in ensuring the conference runs smoothly and successfully.",The organising agency is disjoint with the academic institution. An Organising Agency is a subclass of Organisation. Academic Institution is disjoint with Organising Agency. 
