entity,source_or_target,entity_type,initial_matching,lexical_matching,graphical_matching
source:Academic_Institution,Source,Class,academic institution,"In the context of a conference, an Academic Institution refers to a university, college, or any other educational organization that offers academic programs and conducts research. It typically includes faculties, departments, research centers, and affiliated organizations involved in academic pursuits. Academic institutions often participate in conferences to present their research findings, share knowledge, collaborate with other institutions, and engage in academic discussions and networking.",An academic institution is a subclass of organisation. Academic Institution is disjoint with Organising Agency. The organising agency is disjoint with the academic institution. A research institute is a subclass of an academic institution. A university is a subclass of an academic institution. Scientifically organises the domain of academic institutions. Scientifically organised by range academic institution. 
source:Organisation,Source,Class,organisation,"In the context of a conference, the term ""organisation"" typically refers to the entity or group responsible for planning, coordinating, and managing the conference. This can include tasks such as selecting the venue, setting the agenda, inviting speakers, managing registrations, and overseeing logistics. The organisation may be a company, association, institution, or any other group that takes on the responsibility of hosting the conference.",An organisation is disjoint with a person. The Organising Agency is a subclass of Organisation. Proceedings Publisher is a subclass of Organisation. A person is disjoint with an organisation. An academic institution is a subclass of organisation. The publisher of an organisation is the entity that publishes it. Technically organises the domain of organisation. 
source:Proceedings_Publisher,Source,Class,proceedings publisher,"In the context of a conference, Proceedings_Publisher refers to the entity or organization responsible for publishing the proceedings of the conference. Proceedings typically include the papers, abstracts, presentations, and other materials presented at the conference. The Proceedings_Publisher may be a publishing company, a university press, or an organization affiliated with the conference itself. They are responsible for compiling, editing, and distributing the proceedings to the conference attendees or making them available for purchase or access by the wider academic community.",Proceedings Publisher is a subclass of Organisation. 
source:Poster_Paper,Source,Class,poster paper,"In the context of a conference, a Poster_Paper refers to a type of presentation format where researchers or authors present their work in the form of a poster. A Poster_Paper typically includes a visual display of the research findings, methodology, and conclusions on a large poster board. Attendees can view the poster and interact with the presenter to discuss the research in detail. Poster_Papers are often displayed in a designated area of the conference venue, allowing participants to browse through multiple posters and engage in discussions with the authors.",A poster paper is disjoint with an industrial paper. A poster paper is disjoint with a regular paper. Poster Paper is disjoint with Demo Paper. A Poster Paper is a subclass of Paper. Industrial Paper is disjoint with Poster Paper. Regular Paper is disjoint with Poster Paper. The Demo Paper is disjoint with the Poster Paper. 
source:Regular_Paper,Source,Class,regular paper,"In the context of a conference, a Regular Paper refers to a type of submission that typically represents original research or scholarly work. Regular Papers are usually more comprehensive and detailed than other types of submissions, such as short papers or posters. They often follow a specific format, including sections such as introduction, methodology, results, and conclusion. Regular Papers are typically peer-reviewed and selected for presentation at the conference based on their quality, relevance, and contribution to the field of study.",Regular paper is disjoint with industrial paper. Regular Paper is disjoint with Poster Paper. Regular Paper is disjoint with Demo Paper. A Regular Paper is a subclass of Paper. Industrial Paper is disjoint with Regular Paper. A poster paper is disjoint with a regular paper. The concept of Demo_Paper is disjoint with the concept of Regular_Paper. 
source:Demo_Paper,Source,Class,demo paper,"In the context of a conference, a Demo_Paper refers to a type of submission that showcases a demonstration or prototype of a research project or technology. It typically includes a description of the system, its functionalities, and the underlying research or technical aspects. Demo_Papers are often presented in dedicated sessions or as part of a poster session, allowing researchers to showcase their work and provide hands-on experiences to conference attendees.",The Demo Paper is disjoint with the Poster Paper. The concept of Demo_Paper is disjoint with the concept of Industrial_Paper. The Demo Paper is disjoint with the Regular Paper. A Demo_Paper is a subclass of Paper. Industrial Paper is disjoint with Demo Paper. Regular Paper is disjoint with Demo Paper. Poster Paper is disjoint with Demo Paper. 
source:Location,Source,Class,location,"In the context of a conference, the term ""location"" refers to the physical place or venue where the conference is being held. It typically includes details such as the city, country, specific building or hotel, and any other relevant information about the venue. The location is an important aspect of a conference as it determines the accessibility, convenience, and overall atmosphere of the event.",Location is disjoint with Person. A person is disjoint with a location. The location of the domain is Location. The event is held in a location. 
source:Research_Institute,Source,Class,research institute,"In the context of a conference, a Research Institute refers to an organization or institution that focuses on conducting research in a specific field or discipline. These institutes are often affiliated with universities, government agencies, or private organizations and are dedicated to advancing knowledge and understanding in their respective areas of expertise. They typically engage in various research activities, including conducting experiments, analyzing data, publishing research papers, and collaborating with other researchers. In a conference setting, a Research Institute may present their latest research findings, share insights, and engage in discussions with other participants.",A research institute is a subclass of an academic institution. 
source:Scientific_Event,Source,Class,scientific event,"In the context of a conference, a Scientific_Event refers to a gathering or meeting that focuses on the exchange of scientific knowledge, research findings, and advancements in a particular field or discipline. It typically involves presentations, discussions, workshops, and networking opportunities for scientists, researchers, academics, and professionals to share their work, collaborate, and stay updated with the latest developments in their respective fields.",Scientific Event is a subclass of Event. Track is a subclass of Scientific Event. A workshop is a subclass of a scientific event. A session is a subclass of a scientific event. Individual Presentation is a subclass of Scientific Event. Conference is a subclass of Scientific Event. 
source:Invited_Talk_Abstract,Source,Class,invited talk abstract,"In the context of a conference, an Invited_Talk_Abstract refers to a summary or brief description of a talk or presentation that has been specifically invited by the conference organizers. It is typically provided by the speaker or presenter to give attendees an overview of the content and key points that will be covered in their talk. Invited talks are often given by experts or prominent individuals in their respective fields and are intended to provide valuable insights or perspectives to the conference attendees.",An Invited Talk Abstract is a subclass of Abstract. 
source:Agency_Staff_Member,Source,Class,agency staff member,"In the context of a conference, an Agency_Staff_Member refers to an individual who is employed by an agency to provide support or assistance during the conference. This person may be responsible for various tasks such as registration, logistics, coordination, or any other duties assigned by the agency organizing the conference. They are typically not part of the core organizing team but are hired on a temporary basis to ensure the smooth running of the event.",An Agency Staff Member is a subclass of Person. 
source:Workshop_Session,Source,Class,workshop session,"In the context of a conference, a Workshop_Session refers to a specific session or activity within the conference program that is designed to provide hands-on learning, practical skills, or interactive discussions on a particular topic. It typically involves a smaller group of participants and is led by an expert or facilitator who guides the session. Workshops can cover a wide range of subjects and are intended to provide attendees with a more immersive and interactive learning experience compared to traditional lecture-style presentations.",A workshop session is disjoint with a conference session. A Workshop Session is a subclass of Session. A conference session is disjoint with a workshop session. 
source:Track,Source,Class,track,"In the context of a conference, a track refers to a specific theme or topic area that is covered in a series of related presentations or sessions. Conferences often have multiple tracks running simultaneously, allowing attendees to choose the sessions that align with their interests or professional focus. Each track typically consists of a set of presentations, workshops, or panel discussions that delve into various aspects of the chosen theme.",The track is disjoint with the session. Track is disjoint with Invited_Talk. The track is disjoint with the workshop. The track is disjoint with the tutorial. The track is disjoint with the social event. Track is disjoint with Contributed_Talk. The track is disjoint with the conference. Track is a subclass of Scientific Event. An invited talk is disjoint with a track. A social event is disjoint with a track. A workshop is disjoint with a track. A session is disjoint with a track. A contributed talk is disjoint with a track. The tutorial is disjoint with the track. A conference is disjoint with a track. 
source:Invited_Talk,Source,Class,invited talk,"In the context of a conference, an Invited Talk refers to a presentation or lecture given by a speaker who has been specifically invited by the conference organizers. This speaker is typically an expert or a prominent figure in their field, and their talk is often a highlight of the conference program. Invited Talks are intended to provide valuable insights, share research findings, or discuss important topics related to the conference theme.",An invited talk is disjoint with a workshop. An invited talk is disjoint with a social event. An invited talk is disjoint with a tutorial. An invited talk is disjoint with a contributed talk. An invited talk is disjoint with a track. An invited talk is disjoint with a conference. An invited talk is disjoint with a session. An invited talk is a subclass of individual presentation. Track is disjoint with Invited_Talk. A social event is not the same as an invited talk. A workshop is disjoint with an invited talk. A session is disjoint with an invited talk. A contributed talk is disjoint with an invited talk. Tutorial is disjoint with Invited Talk. A conference is disjoint with an invited talk. 
source:Workshop,Source,Class,workshop,"In the context of a conference, a workshop refers to a session or event where participants engage in interactive activities, discussions, and practical exercises related to a specific topic or skill. Workshops are typically designed to provide hands-on learning experiences, promote collaboration and problem-solving, and allow participants to gain practical knowledge and skills in a specific area. They often involve group work, presentations, demonstrations, and active participation from attendees.",A workshop is disjoint with a conference. A workshop is disjoint with a session. A workshop is disjoint with a tutorial. A workshop is disjoint with a track. A workshop is disjoint with a social event. A workshop is disjoint with an individual presentation. A workshop is disjoint with an invited talk. A workshop is a subclass of a scientific event. The track is disjoint with the workshop. An invited talk is disjoint with a workshop. A social event is disjoint with a workshop. A session is disjoint with a workshop. Individual Presentation is disjoint with Workshop. Tutorial is disjoint with Workshop. A conference is disjoint with a workshop. 
source:Tutorial,Source,Class,tutorial,"In the context of a conference, a tutorial refers to a session or workshop that provides in-depth instruction or guidance on a specific topic or skill. Tutorials are typically led by experts or experienced individuals who aim to teach attendees practical knowledge and techniques. These sessions often involve hands-on activities, demonstrations, and opportunities for participants to ask questions and interact with the instructor. Tutorials are designed to enhance the learning experience and provide attendees with valuable insights and practical skills related to the conference theme or subject matter.",The tutorial is disjoint with the track. The tutorial is disjoint with the conference. Tutorial is disjoint with Workshop. The tutorial is disjoint with the contributed talk. Tutorial is disjoint with Social Event. Tutorial is disjoint with Invited Talk. Tutorial is disjoint with Session. Tutorial is a subclass of Individual Presentation. Track is disjoint with Tutorial. An invited talk is disjoint with a tutorial. A social event is disjoint with a tutorial. A workshop is disjoint with a tutorial. Session is disjoint with Tutorial. A contributed talk is disjoint with a tutorial. Conference is disjoint with Tutorial. 
source:Contributed_Talk,Source,Class,contributed talk,"In the context of a conference, a Contributed Talk refers to a presentation or speech given by an individual who has submitted their work or research to be considered for inclusion in the conference program. The talk is typically based on the individual's own contributions to a particular field or topic and is meant to share their findings, insights, or ideas with the conference attendees. Contributed Talks are often shorter in duration compared to keynote or invited talks and provide an opportunity for researchers, scholars, or professionals to present their work to a wider audience.",A contributed talk is disjoint with a social event. A contributed talk is disjoint with a session. A contributed talk is disjoint with a conference. A contributed talk is disjoint with an invited talk. A contributed talk is disjoint with a tutorial. A contributed talk is disjoint with a track. A Contributed Talk is a subclass of Individual Presentation. Track is disjoint with Contributed_Talk. An invited talk is disjoint with a contributed talk. A social event is disjoint with a contributed talk. Session is disjoint with Contributed Talk. The tutorial is disjoint with the contributed talk. A conference is disjoint with a contributed talk. 
source:Conference,Source,Class,conference,"In the context of a conference, the term ""conference"" refers to a formal gathering or meeting of individuals who come together to discuss and exchange information, ideas, and opinions on a specific topic or field of interest. It typically involves presentations, panel discussions, workshops, and networking opportunities for participants to learn, collaborate, and share their expertise. Conferences can be organized by various institutions, organizations, or professional bodies to promote knowledge sharing, professional development, and networking within a specific industry or academic discipline.",A conference is disjoint with a social event. Conference is disjoint with Tutorial. Conference is disjoint with Contributed Talk. A conference is disjoint with a workshop. A conference is disjoint with an invited talk. A conference is disjoint with a session. A conference is disjoint with a track. Conference is a subclass of Scientific Event. The track is disjoint with the conference. An invited talk is disjoint with a conference. A social event is disjoint with a conference. A workshop is disjoint with a conference. A session is disjoint with a conference. A contributed talk is disjoint with a conference. The tutorial is disjoint with the conference. 
source:Demo_Chair,Source,Class,demo chair,"In the context of a conference, a Demo_Chair refers to the individual who is responsible for overseeing and organizing the demonstration sessions or presentations at the conference. They are in charge of coordinating the logistics, scheduling, and technical aspects of the demo sessions, ensuring that they run smoothly and efficiently. The Demo_Chair may also be involved in the selection and evaluation of the demos to be presented at the conference.",A demo chair is a subclass of conference participant. 
source:Tutorial_Chair,Source,Class,tutorial chair,"In the context of a conference, a Tutorial Chair refers to an individual or a committee responsible for organizing and overseeing the tutorial sessions at the conference. They are in charge of selecting and inviting tutorial presenters, coordinating the scheduling and logistics of the tutorial sessions, and ensuring that the tutorials align with the conference theme and objectives. The Tutorial Chair(s) may also be involved in reviewing and selecting tutorial proposals submitted by potential presenters.",The tutorial chair is disjoint with the PC chair. The tutorial chair is a subclass of conference participant. The Tutorial Chair is a subclass of PC Member. The PC Chair is disjoint with the Tutorial Chair. 
source:PC_Chair,Source,Class,pc chair,"In the context of a conference, PC_Chair refers to the Program Committee Chair. The PC_Chair is responsible for overseeing the program committee, which is a group of experts who review and select the papers or presentations that will be included in the conference program. The PC_Chair typically leads the committee in the evaluation and selection process, ensuring the quality and relevance of the conference content. They may also be involved in organizing the conference and coordinating with other chairs or organizers.",The PC Chair is disjoint with the Tutorial Chair. The PC Chair is disjoint with the Workshop Chair. The PC Chair is a subclass of Conference Participant. The PC Chair is a subclass of PC Member. The tutorial chair is disjoint with the PC chair. The Workshop Chair is disjoint with the PC Chair. 
source:PC_Member,Source,Class,pc member,"In the context of a conference, PC_Member refers to the Program Committee Member. The Program Committee is responsible for reviewing and selecting the papers or presentations that will be included in the conference program. PC_Members are typically experts in the field related to the conference topic and are responsible for evaluating the quality, relevance, and originality of the submissions. They play a crucial role in shaping the content and ensuring the overall quality of the conference.",PC Member is a subclass of Possible Reviewer. The Tutorial Chair is a subclass of PC Member. A Workshop Chair is a subclass of PC Member. A Session Chair is a subclass of PC Member. The PC Chair is a subclass of PC Member. SC_Member is a subclass of PC_Member. 
source:OC_Member,Source,Class,oc member,"In the context of a conference, OC_Member typically refers to an Organizing Committee Member. These individuals are responsible for planning, organizing, and managing various aspects of the conference, such as selecting speakers, coordinating logistics, managing finances, and ensuring the smooth execution of the event. OC_Members play a crucial role in the success of a conference.",An OC Member is a subclass of Conference Participant. OC_Chair is a subclass of OC_Member. 
source:Proceedings,Source,Class,proceedings,"In the context of a conference, proceedings refer to the collection of papers, abstracts, presentations, and other materials that are published or made available after the conference. These proceedings typically include summaries or full texts of the research papers, keynote speeches, panel discussions, and other contributions presented during the conference. They serve as a record of the event and provide a platform for sharing and disseminating the knowledge and findings presented at the conference. Proceedings are often published in print or digital formats and can be accessed by conference attendees, researchers, and the general public.",Proceedings are a subclass of Multi-author Volume. Proceedings are disjoint with Web Site. Proceedings are disjoint with Paper. Proceedings are disjoint with Programme Brochure. Proceedings are disjoint with Flyer. Proceedings are disjoint with Review. Review disjointWith Proceedings. A web site is disjoint with proceedings. Conference Proceedings are a subclass of Proceedings. The Programme Brochure is disjoint with the Proceedings. A flyer is disjoint with proceedings. Paper is disjoint with Proceedings. 
source:Programme_Brochure,Source,Class,programme brochure,"In the context of a conference, a Programme Brochure refers to a document or booklet that provides detailed information about the conference program, schedule, sessions, speakers, and other relevant information. It serves as a guide for attendees, helping them navigate through the conference and plan their participation accordingly. The Programme Brochure may also include additional information about the conference venue, sponsors, exhibitors, and any special events or activities taking place during the conference.",The Programme Brochure is disjoint with the Flyer. The Programme Brochure is disjoint with the Web Site. The Programme Brochure is disjoint with the Paper. The Programme Brochure is disjoint with the Multi-author Volume. The Programme Brochure is disjoint with the Review. The Programme Brochure is disjoint with the Proceedings. A Programme Brochure is a subclass of Document. The Programme Brochure is disjoint with the Review. The Multi-author Volume is disjoint with the Programme Brochure. A web site is disjoint with a programme brochure. Proceedings are disjoint with Programme Brochure. A flyer is disjoint with a programme brochure. Paper is disjoint with Programme Brochure. 
source:Flyer,Source,Class,flyer,"In the context of a conference, a flyer typically refers to a promotional material or document that provides information about the conference. It is usually a printed or digital document that includes details such as the conference theme, date, time, location, agenda, speakers, and registration information. The purpose of a conference flyer is to attract attendees and provide them with essential information about the event.",A flyer is disjoint with a web site. A flyer is disjoint with a paper. A flyer is disjoint with a review. A flyer is disjoint with a multi-author volume. A flyer is disjoint with proceedings. A flyer is disjoint with a programme brochure. A flyer is a subclass of a document. Review is disjoint with Flyer. A multi-author volume is disjoint with a flyer. A web site is disjoint with a flyer. Proceedings are disjoint with Flyer. The Programme Brochure is disjoint with the Flyer. Paper is disjoint with Flyer. 
source:Web_Site,Source,Class,web site,"In the context of a conference, a web site refers to a collection of related web pages that are hosted on a server and accessible through the internet. It serves as an online platform where conference organizers can provide information about the event, including details about the schedule, speakers, registration process, venue, and any other relevant information. Participants can visit the website to gather information, register for the conference, access resources, and stay updated on any updates or changes related to the event.",A web site is disjoint with a programme brochure. A web site is disjoint with proceedings. A web site is disjoint with a review. A web site is disjoint with a multi-author volume. A web site is disjoint with a flyer. A web site is disjoint with a paper. A web site is a subclass of a document. The Web_Site class is disjoint with the Review class. The Multi-author Volume is disjoint with the Web Site. Proceedings are disjoint with Web Site. The Programme Brochure is disjoint with the Web Site. A flyer is disjoint with a web site. Paper is disjoint with Web_Site. 
