entity,source_or_target,entity_type,initial_matching,lexical_matching,graphical_matching
target:IndustryOrganization,Target,Class,industry organization,"In the context of a conference, an Industry Organization refers to a professional body or association that represents the interests of companies and individuals in a particular industry or business sector. These organizations often host or participate in conferences to share knowledge, discuss industry trends, network, and advocate for their industry's interests. Examples of industry organizations include the American Medical Association, the National Restaurant Association, or the International Game Developers Association.",Industry Organization is a subclass of Organization. Industry Organization is completely separate and has no overlap with NGO. Industry Organization is completely separate from Academia Organization. Industry Organization is completely separate from Government Organization. Academia Organization and Industry Organization are completely separate from each other. Non-Governmental Organizations are completely separate from Industry Organizations. Government Organization and Industry Organization are completely separate from each other.
target:NGO,Target,Class,n g o,"In the context of a conference, NGO stands for Non-Governmental Organization. These are nonprofit entities independent of government involvement. They are often involved in humanitarian, educational, health care, public policy, social, human rights, environmental, and other areas. They may attend conferences to discuss these issues, network, and plan initiatives.",An NGO is a subclass of an Organization. Non-Governmental Organizations are completely separate from Industry Organizations. Non-Governmental Organizations are completely separate from Academic Organizations. Non-Governmental Organizations are completely separate from Government Organizations. The organization of academia is completely separate and has no overlap with a non-governmental organization. Industry Organization is disjoint with NGO. Government Organization is completely separate and has no overlap with NGO.
target:GovernmentOrganization,Target,Class,government organization,"In the context of a conference, a Government Organization refers to a body or entity that is part of the government. This could be a department, agency, or any other type of organization that is run by the government. They may participate in conferences to share information, discuss policies, or collaborate with other organizations.",Government Organization is completely separate from NGO. Government Organization is completely separate and has no overlap with Industry Organization. Government organizations are completely separate from academia organizations. A Government Organization is a subclass of an Organization. Academia Organization is completely separate and has no overlap with Government Organization. Non-Governmental Organizations are completely separate from Government Organizations. Industry Organization is completely separate and has no overlap with Government Organization.
target:ComputerNetworksEnterpriseTopic,Target,Class,computer networks enterprise topic,"The term 'ComputerNetworksEnterpriseTopic' in the context of a conference likely refers to a specific topic or session that focuses on the subject of enterprise computer networks. This could cover a range of issues such as network architecture, security, management, and the implementation of new technologies in a business or corporate environment.",The topic of Computer Networks Enterprise is a subcategory of the topic of Computer Networks. The topic of Enterprise in Computer Networks is disjoint with the topic of Switching in Computer Networks. The topic of enterprise in computer networks is completely separate and has no overlap with the topic of sensors in computer networks. The topic of Enterprise in Computer Networks is completely separate from the topic of Security in Computer Networks. The topic of Enterprise in Computer Networks is disjoint with the topic of Optical in Computer Networks. The topic of Enterprise in Computer Networks is disjoint with the topic of Measurements in Computer Networks. The topic of Enterprise in Computer Networks is disjoint with the topic of Management in Computer Networks. The topic of Computer Networks Enterprise is disjoint with the topic of Computer Networks Applications. The topic of Optical Computer Networks is completely separate from the topic of Enterprise Computer Networks. The topic of Computer Networks Measurements is completely separate and has no overlap with the topic of Computer Networks Enterprise. The topic of Computer Networks Management is completely separate and has no overlap with the topic of Computer Networks Enterprise. The topic of Switching in Computer Networks is completely separate from the topic of Enterprise in Computer Networks. The topic of Computer Networks Sensor is completely separate and has no overlap with the topic of Computer Networks Enterprise. The topic of Computer Networks Security is completely separate and has no overlap with the topic of Computer Networks Enterprise. The topic of applications in computer networks is disjoint with the topic of enterprise in computer networks.
target:ComputerNetworksSwitchingTopic,Target,Class,computer networks switching topic,"In the context of a conference, 'ComputerNetworksSwitchingTopic' likely refers to a specific subject or session that focuses on the aspect of switching in computer networks. Switching is a crucial function in networking that involves directing data from one device to another within a network or between different networks. The topic could cover various types of switching like packet switching, circuit switching, etc., and their applications, advancements, challenges, and future prospects.",The topic of switching in computer networks is completely separate from the topic of sensors in computer networks. The topic of Switching in Computer Networks is completely separate from the topic of Security in Computer Networks. The topic of switching in computer networks is completely separate from the topic of optical in computer networks. The topic of Switching in Computer Networks is completely separate from the topic of Measurements in Computer Networks. The topic of Switching in Computer Networks is completely separate from the topic of Management in Computer Networks. The topic of Switching in Computer Networks is completely separate from the topic of Enterprise in Computer Networks. The topic of Switching in Computer Networks is completely separate from the topic of Applications in Computer Networks. The topic of Switching in Computer Networks is a subcategory of the topic of Computer Networks. The topic of Enterprise in Computer Networks is completely separate from the topic of Switching in Computer Networks. The topic of Optical in Computer Networks is disjoint with the topic of Switching in Computer Networks. The topic of Computer Networks Measurements is completely separate and has no overlap with the topic of Computer Networks Switching. The topic of Computer Networks Management is completely separate and has no overlap with the topic of Computer Networks Switching. The topic of Computer Networks Sensor is completely separate and has no overlap with the topic of Computer Networks Switching. The topic of Computer Networks Security is completely separate and has no overlap with the topic of Computer Networks Switching. The topic of applications in computer networks is completely separate from the topic of switching in computer networks.
target:ComputerNetworksSensorTopic,Target,Class,computer networks sensor topic,"The term 'ComputerNetworksSensorTopic' seems to be a combination of several keywords related to a specific area of study or discussion in a conference. 1. Computer Networks: This refers to the study or discussion of data networks allowing computer systems to exchange data or information. 2. Sensor: This could refer to the use of sensors in computer networks, which is a significant topic in areas like Internet of Things (IoT), where sensors collect data and send it through the network. 3. Topic: This simply refers to the subject of discussion. So, in a conference setting, 'ComputerNetworksSensorTopic' would likely refer to a discussion or presentation focused on the use, implementation, or study of sensors in computer networks.",The topic of Computer Networks Sensor is completely separate and has no overlap with the topic of Computer Networks Switching. The topic of Computer Networks Sensor is completely separate and has no overlap with the topic of Computer Networks Security. The topic of Computer Networks Sensor is completely different and has no overlap with the topic of Computer Networks Optical. The topic of Computer Networks Sensor is completely separate and has no overlap with the topic of Computer Networks Measurements. The topic of Computer Networks Sensor is completely separate and has no overlap with the topic of Computer Networks Management. The topic of Computer Networks Sensor is completely separate and has no overlap with the topic of Computer Networks Enterprise. The topic of Computer Networks Sensor is completely separate and has no overlap with the topic of Computer Networks Applications. The topic of Computer Networks Sensor is a subclass of the topic of Computer Networks. The topic of Enterprise in Computer Networks is disjoint with the topic of Sensor in Computer Networks. The topic of Optical Computer Networks is completely separate and has no overlap with the topic of Sensor Computer Networks. The topic of Computer Networks Measurements is completely separate and has no overlap with the topic of Computer Networks Sensor. The topic of Computer Networks Management is completely separate and has no overlap with the topic of Computer Networks Sensor. The topic of Switching in Computer Networks is completely separate from the topic of Sensors in Computer Networks. The topic of Computer Networks Security is completely separate and has no overlap with the topic of Computer Networks Sensor. The topic of applications in computer networks is disjoint with the topic of sensors in computer networks.
target:ComputerNetworksSecurityTopic,Target,Class,computer networks security topic,"ComputerNetworksSecurityTopic in the context of a conference refers to a specific subject or theme that focuses on the security aspects of computer networks. This could include discussions on various threats to computer networks, strategies for protecting networks from cyber attacks, encryption methods, firewall systems, intrusion detection systems, etc. It's a specialized topic often discussed in tech or cybersecurity conferences.",The topic of Computer Networks Security is a subcategory of the topic of Computer Networks. The topic of Computer Networks Security is completely separate from the topic of Computer Networks Switching. The topic of Computer Networks Security is completely separate and has no overlap with the topic of Computer Networks Sensor. The topic of Computer Networks Security is completely separate and has no overlap with the topic of Computer Networks Optical. The topic of Computer Networks Security is completely separate from the topic of Computer Networks Measurements. The topic of Computer Networks Security is completely separate and has no overlap with the topic of Computer Networks Management. The topic of Computer Networks Security is completely separate and has no overlap with the topic of Computer Networks Enterprise. The topic of Computer Networks Security is completely separate from the topic of Computer Networks Applications. The topic of Enterprise in Computer Networks is disjoint with the topic of Security in Computer Networks. The topic of Optical Computer Networks is completely separate from the topic of Computer Network Security. The topic of Computer Networks Measurements is completely separate and has no overlap with the topic of Computer Networks Security. The topic of Computer Networks Management is completely separate and has no overlap with the topic of Computer Networks Security. The topic of Switching in Computer Networks is completely separate from the topic of Security in Computer Networks. The topic of Computer Networks Sensor is completely separate and has no overlap with the topic of Computer Networks Security. The topic of applications in computer networks is completely separate from the topic of security in computer networks.
target:ComputerNetworksOpticalTopic,Target,Class,computer networks optical topic,"The term 'ComputerNetworksOpticalTopic' is not a standard term in the context of conferences. However, it could potentially refer to a specific topic or session within a conference that focuses on the use of optical technology in computer networks. This could include discussions on fiber optic cables, optical switches, or other hardware used in data transmission, as well as software and protocols for managing optical networks.",The topic of Optical in Computer Networks is disjoint with the topic of Switching in Computer Networks. The topic of Optical Computer Networks is completely separate and has no overlap with the topic of Sensor Computer Networks. The topic of Optical Computer Networks is completely separate from the topic of Computer Networks Security. The topic of Optical in Computer Networks is disjoint with the topic of Measurements in Computer Networks. The topic of Optical Computer Networks is completely separate from the topic of Computer Networks Management. The topic of Optical Computer Networks is completely separate from the topic of Enterprise Computer Networks. The topic of Optical Computer Networks is completely separate from the topic of Computer Networks Applications. The topic of Optical in Computer Networks is a subcategory of the topic of Computer Networks. The topic of Enterprise in Computer Networks is disjoint with the topic of Optical in Computer Networks. The topic of Computer Networks Measurements is completely separate and has no overlap with the topic of Computer Networks Optical. The topic of Computer Networks Management is completely separate and has no overlap with the topic of Computer Networks Optical. The topic of Switching in Computer Networks is completely separate from the topic of Optical in Computer Networks. The topic of Computer Networks Sensor is completely different and has no overlap with the topic of Computer Networks Optical. The topic of Computer Networks Security is completely separate from the topic of Computer Networks Optical. The topic of applications in computer networks is disjoint with the topic of optical in computer networks.
target:ComputerNetworksMeasurementsTopic,Target,Class,computer networks measurements topic,"ComputerNetworksMeasurementsTopic in the context of a conference refers to a specific subject or area of discussion that focuses on the methods, techniques, and tools used to measure various aspects of computer networks. This can include measuring network performance, traffic, speed, latency, reliability, and other related metrics. It can also involve discussions on new research, advancements, and challenges in this field.",The topic of Computer Networks Measurements is completely separate and has no overlap with the topic of Computer Networks Switching. The topic of Computer Networks Measurements is disjoint with the topic of Computer Networks Sensor. The topic of Computer Networks Measurements is completely separate and has no overlap with the topic of Computer Networks Security. The topic of Computer Networks Measurements is completely separate and has no overlap with the topic of Computer Networks Optical. The topic of Computer Networks Measurements is completely separate from the topic of Computer Networks Management. The topic of Computer Networks Measurements is completely separate and has no overlap with the topic of Computer Networks Enterprise. The topic of Computer Networks Measurements is completely separate and has no overlap with the topic of Computer Networks Applications. The topic of Computer Networks Measurements is a subcategory of the topic of Computer Networks. The topic of Computer Networks Enterprise is completely separate and has no overlap with the topic of Computer Networks Measurements. The topic of Optical in Computer Networks is disjoint with the topic of Measurements in Computer Networks. The topic of Computer Networks Management is completely separate and has no overlap with the topic of Computer Networks Measurements. The topic of Switching in Computer Networks is completely separate from the topic of Measurements in Computer Networks. The topic of Computer Networks Sensor is completely separate and has no overlap with the topic of Computer Networks Measurements. The topic of Computer Networks Security is completely separate and has no overlap with the topic of Computer Networks Measurements. The topic of applications in computer networks is disjoint with the topic of measurements in computer networks.
target:ComputerNetworksManagementTopic,Target,Class,computer networks management topic,"ComputerNetworksManagementTopic in the context of a conference refers to a specific subject or area of discussion that focuses on the management of computer networks. This could include topics such as network configuration, network monitoring and control, network performance analysis, network security, troubleshooting network issues, and the implementation of network policies and procedures. It could also involve discussions on the latest technologies, tools, and trends in computer network management.",The topic of Computer Networks Management is a subcategory of the topic of Computer Networks. The topic of Computer Networks Management is completely separate and has no overlap with the topic of Computer Networks Switching. The topic of Computer Networks Management is completely separate and has no overlap with the topic of Computer Networks Sensor. The topic of Computer Networks Management is completely separate from the topic of Computer Networks Security. The topic of Computer Networks Management is completely separate and has no overlap with the topic of Computer Networks Optical. The topic of Computer Networks Management is completely separate and has no overlap with the topic of Computer Networks Measurements. The topic of Computer Networks Management is completely separate and has no overlap with the topic of Computer Networks Enterprise. The topic of Computer Networks Management is completely separate and has no overlap with the topic of Computer Networks Applications. The topic of Enterprise in Computer Networks is disjoint with the topic of Management in Computer Networks. The topic of Optical Computer Networks is completely separate from the topic of Computer Networks Management. The topic of Computer Networks Measurements is completely separate from the topic of Computer Networks Management. The topic of Switching in Computer Networks is completely separate from the topic of Management in Computer Networks. The topic of Computer Networks Sensor is completely separate and has no overlap with the topic of Computer Networks Management. The topic of Computer Networks Security is completely separate from the topic of Computer Networks Management. The topic of applications in computer networks is disjoint with the topic of management in computer networks.
target:ComputerNetworksAapplicationsTopic,Target,Class,computer networks applications topic,"In the context of a conference, 'ComputerNetworksAapplicationsTopic' likely refers to a specific topic or session that focuses on the applications of computer networks. This could cover a wide range of subjects, such as the use of computer networks in business, education, healthcare, or other fields. It could also discuss new technologies or advancements in computer networking. The exact content would depend on the specific conference and the experts presenting.",The topic of 'Computer Networks Applications' is a subclass of the topic 'Computer Networks'. The topic of applications in computer networks is completely separate from the topic of switching in computer networks. The topic of applications in computer networks is disjoint with the topic of sensors in computer networks. The topic of applications in computer networks is disjoint with the topic of security in computer networks. The topic of applications in computer networks is completely separate from the topic of optical in computer networks. The topic of applications in computer networks is disjoint with the topic of measurements in computer networks. The topic of applications in computer networks is disjoint with the topic of management in computer networks. The topic of 'Computer Networks Applications' is completely separate and has no overlap with the topic of 'Computer Networks Enterprise'. The topic of Enterprise in Computer Networks is disjoint with the topic of Applications in Computer Networks. The topic of Optical in Computer Networks is disjoint with the topic of Applications in Computer Networks. The topic of Computer Networks Measurements is completely separate and has no overlap with the topic of Computer Networks Applications. The topic of Computer Networks Management is completely separate from the topic of Computer Networks Applications. The topic of Switching in Computer Networks is completely separate from the topic of Applications in Computer Networks. The topic of Computer Networks Sensor is completely separate and has no overlap with the topic of Computer Networks Applications. The topic of Computer Networks Security is completely separate from the topic of Computer Networks Applications.
target:ActivePaper,Target,Class,active paper,"ActivePaper is not a standard term in the context of conferences. It could potentially refer to a digital or interactive document being presented or discussed at a conference. However, without specific context, it's hard to provide an accurate definition. It's best to refer to the conference's guidelines or materials for their specific use of the term.","ActivePaper is a subclass of Paper. ActivePaper is completely separate and has no overlap with PendingPaper. ActivePaper is completely separate and has no overlap with WithdrawnPaper. ActivePaper is completely separate and has nothing in common with RejectedPaper. ActivePaper is completely separate from AcceptedPaper. ActivePaper and PublishedPaper are completely separate, they do not overlap. The entity 'PublishedPaper' is disjoint with the entity 'ActivePaper'. The entity 'WithdrawnPaper' is disjoint with the entity 'ActivePaper'. The entity 'AcceptedPaper' is disjoint with the entity 'ActivePaper'. The entity 'RejectedPaper' is disjoint with the entity 'ActivePaper'. The category of 'PendingPaper' is completely separate and has no overlap with the category of 'ActivePaper'. Rated Papers is a subclass of Active Paper. The domain of 'hasRating' is 'ActivePaper'."
target:PendingPaper,Target,Class,pending paper,"In the context of a conference, a PendingPaper refers to a paper or research submission that is still under review or consideration. It has been submitted but not yet accepted, rejected, or published. The decision is still pending from the conference organizers or the review committee.",PendingPaper is a subclass of Paper. The category of 'PendingPaper' is completely separate and has no overlap with the category of 'ActivePaper'. Pending papers are completely separate from withdrawn papers. Pending papers are completely separate from rejected papers. Pending Paper and Accepted Paper are completely separate from each other. Pending papers are completely separate from published papers. ActivePaper is completely separate and has no overlap with PendingPaper. Published papers are completely separate from pending papers. The entity 'WithdrawnPaper' is disjoint with the entity 'PendingPaper'. The entity 'AcceptedPaper' is disjoint with the entity 'PendingPaper'. The entity 'RejectedPaper' is disjoint with the entity 'PendingPaper'.
target:WithdrawnPaper,Target,Class,withdrawn paper,"A WithdrawnPaper in the context of a conference refers to a paper or presentation that was initially accepted to be part of the conference program but was later withdrawn by the author(s) for various reasons. This could be due to the author(s) being unable to attend, deciding to present their work elsewhere, or any other reason that prevents them from participating in the conference.",The entity 'WithdrawnPaper' is disjoint with the entity 'PendingPaper'. The entity 'WithdrawnPaper' is disjoint with the entity 'ActivePaper'. The entity 'WithdrawnPaper' is disjoint with the entity 'RejectedPaper'. The entity 'WithdrawnPaper' is disjoint with the entity 'AcceptedPaper'. The entity 'WithdrawnPaper' is disjoint with the entity 'PublishedPaper'. A withdrawn paper is a type of paper. ActivePaper is completely separate and has no overlap with WithdrawnPaper. A published paper is completely separate and different from a withdrawn paper. The entity 'AcceptedPaper' is disjoint with the entity 'WithdrawnPaper'. The entity 'RejectedPaper' is disjoint with the entity 'WithdrawnPaper'. Pending Paper and Withdrawn Paper are completely separate from each other.
