entity,source_or_target,entity_type,initial_matching,lexical_matching,graphical_matching
target:ReviewQuestion,Target,Class,review question,"In the context of a conference, a Review Question is a question posed by a reviewer or panel member to the presenter or author of a paper or study. This question is typically aimed at clarifying certain points, challenging assumptions, or probing deeper into the research or presentation. The purpose is to ensure the quality and validity of the presented work.",The entity 'ReviewQuestion' is disjoint with the entity 'Document'. The entity 'ReviewQuestion' is completely separate and has no overlap with the entity 'ConferenceSession'. The concept of 'ReviewQuestion' is completely separate and has no overlap with the concept of 'Place'. The concept of 'ReviewQuestion' is completely separate and has no overlap with the concept of 'Country'. The concept of a Review Question is completely separate and does not overlap with the concept of a Person. The concept of 'ReviewQuestion' is completely separate and has no overlap with the concept of 'Sponsorship'. The entity 'ReviewQuestion' is disjoint with the entity 'Call'. The entity 'ReviewQuestion' is disjoint with the entity 'Organization'. The entity 'ReviewQuestion' is disjoint with the entity 'ReviewRating'. The entity 'ReviewQuestion' is disjoint with the entity 'ConferenceEvent'. The concept of 'ReviewQuestion' is completely separate and does not overlap with the concept of 'Conference'. The concept of 'Review Question' is completely separate and has no overlap with the concept of 'Personal History'. The entity 'ReviewQuestion' is disjoint with the entity 'ReviewForm'. The entity 'ReviewQuestion' is disjoint with the entity 'Topic'. The concept of 'ReviewQuestion' is completely separate and has no overlap with the concept of 'ContactInformation'. The topic is completely separate from the review question. Contact Information and Review Question are completely separate from each other. The place is not the same as the review question. The entity 'Document' is disjoint with the entity 'ReviewQuestion'. Sponsorship and ReviewQuestion are completely separate from each other. A TextualReviewQuestion is a type of ReviewQuestion. Numerical Review Question is a subclass of Review Question. The entity 'Call' is disjoint with the entity 'ReviewQuestion'. ConferenceEvent and ReviewQuestion are completely separate and do not overlap. The concept of a Conference is completely separate and has no overlap with the concept of a ReviewQuestion. The entity 'ConferenceSession' is disjoint with the entity 'ReviewQuestion'. ReviewRating and ReviewQuestion are completely separate and do not overlap. The entity 'ReviewForm' is completely separate and has no overlap with the entity 'ReviewQuestion'. Personal History and Review Question are completely separate and do not overlap. A person cannot be a review question. The concept of 'Country' is completely separate and does not overlap with the concept of 'ReviewQuestion'. The organization is completely separate from the review question.
target:Person,Target,Class,person,"In the context of a conference, a person refers to an individual who is participating in the event. This could be a speaker, attendee, organizer, sponsor, exhibitor, or any other role involved in the conference.",A person cannot be a review question. A person cannot be a review rating. A person cannot be a conference session. A person cannot be a conference. A person is completely separate and distinct from personal history. A person is completely separate and different from a document. A person cannot be a country. A person is completely separate and different from a place. The entity 'Person' is completely separate and has no overlap with the entity 'Topic'. A person cannot be a conference event. A person is completely separate and different from an organization. A person cannot be a review form. A person cannot be a sponsorship. A person cannot be a call. The topic is completely separate from the person. A Conference Chair is a subclass of a Person. The concept of a ReviewQuestion is completely separate and does not overlap with the concept of a Person. The place is completely separate from the person. The category 'Document' is completely separate and has no overlap with the category 'Person'. An attendee is a subclass of a person. Sponsorship and Person are completely separate and do not overlap. Call is disjoint with Person. The concept of a ConferenceEvent is completely separate and has no overlap with the concept of a Person. A conference is completely separate and has no overlap with a person. The concept of a Conference Session is completely separate and does not overlap with the concept of a Person. A Session Chair is a subclass of a Person. A TPCMember is a subclass of a Person. Review Rating and Person are completely separate and do not overlap. The concept of a ReviewForm is completely separate and does not overlap with the concept of a Person. Personal History and Person are completely separate and do not overlap. The category of 'Country' is completely separate and does not overlap with the category of 'Person'. The category of Organization is completely separate and does not overlap with the category of Person. A person can be an attendee at something. The 'hasMember' is in the range of 'Person'. The range of 'hasAttendee' is 'Person'. A person is a member of a domain. The domain of 'hasFirstName' is 'Person'. A person has a biography. The domain of 'hasLastName' is 'Person'.
target:Country,Target,Class,country,"In the context of a conference, 'Country' typically refers to the nation that a participant, speaker, or delegate is representing or from. It could also refer to the location where the conference is being held.",The category of 'Country' is completely separate and does not overlap with the category of 'Topic'. The concept of 'Country' is completely separate and has no overlap with the concept of 'ReviewForm'. The concept of 'Country' is completely separate and does not overlap with the concept of 'Call'. The concept of 'Country' is completely separate and has no overlap with the concept of 'ReviewQuestion'. The concept of a Country is completely separate and has no overlap with the concept of Sponsorship. The category of 'Country' is completely separate and has no overlap with the category of 'Conference'. The concept of 'Country' is completely separate and does not overlap with the concept of 'ContactInformation'. The category of 'Country' is completely separate and has no overlap with the category of 'Document'. The concept of a country is completely separate and has no overlap with the concept of a conference event. The concept of a Country is completely separate and has no overlap with the concept of a ConferenceSession. The category of 'Country' is completely separate and has no overlap with the category of 'Person'. The category of 'Country' is completely separate and does not overlap with the category of 'Organization'. The concept of 'Country' is completely separate and has no overlap with the concept of 'ReviewRating'. The concept of 'Country' is completely separate and has no overlap with the concept of 'PersonalHistory'. The category of 'Country' is completely separate and does not overlap with the category of 'Place'. The topic is completely separate from the country. Contact Information and Country are completely separate from each other. The concept of 'ReviewQuestion' is completely separate and has no overlap with the concept of 'Country'. The place is not the same as the country. The concept of a Document is completely separate and does not overlap with the concept of a Country. Sponsorship and Country are completely separate and do not overlap. The entity 'Call' is disjoint with the entity 'Country'. The concept of a ConferenceEvent is completely separate and has no overlap with the concept of a Country. The category of 'Conference' is completely separate and has no overlap with the category of 'Country'. The concept of a Conference Session is completely separate and does not overlap with the concept of a Country. ReviewRating and Country are completely separate and do not overlap. ReviewForm and Country are completely separate from each other. Personal history is completely separate and has no overlap with country. A person cannot be a country. The organization is completely separate and distinct from the country. The 'hasCountry' is in the range of 'Country'.
target:ConferenceSession,Target,Class,conference session,"A ConferenceSession refers to a specific period or segment within the overall conference where a particular topic is discussed or presented. This could include presentations, panel discussions, workshops, or other activities. Each session typically focuses on a specific theme or subject matter related to the overall conference topic.",The entity 'ConferenceSession' is disjoint with the entity 'ReviewForm'. The concept of a Conference Session is completely separate and does not overlap with the concept of Personal History. The entity 'ConferenceSession' is disjoint with the entity 'Document'. A conference session is completely separate and different from a conference. The entity 'ConferenceSession' is disjoint with the entity 'ReviewRating'. The entity 'ConferenceSession' is disjoint with the entity 'ReviewQuestion'. The concept of a Conference Session is completely separate and does not overlap with the concept of a Country. The entity 'ConferenceSession' is disjoint with the entity 'ContactInformation'. The concept of a Conference Session is completely separate and does not overlap with the concept of a Topic. The concept of a Conference Session is completely separate and does not overlap with the concept of a Person. The concept of a Conference Session is completely separate and does not overlap with the concept of a Call. The concept of a Conference Session is completely separate and does not overlap with the concept of a Place. The concept of a Conference Session is completely separate and has no overlap with the concept of Sponsorship. The entity 'ConferenceSession' is disjoint with the entity 'Organization'. Conference Session is completely separate and has no overlap with Conference Event. The topic is completely separate from the conference session. Contact Information and Conference Session are completely separate from each other. Review Question and Conference Session are completely separate from each other. The place is not the same as the conference session. The entity 'Document' is disjoint with the entity 'ConferenceSession'. Sponsorship and Conference Session are completely separate from each other. The entity 'Call' is disjoint with the entity 'ConferenceSession'. The entity 'ConferenceEvent' is disjoint with the entity 'ConferenceSession'. The entity 'Conference' is disjoint with the entity 'ConferenceSession'. Review Rating and Conference Session are completely separate from each other. The entity 'ReviewForm' is disjoint with the entity 'ConferenceSession'. Personal History and Conference Session are completely separate and do not overlap. A person cannot be a conference session. The concept of a country is completely separate and has no overlap with the concept of a conference session. The organization is completely separate from the conference session.
target:ContactInformation,Target,Class,contact information,"Contact Information in the context of a conference refers to the details provided by the organizers or participants that can be used to communicate or get in touch with them. This may include phone numbers, email addresses, physical addresses, social media handles, etc. It is usually used for inquiries, feedback, or further communication related to the conference.",Contact Information and Personal History are completely separate and do not overlap. Contact Information and Review Form are completely separate from each other. Contact Information and Conference Session are completely separate from each other. Contact Information is completely separate and has no overlap with Document. Contact Information and Review Question are completely separate from each other. Contact Information and Country are completely separate from each other. Contact Information and Conference are completely separate from each other. Contact Information and Sponsorship are completely separate from each other. Contact Information and Topic are completely separate from each other. Contact Information and Call are completely separate from each other. Contact Information and Place are completely separate from each other. Contact Information and Review Rating are completely separate from each other. Contact Information and Conference Event are completely separate and do not overlap. Contact Information and Organization are completely separate from each other. The topic is completely separate from contact information. Review Question and Contact Information are completely separate from each other. The place is completely separate from contact information. The entity 'Document' is disjoint with the entity 'ContactInformation'. Sponsorship and Contact Information are completely separate from each other. The entity 'Call' is disjoint with the entity 'ContactInformation'. The concept of a Conference Event is completely separate and does not overlap with the concept of Contact Information. The category of 'Conference' is completely separate and has no overlap with the category of 'Contact Information'. The entity 'ConferenceSession' is disjoint with the entity 'ContactInformation'. Review Rating and Contact Information are completely separate from each other. Review Form and Contact Information are completely separate from each other. Personal History and Contact Information are completely separate and do not overlap. The concept of 'Country' is completely separate and does not overlap with the concept of 'ContactInformation'. The organization is completely separate from contact information. The domain of 'hasCity' is 'ContactInformation'. The domain of 'hasStreet' is 'ContactInformation'. The domain of 'hasPostalCode' is 'ContactInformation'. The domain of 'hasPhone' is 'ContactInformation'.
target:Place,Target,Class,place,"In the context of a conference, 'Place' refers to the location or venue where the conference is being held. This could be a convention center, hotel, university, or any other suitable venue that can accommodate the attendees and activities of the conference.","The place is completely separate and has no overlap with the document. The place is completely separate from the person. The place is not the same as the country. The place is completely separate from the organization. The place is completely separate and has no overlap with the review rating. The place is completely separate from the topic. The place is not the same as the conference event. The place is completely separate from contact information. The place is completely separate and has no overlap with personal history. The place is completely separate from the sponsorship. The place is disjoint with the call. The place is completely separate from the review form. The place is completely separate from the review question. The place is not the same as the conference session. The place is not the same as the conference. The topic is completely separate from the place. Contact Information and Place are completely separate from each other. A dining place is a subclass of a place. The concept of 'ReviewQuestion' is completely separate and has no overlap with the concept of 'Place'. The concept of a Document is completely separate and does not overlap with the concept of a Place. Sponsorship and Place are completely separate and do not overlap. The entity 'Call' is disjoint with the entity 'Place'. ConferenceEvent and Place are completely separate and do not overlap. The category of 'Conference' is completely separate and does not overlap with the category of 'Place'. The concept of a Conference Session is completely separate and does not overlap with the concept of a Place. ReviewRating and Place are completely separate and do not overlap. The conference venue place is a subclass of place. The concept of 'ReviewForm' is completely separate and does not overlap with the concept of 'Place'. Personal History and Place are completely separate and do not overlap. A person and a place are completely distinct, they cannot overlap or be the same. The meeting room place is a subclass of place. The category of 'Country' is completely separate and does not overlap with the category of 'Place'. The accommodation place is a subclass of the place. The organization is completely separate and has no overlap with the place. The place is the location of. The 'hasLocation' is in the range of 'Place'."
target:WeekRejectRating,Target,Class,week reject rating,"The term 'WeekRejectRating' is not a standard term used in the context of conferences. It could potentially refer to a rating system for rejected proposals or presentations within a week, but without specific context, its meaning is unclear. It's recommended to refer to the specific guidelines or context where the term is used for a precise definition.",WeekRejectRating is a subclass of ReviewRating. The category of WeekRejectRating is completely separate and has no overlap with the category of AcceptRating. The category of WeekRejectRating is completely separate and has no overlap with the category of AccpetIfRoomRating. The category 'WeekRejectRating' is completely separate and has no overlap with the category 'RejectRating'. The entity 'RejectRating' is disjoint with the entity 'WeekRejectRating'. The concept of 'AcceptIfRoomRating' is completely separate and does not overlap with the concept of 'WeekRejectRating'. The concept of 'AcceptRating' is completely separate and does not overlap with the concept of 'WeekRejectRating'.
target:AcceptRating,Target,Class,accept rating consider,"In the context of a conference, 'AcceptRating.Consider' typically refers to a rating given by reviewers to a submitted paper or presentation. This rating suggests that the submission has potential value but requires significant revisions or improvements before it can be accepted for presentation or publication. It's a middle ground between outright acceptance and rejection.",
target:AccpetIfRoomRating,Target,Class,accpet if room rating,"The term 'AcceptIfRoomRating' does not appear to be a standard term used in the context of conferences. It could potentially refer to a system or criteria where a presentation, speaker, or attendee is accepted to a conference if there is enough room or if they meet certain rating criteria. However, without more specific context, it's difficult to provide a precise definition. It's recommended to refer to the specific conference's guidelines or reach out to the organizers for clarification.",AccpetIfRoomRating is a subclass of ReviewRating. The concept of 'AcceptIfRoomRating' is completely separate and does not overlap with the concept of 'AcceptRating'. The concept of 'Accept If Room Rating' is completely separate and has no overlap with 'Reject Rating'. The concept of 'AcceptIfRoomRating' is completely separate and does not overlap with the concept of 'WeekRejectRating'. The category of WeekRejectRating is completely separate and has no overlap with the category of AccpetIfRoomRating. The category of 'RejectRating' is completely separate and has no overlap with the category of 'AcceptIfRoomRating'. The concept of 'AcceptRating' is completely separate and does not overlap with the concept of 'AcceptIfRoomRating'.
target:RejectRating,Target,Class,reject rating,"In the context of a conference, 'RejectRating' typically refers to the score or rating given by reviewers to a submitted paper or presentation proposal that determines its rejection. If the paper or proposal does not meet the required standards or criteria, it may receive a high reject rating, indicating that it is not suitable for presentation at the conference.",The category of 'RejectRating' is completely separate and has no overlap with the category of 'AcceptRating'. The category of 'RejectRating' is completely separate and has no overlap with the category of 'AcceptIfRoomRating'. The entity 'RejectRating' is disjoint with the entity 'WeekRejectRating'. RejectRating is a subclass of ReviewRating. The category 'WeekRejectRating' is completely separate and has no overlap with the category 'RejectRating'. The concept of 'AcceptIfRoomRating' is completely separate and does not overlap with the concept of 'RejectRating'. The concept of 'AcceptRating' is completely separate and does not overlap with the concept of 'RejectRating'.
target:MealEvent,Target,Class,meal event,"A MealEvent in the context of a conference refers to a scheduled event where attendees gather to eat. This could be a breakfast, lunch, dinner, or even a coffee break. These events are often used for networking, informal discussions, or as a break from the main conference activities.",A MealEvent is a subclass of a NonAcademicEvent. MealEvent is completely separate and has no overlap with BreakEvent. The event of a break is disjointed with the event of a meal. A Conference Dinner is a subclass of Meal Event. The domain of 'hasMenu' is 'MealEvent'. The 'isMenuOf' is in the range of 'MealEvent'.
target:NonAcademicEvent,Target,Class,non academic event,"A NonAcademicEvent in the context of a conference refers to an event or activity that is not directly related to the academic or scholarly content of the conference. This could include social events, networking opportunities, recreational activities, cultural tours, or entertainment programs. These events are often designed to provide attendees with a break from the academic sessions, to facilitate informal interactions and networking, or to showcase the local culture or attractions of the conference location.",NonAcademicEvent is a subclass of ConferenceEvent. NonAcademicEvent is completely separate and has no overlap with AcademicEvent. A MealEvent is a subclass of a NonAcademicEvent. The event of a break is a subclass of a non-academic event. Academic events are completely separate and have no overlap with non-academic events. A Social Event is a subclass of a Non-Academic Event.
target:BreakEvent,Target,Class,break event,"A BreakEvent in the context of a conference refers to a scheduled period of rest or relaxation between sessions or activities. This could be a coffee break, lunch break, or networking break where attendees can relax, socialize, or network with each other. It's a time when no formal presentations are taking place.",The class 'BreakEvent' is a subclass of 'NonAcademicEvent'. The event of breaking is disjointed with the event of having a meal. MealEvent is completely separate and has no overlap with BreakEvent. FreeTimeBreak is a subclass of BreakEvent. MealBreak is a subclass of BreakEvent. A Coffee Break is a subclass of a Break Event.
