entity,source_or_target,entity_type,initial_matching,lexical_matching,graphical_matching
source:Meta-Reviewer,Source,Class,meta reviewer,"In the context of a conference, a Meta-Reviewer is a person who oversees and evaluates the reviews given by other reviewers for a particular paper. They have the authority to submit their own review and ensure that all other reviews are consistent and of high quality. The use of a Meta-Reviewer is optional and must be decided before the paper assignment process. They play a crucial role in maintaining the standard and quality of the reviews.",Meta-Reviewer is a subclass of Reviewer. The range of being read by a Meta-Reviewer is a Meta-Reviewer.
source:Reviewer,Source,Class,reviewer,"A reviewer in the context of a conference is a person or a group of people who evaluate or assess the quality, relevance, and merit of submitted papers or presentations. They play a crucial role in deciding which papers or topics will be presented at the conference based on their expertise in the subject matter.","A reviewer is completely separate from an author who is not a reviewer. Reviewer is not the same as ExternalReviewer. A Reviewer is a subclass of a Conference Member. A Reviewer is a subclass of User. Meta-Reviewer is a subclass of Reviewer. External Reviewer and Reviewer are completely separate, they do not overlap. The entity 'AuthorNotReviewer' is disjoint with the entity 'Reviewer'. The range of 'assignReviewer' is 'Reviewer'. The administrator assigns the domain to the reviewer. The domain of adjustBid is Reviewer. The action of reading a paper is within the domain of a Reviewer. The term 'adjustedBy' has a range of 'Reviewer'. The domain of 'hasBeenAssigned' is 'Reviewer'. The property 'assignedByReviewer' has a range of 'Reviewer'. The 'assignedTo' is in the range of 'Reviewer'. The action 'readByReviewer' is applicable to the range of 'Reviewer'. The range of 'writtenBy' is 'Reviewer'. The action of writing a review is within the domain of a Reviewer. The domain of 'assignExternalReviewer' is 'Reviewer'."
source:Decision,Source,Class,decision,"In the context of a conference, a decision refers to the determination or resolution made by the conference organizers or participants regarding a particular issue, topic, or action. This could be related to the conference's agenda, policies, future events, or any other matter that requires a collective agreement or judgement. For example, the decision to accept or reject a paper or presentation, the decision on the conference's date and location, etc.",The concept of 'Decision' is completely separate and has no overlap with the concept of 'Person'. The concept of 'Decision' is completely separate and has no overlap with the concept of 'Document'. The concept of 'Decision' is completely separate and does not overlap with the concept of 'Preference'. The entity 'Decision' is disjoint with the entity 'ProgramCommittee'. The concept of 'Decision' is completely separate and does not overlap with the concept of 'Bid'. The concept of 'Decision' is completely separate and does not overlap with the concept of 'Conference'. The entity 'ProgramCommittee' is disjoint with the entity 'Decision'. The concept of 'Preference' is completely separate and does not overlap with the concept of 'Decision'. Acceptance is a subclass of Decision. The entity 'Bid' is disjoint with the entity 'Decision'. A person is completely separate and distinct from a decision. The document is completely separate and has no overlap with the decision. The category of 'Conference' is completely separate and has no overlap with the category of 'Decision'. Rejection is a subclass of Decision. The range of 'hasDecision' is 'Decision'.
source:Person,Source,Class,person,"In the context of a conference, a person usually refers to an individual who is participating in the conference. This could be a speaker, attendee, organizer, or any other role involved in the conference.",A person is completely separate and different from a preference. A person is completely separate from a program committee. A person cannot be a bid. A person cannot be a conference. A person is completely separate and distinct from a decision. A person is completely separate and different from a document. The concept of 'Decision' is completely separate and does not overlap with the concept of 'Person'. A Program Committee Member is a subclass of a Person. A Conference Member is a subclass of a Person. An External Reviewer is a subclass of a Person. The entity 'ProgramCommittee' is disjoint with the entity 'Person'. The category of Preference is completely separate and does not overlap with the category of Person. A Chairman is a subclass of a Person. The entity 'Bid' is disjoint with the entity 'Person'. A user is a subclass of a person. The entity 'Document' is disjoint with the entity 'Person'. A conference is completely separate and has no overlap with a person. A person has a domain of conflict of interest. The email domain of a person.
source:Document,Source,Class,document,"In the context of a conference, a document refers to any written or digital material that provides information or evidence or that serves as an official record. This could include research papers, presentations, reports, agendas, minutes of meetings, or any other form of written material that is used or presented during the conference.",The document is completely separate and has no overlap with the bid. The document is completely separate and has no overlap with the decision. The entity 'Document' is disjoint with the entity 'ProgramCommittee'. The entity 'Document' is disjoint with the entity 'Conference'. A document is completely separate and different from a person. The entity 'Document' is disjoint with the entity 'Preference'. The concept of 'Decision' is completely separate and has no overlap with the concept of 'Document'. The entity 'ProgramCommittee' is disjoint with the entity 'Document'. The category of Preference is completely separate and has no overlap with the category of Document. A review is a subclass of a document. The category 'Bid' is completely separate and has no overlap with the category 'Document'. Paper is a subclass of Document. A person is completely separate and different from a document. The category of 'Conference' is completely separate and has no overlap with the category of 'Document'. The range of 'hasConflictOfInterest' is 'Document'.
source:Preference,Source,Class,preference,"In the context of a conference, preference often refers to the choices or selections made by attendees or organizers. This could include preferences for specific topics, speakers, sessions, or workshops to attend. It could also refer to logistical preferences such as dietary restrictions for meals, preferred dates or times, or accommodation preferences. In a broader sense, it could also refer to the general interests or priorities of the attendees or organizers.",The preference is not the same as the program committee. The category of Preference is completely separate and does not overlap with the category of Person. The concept of 'Preference' is completely separate and does not overlap with the concept of 'Decision'. The category of Preference is completely separate and has no overlap with the category of Document. The category of Preference is completely separate and does not overlap with the category of Conference. The concept of Preference is disjoint with the concept of Bid. The concept of 'Decision' is completely separate and does not overlap with the concept of 'Preference'. The entity 'ProgramCommittee' is disjoint with the entity 'Preference'. Bid is disjoint with Preference. The category of 'Person' is completely separate and does not overlap with the category of 'Preference'. The entity 'Document' is disjoint with the entity 'Preference'. The category of 'Conference' is completely separate and has no overlap with the category of 'Preference'.
source:ProgramCommittee,Source,Class,program committee,"A Program Committee in the context of a conference is a group of individuals who are responsible for selecting and organizing the content of the conference. This includes reviewing and selecting presentations, arranging speakers, and scheduling sessions. The committee ensures that the conference program aligns with the conference's theme and objectives.",The entity 'ProgramCommittee' is disjoint with the entity 'Person'. The entity 'ProgramCommittee' is disjoint with the entity 'Conference'. The entity 'ProgramCommittee' is disjoint with the entity 'Preference'. The entity 'ProgramCommittee' is disjoint with the entity 'Decision'. The entity 'ProgramCommittee' is disjoint with the entity 'Bid'. The entity 'ProgramCommittee' is disjoint with the entity 'Document'. The entity 'Decision' is disjoint with the entity 'ProgramCommittee'. Preference is completely separate and has no overlap with ProgramCommittee. The entity 'Bid' is disjoint with the entity 'ProgramCommittee'. A person cannot be a program committee. The entity 'Document' is disjoint with the entity 'ProgramCommittee'. The entity 'Conference' is disjoint with the entity 'ProgramCommittee'. The domain of 'hasProgramCommitteeMember' is 'ProgramCommittee'. The member of a program committee is within the range of the program committee.
source:Bid,Source,Class,bid,"In the context of a conference, a bid typically refers to a proposal or application submitted by an individual, group, or city to host the conference. This bid will usually include details such as the proposed venue, accommodations, budget, and other logistical aspects. The organization or committee in charge of the conference will then review all bids and select the one they find most suitable.",The entity 'Bid' is disjoint with the entity 'Document'. The entity 'Bid' is disjoint with the entity 'Preference'. The entity 'Bid' is disjoint with the entity 'ProgramCommittee'. The category 'Bid' is completely separate and has no overlap with the category 'Conference'. The entity 'Bid' is disjoint with the entity 'Decision'. The entity 'Bid' is disjoint with the entity 'Person'. The concept of 'Decision' is completely separate and has no overlap with the concept of 'Bid'. The entity 'ProgramCommittee' is disjoint with the entity 'Bid'. The concept of Preference is disjoint with the concept of Bid. A person cannot be a bid. The document is completely separate and has no overlap with the bid. The concept of a Conference is completely separate and does not overlap with the concept of a Bid. The range of 'hasBid' is 'Bid'. The range of adjustBid is Bid. The domain of 'adjustedBy' is 'Bid'.
source:Conference,Source,Class,conference,"A conference is a formal meeting where participants gather to discuss or exchange ideas, information, and views on a specific topic. This can be a one-time event or occur regularly (like annually or bi-annually). Conferences can be held in various fields such as academia, business, science, and technology, and can range from small workshops to large international gatherings.",The category of 'Conference' is completely separate and has no overlap with the category of 'Preference'. The concept of a Conference is completely separate and has no overlap with the concept of a Decision. A conference is completely separate and has no overlap with a person. The concept of a Conference is completely separate and has no overlap with the concept of a Bid. The entity 'Conference' is disjoint with the entity 'ProgramCommittee'. The category of 'Conference' is completely separate and has no overlap with the category of 'Document'. The concept of 'Decision' is completely separate and has no overlap with the concept of 'Conference'. The entity 'ProgramCommittee' is disjoint with the entity 'Conference'. The category of Preference is completely separate and has no overlap with the category of Conference. The category 'Bid' is completely separate and has no overlap with the category 'Conference'. A person cannot be a conference. The entity 'Document' is disjoint with the entity 'Conference'. The range of finalizing paper assignment is a conference. The domain of 'hasConferenceMember' is 'Conference'. The range of runPaperAssignmentTools is Conference. The range of 'enableVirtualMeeting' is 'Conference'. The start of reviewer bidding range is related to the conference. The domain of 'paperAssignmentFinalizedBy' is 'Conference'. The review criteria is entered by the domain of the conference. The domain of paperAssignmentToolsRunBy is Conference. The domain of 'virtualMeetingEnabledBy' is 'Conference'. The hardcopy mailing manifests are printed by the domain Conference. The action 'enterConferenceDetails' has a range of 'Conference'. The member of a conference is within the range of the conference. The action of printing hardcopy mailing manifests is applicable to the context of a Conference. The details were entered by a domain at the Conference. The domain of 'reviewerBiddingStartedBy' is 'Conference'. The range of 'enterReviewCriteria' is 'Conference'. The date is within the domain of the Conference. The domain of reviews per paper is a conference. The logo URL is the domain of the Conference. The domain of acceptsHardcopySubmissions is Conference. The site URL domain is related to the Conference.
source:ConferenceChair,Source,Class,conference chair,"A Conference Chair is the person who leads or presides over a conference. They are responsible for planning and organizing the event, coordinating speakers and sessions, and ensuring that the conference runs smoothly. They may also play a role in fundraising, marketing, and other administrative tasks related to the event.",A Conference Chair is a subclass of Conference Member. The entity 'Conference Chair' is disjoint with the entity 'Associated Chair'. The entity 'AssociatedChair' is disjoint with the entity 'ConferenceChair'.
source:ConferenceMember,Source,Class,conference member,"A ConferenceMember refers to an individual who is participating in the conference. This could be a speaker, attendee, organizer, or any other person who is part of the conference in some capacity.",A ConferenceMember is a subclass of Person. A Conference Chair is a subclass of Conference Member. A Program Committee Member is a subclass of a Conference Member. An Author is a subclass of a Conference Member. A Reviewer is a subclass of a Conference Member. An Associated Chair is a subclass of a Conference Member. The property 'hasConferenceMember' has a range of 'ConferenceMember'. A member of a conference is in the domain of Conference Member.
source:AssociatedChair,Source,Class,associated chair,"In the context of a conference, an Associated Chair is typically a person who assists the main chairperson or conference chair in organizing and managing the event. Their responsibilities may include coordinating with speakers, managing sessions, overseeing logistics, and other tasks related to the successful execution of the conference. The exact role can vary depending on the specific conference and its structure.",An Associated Chair is a subclass of a Conference Member. The entity 'AssociatedChair' is disjoint with the entity 'ConferenceChair'. The entity 'Conference Chair' is disjoint with the entity 'Associated Chair'.
source:ProgramCommitteeMember,Source,Class,program committee member,"A Program Committee Member in the context of a conference is an individual who is part of the group responsible for planning and organizing the event. This includes tasks such as selecting the topics, choosing speakers, reviewing submitted papers, and deciding on the schedule. They are not just authors of papers, but also reviewers who evaluate the quality and relevance of submissions. They play a crucial role in ensuring the conference is successful and meets its objectives.",A Program Committee Member is a subclass of a Person. A Program Committee Member is a subclass of a Conference Member. A Program Committee Member cannot be an Author who is not a Reviewer. A Program Committee Chair is a subclass of a Program Committee Member. The entity 'AuthorNotReviewer' is disjoint with the entity 'ProgramCommitteeMember'. The range of 'hasProgramCommitteeMember' is 'ProgramCommitteeMember'. A member of the program committee is in the domain of the program committee member. The range of 'setMaxPapers' is 'ProgramCommitteeMember'. The domain of maxPapers is ProgramCommitteeMember. The domain of 'addedBy' is 'ProgramCommitteeMember'. The range of 'addProgramCommitteeMember' is 'ProgramCommitteeMember'.
source:AuthorNotReviewer,Source,Class,author not reviewer,AuthorNotReviewer in the context of a conference typically refers to a role or status where a person is an author of a paper or presentation but is not involved in the peer review process of other papers or presentations. This means they contribute content to the conference but do not evaluate or provide feedback on the work of others.,The entity 'AuthorNotReviewer' is disjoint with the entity 'ProgramCommitteeMember'. The entity 'AuthorNotReviewer' is disjoint with the entity 'Reviewer'. The class 'AuthorNotReviewer' is a subclass of 'Author'. A Program Committee Member cannot be an Author who is not a Reviewer. A reviewer is completely separate from an author who is not a reviewer.
source:SubjectArea,Source,Class,subject area,"In the context of a conference, Subject Area refers to the specific field or topic that the conference is focused on. This could be anything from artificial intelligence, climate change, education, healthcare, etc. It helps potential attendees, speakers, and sponsors understand the relevance and focus of the conference.",The subject area is the range of 'hasSubjectArea'.
source:ExternalReviewer,Source,Class,external reviewer,"In the context of a conference, an External Reviewer is an individual who is not part of the conference's organizing or review committee but is invited to review and evaluate the quality of papers or presentations submitted to the conference. They provide an independent, unbiased assessment based on their expertise in the subject matter.","An External Reviewer is a subclass of a Person. External Reviewer and Reviewer are completely separate, they do not overlap. Reviewer and ExternalReviewer are completely separate, they do not overlap. The domain of 'assignedByReviewer' is 'ExternalReviewer'. The range of 'assignExternalReviewer' is 'ExternalReviewer'."
source:Chairman,Source,Class,chairman,"In the context of a conference, the Chairman is the person who leads or prescribes the order of proceedings. They are responsible for ensuring the conference runs smoothly, moderates discussions, introduces speakers, and often makes concluding remarks.",A Chairman is a subclass of a Person.
source:ProgramCommitteeChair,Source,Class,program committee chair,"A Program Committee Chair is a person who leads the program committee for a conference. This committee is responsible for planning and organizing the content of the conference, including selecting speakers, arranging sessions, and overseeing the review process for submitted papers or presentations. The chair typically makes final decisions and ensures everything runs smoothly.",A Program Committee Chair is a subclass of a Program Committee Member. The domain of endReview is ProgramCommitteeChair.
source:Acceptance,Source,Class,acceptance,"In the context of a conference, acceptance refers to the approval or confirmation of a submitted paper, presentation, or proposal by the conference organizers. This means that the submission has been reviewed and deemed appropriate and valuable for presentation or discussion at the conference.",Acceptance and Rejection are mutually exclusive. Acceptance is a subclass of Decision. Rejection is completely separate from Acceptance.
source:Rejection,Source,Class,rejection,"In the context of a conference, rejection refers to the decision made by the conference organizers or committee not to accept a particular submission or proposal. This could be due to a variety of reasons such as the submission not meeting the required standards, not fitting the theme of the conference, or there being too many submissions and not enough slots available.",Rejection is completely separate from Acceptance. Rejection is a subclass of Decision. Acceptance and Rejection are mutually exclusive.
source:Review,Source,Class,review,"In the context of a conference, a review typically refers to the process of evaluating or assessing the content of presentations, abstracts, papers, or proposals that have been submitted for inclusion in the conference. This is usually done by a panel of experts or peers in the field to ensure the quality, relevance, and accuracy of the content. The review process helps to determine which submissions are accepted or rejected.",The category of 'Review' is completely separate from the category of 'Paper'. A review is a subclass of a document. Paper is completely separate from Review. Meta-Review is a subclass of Review. The range of 'endReview' is 'Review'. The domain of 'writtenBy' is 'Review'. The action 'writeReview' has a range of 'Review'.
source:Paper,Source,Class,paper,"In the context of a conference, a paper refers to a scholarly article or study that is written by researchers or experts in the field. It presents original research, findings, or a review of existing work. These papers are often presented at the conference by the authors to share their work with other professionals in the field for discussion and feedback.",Paper is a subclass of Document. Paper is completely separate from Review. The category of 'Review' is completely separate from the category of 'Paper'. The abstract of a paper is a subclass of the paper. The full version of a paper is a subclass of paper. A paper has a co-author. The range of the action 'rejectPaper' is 'Paper'. The domain of 'hasBid' is 'Paper'. The range of reading a paper is a paper. The term 'markConflictOfInterest' has a range of 'Paper'. The range of co-writing a paper is a paper. The range of 'hasBeenAssigned' is 'Paper'. The domain of 'hasDecision' is 'Paper'. The domain of 'assignedTo' is 'Paper'. The subject area of a paper is its domain. The range of submitting a paper is a Paper. The domain of 'readByReviewer' is 'Paper'. The domain of the paperID is Paper. The title is in the domain of the Paper. The range of accepting a paper is a paper. The domain of 'hasAuthor' is 'Paper'. The domain of 'acceptedBy' is 'Paper'. The domain of 'rejectedBy' is 'Paper'. The domain of 'readByMeta-Reviewer' is 'Paper'. The range of 'writePaper' is 'Paper'.
source:Author,Source,Class,author,"In the context of a conference, an author is typically the person who has written or contributed to a research paper, study, or presentation that is being shared or discussed at the conference. They are responsible for the content and findings of the work.",An Author is a subclass of a Conference Member. An Author is a subclass of a User. A co-author is a subclass of an author. The class 'AuthorNotReviewer' is a subclass of 'Author'. The domain of submitting a paper is the author. The property 'hasAuthor' has a range of 'Author'. The domain of writing a paper is the author.
source:User,Source,Class,user,"In the context of a conference, a user refers to an individual who is utilizing or participating in the conference services. This could be an attendee, a speaker, or an organizer who is using the conference platform or tools for communication, presentation, networking, etc.",A user is a subclass of a person. The author is a subclass of the user. A reviewer is a subclass of a user. An Administrator is a subclass of User.
source:Co-author,Source,Class,co author,A co-author is a person who contributes to the creation or development of a conference paper or presentation along with one or more other individuals. They share the credit for the work and are often listed on the publication or presentation materials.,A co-author is a subclass of an author. The range of 'hasCo-author' is 'Co-author'. The domain of co-writing a paper is a co-author.
source:PaperAbstract,Source,Class,paper abstract,"In the context of a conference, a Paper Abstract refers to a brief summary of a research paper that is going to be presented. It provides a concise overview of the research, including the purpose of the study, the methodology used, the main findings, and the conclusions. This allows attendees to understand the essence of the paper without reading the full text, helping them decide whether to attend the presentation or not.",The abstract of a paper is a subclass of the paper.
source:PaperFullVersion,Source,Class,paper full version,"In the context of a conference, 'PaperFullVersion' refers to the complete and detailed version of a research paper or study that is being presented. This version includes all the research data, methodologies, results, discussions, and conclusions. It is more comprehensive than an abstract or a summary, providing a full account of the research conducted.",A full version of a paper is a subclass of a paper.
