entity,source_or_target,entity_type,initial_matching,lexical_matching,graphical_matching
source:Meta-Reviewer,Source,Class,Meta Reviewer,"In the context of a conference, a Meta-Reviewer is a special type of reviewer who has the ability to review all the reviews submitted for a particular paper and provide their own review. Their role is to ensure that the reviews are of high quality and consistent with each other. The use of Meta-Reviewers is optional and must be determined before the paper assignment process begins.",Meta-Reviewer is a subclass of Reviewer. Read by Meta-Reviewer range Meta-Reviewer.
source:Reviewer,Source,Class,Reviewer,"A reviewer in the context of a conference is an individual who evaluates and provides feedback on research papers submitted for presentation at the conference. Reviewers are typically experts in the field related to the conference topic and are responsible for assessing the quality, relevance, and originality of the submissions. Their feedback helps conference organizers make decisions on which papers to accept for presentation.","Reviewer disjoint with Author Not Reviewer. Reviewer disjointWith ExternalReviewer. Reviewer is a subclass of ConferenceMember. Reviewer is a subclass of User. Meta-Reviewer is a subclass of Reviewer. ExternalReviewer disjointWith Reviewer. AuthorNotReviewer disjointWith Reviewer. Assign reviewer range reviewer. Assigned by administrator domain reviewer. Adjust bid domain reviewer. Read paper domain reviewer. Adjusted by range reviewer. Has been assigned domain Reviewer. Assigned by reviewer range reviewer. Assigned to range Reviewer. Read by reviewer, range reviewer. Written by Range Reviewer. Write review domain reviewer. Assign external reviewer domain reviewer."
source:Decision,Source,Class,Decision,"In the context of a conference, a decision refers to a conclusion or resolution reached by the participants after discussing and deliberating on a particular topic or issue. Decisions made during a conference can range from selecting a course of action, setting goals, allocating resources, or determining next steps. These decisions are typically documented in meeting minutes or official reports to ensure accountability and follow-up.",Decision disjointWith Person. Decision disjointWith Document. Decision disjointWith Preference. Decision disjointWith ProgramCommittee. Decision disjointWith Bid. Decision disjointWith Conference. Program Committee disjoint with Decision. Preference disjointWith Decision. Acceptance is a subclass of Decision. Bid disjointWith Decision. Person disjointWith Decision. Document disjointWith Decision. Conference disjointWith Decision. Rejection is a subclass of Decision. Decision range has Decision.
source:Person,Source,Class,Person,"In the context of a conference, a person refers to an individual who is attending or participating in the event. This could include speakers, presenters, attendees, organizers, and any other individuals involved in the conference. Each person plays a role in contributing to the overall success and experience of the conference.",Person disjointWith Preference. Person is disjoint with ProgramCommittee. Person is disjoint with Bid. Person is disjoint with Conference. Person disjointWith Decision. Person is disjoint with Document. Decision disjointWith Person. ProgramCommitteeMember is a subclass of Person. ConferenceMember is a subclass of Person. ExternalReviewer is a subclass of Person. Program Committee is disjoint with Person. Preference disjointWith Person. Chairman is a subclass of Person. Bid disjointWith Person. User is a subclass of Person. Document disjointWith Person. Conference disjointWith Person. The domain Person has conflict of interest. Email domain Person.
source:Document,Source,Class,Document,"In the context of a conference, a document refers to any written or printed material that is used for reference, information, or communication during the event. This can include agendas, schedules, presentations, reports, handouts, and any other materials that are distributed to attendees or used by speakers during the conference. Documents are an important part of a conference as they help to provide structure, information, and support for the various sessions and activities that take place.",Document disjointWith Bid. Document disjointWith Decision. Document disjointWith ProgramCommittee. Document disjointWith Conference. Document disjointWith Person. Document disjointWith Preference. Decision disjointWith Document. Program Committee is disjoint with Document. Preference disjointWith Document. Review is a subclass of Document. Bid disjointWith Document. Paper is a subclass of Document. Person is disjoint with Document. Conference disjointWith Document. Has conflict of interest range document.
source:Preference,Source,Class,Preference,"In the context of a conference, preference refers to the selection or choice of a particular option, topic, speaker, or session over others. It reflects the individual's or group's inclination or favor towards a specific aspect of the conference program. Preferences can vary based on personal interests, professional needs, or relevance to the conference theme. Organizers may ask attendees to indicate their preferences in order to tailor the conference program to better meet the needs and interests of the participants.",Preference disjointWith ProgramCommittee. Preference disjointWith Person. Preference disjointWith Decision. Preference disjointWith Document. Preference disjointWith Conference. Preference disjointWith Bid. Decision disjointWith Preference. Program Committee disjoint with Preference. Bid disjointWith Preference. Person disjointWith Preference. Document disjointWith Preference. Conference disjointWith Preference.
source:ProgramCommittee,Source,Class,Program Committee,"In the context of a conference, a Program Committee is a group of individuals responsible for selecting and organizing the presentations, panels, workshops, and other activities that will be included in the conference program. The Program Committee typically consists of experts in the field or topic of the conference who review submissions, provide feedback, and make decisions on which submissions will be accepted for presentation at the conference. They also help to ensure that the conference program is well-balanced, diverse, and of high quality.",Program Committee is disjoint with Person. Program Committee is disjoint with Conference. Program Committee disjoint with Preference. Program Committee disjoint with Decision. Program Committee disjoint with Bid. Program Committee is disjoint with Document. Decision disjointWith ProgramCommittee. Preference disjoint with Program Committee. Bid disjointWith ProgramCommittee. Person disjointWith ProgramCommittee. Document disjointWith ProgramCommittee. Conference disjointWith ProgramCommittee. Has Program Committee Member domain Program Committee. Member of Program Committee range Program Committee.
source:Bid,Source,Class,Bid,"In the context of a conference, a bid refers to a formal proposal submitted by a city or organization to host a future conference or event. Bids typically include details such as proposed dates, venue options, accommodations, transportation options, and any other relevant information that would make the city or organization an attractive host for the conference. The selection of a host city or organization is often based on the strength of their bid and their ability to meet the needs and preferences of the conference organizers.",Bid disjointWith Document. Bid disjointWith Preference. Bid disjointWith ProgramCommittee. Bid disjointWith Conference. Bid disjointWith Decision. Bid disjointWith Person. Decision disjointWith Bid. Program Committee disjoint with Bid. Preference disjointWith Bid. Person is disjoint with Bid. Document disjointWith Bid. Conference disjointWith Bid. Bid range has Bid. Adjust bid range bid. Adjusted by domain bid.
source:Conference,Source,Class,Conference,"A conference is a formal meeting where individuals gather to discuss a particular topic or issue, share information, exchange ideas, and make decisions. Conferences can be held for various purposes, such as academic research, business networking, professional development, or industry-specific discussions. They typically involve presentations, workshops, panel discussions, and networking opportunities for attendees.","Conference disjointWith Preference. Conference disjointWith Decision. Conference is disjoint with Person. Conference disjointWith Bid. Conference disjointWith ProgramCommittee. Conference disjointWith Document. Decision disjointWith Conference. Program Committee is disjoint with Conference. Preference is disjoint with Conference. Bid disjointWith Conference. Person is disjoint with Conference. Document disjointWith Conference. Finalize the paper assignment for the conference. The domain Conference has a ConferenceMember. Run paper assignment tools range conference. Enable virtual meeting range conference. Start reviewer bidding range conference. Paper assignment finalized by domain conference. Review criteria entered by the domain conference. Paper assignment tools run by Domain Conference. Virtual meeting enabled by Domain Conference. Hardcopy mailing manifests printed by Domain Conference. Enter conference details, range conference. Member of conference range conference. Print hardcopy mailing manifests for the range conference. Details entered by domain conference. The reviewer bidding started by domain Conference. Enter review criteria range conference. Date domain Conference. Reviews per paper domain conference. The logo URL domain Conference. Accepts hard copy submissions for the conference. The domain Conference siteURL."
source:ConferenceChair,Source,Class,Conference Chair,"A ConferenceChair is a person who is responsible for organizing and overseeing a conference. This role typically involves coordinating with speakers, sponsors, and attendees, managing the schedule and logistics of the event, and ensuring that everything runs smoothly. The ConferenceChair may also be involved in selecting the theme and topics for the conference, as well as promoting the event to potential participants.",ConferenceChair is a subclass of ConferenceMember. Conference Chair disjoint with Associated Chair. Associated Chair disjoint with Conference Chair.
source:ConferenceMember,Source,Class,Conference Member,"A ConferenceMember refers to an individual who is a participant or attendee at a conference. This term can be used to describe anyone who is registered to attend the conference, including speakers, presenters, organizers, and other participants.",ConferenceMember is a subclass of Person. ConferenceChair is a subclass of ConferenceMember. ProgramCommitteeMember is a subclass of ConferenceMember. Author is a subclass of ConferenceMember. Reviewer is a subclass of ConferenceMember. AssociatedChair is a subclass of ConferenceMember. Has conference member range conference member. Member of Conference domain Conference Member.
source:AssociatedChair,Source,Class,Associated Chair,"In the context of a conference, an Associated Chair is a person who assists the Chairperson in organizing and running the conference. They may help with tasks such as coordinating speakers, managing logistics, and overseeing the overall flow of the event. The Associated Chair is typically a senior member of the organizing committee and plays a key role in ensuring the success of the conference.",AssociatedChair is a subclass of ConferenceMember. AssociatedChair disjointWith ConferenceChair. ConferenceChair is disjoint with AssociatedChair.
source:ProgramCommitteeMember,Source,Class,Program Committee Member,"In the context of a conference, a Program Committee Member is a person who is responsible for reviewing and selecting submissions for presentation at the conference. They play a crucial role in ensuring the quality and relevance of the content that is presented at the event. Program Committee Members are typically experts in their field and are chosen for their knowledge and expertise to help shape the program of the conference.",ProgramCommitteeMember is a subclass of Person. ProgramCommitteeMember is a subclass of ConferenceMember. Program Committee Member is disjoint with Author Not Reviewer. ProgramCommitteeChair is a subclass of ProgramCommitteeMember. AuthorNotReviewer disjointWith ProgramCommitteeMember. Has program committee member range program committee member. Member of Program Committee domain Program Committee Member. Set max papers range program committee member. Max Papers domain Program Committee Member. Added by domain ProgramCommitteeMember. Add Program Committee Member range Program Committee Member.
source:AuthorNotReviewer,Source,Class,Author Not Reviewer,"AuthorNotReviewer refers to a participant in a conference who has submitted a paper or presentation for consideration, but is not serving as a reviewer for other submissions. This individual is solely focused on presenting their own work and engaging with other attendees, rather than evaluating the work of others.",AuthorNotReviewer disjointWith ProgramCommitteeMember. AuthorNotReviewer disjointWith Reviewer. AuthorNotReviewer is a subclass of Author. Program Committee Member is disjoint with Author Not Reviewer. Reviewer disjoint with Author Not Reviewer.
source:SubjectArea,Source,Class,Subject Area,"SubjectArea in the context of a conference refers to the specific field or topic that the conference is focused on. It helps to categorize and organize the presentations, discussions, and research that will be presented at the conference. SubjectArea can range from broad topics such as technology or healthcare to more specific areas such as artificial intelligence or cancer research. It helps attendees to identify which sessions and presentations are most relevant to their interests and expertise.",The range of hasSubjectArea is SubjectArea.
source:ExternalReviewer,Source,Class,External Reviewer,"In the context of a conference, an ExternalReviewer refers to a person who has been invited to review a paper submitted for presentation at the conference by another reviewer. This individual is not officially part of the conference's review committee but has been asked to provide an additional perspective or expertise on the paper in question. Their feedback and evaluation can help ensure the quality and credibility of the research being presented at the conference.","""ExternalReviewer is a subclass of Person."" ExternalReviewer disjointWith Reviewer. Reviewer disjointWith ExternalReviewer. Assigned by reviewer domain external reviewer. Assign external reviewer range external reviewer."
source:Chairman,Source,Class,Chairman,"In the context of a conference, the Chairman is the person who presides over the meeting and ensures that the agenda is followed, discussions are productive, and decisions are made in an orderly manner. The Chairman is typically responsible for opening and closing the meeting, maintaining order, and facilitating discussions among participants. They may also have the authority to make final decisions or cast a deciding vote in the event of a tie.",Chairman is a subclass of Person.
source:ProgramCommitteeChair,Source,Class,Program Committee Chair,"The Program Committee Chair is responsible for overseeing the selection and organization of presentations, papers, and speakers for a conference. They work closely with the program committee to review submissions, create the conference schedule, and ensure that the content aligns with the conference theme and objectives. The Program Committee Chair plays a key role in shaping the overall program and ensuring its success.",ProgramCommitteeChair is a subclass of ProgramCommitteeMember. End review domain program committee chair.
source:Acceptance,Source,Class,Acceptance,"Acceptance in the context of a conference refers to the process of reviewing and approving submissions, such as papers, presentations, or proposals, for inclusion in the conference program. When a submission is accepted, it means that the organizers have deemed it to be of high quality and relevant to the conference theme, and it will be scheduled for presentation at the event.",Acceptance disjointWith Rejection. Acceptance is a subclass of Decision. Rejection disjointWith Acceptance.
source:Rejection,Source,Class,Rejection,"In the context of a conference, rejection typically refers to the decision made by the conference organizers or reviewers to not accept a submitted paper, presentation, or proposal for inclusion in the conference program. This decision may be based on factors such as the quality of the submission, relevance to the conference theme, or available space in the program. Rejection can be disappointing for the submitter, but it is a common part of the conference review process.",Rejection disjointWith Acceptance. Rejection is a subclass of Decision. Acceptance disjointWith Rejection.
source:Review,Source,Class,Review,"In the context of a conference, a review typically refers to the evaluation or assessment of a submitted paper, presentation, or research project by peers or experts in the field. Reviews are often conducted to determine the quality, relevance, and originality of the work and to provide feedback to the authors for potential improvements. Reviews are an important part of the conference submission and selection process, as they help ensure the overall quality of the content presented at the conference.",Review disjointWith Paper. Review is a subclass of Document. Paper disjointWith Review. Meta-Review is a subclass of Review. End review range review. The sentence is: 'Written by domain Review.' Verbalised: Written by domain Review. Write review range review.
source:Paper,Source,Class,Paper,"In the context of a conference, a paper refers to a written document that presents research findings, analysis, or ideas on a specific topic. Papers are typically submitted by researchers, scholars, or experts in a particular field to be presented at a conference for discussion and dissemination of knowledge. These papers are often peer-reviewed and selected by the conference organizers for presentation based on their quality and relevance to the conference theme.",Paper is a subclass of Document. Paper disjointWith Review. Review disjointWith Paper. PaperAbstract is a subclass of Paper. PaperFullVersion is a subclass of Paper. Has co-author domain paper. Reject paper range paper. Has bid domain paper. Read paper range paper. Mark Conflict of Interest Range Paper. Co-write paper range paper. Has been assigned range paper. The domain Paper has decision. Paper is assigned to the domain. The domain Paper has subject area. Submit paper range paper. Read by reviewer domain paper. PaperID domain Paper. Title domain paper. Accept paper range paper. The domain Paper has author. The domain Paper is accepted. The domain Paper is rejected. Read by meta-reviewer domain paper. Write paper range paper.
source:Author,Source,Class,Author,"In the context of a conference, an author refers to an individual who has written or contributed to a paper, presentation, or research study that is being presented at the conference. The author is typically the primary creator of the work and is responsible for its content and findings.",Author is a subclass of ConferenceMember. Author is a subclass of User. Co-author is a subclass of Author. AuthorNotReviewer is a subclass of Author. Submit paper domain author. The range Author hasAuthor. Write paper domain author.
source:User,Source,Class,User,"In the context of a conference, a user typically refers to an individual who is attending or participating in the conference. This could include attendees, speakers, presenters, organizers, or any other individual involved in the event. Users may also refer to individuals who are using a specific technology or platform to access the conference virtually.",User is a subclass of Person. Author is a subclass of User. Reviewer is a subclass of User. Administrator is a subclass of User.
source:Co-author,Source,Class,Co author,"A co-author is someone who has collaborated with the primary author in writing a paper, article, or research study. They have contributed significantly to the content and ideas presented in the work and share credit for its creation.",Co-author is a subclass of Author. Has co-author range co-author. Co-write paper domain co-author.
source:PaperAbstract,Source,Class,Paper Abstract,"A Paper Abstract is a brief summary of a research paper or presentation that is typically submitted to a conference for consideration. It provides an overview of the main points and findings of the paper, allowing conference organizers to quickly assess the relevance and quality of the research. The abstract is usually limited to a certain word count or character limit and should concisely convey the key aspects of the paper.",Paper abstract is a subclass of paper.
source:PaperFullVersion,Source,Class,Paper Full Version,"PaperFullVersion typically refers to the complete and final version of a research paper or academic article that is submitted for presentation at a conference. This version includes all the necessary sections such as abstract, introduction, methodology, results, discussion, conclusion, and references, and has undergone peer review and revisions as needed. Presenting the PaperFullVersion at a conference allows researchers to share their findings and insights with a wider audience and receive feedback from other experts in the field.",PaperFullVersion is a subclass of Paper.
source:Administrator,Source,Class,Administrator,"In the context of a conference, an administrator is typically a person responsible for organizing and managing the logistics of the event. This may include tasks such as booking venues, coordinating schedules, managing registrations, handling finances, and overseeing the overall smooth running of the conference. Administrators play a crucial role in ensuring that the conference runs efficiently and successfully.","Administrator is a subclass of User. Finalize paper assignment domain administrator. Run Paper Assignment Tools domain Administrator. Enable virtual meeting domain administrator. Start reviewer bidding domain administrator. Paper assignment finalized by Range Administrator. Assign reviewer domain administrator. Review criteria entered by range administrator. Reject paper domain administrator. Assigned by administrator, range administrator. Paper assignment tools run by Range Administrator. Virtual meeting enabled by Range Administrator. Hardcopy mailing manifests printed by Range Administrator. Enter conference details domain administrator. Print hardcopy mailing manifests for the domain administrator. Set max papers domain administrator. Details entered by range administrator. Reviewer bidding started by Range Administrator. Enter review criteria domain administrator. Accept paper domain administrator. Range Administrator addedBy. Accepted by range administrator. Rejected by range Administrator. Add Program Committee Member domain Administrator."
source:Meta-Review,Source,Class,Meta Review,A meta-review in the context of a conference refers to a review of reviews. It involves analyzing and summarizing the feedback and evaluations provided by multiple reviewers for a particular submission or presentation. The meta-reviewer synthesizes the various perspectives and comments from the individual reviewers to provide an overall assessment of the submission. This process helps to ensure consistency and fairness in the review process and can provide valuable insights for authors on how to improve their work.,Meta-Review is a subclass of Review.
source:assignedByReviewer,Source,Property,Assigned By Reviewer,"AssignedByReviewer refers to the process in which a reviewer is assigned a specific paper or presentation to evaluate and provide feedback on during a conference. This assignment is typically made by the conference organizers or program committee based on the expertise and background of the reviewer. The reviewer is responsible for critically assessing the quality, relevance, and originality of the submission and providing constructive feedback to the authors.",Assigned by reviewer range reviewer. Assigned by reviewer inverse of assign external reviewer. Assigned by reviewer domain external reviewer. Assign external reviewer inverse of assigned by reviewer.
source:hasDecision,Source,Property,has Decision,"In the context of a conference, ""hasDecision"" typically refers to a status or attribute assigned to a submission or proposal that indicates a decision has been made regarding its acceptance or rejection for presentation at the conference. This could include decisions such as acceptance, rejection, conditional acceptance, or acceptance with revisions. The ""hasDecision"" status helps organizers and participants track the progress of submissions and manage the conference program.",The domain Paper has decision. Decision range has Decision.
source:readByReviewer,Source,Property,read By Reviewer,ReadByReviewer refers to the status of a paper or submission that has been reviewed by a reviewer during a conference. This status indicates that the reviewer has read and evaluated the submission according to the conference's criteria and guidelines.,Read by reviewer range reviewer. Read by reviewer domain paper. Read by reviewer is the inverse of read paper. Read paper is the inverse of read by reviewer.
