entity,source_or_target,entity_type,initial_matching,lexical_matching,graphical_matching
target:ComputerNetworksOpticalTopic,Target,Class,Computer Networks Optical Topic,"ComputerNetworksOpticalTopic refers to a specific area of discussion or focus within the field of computer networks that pertains to optical networking technologies. This may include topics such as fiber optic communication, optical switching, optical network design, and other related subjects that involve the use of light signals for data transmission in computer networks.",Computer Networks Optical Topic disjoint with Computer Networks Switching Topic. Computer Networks Optical Topic disjoint with Computer Networks Sensor Topic. Computer Networks Optical Topic disjoint with Computer Networks Security Topic. Computer Networks Optical Topic disjoint with Computer Networks Measurements Topic. Computer Networks Optical Topic disjoint with Computer Networks Management Topic. Computer Networks Optical Topic disjoint with Computer Networks Enterprise Topic. Computer Networks Optical Topic disjoint with Computer Networks Applications Topic. Computer Networks Optical Topic is a subclass of Computer Networks Topic. Computer Networks Enterprise Topic disjoint with Computer Networks Optical Topic. Computer Networks Measurements Topic disjoint with Computer Networks Optical Topic. Computer Networks Management Topic is disjoint with Computer Networks Optical Topic. Computer Networks Switching Topic disjoint with Computer Networks Optical Topic. Computer Networks Sensor Topic disjoint with Computer Networks Optical Topic. Computer Networks Security Topic disjoint with Computer Networks Optical Topic. Computer Networks Applications Topic is disjoint with Computer Networks Optical Topic.
target:ComputerNetworksMeasurementsTopic,Target,Class,Computer Networks Measurements Topic,"Computer Networks Measurements Topic refers to a specific area of study within the field of computer networks that focuses on the measurement and analysis of various aspects of network performance, behavior, and characteristics. This may include topics such as network traffic analysis, network latency, bandwidth utilization, packet loss, network security measurements, and other metrics that help researchers and practitioners understand and improve the performance of computer networks. This topic is often discussed and presented at conferences and research events dedicated to computer networks and related technologies.",Computer Networks Measurements Topic is disjoint with Computer Networks Switching Topic. Computer Networks Measurements Topic is disjoint with Computer Networks Sensor Topic. Computer Networks Measurements Topic is disjoint with Computer Networks Security Topic. Computer Networks Measurements Topic is disjoint with Computer Networks Optical Topic. Computer Networks Measurements Topic is disjoint with Computer Networks Management Topic. Computer Networks Measurements Topic disjoint with Computer Networks Enterprise Topic. Computer Networks Measurements Topic disjoint with Computer Networks Applications Topic. Computer Networks Measurements Topic is a subclass of Computer Networks Topic. Computer Networks Enterprise Topic disjoint with Computer Networks Measurements Topic. Computer Networks Optical Topic disjoint with Computer Networks Measurements Topic. Computer Networks Management Topic is disjoint with Computer Networks Measurements Topic. Computer Networks Switching Topic disjoint with Computer Networks Measurements Topic. Computer Networks Sensor Topic disjoint with Computer Networks Measurements Topic. Computer Networks Security Topic is disjoint with Computer Networks Measurements Topic. Computer Networks Applications Topic is disjoint with Computer Networks Measurements Topic.
target:ComputerNetworksManagementTopic,Target,Class,Computer Networks Management Topic,"Computer Networks Management Topic refers to a specific subject or area of focus within the field of computer networks management. This could include topics such as network security, network performance optimization, network monitoring and troubleshooting, network design and implementation, and other related areas. In a conference setting, this topic would likely be the focus of presentations, discussions, and research papers presented by experts in the field.",Computer Networks Management Topic is a subclass of Computer Networks Topic. Computer Networks Management Topic is disjoint with Computer Networks Switching Topic. Computer Networks Management Topic is disjoint with Computer Networks Sensor Topic. Computer Networks Management Topic is disjoint with Computer Networks Security Topic. Computer Networks Management Topic is disjoint with Computer Networks Optical Topic. Computer Networks Management Topic is disjoint with Computer Networks Measurements Topic. Computer Networks Management Topic is disjoint with Computer Networks Enterprise Topic. Computer Networks Management Topic is disjoint with Computer Networks Applications Topic. Computer Networks Enterprise Topic disjoint with Computer Networks Management Topic. Computer Networks Optical Topic disjoint with Computer Networks Management Topic. Computer Networks Measurements Topic is disjoint with Computer Networks Management Topic. Computer Networks Switching Topic is disjoint with Computer Networks Management Topic. Computer Networks Sensor Topic disjoint with Computer Networks Management Topic. Computer Networks Security Topic disjoint with Computer Networks Management Topic. Computer Networks Applications Topic is disjoint with Computer Networks Management Topic.
target:ComputerNetworksAapplicationsTopic,Target,Class,Computer Networks Applications Topic,"Computer Networks Applications Topic refers to a specific area of discussion or presentation within a conference that focuses on the practical applications of computer networks. This may include topics such as network security, cloud computing, Internet of Things (IoT), network management, and other related subjects that demonstrate how computer networks are used in real-world scenarios. Presentations and discussions within this topic area may cover case studies, best practices, and emerging trends in the field of computer networking applications.",Computer Networks Applications Topic is a subclass of Computer Networks Topic. Computer Networks Applications Topic disjoint with Computer Networks Switching Topic. Computer Networks Applications Topic is disjoint with Computer Networks Sensor Topic. Computer Networks Applications Topic disjoint with Computer Networks Security Topic. Computer Networks Applications Topic disjoint with Computer Networks Optical Topic. Computer Networks Applications Topic is disjoint with Computer Networks Measurements Topic. Computer Networks Applications Topic is disjoint with Computer Networks Management Topic. Computer Networks Applications Topic is disjoint with Computer Networks Enterprise Topic. Computer Networks Enterprise Topic disjoint with Computer Networks Applications Topic. Computer Networks Optical Topic disjoint with Computer Networks Applications Topic. Computer Networks Measurements Topic disjoint with Computer Networks Applications Topic. Computer Networks Management Topic disjoint with Computer Networks Applications Topic. Computer Networks Switching Topic disjoint with Computer Networks Applications Topic. Computer Networks Sensor Topic disjoint with Computer Networks Applications Topic. Computer Networks Security Topic disjoint with Computer Networks Applications Topic.
target:ActivePaper,Target,Class,Active Paper,"ActivePaper refers to a type of interactive paper technology that allows users to interact with digital content through physical paper. This technology typically involves embedding sensors or markers in the paper that can be scanned or detected by a device, such as a smartphone or tablet, to trigger digital content or actions. ActivePaper can be used in various applications, such as interactive presentations, educational materials, and marketing materials, to enhance user engagement and provide a more dynamic and immersive experience.",ActivePaper is a subclass of Paper. ActivePaper disjointWith PendingPaper. ActivePaper disjointWith WithdrawnPaper. ActivePaper disjointWith RejectedPaper. ActivePaper disjointWith AcceptedPaper. ActivePaper disjointWith PublishedPaper. PublishedPaper disjointWith ActivePaper. WithdrawnPaper disjointWith ActivePaper. Accepted Paper disjoint with Active Paper. RejectedPaper disjointWith ActivePaper. PendingPaper disjointWith ActivePaper. RatedPapers is a subclass of ActivePaper. Has rating domain Active Paper.
target:PendingPaper,Target,Class,Pending Paper,"PendingPaper refers to a paper or research submission that is currently under review or awaiting a decision on acceptance for presentation at a conference. It indicates that the paper has not yet been accepted or rejected, and is still in the process of being evaluated by the conference organizers or reviewers.",PendingPaper is a subclass of Paper. PendingPaper disjointWith ActivePaper. Pending Paper disjoint with Withdrawn Paper. Pending Paper disjoint with Rejected Paper. Pending Paper disjoint with Accepted Paper. Pending Paper disjoint with Published Paper. ActivePaper disjointWith PendingPaper. PublishedPaper disjointWith PendingPaper. WithdrawnPaper disjointWith PendingPaper. AcceptedPaper disjointWith PendingPaper. RejectedPaper disjointWith PendingPaper.
target:WithdrawnPaper,Target,Class,Withdrawn Paper,"WithdrawnPaper refers to a paper or presentation that was originally scheduled to be presented at a conference, but has been removed or withdrawn from the program for various reasons. This could be due to the author's request, failure to meet submission requirements, or other unforeseen circumstances.",WithdrawnPaper disjointWith PendingPaper. WithdrawnPaper disjointWith ActivePaper. WithdrawnPaper disjointWith RejectedPaper. WithdrawnPaper disjointWith AcceptedPaper. WithdrawnPaper disjointWith PublishedPaper. WithdrawnPaper is a subclass of Paper. ActivePaper disjointWith WithdrawnPaper. PublishedPaper disjointWith WithdrawnPaper. AcceptedPaper disjointWith WithdrawnPaper. RejectedPaper disjointWith WithdrawnPaper. Pending Paper disjoint with Withdrawn Paper.
target:RejectedPaper,Target,Class,Rejected Paper,"RejectedPaper refers to a paper or research submission that has been deemed unsuitable for presentation or publication at a conference. This decision is typically made by the conference organizers or reviewers based on factors such as relevance, quality, originality, and adherence to submission guidelines.",RejectedPaper disjointWith PendingPaper. RejectedPaper disjointWith ActivePaper. RejectedPaper disjointWith WithdrawnPaper. RejectedPaper disjointWith AcceptedPaper. RejectedPaper disjointWith PublishedPaper. RejectedPaper is a subclass of Paper. ActivePaper disjointWith RejectedPaper. PublishedPaper disjointWith RejectedPaper. WithdrawnPaper disjointWith RejectedPaper. AcceptedPaper disjointWith RejectedPaper. Pending Paper disjoint with Rejected Paper.
target:AcceptedPaper,Target,Class,Accepted Paper,"AcceptedPaper refers to a research paper or academic work that has been reviewed and approved by the conference organizers for presentation at the conference. This means that the paper has met the criteria for acceptance, such as originality, relevance to the conference theme, and quality of research. Accepted papers are typically presented by the authors at the conference through oral presentations, poster sessions, or other formats.",AcceptedPaper disjointWith PendingPaper. Accepted Paper disjoint with Active Paper. Accepted Paper disjoint with Withdrawn Paper. AcceptedPaper disjointWith RejectedPaper. AcceptedPaper disjointWith PublishedPaper. AcceptedPaper is a subclass of Paper. ActivePaper disjointWith AcceptedPaper. PublishedPaper disjointWith AcceptedPaper. WithdrawnPaper disjointWith AcceptedPaper. RejectedPaper disjointWith AcceptedPaper. PendingPaper disjointWith AcceptedPaper. Related to event domain accepted paper. Related to paper range accepted paper.
target:PublishedPaper,Target,Class,Published Paper,"A PublishedPaper in the context of a conference refers to a research paper or article that has been accepted by the conference organizers and published in the conference proceedings. This means that the paper has undergone a peer review process and has been deemed to meet the standards of the conference for quality and relevance. Published papers are typically presented at the conference either in oral or poster format, and are often considered as a significant contribution to the field of study.",PublishedPaper is a subclass of Paper. PublishedPaper disjointWith PendingPaper. PublishedPaper disjointWith ActivePaper. PublishedPaper disjointWith WithdrawnPaper. PublishedPaper disjointWith RejectedPaper. PublishedPaper disjointWith AcceptedPaper. ActivePaper disjointWith PublishedPaper. WithdrawnPaper disjointWith PublishedPaper. AcceptedPaper disjointWith PublishedPaper. RejectedPaper disjointWith PublishedPaper. PendingPaper disjointWith PublishedPaper.
target:Attendee,Target,Class,Attendee,"An attendee is a person who is present at a conference or event. They are typically there to participate in the activities, listen to speakers, network with other attendees, and learn from the presentations and discussions.",
target:CoffeeBreak,Target,Class,Coffee Break,"A CoffeeBreak is a short break during a conference or meeting where attendees have the opportunity to get coffee or other refreshments, socialize with other participants, and take a brief rest before continuing with the event. It is a common practice in conferences to have scheduled CoffeeBreaks to allow attendees to recharge and network with others.",CoffeeBreak is a subclass of BreakEvent.
target:FreeTimeBreak,Target,Class,Free Time Break,"Freetimebreak refers to a period of time during a conference or event where attendees are given the opportunity to take a break from scheduled activities and sessions. This time can be used for networking, exploring the venue, or simply relaxing before the next session begins. It is a chance for attendees to recharge and refresh themselves during the event.",FreeTimeBreak is a subclass of BreakEvent.
target:MealBreak,Target,Class,Meal Break,MealBreak refers to a scheduled break during a conference or event specifically designated for attendees to have a meal. This break allows participants to take a break from the conference sessions and networking activities to have lunch or dinner. Meal breaks are typically included in the conference schedule and may be provided by the event organizers or attendees may have the option to purchase meals from on-site vendors or nearby restaurants.,MealBreak is a subclass of BreakEvent.
target:Reviewer,Target,Class,Reviewer,"A reviewer in the context of a conference is an individual who evaluates and provides feedback on research papers or proposals submitted for presentation at the conference. Reviewers are typically experts in the field related to the conference topic and are responsible for assessing the quality, relevance, and originality of the submissions. Their feedback helps conference organizers make decisions on which submissions to accept for presentation.",Is review history of range reviewer. Has review history domain reviewer.
target:ClosingTalk,Target,Class,Closing Talk,"ClosingTalk refers to the final presentation or speech given at the end of a conference. This talk typically summarizes key points discussed throughout the event, provides closing remarks, and may offer insights or inspiration for attendees to take away. It serves as a conclusion to the conference and often leaves a lasting impression on participants.",Closing Talk disjoint with Welcome Talk. ClosingTalk is a subclass of TalkEvent. Welcome talk disjoint with closing talk.
target:WelcomeTalk,Target,Class,Welcome Talk,"WelcomeTalk is a term used to refer to the opening remarks or speech given at the beginning of a conference to welcome attendees and set the tone for the event. It is typically delivered by a key organizer or host of the conference and may include information about the agenda, logistics, and goals of the event. WelcomeTalks are meant to engage and energize the audience, as well as provide important information to help attendees make the most of their conference experience.",Welcome Talk disjoint with Closing Talk. Welcome Talk is a subclass of TalkEvent. Closing Talk disjointWith Welcome Talk.
target:TalkEvent,Target,Class,Talk Event,"A TalkEvent in the context of a conference refers to a specific session or presentation where a speaker or speakers discuss a particular topic or subject. It is a scheduled event within the conference program where attendees can listen to and engage with the speakers on the topic being presented. TalkEvents are an important part of conferences as they provide valuable information, insights, and opportunities for networking and learning.","TalkEvent disjointWith PaperPresentation. TalkEvent disjointWith Workshop. TalkEvent disjointWith OrganizationalMeeting. ""TalkEvent is a subclass of AcademicEvent."" ClosingTalk is a subclass of TalkEvent. Organizational Meeting disjoint with Talk Event. Welcome Talk is a subclass of TalkEvent. Workshop disjointWith TalkEvent. Paper Presentation disjoint with Talk Event."
target:SessionChair,Target,Class,Session Chair,"A Session Chair is a person responsible for moderating and facilitating a specific session or panel discussion during a conference. They introduce speakers, manage the flow of the session, keep track of time, and facilitate audience participation through Q&A sessions. The Session Chair plays a crucial role in ensuring that the session runs smoothly and that all participants have the opportunity to share their insights and engage in meaningful discussions.",SessionChair disjointWith Author. SessionChair is a subclass of Person. Author disjointWith SessionChair.
target:TPCMember,Target,Class,TPC Member,"TPCMember stands for Technical Program Committee Member. TPCMembers are experts in a particular field who are responsible for reviewing and selecting papers, presentations, and speakers for a conference. They play a crucial role in ensuring the quality and relevance of the content presented at the conference.",TPCMember disjointWith Author. TPCMember is a subclass of Person. Author disjointWith TPCMember.
target:TwoLevelConference,Target,Class,Two Level Conference,"A TwoLevelConference refers to a conference format where there are two levels of participation or engagement. This could involve having both a main conference with keynote speakers, panel discussions, and workshops, as well as smaller breakout sessions or workshops that allow for more in-depth discussions and interactions among participants. This format allows for a more dynamic and interactive conference experience, catering to different interests and levels of engagement among attendees.",
target:CallForPapers,Target,Class,Call For Papers,"CallForPapers is a request for academic researchers, scholars, and professionals to submit their research papers or proposals for presentation at a conference. It is a formal invitation for individuals to contribute their work to the conference program, typically outlining the theme, topics of interest, submission guidelines, and deadlines. Researchers who wish to present their work at the conference must respond to the CallForPapers by submitting their abstracts or full papers for review and consideration by the conference organizers.",Call for papers is a subclass of call.
target:TextualReviewQuestion,Target,Class,Textual Review Question,"A Textual Review Question is a type of question that is based on the text or material being reviewed in a conference. It typically requires participants to analyze and discuss specific details, themes, or arguments presented in the text. Textual Review Questions are often used to deepen understanding, encourage critical thinking, and facilitate meaningful discussions among conference attendees.",Textual Review Question is a subclass of Review Question.
target:NumericalReviewQuestion,Target,Class,Numerical Review Question,"A NumericalReviewQuestion in the context of a conference refers to a question that requires a numerical answer or response. This type of question typically involves calculations, data analysis, or quantitative reasoning. Participants may be asked to solve mathematical problems, interpret statistical data, or provide numerical estimates in response to NumericalReviewQuestions during conference presentations or discussions.",NumericalReviewQuestion is a subclass of ReviewQuestion.
target:OrganizationalMeeting,Target,Class,Organizational Meeting,"An Organizational Meeting in the context of a conference refers to a meeting that is held at the beginning of the conference to discuss and establish the structure, goals, and agenda of the conference. This meeting typically involves key stakeholders such as organizers, sponsors, and speakers, and is important for ensuring that everyone is on the same page and that the conference runs smoothly. Topics discussed during an organizational meeting may include logistics, scheduling, budget, marketing, and any other important details related to the conference.",Organizational Meeting disjoint with Talk Event. Organizational Meeting disjoint with Paper Presentation. Organizational Meeting disjoint with Workshop. Organizational Meeting is a subclass of Academic Event. Workshop disjointWith OrganizationalMeeting. Paper Presentation disjoint with Organizational Meeting. TalkEvent disjointWith OrganizationalMeeting.
target:PaperPresentation,Target,Class,Paper Presentation,"A Paper Presentation is a formal presentation of a research paper or academic work at a conference. It typically involves presenting the key findings, methodology, and conclusions of the paper to an audience of peers and experts in the field. Paper presentations are a common feature of academic conferences and provide researchers with an opportunity to share their work, receive feedback, and engage in discussions with other scholars.",PaperPresentation is a subclass of AcademicEvent. Paper Presentation disjoint with Talk Event. Paper Presentation disjoint with Workshop. Paper Presentation disjoint with Organizational Meeting. Organizational Meeting disjoint with Paper Presentation. Workshop disjointWith PaperPresentation. TalkEvent disjointWith PaperPresentation. Related to event range paper presentation. Related to paper domain paper presentation.
target:Workshop,Target,Class,Workshop,"A workshop in the context of a conference is a session or event where participants engage in hands-on activities, discussions, or exercises related to a specific topic or skill. Workshops are typically interactive and provide attendees with the opportunity to learn new techniques, strategies, or information in a more practical and experiential way. Workshops may be led by experts in the field or by conference attendees who have expertise in a particular area.",Workshop disjointWith TalkEvent. Workshop disjointWith PaperPresentation. Workshop disjointWith OrganizationalMeeting. Workshop is a subclass of Academic Event. Organizational Meeting disjoint with Workshop. Paper Presentation disjoint with Workshop. TalkEvent disjointWith Workshop.
target:AcademicEvent,Target,Class,Academic Event,"An AcademicEvent in the context of a conference refers to any event or activity that is focused on academic or scholarly topics, such as presentations, workshops, panel discussions, poster sessions, and keynote speeches. These events are typically designed to facilitate the exchange of knowledge and ideas among researchers, scholars, and students in a particular field of study. Academic events are an important component of conferences as they provide opportunities for participants to learn from each other, share their research findings, and engage in discussions on current issues and trends in their respective fields.","AcademicEvent is a subclass of ConferenceEvent. Academic Event disjoint with Non-Academic Event. Organizational Meeting is a subclass of Academic Event. NonAcademicEvent disjointWith AcademicEvent. Workshop is a subclass of Academic Event. PaperPresentation is a subclass of AcademicEvent. ""TalkEvent is a subclass of AcademicEvent."" Has call domain Academic Event. For event range academic event."
target:PersonalPublicationHistory,Target,Class,Personal Publication History,"PersonalPublicationHistory refers to a record of an individual's past publications, including academic papers, articles, books, and other works that have been published in professional or academic journals, books, or other platforms. This information is often included in a researcher's or academic's curriculum vitae (CV) and is important for demonstrating their expertise and contributions to their field. In the context of a conference, PersonalPublicationHistory may be requested as part of a speaker's or presenter's biography or profile to provide attendees with information about their background and areas of expertise.",Personal Publication History is a subclass of Personal History.
target:Excursion,Target,Class,Excursion,"In the context of a conference, an excursion refers to a planned trip or outing organized for conference attendees to explore the local area, visit cultural or historical sites, or engage in recreational activities. Excursions are often offered as optional activities outside of the main conference program to provide participants with an opportunity to relax, network, and experience the destination city or region.",Excursion is a subclass of SocialEvent.
