entity,source_or_target,entity_type,initial_matching,lexical_matching,graphical_matching
source:rejectedBy,Source,Property,rejected By,"In the context of a conference, ""rejectedBy"" typically refers to the person or entity who has rejected a submission, proposal, or application for the conference. This could be a reviewer, committee member, or organizer who has deemed the submission to be unsuitable or not meeting the criteria for acceptance.",The domain Paper is rejected. Range Administrator rejectedBy. Rejected by is the inverse of reject paper. Reject paper is the inverse of rejected by.
source:readByMeta-Reviewer,Source,Property,read By Meta Reviewer,"In the context of a conference, ""readByMeta-Reviewer"" typically refers to the status of a paper or submission that has been reviewed by a meta-reviewer. A meta-reviewer is a senior reviewer or committee member who evaluates the reviews provided by other reviewers for a particular submission. Once a submission has been read and evaluated by the meta-reviewer, they may provide additional feedback or make a final decision on the acceptance or rejection of the submission.",Read by Meta-Reviewer range Meta-Reviewer. Read by meta-reviewer domain paper.
source:writtenBy,Source,Property,written By,"In the context of a conference, ""writtenBy"" typically refers to the author or authors of a particular paper, presentation, or document. It is used to attribute the work to the individual or group responsible for creating it. This information is important for giving credit to the original creators and for providing context and credibility to the content being presented.",Written by Domain Review. Written by Range Reviewer. WriteReview is the inverse of writtenBy. Write review is the inverse of written by.
source:writeReview,Source,Property,write Review,"In the context of a conference, ""writeReview"" typically refers to the act of writing a review or feedback on a presentation, session, or overall experience at the conference. This review can include comments on the content, delivery, organization, and any other aspects of the conference that the reviewer wants to share with others or provide feedback to the organizers. Writing a review can help other attendees make informed decisions about attending future conferences and can also help organizers improve and enhance the conference experience for future participants.",Write review range review. Write review domain reviewer. Write review is the inverse of written by. WriteReview is the inverse of writtenBy.
source:assignExternalReviewer,Source,Property,assign External Reviewer,AssignExternalReviewer is a function or process in a conference management system where a reviewer from outside the organization or institution hosting the conference is assigned to review a submitted paper or proposal. This external reviewer is typically an expert in the field related to the paper or proposal and provides an unbiased and objective evaluation of the submission. This helps ensure the quality and credibility of the review process in the conference.,Assign external reviewer inverse of assigned by reviewer. Assign external reviewer range external reviewer. Assign external reviewer domain reviewer. Assigned by reviewer is the inverse of assign external reviewer.
source:writePaper,Source,Property,write Paper,"In the context of a conference, ""writePaper"" typically refers to the process of preparing and submitting a research paper or academic article to be presented at the conference. This involves conducting research, analyzing data, writing the paper, and formatting it according to the conference guidelines. The paper is then submitted to the conference organizers for review and consideration for presentation at the conference.",Write paper domain author. WritePaper is the inverse of hasAuthor. Write paper range paper. The inverse of writePaper hasAuthor.
source:addProgramCommitteeMember,Source,Property,add Program Committee Member,"In the context of a conference, addProgramCommitteeMember refers to the action of adding a new member to the program committee. The program committee is responsible for reviewing and selecting submissions, organizing the conference program, and ensuring the quality and relevance of the content presented at the conference. Adding a new member to the program committee typically involves inviting an individual with expertise in the conference topic or field to contribute their knowledge and insights to the committee's decision-making process.",Add Program Committee Member domain Administrator. Add Program Committee Member range Program Committee Member. Add Program Committee Member inverse of added by. AddProgramCommitteeMember is the inverse of addedBy.
source:name,Source,Property,name,"In the context of a conference, the term ""name"" typically refers to the title or designation of the event. It is the official title by which the conference is known and is used to identify and promote the event to potential attendees. Additionally, ""name"" can also refer to the individual names of the speakers, presenters, and participants involved in the conference.",Name range string.
source:date,Source,Property,date,"In the context of a conference, the term ""date"" typically refers to the specific day or days on which the conference is scheduled to take place. It could also refer to the deadline for submitting proposals, registering for the conference, or other important dates related to the event.",Date domain Conference. Date range date.
source:reviewsPerPaper,Source,Property,reviews Per Paper,"ReviewsPerPaper refers to the average number of reviews that each paper submitted to a conference receives. This metric is often used to evaluate the thoroughness and quality of the peer review process at a conference. A higher ReviewsPerPaper value indicates that each paper is being reviewed by multiple reviewers, which can help ensure a more comprehensive evaluation of the research presented.",Reviews per paper domain conference. Reviews per paper range int.
source:paperID,Source,Property,paper ID,"In the context of a conference, a paperID is a unique identifier assigned to each paper submitted for presentation at the conference. This identifier is used to track and manage the submission throughout the review process, as well as to reference the paper in the conference program and proceedings.",Paper ID range is an unsigned long. PaperID domain Paper.
source:maxPapers,Source,Property,max Papers,MaxPapers refers to the maximum number of papers that an individual or organization is allowed to submit for consideration at a conference. This limit is typically set by the conference organizers to ensure that each participant has a fair opportunity to present their work and to prevent any one individual or group from dominating the conference program.,Max Papers domain Program Committee Member. Max Papers range int.
source:email,Source,Property,email,"In the context of a conference, an email typically refers to a message sent electronically to communicate important information, updates, reminders, or announcements related to the conference. Organizers may use email to communicate with attendees, speakers, sponsors, and other stakeholders before, during, and after the event. Email is often used to distribute schedules, agendas, registration details, and other logistical information to ensure that participants are well-informed and prepared for the conference.",Email domain Person. Email range string.
source:logoURL,Source,Property,logo URL,LogoURL refers to the web address or URL where the logo of a company or organization can be found. This is typically used in the context of conferences when organizers request the logoURL from sponsors or partners to include their logo in promotional materials or on the conference website.,Logo URL range any URI. The logo URL domain Conference.
source:acceptsHardcopySubmissions,Source,Property,accepts Hardcopy Submissions,"AcceptsHardcopySubmissions refers to the policy of a conference or organization to allow participants to submit their work in physical, printed form rather than electronically. This could include printed copies of research papers, posters, or other materials that are typically submitted digitally.",Accepts hard copy submissions range boolean. Accepts hard copy submissions for the conference.
source:title,Source,Property,title,"In the context of a conference, the term ""title"" typically refers to the name or designation given to a presentation, session, paper, or talk that is being presented at the conference. The title is usually a brief and descriptive phrase that summarizes the content or topic of the presentation, helping attendees to quickly understand what the presentation is about. Titles are often listed in the conference program or schedule to help participants navigate the event and choose which sessions to attend.",Title domain paper. Title range string.
source:siteURL,Source,Property,site URL,"In the context of a conference, siteURL refers to the website address or URL where attendees can find information about the conference, register for the event, access the agenda, view speaker profiles, and find other relevant details. It is the online location where participants can go to get all the necessary information about the conference.",Site URL range any URI. The domain Conference siteURL.
target:SlideSet,Target,Class,Slide Set,"In the context of a conference, a SlideSet refers to a collection of slides that are typically used in a presentation. These slides contain information, visuals, and data that the presenter uses to convey their message to the audience. SlideSets are often created using presentation software such as PowerPoint or Keynote, and are an essential tool for speakers to effectively communicate their ideas during a conference session.",SlideSet disjointWith Review. SlideSet is disjoint with Programme. SlideSet is disjoint with Paper. SlideSet is disjoint with MealMenu. SlideSet is a subclass of Document. Paper disjointWith SlideSet. Programme disjointWith SlideSet. MealMenu is disjoint with SlideSet. Review disjointWith SlideSet.
target:Review,Target,Class,Review,"In the context of a conference, a review typically refers to the evaluation and assessment of a submitted paper, presentation, or research project by peers or experts in the field. Reviews are often conducted to determine the quality, relevance, and originality of the work and to provide feedback to the authors for potential improvements. Reviews are an important part of the conference submission and selection process, as they help ensure the overall quality of the content presented at the conference.",Review disjointWith SlideSet. Review disjointWith Programme. Review disjointWith Paper. Review disjointWith MealMenu. Review is a subclass of Document. SlideSet disjointWith Review. Paper disjointWith Review. Programme disjointWith Review. MealMenu disjointWith Review.
target:Programme,Target,Class,Programme,"In the context of a conference, a programme refers to a schedule or agenda of events, sessions, presentations, and activities that will take place during the conference. It typically includes information on the timing of each session, the topics that will be covered, the speakers or presenters, and any other relevant details for attendees. The programme helps attendees plan their participation in the conference and ensures that they are aware of all the opportunities available to them.",Programme disjointWith SlideSet. Programme disjointWith Review. Programme disjointWith Paper. Programme disjointWith MealMenu. Programme is a subclass of Document. SlideSet disjointWith Programme. Paper disjointWith Programme. MealMenu is disjoint with Programme. Review disjointWith Programme. Programme belongs to Event. Programme has Programme range.
target:Paper,Target,Class,Paper,"In the context of a conference, a paper refers to a written document that presents research findings, analysis, or ideas on a specific topic. Papers are typically submitted by researchers, scholars, or experts in a particular field to be presented at a conference for discussion and dissemination of knowledge. Papers are often peer-reviewed before being accepted for presentation at a conference.",Paper is a subclass of Document. Paper disjointWith SlideSet. Paper disjointWith Review. Paper disjointWith Programme. Paper disjointWith MealMenu. Paper disjointWith Conference. SlideSet is disjoint with Paper. Programme disjointWith Paper. ActivePaper is a subclass of Paper. PublishedPaper is a subclass of Paper. MealMenu is disjoint with Paper. WithdrawnPaper is a subclass of Paper. Conference disjointWith Paper. AcceptedPaper is a subclass of Paper. RejectedPaper is a subclass of Paper. PendingPaper is a subclass of Paper. Review disjointWith Paper. Has related paper range paper. Is reviewing range paper. Is written by domain Paper. Is reviewed by domain Paper.
target:MealMenu,Target,Class,Meal Menu,"MealMenu refers to the list of food and beverage options that will be served during a conference or event. It typically includes details such as the types of dishes, dietary restrictions, and meal timings. The MealMenu is important for attendees to know what to expect and make any necessary arrangements for their meals.",MealMenu is disjoint with SlideSet. MealMenu is disjoint with Review. MealMenu is disjoint with Programme. MealMenu is disjoint with Paper. MealMenu is a subclass of Document. SlideSet is disjoint with MealMenu. Paper disjointWith MealMenu. Programme disjointWith MealMenu. Review disjointWith MealMenu. Has menu range meal menu. Is menu of domain meal menu.
target:Document,Target,Class,Document,"In the context of a conference, a document refers to any written or printed material that is used for reference, information, or communication during the event. This can include agendas, schedules, presentations, reports, handouts, and any other materials that are distributed to attendees or used by speakers during the conference. Documents are an important part of a conference as they help to provide structure, information, and support for the various sessions and activities that take place.",
target:Topic,Target,Class,Topic,"In the context of a conference, a topic refers to the subject or theme that will be discussed, presented, or debated during the event. It is the main focus of the conference and guides the selection of speakers, presentations, and discussions. Topics can range from specific issues or trends within a particular industry or field to broader societal or global issues. The topic sets the overall direction and purpose of the conference and helps to attract attendees who are interested in that particular subject matter.",Topic disjointWith ConferenceEvent. Topic disjointWith Call. Topic disjointWith ReviewRating. Topic disjointWith Organization. Topic disjointWith ReviewForm. The topic is disjoint with the conference. Topic disjointWith PersonalHistory. Topic disjointWith Sponsorship. Topic disjointWith ReviewQuestion. The topic is disjoint with person. Topic disjointWith Country. Topic disjointWith ConferenceSession. Topic disjointWith ContactInformation. Topic disjointWith Document. Topic is disjoint with Place. Contact Information disjoint with Topic. Parallel And Distributed Computing Topic is a subclass of Topic. Computer Networks Topic is a subclass of Topic. Communication Theory Topic is a subclass of Topic. Review Question disjoint with Topic. Place disjointWith Topic. Document disjointWith Topic. SecurityTopic is a subclass of Topic. Wireless Communications Topic is a subclass of Topic. Sponsorship is disjoint with Topic. Medicine is a subclass of Topic. Antennas are a subclass of the topic. Performance is a subclass of Topic. CommunicationsTopic is a subClassOf Topic. Signal Processing Topic is a subclass of Topic. Mobile Computing Topic is a subclass of Topic. Call disjointWith Topic. The ConferenceEvent is disjoint with the Topic. CADTopic subClassOf Topic. The conference is disjoint with the topic. OperatingTopicsystems subClassOf Topic. Computer Architecture Topic is a subclass of Topic. ConferenceSession is disjoint with Topic. Review Rating is disjoint with Topic. MultimediaTopic is a subclass of Topic. ReviewForm is disjoint with Topic. Satellite and Space Communications Topic is a subclass of Topic. Personal History disjoint with Topic. CryptographyTopic is a subClassOf Topic. Person is disjoint with Topic. Microelectronics is a subclass of Topic. Powerline Transmission Topic is a subclass of Topic. Country disjointWith Topic. Organization disjointWith Topic. Test Only Topic is a subclass of Topic. Radio Communications Topic is a subclass of Topic. The topic has a range. Topic is the domain of isTopicOf.
target:ConferenceEvent,Target,Class,Conference Event,"A ConferenceEvent refers to a specific event or gathering that is organized for the purpose of bringing together individuals or groups to discuss, share information, and collaborate on a particular topic or theme. This can include conferences, seminars, workshops, symposiums, and other similar events where participants come together to exchange ideas, network, and learn from each other.",ConferenceEvent is disjoint with Document. ConferenceEvent is disjoint with Organization. ConferenceEvent is disjoint with ReviewQuestion. ConferenceEvent is disjoint with Person. ConferenceEvent is disjoint with Sponsorship. ConferenceEvent is disjoint with PersonalHistory. The ConferenceEvent is disjoint with the Topic. ConferenceEvent is disjoint with ReviewForm. ConferenceEvent is disjoint with Place. Conference event is disjoint with conference. ConferenceEvent is disjoint with ConferenceSession. ConferenceEvent is disjoint with ReviewRating. ConferenceEvent is disjoint with Call. ConferenceEvent is disjoint with ContactInformation. The ConferenceEvent is disjoint with Country. Topic disjointWith ConferenceEvent. ContactInformation disjointWith ConferenceEvent. Review Question disjoint with Conference Event. Place disjointWith ConferenceEvent. Document disjointWith ConferenceEvent. Sponsorship is disjoint with ConferenceEvent. Call disjointWith ConferenceEvent. Conference is disjoint with ConferenceEvent. NonAcademicEvent is a subclass of ConferenceEvent. ConferenceSession is disjoint with ConferenceEvent. ReviewRating is disjoint with ConferenceEvent. ReviewForm is disjoint with ConferenceEvent. Personal History disjoint with Conference Event. Person is disjoint with ConferenceEvent. AcademicEvent is a subclass of ConferenceEvent. Country is disjoint with ConferenceEvent. Organization disjointWith ConferenceEvent. Belongs to event range conference event. Attendee at range ConferenceEvent. Is location of range conference event. The domain of hasAttendee is ConferenceEvent. Has location domain Conference Event. Has programme domain conference event. The domain ConferenceEvent has end date time. Has start date time domain conference event.
target:Call,Target,Class,Call,"In the context of a conference, a ""call"" typically refers to a request or invitation for someone to speak or participate in a specific session or panel discussion. It can also refer to a scheduled time for participants to join a virtual meeting or phone call. Additionally, a ""call for papers"" is a common term used to invite researchers and academics to submit their work for presentation at a conference.","Call disjointWith Place. Call disjointWith Sponsorship. Call disjointWith ReviewRating. Call disjointWith Document. Call disjointWith ReviewQuestion. Call disjointWith Topic. Call disjointWith Country. Call disjointWith ConferenceEvent. Call disjointWith ConferenceSession. Call disjointWith ReviewForm. Call disjointWith Conference. Call disjointWith Organization. Call disjointWith PersonalHistory. Call disjointWith Person. Call disjointWith ContactInformation. Topic disjointWith Call. Contact Information disjoint with Call. Review Question disjoint with Call. Place disjointWith Call. Document disjointWith Call. Sponsorship disjointWith Call. Call for papers is a subclass of call. ConferenceEvent is disjoint with Call. Conference disjointWith Call. ""CallForReviews is a subclass of Call."" ConferenceSession is disjoint with Call. Review Rating disjoint with Call. ReviewForm is disjoint with Call. Call for Manuscripts is a subclass of Call. Personal History disjoint with Call. Person is disjoint with Call. Country is disjoint with Call. Organization disjointWith Call. Call range hasCall. Call forEvent domain. Call is initiated by domain. Call initiates range. Call domain has submission instructions. The domain Call has submission deadline."
target:ReviewRating,Target,Class,Review Rating,"In the context of a conference, ReviewRating refers to the evaluation or rating given to a presentation, session, speaker, or overall event by attendees or participants. This rating can be based on various criteria such as content, relevance, delivery, engagement, and overall satisfaction. ReviewRating helps organizers and speakers to understand the feedback and opinions of attendees, and make improvements for future conferences.",ReviewRating disjointWith Topic. Review Rating disjoint with Sponsorship. Review Rating disjoint with Personal History. Review Rating disjoint with Review Form. ReviewRating is disjoint with Person. Review Rating disjoint with Conference. Review Rating is disjoint with Country. Review Rating disjoint with Conference Session. Review Rating disjoint with Organization. ReviewRating is disjoint with Document. ReviewRating disjointWith ConferenceEvent. Review Rating disjoint with Review Question. Review Rating disjoint with Contact Information. ReviewRating disjointWith Place. Review Rating disjoint with Call. Topic disjointWith ReviewRating. WeekRejectRating is a subclass of ReviewRating. Contact Information disjoint with Review Rating. ReviewQuestion is disjoint with ReviewRating. Place disjointWith ReviewRating. Document disjointWith ReviewRating. RejectRating is a subclass of ReviewRating. Sponsorship disjointWith ReviewRating. Call disjointWith ReviewRating. ConferenceEvent is disjoint with ReviewRating. Conference disjointWith ReviewRating. Accept If Room Rating is a subclass of Review Rating. ConferenceSession is disjoint with ReviewRating. AcceptRating is a subclass of ReviewRating. ReviewForm disjointWith ReviewRating. Personal History disjoint with Review Rating. Person is disjoint with ReviewRating. Country disjointWith ReviewRating. Organization disjointWith ReviewRating. Has rating range review rating.
target:Organization,Target,Class,Organization,"In the context of a conference, organization refers to the group or entity responsible for planning, coordinating, and executing the event. This includes tasks such as selecting a venue, inviting speakers, managing registrations, creating a schedule, and overseeing logistics. The organization may be a company, association, institution, or group of individuals working together to ensure the conference runs smoothly and successfully.",
target:ReviewForm,Target,Class,Review Form,"A ReviewForm in the context of a conference is a document or online form that is used by attendees, speakers, or participants to provide feedback on the conference sessions, speakers, organization, and overall experience. This feedback is typically used by the conference organizers to evaluate the success of the event and make improvements for future conferences.",ReviewForm is disjoint with Call. ReviewForm disjointWith PersonalHistory. ReviewForm is disjoint with ReviewRating. ReviewForm is disjoint with Place. ReviewForm is disjoint with ContactInformation. ReviewForm disjointWith ConferenceEvent. ReviewForm is disjoint with Conference. ReviewForm is disjoint with Document. ReviewForm is disjoint with Person. ReviewForm is disjoint with ConferenceSession. ReviewForm is disjoint with Organization. ReviewForm is disjoint with Country. ReviewForm is disjoint with Sponsorship. ReviewForm is disjoint with ReviewQuestion. ReviewForm disjointWith Topic. Topic disjointWith ReviewForm. Contact Information disjoint with Review Form. ReviewQuestion disjointWith ReviewForm. Place disjointWith ReviewForm. Document disjointWith ReviewForm. Sponsorship disjointWith ReviewForm. Call disjointWith ReviewForm. ConferenceEvent is disjoint with ReviewForm. Conference disjointWith ReviewForm. ConferenceSession is disjoint with ReviewForm. Review Rating disjoint with Review Form. Personal History disjoint with Review Form. Person disjointWith ReviewForm. Country disjointWith ReviewForm. Organization disjointWith ReviewForm.
