entity,source_or_target,entity_type,initial_matching,lexical_matching,graphical_matching
target:obtain,Target,Property,obtain,"In the context of a conference, ""obtain"" typically means to acquire or secure something, such as information, data, approval, or results. It can also refer to obtaining permission, access, or resources needed for the conference.",
target:designed_by,Target,Property,designed by,"In the context of a conference, 'designed_by' typically refers to the individual or team responsible for creating the visual design, branding, and overall aesthetic of the conference. This can include designing the logo, website, promotional materials, signage, and any other visual elements associated with the event. The 'designed_by' credit is often given to acknowledge and highlight the creative work of the designers involved in shaping the conference's visual identity.",Design is the inverse of designed_by. The sentence is: 'Designed by range ACM SIGKDD.' Verbalised sentence: Designed by range ACM SIGKDD. Designed by domain deadline. Design is the inverse of designed by.
target:presentationed_by,Target,Property,presentationed by,presented by,The presentation was given by the Speaker. Presentationed by domain Document. Presentationed by inverseOf presentation. Presentation is the inverse of being presented.
target:searched_by,Target,Property,searched by,"In the context of a conference, ""searched by"" typically refers to the process of conducting a search or investigation to find specific information, data, or resources related to a particular topic or subject. This could involve using search engines, databases, or other tools to gather relevant information for presentation or discussion at the conference.",
target:Price,Target,Property,Price,"In the context of a conference, the term ""price"" typically refers to the cost of attending the conference. This may include registration fees, accommodation costs, travel expenses, and any additional fees for workshops, networking events, or other activities associated with the conference. Organizers may offer early bird discounts, group rates, or scholarships to make the conference more accessible to a wider range of participants.",Price domain Registration fee. Price range int.
target:Name_of_conference,Target,Property,Name of conference,"Name_of_conference refers to the specific title or name of a conference event that is being held. It is used to identify and distinguish one conference from another, and often reflects the theme or focus of the event.",Name of conference domain Conference. Name of conference range string.
target:Nation,Target,Property,Nation,"In the context of a conference, the term ""Nation"" typically refers to a sovereign state or country, often represented by a delegation of government officials or representatives. Nations participate in conferences to discuss and negotiate various issues such as international relations, trade agreements, security, and environmental concerns. Each nation has its own interests, priorities, and perspectives that they bring to the conference discussions.",Nation range string. Person domain Nation.
target:Name,Target,Property,Name,"In the context of a conference, ""Name"" typically refers to the full name of the attendee or participant. This information is often used for registration purposes, identification, and networking opportunities during the event. It is important for attendees to provide their full name accurately to ensure smooth communication and organization during the conference.",Name range string. Name domain Person.
target:Currency,Target,Property,Currency,"In the context of a conference, currency refers to the accepted form of payment for registration fees, merchandise, or any other expenses related to the event. This could include cash, credit cards, or other forms of payment that the conference organizers have specified as acceptable.",
target:Name_of_sponsor,Target,Property,Name of sponsor,"Name_of_sponsor refers to the specific company or organization that is providing financial support or resources for a conference. Sponsors often have their logo displayed prominently at the event and may have the opportunity to promote their products or services to attendees. Sponsors play a crucial role in helping to fund and organize conferences, and their support is typically acknowledged and appreciated by the organizers and participants.",Name of sponsor range string. Name of sponsor domain Sponzor.
target:Start_of_conference,Target,Property,Start of conference,"Start_of_conference refers to the beginning of a conference or event where attendees gather, presentations are made, and discussions take place. It marks the official commencement of the conference program and sets the tone for the rest of the event.",Start of conference range date time. Start of conference domain Conference.
target:E-mail,Target,Property,E-mail,"In the context of a conference, an email refers to a message sent electronically from one participant to another, typically for communication purposes related to the conference. This could include sharing information, coordinating schedules, sending reminders, or discussing agenda items. Email is a common form of communication in conference planning and execution.",E-mail domain Person. E-mail range string.
target:Date,Target,Property,Date,"In the context of a conference, the term ""date"" typically refers to the specific day or days on which the conference is scheduled to take place. This could include the start date, end date, or both. It is important for attendees, organizers, and speakers to be aware of the dates of the conference in order to make necessary arrangements and plan their participation accordingly.",Date range dateTime. Date domain Deadline.
target:City_of_conference,Target,Property,City of conference,"City_of_conference refers to the location or city where a conference is taking place. It is the city where attendees gather to participate in the conference sessions, workshops, and networking events. The city of the conference can play a significant role in attracting attendees and influencing the overall experience of the event.",City of conference domain Conference. City of conference range string.
target:End_of_conference,Target,Property,End of conference,"End_of_conference refers to the conclusion or end of a conference event. This typically includes the final sessions, closing remarks, and any post-conference activities or networking opportunities. It signifies the end of the formal agenda and marks the completion of the conference.",End of conference range date time. End of conference domain Conference.
