entity,source_or_target,entity_type,initial_matching,lexical_matching,graphical_matching
source:Trip,Source,Class,Trip,"In the context of a conference, a trip typically refers to a planned visit or journey to a specific location for the purpose of attending the conference. This may involve traveling by car, train, plane, or other means of transportation to reach the conference venue.",Trip disjointWith Banquet. Trip disjointWith Reception. Trip is a subclass of social event. Banquet is disjoint with Trip. Reception is disjoint with Trip.
source:Banquet,Source,Class,Banquet,"A banquet in the context of a conference refers to a formal meal or feast that is typically held as part of the conference program. It is a special event where attendees can come together to enjoy a meal, socialize, and network with one another in a more relaxed and festive setting. Banquets are often held in a large dining hall or banquet room and may include speeches, entertainment, and awards presentations.",Banquet disjointWith Trip. Banquet disjointWith Reception. Banquet is a subclass of social event. Trip disjointWith Banquet. Reception disjointWith Banquet.
source:Reception,Source,Class,Reception,"In the context of a conference, reception refers to the area or event where attendees are welcomed, registered, and provided with information about the conference. It is typically the first point of contact for participants and serves as a hub for communication and assistance throughout the event. Reception may also refer to a social gathering or networking event held before or after the main conference sessions.",
source:Social_event,Source,Class,Social event,"A social event at a conference refers to any planned gathering or activity that allows attendees to interact with each other in a more relaxed and informal setting. This could include networking receptions, dinners, parties, team-building exercises, or sightseeing tours. Social events are designed to facilitate relationship-building, collaboration, and camaraderie among conference participants.",Social event is a subclass of Event. Social event is disjoint with Working event. Social event is disjoint with Administrative event. Trip is a subclass of social event. Banquet is a subclass of social event. Reception is a subclass of social event. Working event disjoint with Social event. Administrative event disjoint with Social event.
source:Event,Source,Class,Event,"In the context of a conference, an event refers to a specific activity or happening that is part of the overall conference program. This could include keynote speeches, panel discussions, workshops, networking sessions, social events, and any other scheduled activities that are organized as part of the conference agenda. The term ""event"" is often used interchangeably with ""session"" or ""activity"" in the context of conference planning and management.",Event disjointWith Contribution. Event is disjoint with City. Event is disjoint with Organization. Event is disjoint with Person. Event disjointWith Topic. Event disjointWith Country. Topic disjointWith Event. Contribution disjointWith Event. Organization disjointWith Event. Country disjointWith Event. Person is disjoint with Event. Social event is a subclass of Event. Working event is a subclass of Event. City is disjoint with Event. Administrative event is a subclass of event. Event starts on domain. Ends on domain Event.
source:Contribution,Source,Class,Contribution,"In the context of a conference, a contribution refers to a submission made by an individual or group that adds value to the overall program of the conference. This can include research papers, presentations, posters, workshops, panels, or any other form of content that contributes to the knowledge and discussion within the conference theme. Contributions are typically reviewed and selected by the conference organizers or program committee before being included in the conference program.",Contribution disjointWith Country. Contribution disjointWith City. Contribution disjointWith Event. Contribution disjointWith Person. Contribution disjointWith Topic. Contribution disjointWith Organization. Event disjointWith Contribution. Topic disjointWith Contribution. Poster is a subclass of Contribution. Short paper is a subclass of contribution. Organization disjointWith Contribution. Country disjointWith Contribution. Person disjointWith Contribution. City is disjoint with Contribution. Paper is a subclass of Contribution. Contribution writes range. Reviewes range contribution. Written by domain contribution. Deals with domain contribution. Contribution domain remark. Abstract domain contribution. Contact email domain contribution. Has keyword domain contribution. Has title domain contribution.
source:City,Source,Class,City,"In the context of a conference, ""City"" typically refers to the location where the conference is being held. It could also refer to the specific city or region that is the focus of the conference, such as a conference on urban planning or city development.",City is disjoint with Contribution. City is disjoint with Person. City is disjoint with Organization. City is disjoint with Event. The city is disjoint with the topic. Event is disjoint with City. Topic is disjoint with City. Contribution disjointWith City. Organization is disjoint with City. Person is disjoint with City. City has a range City.
source:Organization,Source,Class,Organization,"In the context of a conference, organization refers to the group or entity responsible for planning, coordinating, and executing the event. This includes tasks such as selecting a venue, inviting speakers, managing registrations, scheduling sessions, and overseeing logistics. The organization may be a professional association, company, university, or other entity that is hosting the conference.",Organization disjointWith Event. Organization disjointWith Person. Organization disjointWith Contribution. Organization disjointWith Topic. Organization is disjoint with City. Organization disjointWith Country. Event disjointWith Organization. Company is a subclass of Organization. Topic disjointWith Organization. Contribution disjointWith Organization. University is a subclass of Organization. Country disjointWith Organization. Person is disjoint with Organization. The city is disjoint with the organization. Organization range employedBy.
source:Person,Source,Class,Person,"In the context of a conference, a ""Person"" typically refers to an individual who is attending, presenting, organizing, or otherwise involved in the conference in some capacity. This could include conference participants, speakers, organizers, volunteers, staff, or any other individual who is part of the conference proceedings.",Person is disjoint with City. Person is disjoint with Topic. Person is disjoint with Organization. Person is disjoint with Country. Person is disjoint with Contribution. Person is disjoint with Event. Event is disjoint with Person. Scholar is a subclass of Person. Administrator is a subclass of Person. Topic disjointWith Person. Contribution disjointWith Person. Organization disjointWith Person. Country is disjoint with Person. Member_PC is a subclass of Person. Chair_PC is a subclass of Person. Science worker is a subclass of person. Assistant is a subclass of Person. Volunteer is a subclass of Person. Participant is a subclass of Person. City is disjoint with Person. Author is a subclass of Person. Person is employed by domain. Person domain hasHomePage. The domain Person has surname. Person domain hasFax. The domain Person has first name. Has phone domain person. Person hasEmail domain.
source:Topic,Source,Class,Topic,"In the context of a conference, a ""topic"" refers to the specific subject or theme that will be discussed, presented, or explored during the event. Topics can range from broad categories such as ""technology"" or ""healthcare"" to more specific subjects like ""artificial intelligence in education"" or ""mental health in the workplace."" Conference organizers typically choose a variety of topics to appeal to a diverse audience and provide a comprehensive overview of the latest research, trends, and developments in a particular field. Participants may choose to attend sessions or presentations based on their interest in a specific topic.",Topic disjointWith Country. Topic disjointWith Contribution. Topic disjointWith Organization. Topic disjointWith City. Topic disjointWith Event. Topic disjointWith Person. Event disjointWith Topic. Contribution disjointWith Topic. Organization disjointWith Topic. Country is disjoint with Topic. Person is disjoint with Topic. The city is disjoint with the topic. Expert on range topic. The topic has a range. Deals with range topic.
source:Country,Source,Class,Country,"In the context of a conference, the term ""Country"" typically refers to a specific nation or state that is represented at the conference. Each country may have one or more delegates or representatives attending the conference to discuss and negotiate on behalf of their country's interests and policies. Countries play a significant role in shaping the outcomes and decisions made at conferences, particularly those that involve international relations, diplomacy, and global issues.",Country disjointWith Event. Country disjointWith Organization. Country disjointWith Person. Country disjointWith Contribution. Country is disjoint with Topic. Event is disjoint with Country. Topic is disjoint with Country. Contribution disjointWith Country. Organization disjointWith Country. Person is disjoint with Country. Country has range Country.
source:Company,Source,Class,Company,"In the context of a conference, a company refers to an organization or business entity that is participating in the event. This could be a company presenting their products or services, sponsoring the conference, or sending representatives to network and learn from other industry professionals.",Company is a subclass of Organization. The company is disjoint with the university. University is disjoint with Company.
source:University,Source,Class,University,"In the context of a conference, a university refers to an institution of higher education that offers undergraduate and graduate programs in various academic disciplines. Universities often host conferences and academic events where researchers, scholars, and experts gather to present their work, share knowledge, and engage in discussions on specific topics or fields of study. Universities are also known for their research activities and contributions to the advancement of knowledge in various fields.",University is a subclass of Organization. University is disjoint with Company. The company is disjoint with the university. Study at Range University.
source:Scholar,Source,Class,Scholar,"In the context of a conference, a Scholar typically refers to an individual who is an expert or specialist in a particular field of study or research. Scholars are often invited to conferences to present their research findings, share their knowledge, and engage in discussions with other experts in their field. They are respected for their expertise and contributions to the academic community.",Scholar is a subclass of Person. Study at domain Scholar.
source:Administrator,Source,Class,Administrator,"In the context of a conference, an Administrator is a person who is responsible for managing and overseeing the organization and logistics of the event. This may include tasks such as setting up registration systems, coordinating with speakers and presenters, managing the conference schedule, and ensuring that all logistical aspects of the event run smoothly. The Administrator may also be responsible for handling any issues or problems that arise during the conference and ensuring that attendees have a positive experience.",Administrator is a subclass of Person.
source:Poster,Source,Class,Poster,"In the context of a conference, a poster refers to a visual presentation of research or information that is displayed on a large board or wall for attendees to view. Posters typically include a combination of text, images, and graphs to convey key points and findings of a study or project. Presenting a poster at a conference allows researchers to share their work with a wider audience, engage in discussions with other attendees, and receive feedback on their research.",The poster is disjoint with the paper. Poster disjointWith Short_paper. Poster is a subclass of Contribution. Short paper disjoint with Poster. Paper disjointWith Poster.
source:Paper,Source,Class,Paper,"In the context of a conference, a paper refers to a written document that presents research findings, analysis, or ideas on a specific topic. Papers are typically submitted by researchers, academics, or professionals in a particular field for presentation at a conference, where they are often shared with other attendees through presentations or poster sessions. Papers are an important part of academic conferences as they allow for the dissemination of new knowledge and facilitate discussions among experts in the field.",Paper is disjoint with Short_paper. Paper disjointWith Poster. Paper is a subclass of Contribution. Poster disjointWith Paper. Short paper disjoint with Paper.
source:Short_paper,Source,Class,Short paper,"In the context of a conference, a short paper typically refers to a brief research paper or article that presents concise and focused information on a specific topic. Short papers are usually shorter in length compared to full-length research papers and are often used to present preliminary findings, case studies, or innovative ideas in a more succinct format. Short papers are commonly included in conference proceedings and may be presented as part of a panel discussion or poster presentation at the conference.",Short paper disjoint with Poster. Short paper disjoint with Paper. Short paper is a subclass of contribution. Poster disjointWith Short_paper. Paper is disjoint with Short_paper.
source:Reviewing_results_event,Source,Class,Reviewing results event,"Reviewing_results_event refers to the outcome of the reviewing process for submitted papers or abstracts for a conference. This information is typically accessible to authors through the conference management system, such as confTool. The reviewing results event provides authors with feedback on their submissions, including whether they have been accepted, rejected, or require revisions. It is an important step in the conference organization process as it helps to ensure the quality and relevance of the content presented at the event.",Reviewing results event is a subclass of administrative event. Reviewing results event disjoint with reviewing event. Reviewing results event disjoint with registration of participants event. Reviewing results event disjoint with submission event. Reviewing results event disjoint with Camera Ready event. Submission event is disjoint with reviewing results event. Camera Ready event disjoint with Reviewing results event. Registration of participants event disjoint with reviewing results event. Reviewing event disjoint with Reviewing results event.
source:Administrative_event,Source,Class,Administrative event,"An administrative event in the context of a conference refers to any event or activity that is related to the organization and management of the conference itself. This could include things like registration, scheduling, logistics, communication with attendees, and other administrative tasks that are necessary for the smooth running of the conference. Administrative events are typically handled by the conference organizers or administrative staff.",Administrative event disjoint with Social event. Administrative event is disjoint with Working event. Administrative event is a subclass of Event. Reviewing results event is a subclass of administrative event. Submission event is a subclass of administrative event. Camera Ready event is a subclass of Administrative event. Social event is disjoint with Administrative event. Registration of participants event is a subclass of administrative event. Working event is disjoint with Administrative event. Reviewing event is a subclass of Administrative event. Administrative event. Follows domain Administrative_event. Parallel with range Administrative event. Parallel with domain Administrative event. Has administrative event range administrative event.
source:Reviewing_event,Source,Class,Reviewing event,"In the context of a conference, a Reviewing_event refers to the process of evaluating and assessing the submitted contributions, such as papers, posters, or presentations, to determine their quality, relevance, and suitability for inclusion in the conference program. This process typically involves peer reviewers or a program committee who carefully examine the submissions based on predefined criteria and provide feedback or recommendations to the authors. The Reviewing_event plays a crucial role in ensuring the overall quality and integrity of the conference program by selecting the most valuable and impactful contributions for presentation to the attendees.",Reviewing event is a subclass of Administrative event. Reviewing event disjoint with Camera Ready event. Reviewing event disjoint with Reviewing results event. Reviewing event is disjoint with Registration of participants event. Reviewing event disjoint with Submission event. Reviewing results event is disjoint with reviewing event. Submission event is disjoint with reviewing event. Camera Ready event disjoint with Reviewing event. Registration of participants event disjoint with reviewing event.
source:Registration_of_participants_event,Source,Class,Registration of participants event,"Registration_of_participants_event refers to the process of individuals signing up to attend a conference or event. This typically involves providing personal information, selecting sessions or workshops to attend, and paying any registration fees. The Registration_of_participants_event is an important aspect of event planning as it helps organizers track attendance, plan for logistics, and ensure a smooth experience for participants.",Registration of participants event is a subclass of administrative event. Registration of participants event disjoint with Camera Ready event. Registration of participants event disjoint with reviewing results event. Registration of participants event disjoint with submission event. Registration of participants event disjoint with reviewing event. Reviewing results event disjoint with registration of participants event. Submission event is disjoint with registration of participants event. Camera Ready event disjoint with Registration of participants event. Reviewing event disjoint with Registration of participants event.
source:Submission_event,Source,Class,Submission event,"Submission_event refers to the specific period of time during which participants can submit their contributions, such as papers, posters, or presentations, to be considered for inclusion in the conference program. This event marks the deadline for submitting materials for review by the conference organizers and program committee.",Submission event is disjoint with registration of participants event. Submission event is disjoint with Camera Ready event. Submission event is disjoint with reviewing event. Submission event is disjoint with reviewing results event. Submission event is a subclass of administrative event. Reviewing results event disjoint with submission event. Camera Ready event disjoint with Submission event. Registration of participants event disjoint with Submission event. Reviewing event disjoint with Submission event.
source:Camera_Ready_event,Source,Class,Camera Ready event,"The Camera Ready event refers to the final deadline for authors to submit the final version of their accepted contributions (such as papers, posters, or presentations) for a conference. This version is typically the revised and polished version of the original submission, incorporating feedback from reviewers and ensuring that all formatting and content requirements are met. The Camera Ready event is the last opportunity for authors to make any necessary changes before their work is published and presented at the conference.",Camera Ready event disjoint with Reviewing event. Camera Ready event disjoint with Registration of participants event. Camera Ready event disjoint with Reviewing results event. Camera Ready event disjoint with Submission event. Camera Ready event is a subclass of Administrative event. Reviewing results event disjoint with Camera Ready event. Submission event is disjoint with Camera Ready event. Registration of participants event disjoint with Camera Ready event. Reviewing event disjoint with Camera Ready event.
source:Workshop,Source,Class,Workshop,"A workshop in the context of a conference is a session or event where participants engage in hands-on activities, discussions, and exercises related to a specific topic or skill. Workshops are typically interactive and provide attendees with the opportunity to learn new techniques, strategies, or information in a more practical and engaging way than traditional presentations or lectures. Workshops may be led by experts in the field or by conference attendees who have expertise in the topic being covered.",Workshop disjointWith Conference. Workshop disjointWith Tutorial. Workshop is a subclass of Working event. Tutorial disjointWith Workshop. Conference disjointWith Workshop.
source:Conference,Source,Class,Conference,"A conference is a formal meeting where individuals gather to discuss a particular topic, share information, exchange ideas, and make decisions. Conferences can be held for various purposes such as academic research, business networking, professional development, or industry-specific discussions. They typically involve presentations, workshops, panel discussions, and networking opportunities for attendees.",Conference disjointWith Tutorial. Conference disjointWith Workshop. Conference is a subclass of working event. Workshop disjointWith Conference. Tutorial disjointWith Conference.
source:Tutorial,Source,Class,Tutorial,A tutorial in the context of a conference is a session or workshop that provides attendees with hands-on instruction or guidance on a specific topic or skill. Tutorials are typically led by experts in the field and are designed to help participants deepen their understanding and practical knowledge in a particular subject area.,Tutorial disjointWith Conference. Tutorial disjointWith Workshop. Tutorial is a subclass of Working_event. Workshop disjointWith Tutorial. Conference disjointWith Tutorial.
source:Working_event,Source,Class,Working event,"A working event in the context of a conference refers to a specific session or activity within the conference that involves participants actively engaging in discussions, workshops, or collaborative tasks related to a particular topic or theme. Working events are typically designed to be interactive and hands-on, allowing attendees to exchange ideas, share insights, and work together to achieve specific goals or outcomes. These events may include group discussions, brainstorming sessions, problem-solving exercises, or practical workshops aimed at fostering collaboration and knowledge sharing among participants.",Working event is a subclass of Event. Working event disjoint with Administrative event. Working event is disjoint with Social event. Workshop is a subclass of Working event. Social event is disjoint with Working event. Tutorial is a subclass of Working_event. Administrative event disjoint with Working event. Conference is a subclass of working event. The domain Working_event has topic. Has administrative event domain working event.
source:Member,Source,Class,Member,"In the context of a conference, a member typically refers to an individual who is registered to attend the conference and participate in its activities. Members may include presenters, attendees, organizers, sponsors, or any other individuals involved in the conference in some capacity.",Member is a subclass of Participant.
source:Participant,Source,Class,Participant,"In the context of a conference, a participant refers to an individual who is attending the conference, either as a presenter, speaker, attendee, or organizer. Participants are actively involved in the conference proceedings, such as presenting research, networking with other attendees, attending sessions, and engaging in discussions.",Participant is a subclass of Person. Member is a subclass of Participant. Student is a subclass of Participant. Regular subClassOf Participant. Early registration domain participant.
source:Member_PC,Source,Class,Member PC,"In the context of a conference, Member_PC refers to a member of the Program Committee. The Program Committee is responsible for reviewing and selecting submissions, organizing the conference program, and ensuring the overall quality of the conference. Member_PC would be involved in reviewing papers, providing feedback, and making decisions on which submissions to accept for presentation at the conference.",Member_PC is a subclass of Person. Expert on domain Member_PC. Reviewes domain Member_PC.
source:Chair_PC,Source,Class,Chair PC,"In the context of a conference, Chair_PC refers to the Program Committee Chair. This individual is responsible for overseeing the program committee, which is responsible for reviewing and selecting the papers, presentations, and sessions that will be included in the conference program. The Program Committee Chair plays a key role in ensuring the quality and relevance of the content presented at the conference.",Chair_PC is a subclass of Person.
