entity,source_or_target,entity_type,initial_matching,lexical_matching,graphical_matching
source:PaperFullVersion,Source,Class,paper full version,"In the context of a conference, 'PaperFullVersion' refers to the complete and detailed version of a research paper or study that is being presented. This version typically includes all aspects of the research including the introduction, methodology, results, discussion, and conclusion. It is more comprehensive than an abstract or a summary, providing full insight into the research conducted.",The full version of a paper is a subclass of paper.
source:Administrator,Source,Class,administrator,"In the context of a conference, an Administrator is a person who is responsible for managing and organizing the event. This can include tasks such as scheduling, coordinating with speakers and attendees, managing registration, overseeing technical aspects, and handling any issues or problems that arise. They ensure the smooth running of the conference and are the main point of contact for any queries or concerns.",An Administrator is a subclass of User. The action of finalizing paper assignment is in the domain of an Administrator. The domain of runPaperAssignmentTools is Administrator. The domain of enabling a virtual meeting is an Administrator. The domain of startReviewerBidding is Administrator. The finalization of a paper assignment is within the range of an Administrator's responsibilities. The domain of 'assignReviewer' is 'Administrator'. The review criteria is entered by an entity within the range of an Administrator. The domain of rejectPaper is Administrator. The property 'assignedByAdministrator' has a range of 'Administrator'. The range of tools run by paper assignment is Administrator. The virtual meeting is enabled by the range of the Administrator. The hardcopy mailing manifests are printed by the range administrator. The domain of entering conference details is the Administrator. The domain of printHardcopyMailingManifests is Administrator. The domain of setMaxPapers is Administrator. The details are entered by someone who falls within the range of an Administrator. The process of reviewer bidding is started by an entity in the range of an Administrator. The domain of 'enterReviewCriteria' is 'Administrator'. The domain of accepting a paper is an Administrator. The 'addedBy' is within the range of 'Administrator'. The term 'acceptedBy' has a range that includes 'Administrator'. The term 'rejectedBy' has a range that includes 'Administrator'. An Administrator can add a Program Committee Member.
source:Meta-Review,Source,Class,meta review,"A Meta-Review in the context of a conference is a summary or overview of all the reviews a particular submission or paper has received. It is typically written by a senior reviewer or the program chair and provides an overall assessment of the paper based on the feedback from all reviewers. This helps in making the final decision on whether the paper should be accepted, rejected, or requires further revisions.",Meta-Review is a subclass of Review.
source:assignedByReviewer,Source,Property,assigned by reviewer,"In the context of a conference, 'assignedByReviewer' typically refers to tasks, papers, or responsibilities that have been assigned by a reviewer. This could be a reviewer of conference papers assigning certain papers to specific individuals for further review or discussion. It could also refer to a reviewer assigning tasks related to the organization or running of the conference.",The property 'assignedByReviewer' has a range of 'Reviewer'. The action of being assigned by a reviewer is the inverse of assigning an external reviewer. The domain of 'assignedByReviewer' is 'ExternalReviewer'. The action of assigning an external reviewer is the inverse of being assigned by a reviewer.
source:hasDecision,Source,Property,has decision,"In the context of a conference, 'hasDecision' typically refers to a status indicating whether a decision has been made regarding a particular matter. This could be related to the acceptance or rejection of a conference paper, the selection of a keynote speaker, the choice of a venue, etc. It is often used in programming or database management to track the decision-making process.",The domain of 'hasDecision' is 'Paper'. The range of 'hasDecision' is 'Decision'.
source:readByReviewer,Source,Property,read by reviewer,"In the context of a conference, 'readByReviewer' typically refers to a paper or abstract that has been read or evaluated by a reviewer. This is part of the peer review process where experts in the field assess the quality and validity of the research presented in the paper before it is accepted for presentation at the conference.",The 'readByReviewer' is in the range of 'Reviewer'. The domain of 'readByReviewer' is 'Paper'. The reviewer who read is the inverse of the paper that was read. The action of reading a paper is the inverse of being read by a reviewer.
source:hasConflictOfInterest,Source,Property,has conflict of interest,"In the context of a conference, 'hasConflictOfInterest' typically refers to a situation where a person or organization involved in the conference may have a personal or financial interest that could potentially influence their decisions or actions. This could include a speaker who is sponsored by a company whose products they are promoting, or a conference organizer who also works for a company that is a major sponsor of the event. Such conflicts of interest should be disclosed to ensure transparency and integrity.",A person has a domain of conflict of interest. The range of 'hasConflictOfInterest' is 'Document'.
source:finalizePaperAssignment,Source,Property,finalize paper assignment,"FinalizePaperAssignment in the context of a conference refers to the process of assigning each submitted paper or presentation to a specific reviewer or panel. This is typically done after all submissions have been received and the review process is about to begin. The assignment is usually based on the reviewer's expertise and interest. Once the assignment is finalized, the reviewers can start evaluating the papers.",The domain of finalizing paper assignment is Administrator. Finalize paper assignment is the inverse of paper assignment finalized by. The range of finalizing paper assignment is a conference. The paper assignment is finalized by someone is the inverse of someone finalizes the paper assignment.
source:paperAssignmentFinalizedBy,Source,Property,paper assignment finalized by,"In the context of a conference, 'paperAssignmentFinalizedBy' likely refers to the date or person by whom the final assignment of papers to reviewers or sessions was completed. This could be a deadline by which all papers must be assigned for review, or the individual who is responsible for finalizing these assignments.",The paper assignment is finalized by someone in the range of an Administrator. The domain of 'paperAssignmentFinalizedBy' is 'Conference'. The paper assignment is finalized by someone is the inverse of someone finalizes the paper assignment. Finalize paper assignment is the inverse of paper assignment finalized by.
source:hasConferenceMember,Source,Property,has conference member,"In the context of a conference, 'hasConferenceMember' likely refers to a function or property in a software or database system. It would be used to check if a particular person or entity is a member or participant of the specified conference.",The 'hasConferenceMember' is in the range of 'ConferenceMember'. The domain of 'hasConferenceMember' is 'Conference'. The entity 'hasConferenceMember' is the inverse of 'memberOfConference'. Being a member of a conference is the inverse of having a conference member.
source:memberOfConference,Source,Property,member of conference,"In the context of a conference, 'memberOfConference' typically refers to an individual or entity that is part of the conference. This could be a participant, a speaker, a sponsor, or an organizer. They are considered a 'member' of the conference because they are actively involved in it in some way.",A member of a conference is a domain of a conference member. Being a member of a conference is the inverse of having a conference member. A member of a conference is within the range of the conference. The entity 'hasConferenceMember' is the inverse of 'memberOfConference'.
source:runPaperAssignmentTools,Source,Property,run paper assignment tools,"In the context of a conference, 'runPaperAssignmentTools' likely refers to a software or program used to assign research papers or presentations to specific sessions or reviewers. This tool would take into consideration various factors such as the topic of the paper, the expertise of the reviewer, and the schedule of the conference to make the most appropriate assignments.",The range of runPaperAssignmentTools is Conference. The domain of runPaperAssignmentTools is Administrator. The tool 'runPaperAssignmentTools' is the inverse of 'paperAssignmentToolsRunBy'. The tools that run the paper assignment are run by the paper assignment tools.
source:paperAssignmentToolsRunBy,Source,Property,paper assignment tools run by,"The term 'paperAssignmentToolsRunBy' is not a standard term used in the context of conferences. It could potentially refer to the person or system responsible for assigning papers or presentations to specific sessions or individuals for review. However, without more context, it's difficult to provide a precise definition. It's best to refer to the specific conference's guidelines or ask the conference organizers for clarification.",The operation of paper assignment tools is run by is the inverse of running paper assignment tools. The range of tools run by paper assignment is Administrator. The tools for paper assignment are run by the domain of the conference. The tool 'runPaperAssignmentTools' is the inverse of 'paperAssignmentToolsRunBy'.
source:enableVirtualMeeting,Source,Property,enable virtual meeting,"EnableVirtualMeeting typically refers to a setting or feature that allows a conference to be held online or remotely, using video conferencing tools or software. This could include platforms like Zoom, Microsoft Teams, Google Meet, etc. When this feature is enabled, participants can join the conference from anywhere in the world, as long as they have an internet connection.",The domain of enabling a virtual meeting is an Administrator. The range of enabling a virtual meeting is a conference. Enabling a virtual meeting is the inverse of a virtual meeting being enabled by something. Virtual meeting is enabled by is the inverse of enable virtual meeting.
source:virtualMeetingEnabledBy,Source,Property,virtual meeting enabled by,"In the context of a conference, 'virtualMeetingEnabledBy' likely refers to the platform or service that is enabling the virtual meeting to take place. This could be a software or application like Zoom, Microsoft Teams, Google Meet, etc.",The domain of 'virtualMeetingEnabledBy' is 'Conference'. The virtual meeting is enabled by the range of the Administrator. Virtual meeting is enabled by is the inverse of enable virtual meeting. Enabling a virtual meeting is the inverse of a virtual meeting being enabled by something.
source:hasProgramCommitteeMember,Source,Property,has program committee member,"In the context of a conference, 'hasProgramCommitteeMember' refers to a person who is a member of the program committee. The program committee is responsible for planning and organizing the content of the conference, including selecting speakers, setting the agenda, and overseeing the review process for submitted papers.",The domain of 'hasProgramCommitteeMember' is 'ProgramCommittee'. Being a 'Program Committee Member' is the inverse of being a 'Member of Program Committee'. The range of 'hasProgramCommitteeMember' is 'ProgramCommitteeMember'. Being a member of a program committee is the inverse of having a program committee member.
source:memberOfProgramCommittee,Source,Property,member of program committee,"In the context of a conference, a member of the Program Committee is an individual who is part of a group responsible for selecting and organizing the presentations, workshops, and sessions that will take place during the conference. They review submissions, decide on the conference agenda, and may also be involved in other aspects such as inviting keynote speakers.",Being a member of a program committee is the inverse of having a program committee member. A member of program committee is in the domain of program committee member. The member of program committee is within the range of the program committee. Having a program committee member is the inverse of being a member of a program committee.
source:startReviewerBidding,Source,Property,start reviewer bidding,"StartReviewerBidding is a phase in the conference review process where reviewers are allowed to bid or express their interest in reviewing certain papers or topics. This process helps in assigning papers to reviewers who have expertise or interest in the paper's subject, thereby ensuring a more accurate and thorough review.",The domain of startReviewerBidding is Administrator. The range of the startReviewerBidding is Conference. The process of 'startReviewerBidding' is the inverse of the process 'reviewerBiddingStartedBy'. The event of 'reviewerBiddingStartedBy' is the inverse of 'startReviewerBidding'.
source:reviewerBiddingStartedBy,Source,Property,reviewer bidding started by,"In the context of a conference, 'reviewerBiddingStartedBy' likely refers to the individual or entity that initiated the process of reviewer bidding. Reviewer bidding is a process where reviewers indicate their interest or expertise in reviewing certain papers or topics. This helps in assigning the most suitable reviewers for each paper. The 'reviewerBiddingStartedBy' would be the one who starts this process, often the conference organizer or committee.",The domain of 'reviewerBiddingStartedBy' is 'Conference'. The event of reviewer bidding being started is initiated by the action of starting reviewer bidding. The range of 'reviewerBiddingStartedBy' is 'Administrator'. The process of 'startReviewerBidding' is the inverse of the process 'reviewerBiddingStartedBy'.
source:assignReviewer,Source,Property,assign reviewer,"In the context of a conference, 'assignReviewer' typically refers to the process of appointing a person or a group of people to review or evaluate the content of conference submissions. This could include research papers, panel proposals, or other types of submissions. The reviewers are responsible for assessing the quality, relevance, and accuracy of the submissions and providing feedback or recommendations.",The action of 'assignReviewer' is the inverse of the action 'assignedByAdministrator'. The range of 'assignReviewer' is 'Reviewer'. The domain of 'assignReviewer' is 'Administrator'. The action of being assigned by an administrator is the inverse of assigning a reviewer.
source:assignedByAdministrator,Source,Property,assigned by administrator,"AssignedByAdministrator typically refers to tasks, roles, permissions, or responsibilities that are given or assigned to a particular individual or group by an administrator during a conference. This could include tasks like moderating a session, managing technical aspects, or overseeing certain areas of the conference. The administrator is usually someone who has overall control or management of the conference.",The property 'assignedByAdministrator' has a range of 'Administrator'. The action of being assigned by an administrator is the inverse of assigning a reviewer. The domain Reviewer is assigned by Administrator. The action of 'assignReviewer' is the inverse of the action 'assignedByAdministrator'.
source:reviewCriteriaEnteredBy,Source,Property,review criteria entered by,"In the context of a conference, 'reviewCriteriaEnteredBy' likely refers to the specific criteria or guidelines entered by a particular person or group (such as a conference organizer or committee) that will be used to review and evaluate submissions or presentations. This could include things like relevance to the conference theme, originality, quality of research, etc.",The review criteria is entered by someone in the range of an Administrator. The review criteria is entered by someone is the inverse of someone enters the review criteria. The review criteria is entered by the domain of the conference. Entering review criteria is the inverse of review criteria being entered by someone.
source:enterReviewCriteria,Source,Property,enter review criteria,"In the context of a conference, 'enterReviewCriteria' likely refers to the process of inputting or defining the criteria that will be used to review and evaluate submissions or presentations. This could include factors such as relevance to the conference theme, originality, quality of research, clarity of presentation, etc. This criteria would then be used by the conference organizers or a review committee to assess each submission and decide which ones will be accepted for the conference.",Entering review criteria is the inverse of review criteria being entered by someone. The domain of 'enterReviewCriteria' is 'Administrator'. The action 'enterReviewCriteria' has a range of 'Conference'. The review criteria is entered by someone is the inverse of someone enters the review criteria.
source:hasCo-author,Source,Property,has co-author,"In the context of a conference, 'hasCo-author' refers to a situation where a presentation, paper, or research study that is being presented or discussed at the conference has been written or conducted by more than one author. It indicates a collaborative effort in the creation of the work.",Having a co-author is the inverse of co-writing a paper. The range of 'hasCo-author' is 'Co-author'. A paper has a co-author. Co-writing a paper is the inverse of having a co-author.
source:co-writePaper,Source,Property,co write paper,"Co-writePaper in the context of a conference refers to the act of two or more individuals collaborating to write a research paper or academic article that will be presented at the conference. This often involves sharing ideas, research, and writing responsibilities.",Co-writing a paper is the inverse of having a co-author. The range of co-writing a paper is a paper. The domain of co-writing a paper is a co-author. Having a co-author is the inverse of co-writing a paper.
source:rejectPaper,Source,Property,reject paper,"In the context of a conference, 'rejectPaper' refers to the decision made by the conference committee or reviewers to not accept a submitted paper for presentation or publication. This could be due to various reasons such as the paper not meeting the required standards, not being relevant to the conference theme, or containing plagiarized content.",The range of 'rejectPaper' is 'Paper'. The action 'rejectPaper' is the inverse of being 'rejectedBy'. The domain of 'rejectPaper' is 'Administrator'. The entity 'rejectedBy' is the inverse of 'rejectPaper'.
source:endReview,Source,Property,end review,"In the context of a conference, 'endReview' typically refers to the deadline or the completion of the process where conference papers or presentations are reviewed by a panel or committee. This could involve evaluating the relevance, quality, and originality of the submitted work. After the 'endReview' stage, decisions are usually made about which papers or presentations will be included in the conference.",The domain of endReview is ProgramCommitteeChair. The range of 'endReview' is 'Review'.
source:hasBid,Source,Property,has bid,"In the context of a conference, 'hasBid' typically refers to a system used by conference organizers where reviewers or committee members bid on papers or proposals they are interested in reviewing. This is often done to ensure that the reviewer has some knowledge or interest in the topic they are reviewing. So, if a reviewer 'hasBid' on a paper, it means they have expressed interest in reviewing that particular paper.",The domain of 'hasBid' is 'Paper'. The range of 'hasBid' is 'Bid'.
source:adjustBid,Source,Property,adjust bid,"In the context of a conference, 'adjustBid' doesn't seem to have a specific meaning. It might be related to bidding on conference locations, sponsorships, or services, where 'adjustBid' could mean changing the amount of money offered. However, without more specific context, it's hard to provide a precise definition. The term is more commonly used in advertising and online marketing, where it refers to changing the amount of money a company is willing to pay for a click or impression.",The action 'adjustBid' is the inverse of being 'adjustedBy'. The domain of 'adjustBid' is 'Reviewer'. The range of adjustBid is Bid. AdjustedBy is the inverse of adjustBid.
source:adjustedBy,Source,Property,adjusted by,"In the context of a conference, 'adjusted by' could refer to changes or modifications made by a particular person or entity. For example, the schedule or agenda of the conference may be 'adjusted by' the event coordinator to accommodate changes in speaker availability or session topics. It could also refer to adjustments in data or statistics presented at the conference, made by a researcher or analyst. Without a specific sentence or context, it's hard to provide a more precise definition.",The domain of 'adjustedBy' is 'Bid'. The term 'adjustedBy' has a range of 'Reviewer'. The term 'adjustedBy' is the inverse of 'adjustBid'. The action 'adjustBid' is the inverse of being 'adjustedBy'.
source:readPaper,Source,Property,read paper,"In the context of a conference, 'readPaper' typically refers to the act of presenting a scholarly paper or research findings. The presenter would read out their paper, often accompanied by a slide presentation, to the audience. This allows for the dissemination of their work and opens up the floor for discussion and feedback.",The act of reading a paper is the inverse of being read by a reviewer. The action of reading a paper is applicable to the range of Paper. The domain of reading a paper is a reviewer. The reviewer who read is the inverse of the paper that was read.
source:hardcopyMailingManifestsPrintedBy,Source,Property,hardcopy mailing manifests printed by,"This phrase seems to be a technical term or jargon. In general, it could refer to the physical (hard copy) mailing lists or manifests (documents listing passengers or cargo) that have been printed by a certain individual or organization in the context of a conference. These could be used for various purposes such as sending out invitations, confirmations, or other conference-related materials.",Hardcopy mailing manifests are printed by is the inverse of print hardcopy mailing manifests. The hardcopy mailing manifests are printed by the domain Conference. Hardcopy mailing manifests are printed by the range administrator. Printing hardcopy mailing manifests is the inverse of hardcopy mailing manifests being printed by.
source:printHardcopyMailingManifests,Source,Property,print hardcopy mailing manifests,"PrintHardcopyMailingManifests refers to the action of printing a physical list or document that contains the addresses and other shipping information of the attendees or participants of a conference. This list is used for mailing purposes such as sending invitations, tickets, conference materials, or other related items.",The action of printing hardcopy mailing manifests is applicable to the context of a Conference. Printing hardcopy mailing manifests is the inverse of being printed by hardcopy mailing manifests. The action of printing hardcopy mailing manifests is within the domain of an Administrator. Hardcopy mailing manifests printed by is the inverse of print hardcopy mailing lists.
source:markConflictOfInterest,Source,Property,mark conflict of interest,"In the context of a conference, markConflictOfInterest refers to the process of identifying and indicating a conflict of interest between a reviewer and a specific paper. This could be due to a personal or professional relationship, or any other reason that could potentially bias the reviewer's assessment of the paper. Once a conflict of interest is marked, the reviewer is prohibited from bidding on, being assigned to, or viewing review submissions for that paper to ensure the integrity and fairness of the review process.",The term 'markConflictOfInterest' has a range of 'Paper'.
source:enterConferenceDetails,Source,Property,enter conference details,"In the context of a conference, 'enterConferenceDetails' typically refers to the action of inputting specific information about the conference into a system or form. This could include details such as the conference name, date, time, location, topics to be discussed, names of speakers, and other relevant information. This is often done during the planning stages of the conference or when registering for the conference.",The domain of entering conference details is the Administrator. Entering conference details is the inverse of details being entered by. The action 'enterConferenceDetails' has a range of 'Conference'. The details entered by is the inverse of entering conference details.
source:detailsEnteredBy,Source,Property,details entered by,"In the context of a conference, 'detailsEnteredBy' likely refers to the person who entered the details or information about the conference into a system or database. This could include information such as the date, time, location, speakers, and attendees of the conference.",The details are entered by the domain of the Conference. The details entered by someone is the inverse of someone entering conference details. The details are entered by someone who falls within the range of an Administrator. Entering conference details is the inverse of details being entered by someone.
