entity,source_or_target,entity_type,initial_matching,lexical_matching,graphical_matching
source:Meta-Reviewer,Source,Class,meta reviewer,"In the context of a conference, a Meta-Reviewer is a person who oversees and evaluates the reviews given by other reviewers for a particular paper. They have the authority to submit their own review and ensure that all other reviews are consistent and of good quality. The use of a Meta-Reviewer is optional and must be decided before the paper assignment process. They play a crucial role in maintaining the quality and integrity of the review process.",Meta-Reviewer is a subclass of Reviewer. The range of being read by a Meta-Reviewer is a Meta-Reviewer.
source:Reviewer,Source,Class,reviewer,"A reviewer in the context of a conference is a person or a group of people who evaluate or assess the quality, relevance, and merit of submitted papers or presentations. They play a crucial role in the selection process, determining which papers or topics are suitable and meet the standards of the conference.","Reviewer and AuthorNotReviewer are completely separate, they do not overlap. Reviewer and ExternalReviewer are completely separate from each other. A Reviewer is a subclass of ConferenceMember. A reviewer is a subclass of a user. Meta-Reviewer is a subclass of Reviewer. External Reviewer and Reviewer are completely separate, they do not overlap. The entity 'AuthorNotReviewer' is disjoint with the entity 'Reviewer'. The range of 'assignReviewer' is 'Reviewer'. The administrator assigns the domain to the reviewer. The domain of 'adjustBid' is 'Reviewer'. The domain of reading a paper is a reviewer. The term 'adjustedBy' has a range that includes the entity 'Reviewer'. The domain of 'hasBeenAssigned' is 'Reviewer'. The property 'assignedByReviewer' has a range of 'Reviewer'. The property 'assignedTo' has a range of 'Reviewer'. The property 'readByReviewer' has a range of 'Reviewer'. The range of 'writtenBy' is 'Reviewer'. The action of writing a review is within the domain of a reviewer. The domain of assigning an external reviewer is the reviewer."
source:Decision,Source,Class,decision,"In the context of a conference, a decision refers to the determination made by the conference organizers or committee about a particular matter. This could include decisions about the conference's theme, location, speakers, schedule, or other logistical details. In the context of academic or scientific conferences, a decision could also refer to the acceptance or rejection of papers or presentations submitted by participants.",The concept of 'Decision' is completely separate and has no overlap with the concept of 'Person'. The concept of 'Decision' is completely separate and does not overlap with the concept of 'Document'. The concept of 'Decision' is disjoint with the concept of 'Preference'. The entity 'Decision' is disjoint with the entity 'ProgramCommittee'. The concept of 'Decision' is completely separate and has no overlap with the concept of 'Bid'. The concept of 'Decision' is completely separate and has no overlap with the concept of 'Conference'. The entity 'ProgramCommittee' is disjoint with the entity 'Decision'. The concept of 'Preference' is completely separate and does not overlap with the concept of 'Decision'. Acceptance is a subclass of Decision. The entity 'Bid' is disjoint with the entity 'Decision'. A person is completely separate and distinct from a decision. The document is completely separate and has no overlap with the decision. The category of 'Conference' is completely separate and does not overlap with the category of 'Decision'. Rejection is a subclass of Decision. The range of 'hasDecision' is 'Decision'.
source:Person,Source,Class,person,"In the context of a conference, a person refers to an individual who is participating in the conference. This could be a speaker, attendee, organizer, sponsor, or exhibitor. They could be involved in various activities such as presenting, networking, learning, or facilitating the event.",The category of 'Person' is completely separate and does not overlap with the category of 'Preference'. A person is completely separate from a program committee. A person cannot be a bid. A person cannot be a conference. A person cannot be a decision. A person is completely separate and different from a document. The concept of 'Decision' is completely separate and has no overlap with the concept of 'Person'. A Program Committee Member is a subclass of a Person. A Conference Member is a subclass of a Person. An External Reviewer is a subclass of a Person. The entity 'ProgramCommittee' is disjoint with the entity 'Person'. The category of 'Preference' is completely separate and does not overlap with the category of 'Person'. A Chairman is a subclass of a Person. The category 'Bid' is completely separate and has no overlap with the category 'Person'. A user is a subclass of a person. The entity 'Document' is disjoint with the entity 'Person'. The category of 'Conference' is completely separate and does not overlap with the category of 'Person'. A person has a domain of conflict of interest. The email domain of a person.
source:Document,Source,Class,document,"In the context of a conference, a document refers to any written or digital material that provides information or evidence or that serves as an official record. This could include research papers, presentations, reports, agendas, minutes of meetings, or any other form of written material that is used or presented during the conference.",The concept of a Document is completely separate and does not overlap with the concept of a Bid. The document is completely separate and has no overlap with the decision. The entity 'Document' is disjoint with the entity 'ProgramCommittee'. The entity 'Document' is disjoint with the entity 'Conference'. The category 'Document' is completely separate and has no overlap with the category 'Person'. The entity 'Document' is disjoint with the entity 'Preference'. The concept of 'Decision' is completely separate and does not overlap with the concept of 'Document'. The entity 'ProgramCommittee' is disjoint with the entity 'Document'. The category of Preference is completely separate and has no overlap with the category of Document. Review is a subclass of Document. The category 'Bid' is completely separate and has no overlap with the category 'Document'. Paper is a subclass of Document. A person is completely separate and different from a document. The category of 'Conference' is completely separate and has no overlap with the category of 'Document'. The range of 'hasConflictOfInterest' is 'Document'.
source:Preference,Source,Class,preference,"In the context of a conference, preference often refers to the choices or selections made by attendees or organizers. This could include preferences for specific topics, speakers, sessions, or workshops to attend. It could also refer to dietary preferences for meals provided, or accommodation preferences for multi-day conferences. In a broader sense, it could also refer to the preferred methods of hosting or organizing the conference, such as virtually or in-person.",The category of Preference is completely separate from the category of ProgramCommittee. The category of Preference is completely separate and does not overlap with the category of Person. The concept of 'Preference' is completely separate and does not overlap with the concept of 'Decision'. The category of Preference is completely separate and has no overlap with the category of Document. The category of Preference is completely separate and has no overlap with the category of Conference. The concept of Preference is disjoint with the concept of Bid. The concept of 'Decision' is completely separate and does not overlap with the concept of 'Preference'. The entity 'ProgramCommittee' is disjoint with the entity 'Preference'. Bid is disjoint with Preference. A person is completely separate and has no overlap with a preference. The concept of a Document is completely separate and does not overlap with the concept of a Preference. The concept of a Conference is completely separate and has no overlap with the concept of Preference.
source:ProgramCommittee,Source,Class,program committee,"A Program Committee in the context of a conference is a group of individuals who are responsible for selecting and organizing the content of the conference. This includes reviewing and selecting presentations, papers, or workshops, organizing the schedule, and sometimes inviting keynote speakers. The committee ensures that the conference program aligns with the conference's theme and objectives.",The entity 'ProgramCommittee' is disjoint with the entity 'Person'. The entity 'ProgramCommittee' is disjoint with the entity 'Conference'. The entity 'ProgramCommittee' is disjoint with the entity 'Preference'. The entity 'ProgramCommittee' is disjoint with the entity 'Decision'. The entity 'ProgramCommittee' is disjoint with the entity 'Bid'. The entity 'ProgramCommittee' is disjoint with the entity 'Document'. The entity 'Decision' is disjoint with the entity 'ProgramCommittee'. The category of Preference is completely separate and does not overlap with the category of ProgramCommittee. The entity 'Bid' is disjoint with the entity 'ProgramCommittee'. A person is completely separate from a program committee. The entity 'Document' is disjoint with the entity 'ProgramCommittee'. The entity 'Conference' is disjoint with the entity 'ProgramCommittee'. The domain of 'hasProgramCommitteeMember' is 'ProgramCommittee'. The member of program committee is within the range of the program committee.
source:Bid,Source,Class,bid,"In the context of a conference, a bid refers to a proposal or application submitted by an individual, group, or city to host the event. This bid often includes details such as the proposed venue, accommodations, budget, and other logistical aspects. The organization or committee in charge of the conference will then review all bids and select the one they find most suitable.",The category 'Bid' is completely separate and has no overlap with the category 'Document'. Bid is disjoint with Preference. The entity 'Bid' is disjoint with the entity 'ProgramCommittee'. The category of 'Bid' is completely separate from the category of 'Conference'. The entity 'Bid' is disjoint with the entity 'Decision'. The category 'Bid' is completely separate and has no overlap with the category 'Person'. The concept of 'Decision' is completely separate and has no overlap with the concept of 'Bid'. The entity 'ProgramCommittee' is disjoint with the entity 'Bid'. The category of Preference is completely separate and has no overlap with the category of Bid. A person cannot be a bid. The concept of a Document is completely separate and does not overlap with the concept of a Bid. The category of 'Conference' is completely separate from the category of 'Bid'. The range of 'hasBid' is 'Bid'. The range of adjustBid is Bid. The domain of 'adjustedBy' is 'Bid'.
source:Conference,Source,Class,conference,"A conference is a formal meeting where participants gather to discuss various topics, often within a specific industry or academic field. It usually involves presentations, panel discussions, workshops, and networking opportunities. Conferences can be held in person, virtually, or in a hybrid format. They are typically organized by professional associations, academic institutions, or businesses.",The category of 'Conference' is completely separate and has no overlap with the category of 'Preference'. The concept of a Conference is completely separate and has no overlap with the concept of a Decision. A conference is completely separate and has no overlap with a person. The concept of a Conference is completely separate and does not overlap with the concept of a Bid. The entity 'Conference' is disjoint with the entity 'ProgramCommittee'. The category of 'Conference' is completely separate and has no overlap with the category of 'Document'. The concept of 'Decision' is completely separate and does not overlap with the concept of 'Conference'. The entity 'ProgramCommittee' is disjoint with the entity 'Conference'. The category of Preference is completely separate from the category of Conference. The category 'Bid' is completely separate and has no overlap with the category 'Conference'. A person cannot be a conference. The category 'Document' is completely separate and has no overlap with the category 'Conference'. The range of finalizing paper assignment is a conference. The domain of 'hasConferenceMember' is 'Conference'. The range of the runPaperAssignmentTools is a Conference. The range of enabling a virtual meeting is a conference. The range of the startReviewerBidding is Conference. The domain of 'paperAssignmentFinalizedBy' is 'Conference'. The review criteria is entered by the domain of the conference. The domain of paperAssignmentToolsRunBy is Conference. The domain of 'virtualMeetingEnabledBy' is 'Conference'. The hardcopy mailing manifests are printed by the domain Conference. The action 'enterConferenceDetails' has a range of 'Conference'. The member of a conference is within the range of a conference. The action of printing hardcopy mailing manifests is applicable to the context of a Conference. The details were entered by a domain related to the Conference. The domain of 'reviewerBiddingStartedBy' is 'Conference'. The action 'enterReviewCriteria' has a range of 'Conference'. The date is a domain of the Conference. The domain of reviewsPerPaper is Conference. The logo URL is the domain of the Conference. The domain of acceptsHardcopySubmissions is Conference. The site URL domain is related to the Conference.
source:ConferenceChair,Source,Class,conference chair,"A Conference Chair is the person who leads or presides over a conference. They are responsible for planning and organizing the event, coordinating speakers and sessions, and ensuring that the conference runs smoothly. They may also play a role in fundraising, marketing, and other administrative tasks related to the event.",A Conference Chair is a subclass of Conference Member. The role of Conference Chair is completely separate and distinct from the role of Associated Chair. The entity 'AssociatedChair' is disjoint with the entity 'ConferenceChair'.
source:ConferenceMember,Source,Class,conference member,"A ConferenceMember refers to an individual who is part of a conference. This could be a participant, speaker, attendee, organizer, or any other person who is involved in the conference in some way. They may contribute to the conference by presenting, attending sessions, networking, or helping to organize and run the event.",A Conference Member is a subclass of a Person. A Conference Chair is a subclass of Conference Member. A Program Committee Member is a subclass of a Conference Member. An Author is a subclass of ConferenceMember. A Reviewer is a subclass of ConferenceMember. An Associated Chair is a subclass of a Conference Member. The property 'hasConferenceMember' has a range of 'ConferenceMember'. A member of a conference is in the domain of a conference member.
source:AssociatedChair,Source,Class,associated chair,"In the context of a conference, an Associated Chair is typically a person who assists the main chairperson or conference chair in organizing and managing the event. Their responsibilities may include coordinating with speakers, managing sessions, overseeing logistics, and other tasks related to the successful execution of the conference. The exact role can vary depending on the specific conference and its structure.",An Associated Chair is a subclass of a Conference Member. The entity 'AssociatedChair' is disjoint with the entity 'ConferenceChair'. The entity 'Conference Chair' is completely separate and has no overlap with the entity 'Associated Chair'.
source:ProgramCommitteeMember,Source,Class,program committee member,"A ProgramCommitteeMember in the context of a conference refers to an individual who is part of the program committee. This committee is responsible for planning and organizing the conference program. This includes selecting the papers to be presented, arranging the schedule, deciding on the keynote speakers, and other related tasks. These members are not authors of the papers presented unless they also serve as reviewers. They play a crucial role in ensuring the conference runs smoothly and the content presented is of high quality and relevance.",A Program Committee Member is a subclass of a Person. A Program Committee Member is a subclass of a Conference Member. A Program Committee Member cannot be an Author who is not a Reviewer. A Program Committee Chair is a subclass of a Program Committee Member. The entity 'AuthorNotReviewer' is disjoint with the entity 'ProgramCommitteeMember'. The range of 'hasProgramCommitteeMember' is 'ProgramCommitteeMember'. A member of program committee is in the domain of program committee member. The range of 'setMaxPapers' is 'ProgramCommitteeMember'. The domain of maxPapers is ProgramCommitteeMember. A ProgramCommitteeMember is the domain of addedBy. The range of 'addProgramCommitteeMember' is 'ProgramCommitteeMember'.
source:AuthorNotReviewer,Source,Class,author not reviewer,AuthorNotReviewer is a term used to indicate that the author of a paper or presentation at a conference is not one of the reviewers. This is to ensure objectivity and fairness in the review process. It means that the author cannot review or evaluate their own work or have any influence on the review process.,"The role of AuthorNotReviewer is completely separate and does not overlap with the role of ProgramCommitteeMember. The entity 'AuthorNotReviewer' is completely separate and has no overlap with the entity 'Reviewer'. The class 'AuthorNotReviewer' is a subclass of 'Author'. A Program Committee Member cannot be an Author who is not a Reviewer. Reviewer and AuthorNotReviewer are completely separate, they do not overlap."
source:SubjectArea,Source,Class,subject area,"In the context of a conference, Subject Area refers to the specific field or topic that the conference is focused on. This could be anything from artificial intelligence, climate change, healthcare, education, etc. It helps potential attendees understand the relevance of the conference to their interests or field of work/study.",The subject area range has a subject area.
source:ExternalReviewer,Source,Class,external reviewer,"In the context of a conference, an External Reviewer refers to an individual who is not part of the conference's organizing or review committee but is invited to evaluate and provide feedback on submitted papers or presentations. This person is usually an expert in the field related to the conference's theme. Their role is to ensure the quality and relevance of the content presented at the conference.",An External Reviewer is a subclass of a Person. External Reviewer and Reviewer are completely separate and do not overlap. Reviewer is not the same as ExternalReviewer. The domain of 'assignedByReviewer' is 'ExternalReviewer'. The range of 'assignExternalReviewer' is 'ExternalReviewer'.
source:Chairman,Source,Class,chairman,"In the context of a conference, the Chairman is the person who leads or prescribes the order of proceedings. They are responsible for ensuring the conference runs smoothly, moderating discussions, introducing speakers, and often summarizing or clarifying points.",A Chairman is a subclass of a Person.
source:ProgramCommitteeChair,Source,Class,program committee chair,"A Program Committee Chair is a person who leads the program committee for a conference. This committee is responsible for planning and organizing the content of the conference, including selecting speakers, arranging sessions, and overseeing the review process for submitted papers or presentations. The chairperson typically makes final decisions and ensures everything runs smoothly.",A Program Committee Chair is a subclass of a Program Committee Member. The domain of endReview is ProgramCommitteeChair.
source:Acceptance,Source,Class,acceptance,"In the context of a conference, acceptance usually refers to the approval of a proposal, abstract, or paper submitted by an individual or group for presentation. Once reviewed and accepted by the conference committee or panel, the individual or group is then invited to present their work at the conference.",Acceptance and Rejection are mutually exclusive. Acceptance is a subclass of Decision. Rejection is completely separate from Acceptance.
source:Rejection,Source,Class,rejection,"In the context of a conference, 'rejection' typically refers to a proposal, abstract, or paper submitted for presentation that has not been accepted by the conference organizers or review committee. This could be due to various reasons such as lack of originality, poor quality of research, irrelevance to the conference theme, etc.",Rejection is completely separate from Acceptance. Rejection is a subclass of Decision. Acceptance is completely separate from Rejection.
source:Review,Source,Class,review,"In the context of a conference, a review typically refers to the process of evaluating or assessing the content of presentations, papers, or proposals that have been submitted for inclusion in the conference. This is usually done by a panel of experts or peers in the field. The purpose of the review is to ensure that the content is of high quality, relevant, and contributes to the field of study or industry.",The category of 'Review' is completely separate from the category of 'Paper'. A review is a subclass of a document. Paper is completely separate from Review. Meta-Review is a subclass of Review. The range of 'endReview' is 'Review'. The domain of 'writtenBy' is 'Review'. The action 'writeReview' has a range of 'Review'.
source:Paper,Source,Class,paper,"In the context of a conference, a paper refers to a scholarly article or study that is written by researchers or experts in the field. It presents original research, findings, or a review of existing work. These papers are often presented at conferences as a way of sharing the information with others in the field. They are usually peer-reviewed and may be published in academic journals.",Paper is a subclass of Document. Paper is completely separate from Review. The category of 'Review' is completely separate from the category of 'Paper'. The abstract of a paper is a subclass of the paper. The full version of a paper is a subclass of paper. A paper has a co-author. The range of 'rejectPaper' is 'Paper'. The domain of 'hasBid' is 'Paper'. The range of reading a paper is a paper. The term 'markConflictOfInterest' has a range of 'Paper'. The range of co-writing a paper is a paper. The range of 'hasBeenAssigned' is 'Paper'. The domain of 'hasDecision' is 'Paper'. The domain of 'assignedTo' is 'Paper'. The subject area of a paper is its domain. The range of submitting a paper is a paper. The domain of 'readByReviewer' is 'Paper'. The domain of the paperID is Paper. The title is in the domain of the Paper. The range of 'acceptPaper' is 'Paper'. The domain of 'hasAuthor' is 'Paper'. The domain of 'acceptedBy' is 'Paper'. The domain of 'rejectedBy' is 'Paper'. The domain of 'readByMeta-Reviewer' is 'Paper'. The range of 'writePaper' is 'Paper'.
source:Author,Source,Class,author,"In the context of a conference, an author is typically the person who has written or contributed to a research paper, study, or presentation that is being shared or discussed at the conference. They are responsible for the content and findings of the work being presented.",An Author is a subclass of a Conference Member. The author is a subclass of the user. A co-author is a subclass of an author. The class 'AuthorNotReviewer' is a subclass of 'Author'. The domain of submitting a paper is the author. The property 'hasAuthor' has the range 'Author'. The domain of writing a paper is an Author.
source:User,Source,Class,user,"In the context of a conference, a user typically refers to an individual who is utilizing or participating in the conference services. This could be an attendee, a speaker, or anyone who is using the conference's digital platform or physical facilities.",A user is a subclass of a person. An author is a subclass of a user. A reviewer is a subclass of a user. Administrator is a subclass of User.
source:Co-author,Source,Class,co author,"A co-author is a person who contributes to a research paper, study, or presentation along with one or more other authors. In a conference setting, this could be someone who helped write a paper being presented, or who worked on the research being discussed. They share the credit and responsibility for the work.",A co-author is a subclass of an author. The range of 'hasCo-author' is 'Co-author'. The domain of co-writing a paper is a co-author.
source:PaperAbstract,Source,Class,paper abstract,"In the context of a conference, a Paper Abstract refers to a brief summary of a research paper that is going to be presented. It provides a concise overview of the research, including the purpose of the study, the methodology used, the main findings, and the conclusions. This allows attendees to understand the essence of the paper without reading the whole document. It's often used to help attendees decide which presentations they wish to attend.",A paper abstract is a subclass of a paper.
