entity,source_or_target,entity_type,initial_matching,lexical_matching,graphical_matching
source:Conference_announcement,Source,Class,conference announcement,"A conference announcement is a formal notification or information shared about an upcoming conference. It typically includes details such as the conference theme, date, location, keynote speakers, registration details, submission deadlines (for academic or scientific conferences), and other relevant information. It is usually disseminated through various channels such as emails, newsletters, websites, or social media to reach potential attendees.",A conference announcement is a subclass of a conference document. 
source:Paper,Source,Class,paper,"In the context of a conference, a paper refers to a scholarly article or study that is written by researchers or experts in the field. It presents original research, findings, or a review of existing work. These papers are often presented at conferences as a way of sharing the information with others in the field, sparking discussion, and receiving feedback.",Paper is a subclass of Regular contribution. Paper is completely separate from Extended Abstract. The concept of 'Extended_abstract' is completely separate and does not overlap with the concept of 'Paper'. 
source:Invited_talk,Source,Class,invited talk,"An Invited Talk in a conference is a presentation or speech given by a speaker who has been specifically invited by the conference organizers due to their expertise or prominence in the field. This talk is usually a key feature of the conference and may cover a significant development, issue, or trend in the field.","The concept of an 'Invited talk' is completely separate and does not overlap with the concept of a 'Poster'. An invited talk is completely separate and has no overlap with a regular contribution. An invited talk is a subclass of a presentation. Regular contribution and Invited talk are completely separate, they do not overlap. A poster is not the same as an invited talk. "
source:Conference_part,Source,Class,conference part,"In the context of a conference, ""Conference_part"" could refer to a specific segment or section of the conference. This could be a particular presentation, workshop, panel discussion, or any other scheduled event that is part of the overall conference program.",A track is a subclass of conference part. A workshop is a subclass of conference part. A tutorial is a subclass of a conference part. The range of 'has_parts' is 'Conference_part'. The conference part has a track workshop on the tutorial topic. The range of 'is_a_topic_of_conference_parts' is 'Conference_part'. The domain of 'is part of conference volumes' is 'Conference part'. Was a track-workshop chair of a range of conference parts. A conference part has a track workshop tutorial chair. 
source:Presentation,Source,Class,presentation,"In the context of a conference, a presentation refers to a speech or talk in which a new product, idea, or piece of work is shown and explained to the audience. It often involves the use of visual aids such as slides, charts, or videos to help convey the information more effectively. The presenter usually has a set amount of time to deliver their information and may also engage in a question and answer session with the audience afterwards.",A presentation is a subclass of a conference contribution. An invited talk is a subclass of a presentation. The range of 'gives_presentations' is 'Presentation'. The domain of 'Presentation' is given by 'is_given_by'. 
source:Chair,Source,Class,chair,"In the context of a conference, the Chair is the person who leads or prescribes the meeting or session. They are responsible for keeping the discussion on track, introducing speakers, facilitating questions, and ensuring the conference runs smoothly and on time.",A chair is a subclass of a committee member. The range of having a committee chair is a Chair. The domain of 'was a committee chair of' is Chair. 
source:Track,Source,Class,track,"In the context of a conference, a track refers to a series of sessions or events that are grouped together based on a specific topic or theme. Attendees can choose to follow a particular track based on their interests or professional needs. For example, a technology conference might have separate tracks for software development, data science, and cybersecurity.",A track is a subclass of conference part. Track is disjoint with Workshop. Track is disjoint with Tutorial. The category of 'Workshop' is completely separate and does not overlap with the category of 'Track'. The category 'Tutorial' is completely separate and has no overlap with the category 'Track'. The property 'has_tracks' has a range of 'Track'. 
source:Workshop,Source,Class,workshop,"A workshop in a conference is a session that is often more interactive and focused on a specific topic. It is usually designed to provide attendees with practical skills, techniques, or ideas that they can then apply in their own work or study. Workshops are typically led by experts in the field and may involve activities, discussions, or hands-on practice.",A workshop is a subclass of conference part. Workshop and Tutorial are completely separate from each other. Workshop is completely separate from Track. Track is disjoint with Workshop. The category 'Tutorial' is completely separate from the category 'Workshop'. The property 'has_workshops' has a range of 'Workshop'. 
source:Tutorial,Source,Class,tutorial,"In the context of a conference, a tutorial is a session where a topic or a set of topics is presented in a comprehensive and detailed manner, often by an expert in the field. It is designed to provide in-depth knowledge and is often more interactive and detailed than a typical conference presentation. Tutorials can be designed for beginners or advanced attendees and may include hands-on activities or demonstrations.",The category 'Tutorial' is completely separate and has no overlap with the category 'Track'. The category 'Tutorial' is completely separate and has no overlap with the category 'Workshop'. A tutorial is a subclass of conference part. The category 'Track' is completely separate and has no overlap with the category 'Tutorial'. Workshop is disjoint with Tutorial. The range of 'has_tutorials' is 'Tutorial'. 
source:Rejected_contribution,Source,Class,rejected contribution,"In the context of a conference, a Rejected_contribution refers to a proposed presentation, paper, or research submission that has been reviewed and denied by the conference organizers or committee. This could be due to a variety of reasons such as lack of originality, poor quality, irrelevance to the conference theme, or failure to meet submission guidelines.",The category of 'Rejected contribution' is completely separate from the category of 'Accepted contribution'. A rejected contribution is a subclass of a reviewed contribution. The accepted contribution is completely separate and has no overlap with the rejected contribution. 
source:Reviewed_contribution,Source,Class,reviewed contribution,"A reviewed contribution in the context of a conference refers to a presentation, paper, research findings, or any other form of academic or professional work that has been submitted for the conference and has undergone a process of evaluation or review by a panel of experts or peers. This review process is to ensure the quality, relevance, and accuracy of the work before it is presented or published in the conference proceedings.",Reviewed contribution is a subclass of Submitted contribution. An accepted contribution is a subclass of a reviewed contribution. A rejected contribution is a subclass of a reviewed contribution. The domain of 'has a review' is 'Reviewed contribution'. Reviews range the reviewed contribution. 
source:Review,Source,Class,review,"In the context of a conference, a review typically refers to the process of evaluating or assessing the content of presentations, papers, or proposals submitted by participants. This is usually done by a panel of experts or peers in the field to ensure the quality and relevance of the content to be presented at the conference. The review process can determine whether a submission is accepted, rejected, or requires revisions.",A review is a subclass of a conference document. The range of 'has_a_review' is 'Review'. The domain of reviews is Review. 
source:Topic,Source,Class,topic,"In the context of a conference, a topic refers to the main subject or theme that the conference is focused on. It is the central idea that the speakers will discuss, present about, or explore in their presentations or sessions. For example, in a technology conference, the topic could be ""Artificial Intelligence in Healthcare"".",The topic belongs to a review reference domain. The workshop has a track that covers a tutorial topic in the range of Topic. The domain of 'is_a_topic_of_conference_parts' is 'Topic'. 
source:Late_paid_applicant,Source,Class,late paid applicant,"A Late_paid_applicant in the context of a conference refers to an individual who has applied to attend the conference and paid the required fees, but has done so after the specified deadline. This may result in additional late fees or potential restrictions depending on the conference's policies.",A late paid applicant is a subclass of a paid applicant. Late paid applicant is disjoint with early paid applicant. Early paid applicant is disjoint with late paid applicant. 
source:Paid_applicant,Source,Class,paid applicant,A paid applicant in the context of a conference is an individual who has completed the registration process and paid the required fees to attend the conference. This person is now officially a participant or attendee of the event.,A paid applicant is a subclass of a registered applicant. A late paid applicant is a subclass of a paid applicant. Early paid applicant is a subclass of Paid applicant. 
source:Early_paid_applicant,Source,Class,early paid applicant,An Early_paid_applicant refers to an individual who has registered and paid for a conference or event before a specified early registration deadline. This is often done at a discounted rate compared to the standard or late registration fees.,Early paid applicant is disjoint with late paid applicant. An early paid applicant is a subclass of a paid applicant. Late paid applicant is disjoint with early paid applicant. 
source:Organizer,Source,Class,organizer,"An organizer in the context of a conference is the person, group, or organization that plans and coordinates the event. They are responsible for arranging the venue, scheduling, inviting speakers and participants, managing registration, and overseeing all other details involved in running the conference.",
source:Call_for_participation,Source,Class,call for participation,"A Call for Participation in the context of a conference is an invitation for individuals to contribute to the conference in some way. This could be through presenting papers, workshops, or posters, participating in panels, or other activities related to the conference theme. The call usually includes information on the conference theme, submission guidelines, deadlines, and other relevant details.",A call for participation is a subclass of a conference document. 
source:Publisher,Source,Class,publisher,"In the context of a conference, a publisher typically refers to the organization or company that is responsible for printing and distributing the materials, proceedings, or articles that are presented during the conference. This could include academic journals, research papers, or other types of scholarly works. The publisher often also manages the peer-review process and ensures the quality and credibility of the published works.",The property 'has_a_publisher' has a range of 'Publisher'. The domain of issues is Publisher. 
source:Registeered_applicant,Source,Class,registered applicant,A Registered Applicant in the context of a conference is an individual who has completed the necessary steps to apply for attendance at the conference. This typically includes filling out an application form and paying any required fees. The person is then registered and listed as an attendee for the conference.,A registered applicant is a subclass of a conference applicant. A paid applicant is a subclass of a registered applicant. 
source:Track-workshop_chair,Source,Class,track workshop chair,"A Track-Workshop Chair in a conference is a person who is responsible for overseeing and managing a specific track (topic or theme) or workshop within the conference. This includes tasks such as organizing the schedule, selecting and coordinating with speakers, moderating discussions, and ensuring the smooth running of the track or workshop.",A track-workshop chair is a type of person. The domain of 'was_a_track-workshop_chair_of' is 'Track-workshop_chair'. The track-workshop-tutorial chair has a range of Track-workshop_chair. 
source:Conference_www,Source,Class,conference www,"The term ""Conference_www"" is not standard in the context of conferences. It could possibly refer to a specific conference that is either related to the World Wide Web or is being held online. However, without more specific context, it's hard to determine the exact meaning. It could also be a placeholder or code used in a specific system to refer to certain types of conferences.",The class 'Conference_www' is a subclass of the class 'Conference_document'. The domain 'Conference_www' has a URL. 
source:Conference_fees,Source,Class,conference fees,"Conference fees refer to the amount of money charged by the organizers to attend a conference. These fees usually cover costs such as venue rental, speakers, materials, meals, and other related expenses. The amount can vary greatly depending on the size, location, and prestige of the conference.",
source:Review_preference,Source,Class,review preference,"In the context of a conference, ""review preference"" typically refers to the preference of a reviewer in terms of the type of papers or topics they would like to review. This could be based on their area of expertise, interest, or experience. This helps in assigning the right papers to the right reviewers, ensuring a more accurate and effective review process.",The property 'belongs_to_a_review_reference' has a range of 'Review_preference'. The domain of having a topic or a submission contribution is Review preference. The domain of 'has a degree' is 'Review preference'. A review reference has been assigned a range of review preference. 
target:Hotel,Target,Class,hotel,"In the context of a conference, a hotel refers to the accommodation facility where the conference is being held or where attendees of the conference are staying. It often provides rooms for attendees to stay in overnight, as well as meeting spaces where the conference or parts of it may be held.",A hotel is a subclass of a place. 
target:Place,Target,Class,place,"In the context of a conference, ""Place"" refers to the location or venue where the conference is being held. This could be a specific building, city, or even a virtual platform for online conferences.",A hotel is a subclass of a place. A conference hall is a subclass of a place. The main office is a subclass of a place. The entity 'can stay in' has a range of 'Place'. 
target:Abstract,Target,Class,abstract,"In the context of a conference, an abstract is a brief summary of a research paper, thesis, review, or other in-depth analysis that is presented at the conference. It provides a concise overview of the research, including the main arguments, findings, and conclusions. This allows attendees to understand the key points of the presentation without having to read the entire paper.",An abstract is a subclass of a document. 
target:Document,Target,Class,document,"In the context of a conference, a document refers to any written, printed, or electronic material that provides information or evidence or that serves as an official record. This could include conference agendas, research papers, presentations, transcripts of speeches, minutes of meetings, or any other materials distributed or presented during the conference.",Abstract is a subclass of Document. A review is a subclass of a document. Paper is a subclass of Document. The domain of 'presentationed_by' is 'Document'. The range of the presentation is documented. The domain of 'submit_until' is 'Document'. 
target:Deadline_Abstract_Submission,Target,Class,deadline abstract submission,"Deadline_Abstract_Submission refers to the final date by which the summary or abstract of a research paper, presentation, or study must be submitted for consideration to be included in the conference. After this date, the conference organizers will not accept any more abstracts.",The deadline for abstract submission is a subclass of deadline. 
target:Best_Applications_Paper_Award,Target,Class,best applications paper award,"The Best Applications Paper Award is an award given at a conference to recognize the paper that presents the most innovative and impactful practical application of a theory, method, or technology. This award is typically given in fields such as computer science, engineering, or other technical disciplines. The criteria for this award often include the novelty of the application, its potential impact, and the quality of the paper itself.",The Best Applications Paper Award is a subclass of Award. 
target:Award,Target,Class,award,"In the context of a conference, an award typically refers to a recognition or honor given to an individual or group for their outstanding achievement, contribution, or performance in a specific field or area. This could be for presenting the best research paper, making significant contributions to the industry, or demonstrating exceptional innovation or leadership, among others. The criteria for these awards are usually set by the conference organizers.",The Best Applications Paper Award is a subclass of Award. The Best Student Paper Award is a subclass of Award. The Best Research Paper Award is a subclass of Award. Obtain the range of the award. The domain of 'awarded_by' is 'Award'. The range of the award is Award. 
target:Deadline_Paper_Submission,Target,Class,deadline paper submission,"Deadline_Paper_Submission refers to the final date by which the conference organizers will accept papers or abstracts for consideration. After this date, no more submissions will be accepted. This deadline is important for researchers and academics who wish to present their work at the conference.",The deadline for paper submission is a subclass of deadline. 
target:Deadline,Target,Class,deadline,"In the context of a conference, a deadline refers to the final date or time by which something must be completed or submitted. This could refer to the deadline for submitting abstracts, papers, or proposals, registering for the conference, booking accommodations, etc. After this date or time, submissions or actions may not be accepted.",The deadline for paper submission is a subclass of the deadline. The deadline for author notification is a subclass of deadline. The deadline for abstract submission is a subclass of deadline. The domain of 'designed_by' is 'Deadline'. The range of 'submit_until' is 'Deadline'. The design range has a deadline. The date is within the domain of the deadline. 
target:Deadline_Author_notification,Target,Class,deadline author notification,Deadline_Author_notification refers to the date by which the authors will be notified about the acceptance or rejection of their submitted papers or proposals for the conference.,The deadline for author notification is a subclass of deadline. The notification until has a range of Deadline Author notification. 
target:Webmaster,Target,Class,web master,"A Webmaster in the context of a conference is the person responsible for maintaining and updating the conference's website. They ensure that all information is accurate and up-to-date, manage online registrations, handle any technical issues, and may also be involved in designing and developing the website.",A Webmaster is a subclass of an Organizator. 
target:Organizator,Target,Class,organizator,"The term ""Organizator"" is not standard English. However, it seems to be a misspelling or translation of the word ""Organizer"". In the context of a conference, the organizer is the person or group who plans and arranges the event. They are responsible for all aspects of the conference, including choosing a venue, scheduling, inviting speakers, promoting the event, and managing logistics.",An organizer is a subclass of a person. A Webmaster is a subclass of an Organizator. The program chair is a subclass of the organizer. A General Chair is a subclass of an Organizer. A member of the Program Committee is a subclass of an Organizer. An Organizing Committee member is a subclass of an Organizer. 
target:Author_of_paper_student,Target,Class,author of paper student,"In the context of a conference, ""Author_of_paper_student"" likely refers to a student who is the author of a paper that is being presented or discussed at the conference. This could be a graduate student, an undergraduate, or even a high school student, depending on the conference. The student has conducted research or a study and written a paper detailing their findings, which they then submit to the conference for consideration.",The author of a paper who is a student is a subclass of an author. 
target:Best_Student_Paper_Award,Target,Class,best student paper award,"The Best Student Paper Award is a recognition given at a conference to the student who has presented an exceptionally high-quality research paper. This award is typically judged on the originality and importance of the research, as well as the quality of the presentation. It is designed to encourage and acknowledge outstanding student research.",The Best Student Paper Award is a subclass of Award. 
target:Author,Target,Class,author,"In the context of a conference, an author is typically the person who has written or contributed to a research paper, study, or presentation that is being shared or discussed at the conference. They are responsible for the content and findings of the work being presented.",An author is a subclass of a speaker. The author of a paper who is a student is a subclass of an author. The author of a paper is a subclass of an author. Obtain the domain of the entity 'Author'. The domain of 'submit' is 'Author'. The domain of the notification until is the author. 
target:ACM_SIGKDD,Target,Class,acm sigkdd,"ACM_SIGKDD refers to the Special Interest Group on Knowledge Discovery and Data Mining of the Association for Computing Machinery (ACM). It is a leading professional organization in the field of data mining and knowledge discovery, and it organizes the annual KDD Conference, a top conference in the field.",The range of what is held by is ACM_SIGKDD. The domain of 'hold' is ACM_SIGKDD. The range of 'designed by' is ACM SIGKDD. The search domain is ACM_SIGKDD. The design domain is associated with ACM_SIGKDD. The range of 'searched_by' is ACM_SIGKDD. 
target:Conference,Target,Class,conference,"A conference is a formal meeting of people with a shared interest, typically one that takes place over several days. It involves various presentations, discussions, workshops or exhibitions about a particular subject or topic. It is often organized by a professional association or organization. It provides a platform for participants to exchange their views, ideas, developments and research findings.",The domain of 'holded_by' is 'Conference'. The range of the hold is related to the conference. The domain of the conference named 'Name_of_conference' is 'Conference'. The start of the conference is a domain of the conference. The city of the conference is a domain of the conference. The end of a conference is a part of the domain of a conference. 
target:Sponzor,Target,Class,sponzor,"""Sponzor"" appears to be a misspelling of the word ""Sponsor."" In the context of a conference, a sponsor is an individual, group, or organization that provides financial or other support for the event. This can include funding for venue rental, speaker fees, promotional materials, and more. In return, sponsors often receive benefits such as advertising or promotional opportunities at the conference.",An Exhibitor is a subclass of a Sponsor. A Bronze Supporter is a subclass of a Sponsor. A Platinum Supporter is a type of Sponsor. A Gold Supporter is a subclass of a Sponsor. The Best Student Paper Supporter is a subclass of Sponsor. A Silver Supporter is a subclass of a Sponsor. The search range is sponsored. The domain 'Sponzor' is searched by 'entity_graphical'. The sponsor of the domain is Name_of_sponsor. 
target:Exhibitor,Target,Class,exhibitor,"An exhibitor in a conference is a person, company, or organization that displays and presents their products or services in a designated space, often in a booth or stand. This is usually done for promotional purposes, to attract potential customers or clients, and to network with other industry professionals.",An Exhibitor is a subclass of a Sponsor. 
target:Registration_SIGMOD_Member,Target,Class,registration sigmod member,"Registration_SIGMOD_Member likely refers to the registration process for a member of SIGMOD (Special Interest Group on Management of Data) to attend a conference. SIGMOD is a community of software professionals and academics affiliated with the Association for Computing Machinery (ACM), who specialize in large scale data management problems and databases.",The registration for a SIGMOD member is a subclass of the registration fee. 
