entity,source_or_target,entity_type,syntactic_matching,lexical_matching,graphical_matching
http://ontology.dumontierlab.com/Beryllium,Target,Class,beryllium,"Beryllium is a chemical element with the symbol Be and atomic number 4. It is a lightweight metal that is commonly used in materials science due to its high strength-to-weight ratio, thermal conductivity, and resistance to corrosion. In this context, beryllium is a valuable material for various applications in industries such as aerospace, defense, and electronics.",Information is not available.
http://ontology.dumontierlab.com/BerylliumAtom,Target,Class,beryllium atom,"The term ""Beryllium Atom"" refers to a single atom of the element beryllium. Beryllium is a chemical element with the symbol Be and atomic number 4. It is a lightweight metal that is commonly used in materials science due to its high strength-to-weight ratio, thermal conductivity, and resistance to corrosion. Understanding the properties and behavior of a single beryllium atom is important in the study and development of materials that utilize beryllium, such as aerospace components, nuclear reactors, and electronic devices.",Information is not available.
http://ontology.dumontierlab.com/BinaryCompound,Target,Class,binary compound,"In materials science, a Binary Compound is a chemical compound that consists of only atoms of two different elements. This means that the compound is made up of molecules containing two different types of atoms bonded together. Examples of binary compounds include sodium chloride (NaCl) and water (H2O).",Information is not available.
http://ontology.dumontierlab.com/Bismuth,Target,Class,bismuth,"Bismuth is a chemical element with the symbol Bi and atomic number 83. In materials science, bismuth is known for its unique properties, such as being a brittle metal with a pinkish hue. It is often used in alloys to lower the melting point and improve machinability. Bismuth is also used in a variety of applications, including in cosmetics, pharmaceuticals, and as a replacement for lead in certain applications due to its non-toxic nature.",Information is not available.
http://ontology.dumontierlab.com/BismuthAtom,Target,Class,bismuth atom,"In the context of materials science, a Bismuth Atom refers to an atom of the element bismuth. Bismuth is a chemical element with the symbol Bi and atomic number 83. It is a brittle metal with a white, silver-pink hue and is commonly used in various applications such as cosmetics, pharmaceuticals, and as an alloy in materials science. The Bismuth Atom plays a crucial role in the properties and behavior of materials containing bismuth.",Information is not available.
http://ontology.dumontierlab.com/BlockElement,Target,Class,block element,"In materials science, a BlockElement refers to an element in the periodic table where the highest-energy electrons occupy a specific orbital in the atomic ground state. This term is used to categorize elements based on their electron configurations and orbital filling patterns.",Information is not available.
http://ontology.dumontierlab.com/Bohrium,Target,Class,bohrium,"Bohrium is a synthetic element with the atomic number 107 and symbol Bh. It is named after Danish physicist Niels Bohr. In materials science, Bohrium is not commonly used due to its rarity and radioactive nature.",Information is not available.
http://ontology.dumontierlab.com/BohriumAtom,Target,Class,bohrium atom,"Bohrium is a synthetic chemical element with the symbol Bh and atomic number 107. It is a highly radioactive element that does not occur naturally and must be produced in a laboratory. A Bohrium atom refers to an atom of the element Bohrium, which has unique properties due to its high atomic number and radioactive nature. In materials science, researchers may study Bohrium atoms to understand their behavior and potential applications in various fields.",Information is not available.
http://ontology.dumontierlab.com/Boron,Target,Class,boron,"Boron is a chemical element with the symbol B and atomic number 5. In materials science, boron is known for its unique properties, such as high strength, low density, and excellent thermal and electrical conductivity. It is often used in the production of high-performance materials, such as boron fibers, ceramics, and semiconductors.",Information is not available.
http://ontology.dumontierlab.com/BoronAtom,Target,Class,boron atom,"In materials science, a Boron Atom refers to an atom of the element boron. Boron is a chemical element with the symbol B and atomic number 5. It is a metalloid that is commonly used in various materials and compounds due to its unique properties, such as high strength, low density, and excellent thermal and electrical conductivity. Boron atoms play a crucial role in the development of advanced materials for various applications in industries such as aerospace, electronics, and energy.",Information is not available.
http://ontology.dumontierlab.com/BoronGroupElement,Target,Class,boron group element,"BoronGroupElement refers to an element in group 13 of the periodic table, also known as the boron group. These elements include boron, aluminum, gallium, indium, and thallium. They share similar chemical properties due to their placement in the same group on the periodic table. In materials science, BoronGroupElements are often studied for their unique properties and potential applications in various industries.",Information is not available.
http://ontology.dumontierlab.com/BoseEinsteinCondensate,Target,Class,bose einstein condensate,"A Bose-Einstein Condensate is a state of matter that forms at extremely low temperatures, close to absolute zero. In this state, a group of boson particles, which have integer spin, occupy the same quantum state, behaving as a single entity. This phenomenon was predicted by Satyendra Nath Bose and Albert Einstein in the early 20th century and was first achieved in the laboratory in 1995. Bose-Einstein Condensates have unique properties that make them valuable for studying quantum mechanics and for developing new technologies in fields such as materials science.",Information is not available.
http://ontology.dumontierlab.com/Bromine,Target,Class,bromine,"Bromine is a chemical element with the symbol Br and atomic number 35. It is a reddish-brown liquid at room temperature and is part of the halogen group on the periodic table. In materials science, bromine is often used as a flame retardant in plastics and textiles due to its ability to inhibit the spread of fire.",Information is not available.
http://ontology.dumontierlab.com/BromineAtom,Target,Class,bromine atom,"In the context of materials science, a Bromine Atom refers to a single atom of the element bromine. Bromine is a chemical element with the symbol Br and atomic number 35. It is a halogen that is commonly used in various industrial applications, such as flame retardants, pharmaceuticals, and water treatment. The Bromine Atom plays a crucial role in the properties and behavior of materials that contain bromine, influencing their chemical and physical characteristics.",Information is not available.
http://ontology.dumontierlab.com/CASName,Target,Class,cas name,"CASName refers to a name given by the Chemical Abstracts Service (CAS) to a specific material or compound. In the field of materials science, CASName is used as a standardized way to identify and refer to different substances, making it easier for researchers and scientists to communicate and share information about materials.",Information is not available.
http://ontology.dumontierlab.com/Cadmium,Target,Class,cadmium,"Cadmium is a chemical element with the symbol Cd and atomic number 48. In materials science, cadmium is often used in the production of various alloys, such as solder, as well as in the manufacturing of batteries and pigments. It is known for its low melting point and resistance to corrosion, making it a valuable material in various industrial applications.",Information is not available.
http://ontology.dumontierlab.com/CadmiumAtom,Target,Class,cadmium atom,"The term ""CadmiumAtom"" refers to a single atom of the element cadmium. Cadmium is a metallic element commonly used in materials science for its unique properties, such as high corrosion resistance and low melting point. Understanding the behavior and structure of a CadmiumAtom is important in the study and development of materials that contain cadmium, such as batteries, pigments, and coatings.",Information is not available.
http://ontology.dumontierlab.com/Caesium,Target,Class,caesium,"Caesium is a chemical element with the symbol Cs and atomic number 55. It is a soft, silvery-gold alkali metal that is highly reactive and has a melting point of 28.5°C (83.3°F). In materials science, caesium is used in various applications such as atomic clocks, catalysis, and in the production of certain types of glass.",Information is not available.
http://ontology.dumontierlab.com/CaesiumAtom,Target,Class,caesium atom,"In the context of materials science, a Caesium Atom refers to an atom of the chemical element caesium. Caesium is a soft, silvery-gold alkali metal with the atomic number 55. Caesium atoms are commonly used in various scientific experiments and technologies due to their unique properties, such as high reactivity and sensitivity to electromagnetic fields.",Information is not available.
http://ontology.dumontierlab.com/Calcium,Target,Class,calcium,"In materials science, calcium is a chemical element with the symbol Ca and atomic number 20. It is a soft gray alkaline earth metal that is essential for living organisms, including humans. In materials science, calcium is often used as an alloying agent to improve the properties of various materials, such as increasing strength and corrosion resistance.",Information is not available.
http://ontology.dumontierlab.com/CalciumAtom,Target,Class,calcium atom,"In the context of materials science, a Calcium Atom refers to the smallest unit of the chemical element calcium. Calcium is a metallic element with the atomic number 20 and is essential for various biological processes in living organisms. In materials science, calcium atoms can be found in various compounds and materials, contributing to their properties and behavior. Understanding the behavior and interactions of calcium atoms is important for the development of new materials with specific characteristics and applications.",Information is not available.
http://ontology.dumontierlab.com/Californium,Target,Class,californium,"Californium is a radioactive metallic chemical element with the symbol Cf and atomic number 98. It is named after the state of California, where it was first synthesized. Californium is used in materials science for research purposes, particularly in nuclear reactors and neutron sources.",Information is not available.
http://ontology.dumontierlab.com/CaliforniumAtom,Target,Class,californium atom,"The meaning of Californium Atom in materials science refers to the atom of the element Californium, which is a radioactive metallic chemical element with the symbol Cf and atomic number 98. Californium is primarily used in neutron sources for various applications in materials science, such as neutron activation analysis and neutron radiography. Its unique properties make it a valuable tool for studying the structure and properties of materials at the atomic level.",Information is not available.
http://ontology.dumontierlab.com/Capacitance,Target,Class,capacitance,"Capacitance in materials science refers to the measure of the amount of electric charge that can be stored for a given electric potential. It is a property that describes the ability of a material to store electrical energy in the form of an electric field. The higher the capacitance of a material, the more charge it can store for a given voltage. This property is important in various applications such as in capacitors, where capacitance determines the amount of energy that can be stored and released.",Information is not available.
http://ontology.dumontierlab.com/CapacitanceUnit,Target,Class,capacitance unit,The meaning of CapacitanceUnit in materials science is a standard measure for capacitance. It is a unit used to quantify the ability of a system to store electrical charge.,Information is not available.
http://ontology.dumontierlab.com/Carbon,Target,Class,carbon,"In materials science, carbon refers to a chemical element with the symbol C and atomic number 6. It is a versatile element that can exist in various forms, such as graphite, diamond, and carbon nanotubes. Carbon is known for its exceptional properties, including high strength, low density, and excellent thermal and electrical conductivity. It is widely used in various industries, including aerospace, automotive, and electronics, due to its unique characteristics.",Information is not available.
http://ontology.dumontierlab.com/CarbonAllotrope,Target,Class,carbon allotrope,"In the context of materials science, a carbon allotrope refers to a specific form or structure of carbon. Carbon can exist in various allotropes, such as diamond, graphite, and graphene, each with unique properties and characteristics. The term 'carbon allotrope' simply denotes a different form or arrangement of carbon atoms.",Information is not available.
http://ontology.dumontierlab.com/CarbonAtom,Target,Class,carbon atom,"A Carbon Atom is the smallest unit of a carbon element, which is a fundamental building block of materials in the field of materials science. Carbon atoms are known for their versatility and ability to form a wide range of compounds, making them essential for the development of various materials with unique properties.",Information is not available.
http://ontology.dumontierlab.com/CarbonGroup,Target,Class,carbon group,"In materials science, the term ""Carbon Group"" refers to a group of elements in the periodic table that includes carbon, silicon, germanium, tin, and lead. These elements share similar chemical properties due to their similar electron configurations. They are important in materials science as they can form various compounds and alloys with unique properties, making them valuable for a wide range of applications in industries such as electronics, construction, and energy.",Information is not available.
http://ontology.dumontierlab.com/CarbonGroupElement,Target,Class,carbon group element,"In the context of materials science, a Carbon Group Element refers to an element that belongs to group 14 of the periodic table according to IUPAC style. This group includes elements such as carbon, silicon, germanium, tin, and lead. These elements share similar chemical properties due to their placement in the same group on the periodic table.",Information is not available.
http://ontology.dumontierlab.com/CarbonNanofoam,Target,Class,carbon nanofoam,Carbon nanofoam is an allotrope of carbon that consists of a low-density cluster-assembly of carbon atoms strung together in a loose three-dimensional web. Each cluster is about 6 nanometers wide and consists of about 4000 carbon atoms linked in graphite-like sheets that are given negative curvature by the inclusion of heptagons among the regular hexagonal pattern.,Information is not available.
http://ontology.dumontierlab.com/CarbonylCompound,Target,Class,carbonyl compound,"A carbonyl compound is a type of organic compound that contains a carbonyl group, which is a carbon atom double-bonded to an oxygen atom. These compounds are commonly used in materials science for their unique chemical properties, such as reactivity and stability. They are often utilized in the synthesis of polymers, coatings, and other advanced materials.",Information is not available.
http://ontology.dumontierlab.com/CarbonylGroup,Target,Class,carbonyl group,"In materials science, a carbonyl group refers to a functional group composed of a carbon atom double-bonded to an oxygen atom. This group is commonly found in organic compounds and plays a significant role in the properties and reactivity of materials. The presence of a carbonyl group can influence the chemical and physical properties of a material, such as its solubility, stability, and reactivity.",Information is not available.
http://ontology.dumontierlab.com/CarboxylicAcid,Target,Class,carboxylic acid,"Carboxylic acid is a type of organic compound that contains a carboxyl group (COOH). It is commonly used in materials science for its ability to form strong bonds with other molecules, making it a useful component in adhesives, coatings, and polymers. Carboxylic acids are known for their acidic properties and are often used in the synthesis of various materials due to their reactivity and versatility.",Information is not available.
http://ontology.dumontierlab.com/CarboxylicAcidGroup,Target,Class,carboxylic acid group,"In materials science, a carboxylic acid group refers to a functional group consisting of a carbon atom double-bonded to an oxygen atom and single-bonded to a hydroxyl group. This group is commonly found in organic compounds such as carboxylic acids, which are important in various applications including polymers, pharmaceuticals, and organic synthesis. The presence of a carboxylic acid group can influence the chemical and physical properties of a material, making it a key consideration in materials science research and development.",Information is not available.
http://ontology.dumontierlab.com/Catalyst,Target,Class,catalyst,"In the context of materials science, a catalyst is a chemical agent that increases the rate of a reaction by lowering the activation energy required for the reaction to occur. This means that a catalyst can speed up a reaction without being consumed in the process.",Information is not available.
http://ontology.dumontierlab.com/CatalyticActivity,Target,Class,catalytic activity,"Catalytic activity in materials science refers to the measure of the acceleration of a chemical reaction that is facilitated by a catalyst. A catalyst is a substance that increases the rate of a chemical reaction without being consumed in the process. The catalytic activity of a material is important in various industrial processes where the speed and efficiency of chemical reactions are crucial. By enhancing the catalytic activity of a material, researchers can improve the overall performance and effectiveness of chemical processes.",Information is not available.
http://ontology.dumontierlab.com/CatalyticActivityUnit,Target,Class,catalytic activity unit,"In the context of materials science, a Catalytic Activity Unit is a standard measure used to quantify the catalytic activity of a material. This unit is used to compare the effectiveness of different catalysts in promoting chemical reactions. The Catalytic Activity Unit provides a standardized way to evaluate and compare the catalytic performance of various materials in a consistent and meaningful manner.",Information is not available.
http://ontology.dumontierlab.com/CatalyticConcentration,Target,Class,catalytic concentration,"Catalytic concentration refers to the measure of catalytic activity per unit volume in materials science. It indicates the amount of catalyst present in a given volume of a reaction mixture, which can affect the rate of a catalyzed reaction. A higher catalytic concentration typically leads to a faster reaction rate, as there are more catalyst molecules available to facilitate the reaction.",Information is not available.
http://ontology.dumontierlab.com/CatalyticConcentrationUnit,Target,Class,catalytic concentration unit,"In the context of materials science, a CatalyticConcentrationUnit refers to a standard measure used to quantify the concentration of a catalyst in a reaction. This unit is used to determine the amount of catalyst present in a reaction system, which is crucial for understanding and optimizing catalytic processes. The CatalyticConcentrationUnit provides a standardized way to compare and analyze the effectiveness of different catalysts in various reactions.",Information is not available.
http://ontology.dumontierlab.com/CatalyzedReaction,Target,Class,catalyzed reaction,"In the context of materials science, a CatalyzedReaction refers to a chemical reaction that is facilitated or sped up by a catalyst. A catalyst is a substance that increases the rate of a chemical reaction without being consumed in the process. Therefore, a catalyzed reaction is one that is enhanced by the presence of a catalyst, allowing the reaction to occur more efficiently or under milder conditions.",Information is not available.
http://ontology.dumontierlab.com/Cation,Target,Class,cation,"In materials science, a cation refers to a positively charged ion. This means that it is an atom or molecule that has lost one or more electrons, resulting in a net positive charge. Cations play a crucial role in various chemical reactions and material properties.",Information is not available.
http://ontology.dumontierlab.com/CationPiInteraction,Target,Class,cation pi interaction,"Cation-pi interaction refers to the electronic interaction between a positively charged ion (cation) and the localized negative charge of π orbital electrons in an aromatic ring. This interaction occurs when the positive charge of the cation is attracted to the electron-rich region above and below the plane of the aromatic ring. In materials science, cation-pi interactions play a significant role in influencing the properties and behavior of molecules and materials, particularly in the design and study of organic compounds and supramolecular structures.",Information is not available.
http://ontology.dumontierlab.com/CentiScaledUnit,Target,Class,centi scaled unit,"In the context of materials science, a CentiScaledUnit refers to a unit that has been scaled by a factor of 10^-2, or in other words, divided by 100. This means that the CentiScaledUnit is 100 times smaller than the original unit.",Information is not available.
http://ontology.dumontierlab.com/Cerium,Target,Class,cerium,"Cerium is a chemical element with the symbol Ce and atomic number 58. It is a rare earth metal that is commonly used in materials science for its unique properties, such as its ability to act as a catalyst in various chemical reactions. Cerium is known for its high reactivity and is often used in the production of glass, ceramics, and alloys.",Information is not available.
http://ontology.dumontierlab.com/CeriumAtom,Target,Class,cerium atom,"In materials science, a Cerium Atom refers to an atom of the element cerium. Cerium is a chemical element with the symbol Ce and atomic number 58. It is a rare earth metal that is commonly used in various applications, such as in the production of catalytic converters, glass polishing compounds, and as a component in some types of alloys. The study of Cerium Atoms is important in understanding the properties and behavior of materials that contain cerium, as well as in developing new materials with specific characteristics.",Information is not available.
http://ontology.dumontierlab.com/Chalcogen,Target,Class,chalcogen,"Chalcogen refers to an element of Group 16 in the periodic table, which includes oxygen, sulfur, selenium, tellurium, polonium, and ununhexium. These elements are known for their chemical properties and are commonly used in materials science for various applications.",Information is not available.
http://ontology.dumontierlab.com/Chaoite,Target,Class,chaoite,"Chaoite is an allotrope of carbon that is slightly harder than graphite and has a reflection color of grey to white. In the context of materials science, chaoite is a unique form of carbon with specific physical and chemical properties that make it distinct from other carbon allotropes like graphite and diamond.",Information is not available.
http://ontology.dumontierlab.com/ChemicalAgent,Target,Class,chemical agent,"In the context of materials science, a Chemical Agent refers to a substance that interacts with another chemical, causing a specific reaction or effect. Chemical agents can be used in various processes such as synthesis, modification, or analysis of materials. These agents play a crucial role in manipulating the properties and behavior of materials for specific applications.",Information is not available.
http://ontology.dumontierlab.com/ChemicalBond,Target,Class,chemical bond,"Chemical bond refers to the strong interaction between atoms that results in the formation of a compound or molecule. It is the attractive force that holds atoms together in a stable arrangement, allowing them to form various materials with unique properties. In materials science, understanding chemical bonds is crucial for studying the structure, properties, and behavior of different materials.",Information is not available.
http://ontology.dumontierlab.com/ChemicalConformation,Target,Class,chemical conformation,"Chemical conformation refers to the spatial orientation of atoms rotating about a bond in a molecule. In materials science, understanding the chemical conformation of a molecule is important as it can affect the properties and behavior of materials. The quality of a conformer is determined by how the atoms are arranged and how they rotate around the bond, which can impact the overall structure and stability of the molecule. By studying chemical conformation, researchers can gain insights into how molecules interact and how they can be manipulated to enhance the properties of materials.",Information is not available.
