entity,source_or_target,entity_type,syntactic_matching,lexical_matching,graphical_matching
http://ontology.dumontierlab.com/Irradiance,Target,Class,irradiance,"Irradiance in the context of materials science refers to the measure of the power of electromagnetic radiation at a surface. It is a crucial parameter for understanding how materials interact with light and other forms of electromagnetic radiation. By measuring irradiance, scientists can determine the intensity of radiation hitting a surface, which is essential for various applications in materials science, such as solar energy conversion, photovoltaics, and optical coatings.",Information is not available.
http://ontology.dumontierlab.com/IrradianceUnit,Target,Class,irradiance unit,"In the context of materials science, IrradianceUnit refers to a standard measure for irradiance. IrradianceUnit is a unit of measurement used to quantify the amount of radiant energy (such as light or heat) that is incident on a surface per unit area. It provides a standardized way to express the intensity of radiation being received by a material.",Information not available
http://ontology.dumontierlab.com/Isomer,Target,Class,isomer,"In materials science, an isomer refers to a compound that has the same chemical composition as another compound, but with a different arrangement of atoms. This difference in atomic connectivity results in isomers having distinct properties and behaviors.",Information is not available.
http://ontology.dumontierlab.com/Isomerization,Target,Class,isomerization,"Isomerization in materials science refers to a chemical reaction where a molecule is transformed into its isomer. This process involves rearranging the atoms within the molecule to create a new structure with the same chemical formula but different properties. Isomerization is an important concept in materials science as it can lead to changes in the physical and chemical properties of materials, which can be useful for various applications.",Information is not available.
http://ontology.dumontierlab.com/IsotopicAtomCount,Target,Class,isotopic atom count,"IsotopicAtomCount refers to the number of atoms within a material that have different isotopes. This count is important in materials science as it can affect the properties and behavior of the material. By knowing the IsotopicAtomCount, researchers can better understand how isotopic variations may impact the material's performance in various applications.",Information is not available.
http://ontology.dumontierlab.com/Ketone,Target,Class,ketone,"In materials science, a ketone is a type of organic compound that contains a carbonyl group bonded to two carbon atoms. Ketones are commonly used in various applications, such as solvents, polymers, and pharmaceuticals. They are known for their unique chemical properties and are important building blocks in the field of materials science.",Information is not available.
http://ontology.dumontierlab.com/KetoneGroup,Target,Class,ketone group,"In materials science, a ketone group refers to a functional group in organic chemistry that consists of a carbonyl group (C=O) bonded to two carbon atoms. Ketones are important compounds in materials science as they can be used in the synthesis of various polymers, resins, and other materials. The presence of a ketone group in a molecule can affect its properties and reactivity, making it a key feature to consider in materials design and development.",Information is not available.
http://ontology.dumontierlab.com/KiloScaledUnit,Target,Class,kilo scaled unit,"In the context of materials science, a KiloScaledUnit refers to a unit that is scaled by a factor of 10^3, or one thousand. This means that the unit is multiplied by 1000 to represent larger quantities or measurements. For example, a kilogram is a KiloScaledUnit of mass, as it is equal to 1000 grams.",Information is not available.
http://ontology.dumontierlab.com/Krypton,Target,Class,krypton,"In materials science, Krypton is a chemical element with the symbol Kr and atomic number 36. It is a noble gas that is colorless, odorless, and tasteless. Krypton is commonly used in lighting, such as in fluorescent lamps and photographic flashes, as well as in certain types of lasers. Its name comes from the Greek word ""kryptos,"" meaning hidden or secret, reflecting its rarity and inert nature.",Information is not available.
http://ontology.dumontierlab.com/KryptonAtom,Target,Class,krypton atom,"In the context of materials science, a Krypton atom refers to an atom of the element Krypton, which is a noble gas with the atomic number 36. Krypton atoms are typically used in various applications such as lighting, lasers, and insulation. The term ""KryptonAtom"" could potentially refer to a specific application or study related to Krypton atoms in the field of materials science.",Information is not available.
http://ontology.dumontierlab.com/LIsomer,Target,Class,lisomer,"In materials science, an L isomer refers to an optical isomer where the three highest priority substituents decrease in a counter-clockwise direction when the lowest is pointed away from the viewer. This specific arrangement of substituents gives the molecule a certain orientation and chirality, which can have important implications for its properties and behavior in materials science applications.",Information not available
http://ontology.dumontierlab.com/Lanthanide,Target,Class,lanthanide,"In materials science, the term ""lanthanide"" refers to an element with an atomic number between 57 and 71. Lanthanides are a group of metallic elements that are commonly used in various applications due to their unique properties, such as magnetic and optical properties. These elements are often used in the production of magnets, catalysts, and electronic devices.",Information is not available.
http://ontology.dumontierlab.com/Lanthanum,Target,Class,lanthanum,"Lanthanum is a chemical element with the symbol La and atomic number 57. It is a rare earth metal that is commonly used in materials science for its unique properties, such as its ability to improve the strength and durability of materials. In this context, lanthanum plays a crucial role in the development of advanced materials for various applications in industries such as electronics, automotive, and aerospace.",Information is not available.
http://ontology.dumontierlab.com/LanthanumAtom,Target,Class,lanthanum atom,"In materials science, a Lanthanum Atom refers to an atom of the element lanthanum, which is a rare earth metal. Lanthanum is commonly used in various applications such as in the production of high refractive index glass, catalysts, and rechargeable batteries. The properties of lanthanum atoms play a crucial role in determining the characteristics and behavior of materials in which they are present.",Information is not available.
http://ontology.dumontierlab.com/Lawrencium,Target,Class,lawrencium,"Lawrencium is a synthetic chemical element with the symbol Lr and atomic number 103. It is named after Ernest Lawrence, the inventor of the cyclotron, a device used to accelerate particles in nuclear reactions. In the context of materials science, Lawrencium is a highly radioactive element that is primarily used for research purposes and has no practical applications.",Information is not available.
http://ontology.dumontierlab.com/LawrenciumAtom,Target,Class,lawrencium atom,"Lawrencium is a synthetic chemical element with the symbol Lr and atomic number 103. It is named after Ernest Lawrence, the inventor of the cyclotron, and is a highly radioactive element. A Lawrencium atom refers to an atom of this element, which is typically produced in nuclear reactors or particle accelerators. In materials science, Lawrencium atoms may be used in research to study their properties and behavior, particularly in relation to nuclear reactions and transmutation processes.",Information is not available.
http://ontology.dumontierlab.com/Lead,Target,Class,lead,"In materials science, lead refers to a chemical element with the symbol Pb and atomic number 82. Lead is a heavy metal that is commonly used in various applications, such as in batteries, construction materials, and radiation shielding. It is known for its high density, malleability, and resistance to corrosion. Lead is also toxic to humans and the environment, so its use is regulated in many industries to prevent harmful exposure.",Information is not available.
http://ontology.dumontierlab.com/LeadAtom,Target,Class,lead atom,"In the context of materials science, a Lead Atom refers to an atom of the element lead. Lead is a heavy metal with the atomic number 82 and is commonly used in various applications such as batteries, radiation shielding, and soldering. Lead atoms have a relatively large atomic size and are known for their toxicity, which is why there are strict regulations in place for its use and disposal.",Information is not available.
http://ontology.dumontierlab.com/Length,Target,Class,length,"In materials science, length refers to a measure of one dimension of an object or material. It is a fundamental physical quantity that helps characterize the size and shape of materials. Length is typically measured in units such as meters, centimeters, or millimeters.",Information is not available.
http://ontology.dumontierlab.com/LengthUnit,Target,Class,length unit,"In the context of materials science, LengthUnit refers to a standard measure for length. It is a unit of measurement used to quantify the size or dimensions of materials in scientific research and experimentation. This unit helps scientists and researchers accurately describe and compare the lengths of various materials in their studies.",Information is not available.
http://ontology.dumontierlab.com/LinearDensity,Target,Class,linear density,"Linear density in materials science refers to the measure of mass per unit length of a material. It is a physical property that helps determine the amount of material present in a given length. This measurement is important in various applications such as determining the strength and flexibility of materials, as well as in the manufacturing process of fibers and wires.",Information is not available.
http://ontology.dumontierlab.com/LinearDensityUnit,Target,Class,linear density unit,"LinearDensityUnit refers to a standard measure of linear density in materials science. It is used to quantify the mass per unit length of a material, providing important information about its physical properties. This unit helps researchers and scientists accurately describe and compare the linear density of different materials in their studies and experiments.",Information is not available.
http://ontology.dumontierlab.com/LinearMolecularGeometry,Target,Class,linear molecular geometry,"Linear molecular geometry refers to the arrangement of atoms in a molecule where the atoms are aligned in a straight line. This type of geometry is characterized by having two atoms bonded to a central atom with a bond angle of 180 degrees. In materials science, understanding the molecular geometry of a material is important as it can affect the material's properties and behavior.",Information is not available.
http://ontology.dumontierlab.com/LiquidCrystalPhase,Target,Class,liquid crystal phase,"Liquid crystal phase refers to a state of matter where molecules are arranged in an ordered manner similar to a crystal, but with the ability to flow like a liquid. This phase is commonly found in certain types of materials, such as liquid crystal displays (LCDs), where the molecules align in specific orientations to exhibit unique optical properties. In materials science, studying the liquid crystal phase is important for developing new technologies and understanding the behavior of these materials.",Information is not available.
http://ontology.dumontierlab.com/LiquidPhase,Target,Class,liquid phase,"In materials science, the term ""LiquidPhase"" refers to a state of matter where a material exists in a liquid form. This means that the atoms or molecules of the material are able to move freely past each other, giving the material a fluid and shapeless quality. The liquid phase is characterized by a lack of fixed shape and volume, as the material takes the shape of its container and can flow easily. This phase is distinct from the solid phase, where the atoms or molecules are tightly packed and have a fixed shape, and the gas phase, where the atoms or molecules are spread out and move freely.",Information is not available.
http://ontology.dumontierlab.com/Lithium,Target,Class,lithium,"Lithium is a chemical element with the symbol Li and atomic number 3. In materials science, lithium is known for its low density and high electrochemical potential, making it a popular choice for use in batteries, particularly in rechargeable lithium-ion batteries. These batteries are commonly used in electronic devices such as smartphones, laptops, and electric vehicles due to their high energy density and long lifespan.",Information is not available.
http://ontology.dumontierlab.com/LithiumAtom,Target,Class,lithium atom,"The term ""Lithium Atom"" refers to a single atom of the element lithium. In materials science, lithium atoms are of particular interest due to their unique properties, such as being the lightest metal and having high reactivity. Lithium atoms are commonly used in batteries, ceramics, and other advanced materials due to their ability to store and release energy efficiently.",Information is not available.
http://ontology.dumontierlab.com/Lonsdaleite,Target,Class,lonsdaleite,"Lonsdaleite is a hexagonal allotrope of the carbon allotrope diamond. It is a rare form of carbon that is even harder than diamond. It is named after the crystallographer Kathleen Lonsdale. In materials science, lonsdaleite is studied for its unique properties and potential applications in various industries.",Information is not available.
http://ontology.dumontierlab.com/Luminance,Target,Class,luminance,"In the context of materials science, luminance refers to a measure of the density of luminous intensity in a given direction. It is a quantitative measurement that describes the brightness of a surface or material when illuminated by a light source. Luminance is an important factor to consider when studying the optical properties of materials and is often used to characterize the visual appearance of surfaces in various applications.",Information is not available.
http://ontology.dumontierlab.com/LuminanceUnit,Target,Class,luminance unit,"In materials science, LuminanceUnit refers to a standard measure for luminance. LuminanceUnit is a unit of measurement used to quantify the brightness of a surface or light source. It is a standardized unit that allows for accurate comparisons of luminance levels across different materials or light sources.",Information is not available.
http://ontology.dumontierlab.com/LuminousFlux,Target,Class,luminous flux,"Luminous flux is a measure of the perceived power of light, specifically in the field of materials science. It quantifies the total amount of visible light emitted by a light source, taking into account the sensitivity of the human eye to different wavelengths of light. In other words, luminous flux measures the brightness of light as perceived by the human eye, rather than just the total amount of light energy emitted.",Information is not available.
http://ontology.dumontierlab.com/LuminousFluxUnit,Target,Class,luminous flux unit,"In materials science, the term ""LuminousFluxUnit"" refers to a standard measure for luminous flux. Luminous flux unit is a unit of measurement used to quantify the total amount of visible light emitted by a light source. It is an important parameter in the field of materials science as it helps in understanding the brightness and intensity of light sources, which is crucial for various applications such as lighting design, optical materials, and display technologies.",Information is not available.
http://ontology.dumontierlab.com/LuminousIntensity,Target,Class,luminous intensity,"Luminous intensity is a measure of the power emitted by a light source in a specific direction. In the context of materials science, luminous intensity is important for understanding how much light is being emitted by a material or device, which can be crucial for various applications such as lighting, displays, and sensors. It helps researchers and engineers quantify the brightness of a light source and determine its effectiveness in a particular direction.",Information is not available.
http://ontology.dumontierlab.com/LuminousIntensityUnit,Target,Class,luminous intensity unit,"In materials science, the term ""LuminousIntensityUnit"" refers to a standard measure for luminous intensity. This unit is used to quantify the amount of visible light emitted by a source in a particular direction. It is an important parameter in materials science as it helps researchers and engineers understand the brightness and visibility of materials under different lighting conditions.",Information is not available.
http://ontology.dumontierlab.com/Lutetium,Target,Class,lutetium,"Lutetium is a chemical element with the symbol Lu and atomic number 71. It is a rare earth metal that is often used in materials science for its unique properties, such as its high density and resistance to corrosion. In this context, Lutetium is a valuable element for researchers and engineers working in the field of materials science.",Information is not available.
http://ontology.dumontierlab.com/LutetiumAtom,Target,Class,lutetium atom,"LutetiumAtom refers to an atom of the element lutetium, which is a rare earth metal commonly used in materials science. Lutetium is known for its high density, high melting point, and resistance to corrosion, making it valuable for various applications such as in the production of catalysts, superconductors, and nuclear reactors.",Information is not available.
http://ontology.dumontierlab.com/Magnesium,Target,Class,magnesium,"In materials science, magnesium is a chemical element with the symbol Mg and atomic number 12. It is a lightweight metal that is commonly used in various applications due to its high strength-to-weight ratio. Magnesium is known for its excellent corrosion resistance and is often used in the automotive and aerospace industries for components that require both strength and lightness.",Information is not available.
http://ontology.dumontierlab.com/MagnesiumAtom,Target,Class,magnesium atom,"In the context of materials science, a Magnesium Atom refers to a single atom of the element magnesium. Magnesium is a chemical element with the symbol Mg and atomic number 12. It is a lightweight and highly reactive metal that is commonly used in various industrial applications, including the production of alloys and as a component in structural materials. Understanding the properties and behavior of individual magnesium atoms is important for researchers in materials science to develop new materials with specific characteristics and applications.",Information is not available.
http://ontology.dumontierlab.com/MagneticFieldStrength,Target,Class,magnetic field strength,"In materials science, MagneticFieldStrength refers to the intensity of a magnetic field at a specific point. It is a measure of how strong the magnetic field is at that location. This parameter is important for understanding the behavior of materials in response to magnetic fields and for designing magnetic devices.",Information is not available.
http://ontology.dumontierlab.com/MagneticFieldStrengthUnit,Target,Class,magnetic field strength unit,"In materials science, the MagneticFieldStrengthUnit refers to a standard measure for magnetic field strength. This unit is used to quantify the intensity of a magnetic field in a given material. It helps researchers and scientists accurately describe and compare the strength of magnetic fields in different materials, allowing for more precise analysis and understanding of magnetic properties.",Information is not available.
http://ontology.dumontierlab.com/MagneticFlux,Target,Class,magnetic flux,"In materials science, magnetic flux refers to a measure of the strength and extent of a magnetic field. It is a quantity that represents the total magnetic field passing through a given area. This measurement is important in understanding the behavior of magnetic materials and their interactions with external magnetic fields.",Information is not available.
http://ontology.dumontierlab.com/MagneticFluxDensity,Target,Class,magnetic flux density,"In materials science, Magnetic Flux Density refers to a measure of the magnetic flux within a specific area that is perpendicular to the direction of magnetic flow. It quantifies the strength of the magnetic field in a given region and is typically denoted by the symbol B. Magnetic flux density is an important parameter in understanding the behavior of magnetic materials and is used in various applications such as magnetic sensors, motors, and transformers.",Information is not available.
http://ontology.dumontierlab.com/MagneticFluxDensityUnit,Target,Class,magnetic flux density unit,The MagneticFluxDensityUnit is a standard measure for magnetic flux density in materials science. It is a unit used to quantify the strength of a magnetic field within a material.,Information is not available.
http://ontology.dumontierlab.com/MagneticFluxUnit,Target,Class,magnetic flux unit,The meaning of MagneticFluxUnit in materials science is a standard measure for magnetic flux. It is a unit used to quantify the amount of magnetic flux passing through a given area.,Information is not available.
http://ontology.dumontierlab.com/Manganese,Target,Class,manganese,Manganese is a chemical element that is commonly used in materials science for its properties such as increasing the strength and hardness of steel. It is often added to alloys to improve their mechanical properties and resistance to corrosion.,Information is not available.
http://ontology.dumontierlab.com/ManganeseAtom,Target,Class,manganese atom,"In materials science, a Manganese Atom refers to an atom of the element manganese. Manganese is a chemical element with the symbol Mn and atomic number 25. It is commonly used in the production of steel and other alloys due to its ability to improve the strength and durability of materials. In its atomic form, manganese has 25 protons and typically 30 neutrons in its nucleus.",Information is not available.
http://ontology.dumontierlab.com/Mass,Target,Class,mass,"In materials science, mass refers to a measure of the amount of matter and energy present in a substance. It is a fundamental property that helps determine the behavior and characteristics of materials.",Information is not available.
http://ontology.dumontierlab.com/MassUnit,Target,Class,mass unit,"In the context of materials science, MassUnit refers to a standard measure for mass. It is a unit of measurement used to quantify the amount of matter in a substance. This term is commonly used in scientific research and experimentation to accurately describe the mass of materials being studied.",Information is not available.
http://ontology.dumontierlab.com/MeasuredProperty,Target,Class,measured property,"In materials science, a MeasuredProperty refers to a specific quality of a material that can be quantitatively determined through testing or analysis. This could include properties such as density, hardness, conductivity, or tensile strength. These properties are essential for understanding the behavior and characteristics of materials in various applications.",Information is not available.
http://ontology.dumontierlab.com/MegaScaledUnit,Target,Class,mega scaled unit,"In the context of materials science, a MegaScaledUnit refers to a unit that has been scaled by a factor of 10^6. This means that the unit is one million times larger than the original unit. This term is often used to describe measurements or quantities that are extremely large in scale within the field of materials science.",Information is not available.
http://ontology.dumontierlab.com/Meitnerium,Target,Class,meitnerium,"Meitnerium is a synthetic element with the atomic number 109 and symbol Mt. It was named after Lise Meitner, an Austrian physicist who made significant contributions to the field of nuclear physics. Meitnerium is a highly radioactive element that is not found naturally and is only produced in laboratories through nuclear reactions. In materials science, Meitnerium is studied for its properties and behavior in various environments, contributing to our understanding of the periodic table and the behavior of heavy elements.",Information is not available.
http://ontology.dumontierlab.com/MeitneriumAtom,Target,Class,meitnerium atom,"Meitnerium is a synthetic element with the atomic number 109 and the symbol Mt. Meitnerium atoms refer to atoms of this element. Meitnerium is a highly radioactive element that is not found naturally and must be synthesized in a laboratory. It is named after Lise Meitner, a physicist who made significant contributions to the field of nuclear physics. In materials science, the study of Meitnerium atoms may involve investigating their properties, behavior, and potential applications in various materials and technologies.",Information is not available.
http://ontology.dumontierlab.com/Mendelevium,Target,Class,mendelevium,"Mendelevium is a synthetic element with the atomic number 101 and symbol Md. It was named after Dmitri Mendeleev, the Russian chemist who is known for creating the periodic table of elements. In materials science, Mendelevium is used in research and studies related to nuclear chemistry and the properties of heavy elements.",Information is not available.
