entity,source_or_target,entity_type,syntactic_matching,lexical_matching,graphical_matching
http://ontology.dumontierlab.com/SodiumAtom,Target,Class,sodium atom,"In the context of materials science, a Sodium Atom refers to a single atom of the element sodium. Sodium is a chemical element with the symbol Na and atomic number 11. It is a highly reactive metal that is commonly found in compounds such as table salt (sodium chloride). Sodium atoms have 11 protons and typically 12 neutrons in their nucleus, giving them a total atomic mass of around 23 atomic mass units. Sodium atoms are important in materials science as they can participate in various chemical reactions and form different compounds with other elements.",Information is not available.
http://ontology.dumontierlab.com/SolidAngle,Target,Class,solid angle,"In materials science, the term Solid Angle refers to a measure of the angle formed by three or more planes intersecting at a common point. It is a concept used to describe the amount of space or solid angle that a particular object or material occupies in three-dimensional space. The solid angle is important in materials science as it helps in understanding the arrangement and orientation of atoms or molecules within a material, which in turn affects its properties and behavior.",Information is not available.
http://ontology.dumontierlab.com/SolidAngleUnit,Target,Class,solid angle unit,SolidAngleUnit is a standard measure for solid angle in materials science. It is a unit used to quantify the amount of space an object takes up in three-dimensional space. This unit helps researchers and scientists accurately measure and compare solid angles in various materials and structures.,Information is not available.
http://ontology.dumontierlab.com/SolidPhase,Target,Class,solid phase,"In materials science, the term ""SolidPhase"" refers to the state of matter in which a material exists as a solid. This means that the atoms or molecules in the material are closely packed together in a fixed arrangement, giving the material a definite shape and volume. The solid phase is characterized by strong intermolecular forces that hold the particles together in a rigid structure. This phase is distinct from the liquid and gas phases, where the particles are more loosely packed and have more freedom of movement.",Information is not available.
http://ontology.dumontierlab.com/Solute,Target,Class,solute,"In materials science, a solute refers to a substance that is capable of dissolving in a solvent. This means that the solute can be mixed into the solvent to create a solution.",Information is not available.
http://ontology.dumontierlab.com/Solution,Target,Class,solution,"In the context of materials science, a solution refers to a homogeneous mixture where one or more substances, called solutes, are dissolved in another substance, known as a solvent. This means that the solutes are evenly distributed throughout the solvent, creating a uniform mixture.",Information is not available.
http://ontology.dumontierlab.com/Solvent,Target,Class,solvent,"In the context of materials science, a solvent is a substance that has the ability to dissolve other substances, resulting in the formation of a solution.",Information is not available.
http://ontology.dumontierlab.com/Source,Target,Class,source,"In the context of materials science, the term ""source"" refers to the origin of a particular resource or information. This could include where a specific material was obtained from, or where data or research findings were gathered from. The source is crucial in understanding the reliability and credibility of the information being presented.",Information is not available.
http://ontology.dumontierlab.com/SpecificEnergy,Target,Class,specific energy,"Specific energy in the context of materials science refers to the amount of energy stored in a material per unit mass. It is a measure of the energy density of a material, indicating how much energy can be extracted from or stored in a given amount of that material. Specific energy is important in various applications, such as in the design of batteries, fuel cells, and other energy storage systems. By understanding the specific energy of different materials, scientists and engineers can optimize the performance and efficiency of these technologies.",Information is not available.
http://ontology.dumontierlab.com/SpecificEnergyUnit,Target,Class,specific energy unit,"In the context of materials science, the term ""SpecificEnergyUnit"" refers to a standard measure for specific energy. This unit is used to quantify the amount of energy stored in a material per unit mass or volume. It provides a standardized way to compare the energy content of different materials, making it a valuable tool for researchers and engineers working in the field of materials science.",Information is not available.
http://ontology.dumontierlab.com/SpecificEntropy,Target,Class,specific entropy,"Specific entropy is a measure of the entropy of a specific mass of a system in the field of materials science. It quantifies the amount of disorder or randomness within that mass, providing insight into the system's thermodynamic properties.",Information is not available.
http://ontology.dumontierlab.com/SpecificEntropyUnit,Target,Class,specific entropy unit,"SpecificEntropyUnit refers to a standard measure used in materials science to quantify specific entropy. It is a unit of measurement that allows scientists and researchers to accurately compare and analyze the entropy of different materials. By using specific entropy units, they can better understand the thermodynamic properties and behavior of materials under various conditions.",Information is not available.
http://ontology.dumontierlab.com/SpecificVolume,Target,Class,specific volume,"Specific volume is a measure of the volume occupied by a unit of mass of a material. In the context of materials science, specific volume is an important property that helps determine the density and compressibility of a material. It is calculated by dividing the volume of a substance by its mass, and is typically expressed in units such as cubic meters per kilogram. By understanding the specific volume of a material, scientists and engineers can better analyze its physical properties and behavior under different conditions.",Information is not available.
http://ontology.dumontierlab.com/SpecificVolumeUnit,Target,Class,specific volume unit,"In the context of materials science, the term 'SpecificVolumeUnit' refers to a standard measure used to quantify specific volume. Specific volume is a property of a material that represents the volume occupied by a unit mass of the substance. The specific volume unit provides a standardized way to express this measurement in order to compare and analyze different materials.",Information is not available.
http://ontology.dumontierlab.com/SquarePlanarMolecularGeometry,Target,Class,square planar molecular geometry,Square planar molecular geometry refers to a specific arrangement of atoms in a molecule where the atoms are positioned in a square shape around a central atom. This geometry is commonly observed in certain materials used in materials science.,Information is not available.
http://ontology.dumontierlab.com/SquarePyramidalMolecularGeometry,Target,Class,square pyramidal molecular geometry,"Square pyramidal molecular geometry refers to a molecular arrangement where there are four bonded atoms and two lone electron pairs around a central atom. This geometry is similar to an octahedral shape, but with one of the bonded atoms replaced by a lone pair of electrons, resulting in a square pyramid-like structure. In materials science, understanding the molecular geometry of compounds is important for predicting their physical and chemical properties.",Information is not available.
http://ontology.dumontierlab.com/StaggeredConformation,Target,Class,staggered conformation,"In materials science, a staggered conformation refers to a specific arrangement of atoms in a chemical bond. This conformation occurs when two sp3 hybridized atoms are connected by a single bond in an open chain molecule. It is considered a conformational energy minimum, meaning it is a stable arrangement of atoms with the lowest energy compared to other possible conformations.",Information is not available.
http://ontology.dumontierlab.com/StereoBond,Target,Class,stereo bond,"In materials science, a StereoBond refers to a type of bond in which atoms are located either below or above the plane of drawing. This type of bond is important for understanding the three-dimensional structure of molecules and materials, as it affects their properties and behavior. StereoBonds play a crucial role in determining the overall shape and arrangement of atoms within a molecule, which in turn influences its chemical and physical properties.",Information is not available.
http://ontology.dumontierlab.com/StereoHashBond,Target,Class,stereo hash bond,"In materials science, a StereoHashBond refers to a stereo bond where an atom is positioned below the plane of drawing. This term is used to describe the three-dimensional arrangement of atoms in a molecule, particularly in the context of materials science research.",Information is not available.
http://ontology.dumontierlab.com/StereoWedgeBond,Target,Class,stereo wedge bond,"In materials science, StereoWedgeBond refers to a type of stereo bond where an atom is positioned above the plane of drawing. This term is used to describe the orientation of atoms in a molecule or material, specifically when one atom is depicted as being higher than the surrounding atoms in a structural diagram. This type of bond is important for understanding the three-dimensional arrangement of atoms in a molecule, which can impact the properties and behavior of the material.",Information is not available.
http://ontology.dumontierlab.com/Stereoisomer,Target,Class,stereoisomer,"In materials science, a stereoisomer is an isomer that has the same atomic connectivity as another molecule, but differs in the spatial arrangement of its atoms. This difference in spatial arrangement can result in different physical and chemical properties, making stereoisomers important in understanding the behavior of materials at the molecular level.",Information is not available.
http://ontology.dumontierlab.com/StrangeMatterPhase,Target,Class,strange matter phase,"In materials science, the term ""StrangeMatterPhase"" refers to a hypothetical phase of matter that is composed of strange quarks. Strange quarks are a type of elementary particle that is heavier and more unstable than the up and down quarks that make up ordinary matter. The existence of strange matter phase is still a topic of theoretical research and has not been observed in nature. It is believed that strange matter phase could have unique properties and could potentially be more stable than ordinary matter under extreme conditions such as high pressure or temperature.",Information is not available.
http://ontology.dumontierlab.com/Strontium,Target,Class,strontium,"Strontium is a chemical element with the symbol Sr and atomic number 38. In materials science, strontium is often used as a dopant in various materials to modify their properties. For example, strontium can be added to ceramics to improve their mechanical strength or to semiconductors to enhance their electrical conductivity. Overall, strontium plays a significant role in the field of materials science by enabling the customization and enhancement of material properties for various applications.",Information is not available.
http://ontology.dumontierlab.com/StrontiumAtom,Target,Class,strontium atom,"In materials science, a Strontium Atom refers to an atom of the element strontium, which is a chemical element with the symbol Sr and atomic number 38. Strontium atoms have 38 protons and typically 38 neutrons in their nucleus. Strontium is commonly used in various applications, such as in the production of ferrite magnets, pyrotechnics, and in the medical field for its radioactive isotopes.",Information is not available.
http://ontology.dumontierlab.com/StructuralIsomer,Target,Class,structural isomer,"In materials science, a structural isomer refers to a type of isomer where the atoms are connected in different arrangements. This means that while the chemical formula may be the same, the actual structure of the molecule is different. This can have significant implications for the properties and behavior of the material.",Information is not available.
http://ontology.dumontierlab.com/Substrate,Target,Class,substrate,"In materials science, the term ""substrate"" refers to a reactant that is consumed or changed in a chemical reaction. It is the material on which a process or reaction takes place, serving as the foundation or base for further reactions or applications.",Information is not available.
http://ontology.dumontierlab.com/SulfinicAcidGeneralGroup,Target,Class,sulfinic acid general group,"The term ""SulfinicAcidGeneralGroup"" refers to a general functional group in materials science that consists of a sulfinic acid group. Sulfinic acid is a compound containing a sulfur atom bonded to two oxygen atoms and a hydrogen atom. This functional group is important in various chemical reactions and can be found in certain materials with specific properties.",Information is not available.
http://ontology.dumontierlab.com/SulfonicAcidDerivativeGroup,Target,Class,sulfonic acid derivative group,"In materials science, a sulfonic acid derivative group refers to a functional group that is derived from sulfonic acid. This group typically contains a sulfur atom bonded to three oxygen atoms and a carbon atom. Sulfonic acid derivative groups are commonly used in the synthesis of various materials, such as polymers, surfactants, and catalysts, due to their strong acidity and ability to enhance the properties of the resulting materials.",Information is not available.
http://ontology.dumontierlab.com/SulfonicAcidGroup,Target,Class,sulfonic acid group,"In materials science, a sulfonic acid group refers to a functional group containing a sulfur atom bonded to three oxygen atoms and a hydrogen atom. This group is commonly found in sulfonic acids, which are strong acids with a sulfonic acid group attached to an organic molecule. Sulfonic acids are widely used in various industries, including as catalysts, surfactants, and ion exchange resins.",Information is not available.
http://ontology.dumontierlab.com/SulfonylHalideGroup,Target,Class,sulfonyl halide group,"In materials science, a sulfonyl halide group refers to a functional group that contains a sulfur atom bonded to two oxygen atoms and a halogen atom (such as chlorine, bromine, or iodine). This group is commonly used in the synthesis of various materials and compounds due to its reactivity and ability to participate in a wide range of chemical reactions.",Information is not available.
http://ontology.dumontierlab.com/SulfoxideGroup,Target,Class,sulfoxide group,"In materials science, a sulfoxide group refers to a functional group containing a sulfur atom bonded to an oxygen atom and two organic substituents. Sulfoxides are commonly used as solvents, reagents, and intermediates in organic synthesis. They are known for their ability to act as chiral auxiliaries and can participate in various chemical reactions due to the polar nature of the sulfur-oxygen bond.",Information is not available.
http://ontology.dumontierlab.com/Sulfur,Target,Class,sulfur,"Sulfur is a chemical element with the symbol S and atomic number 16. In materials science, sulfur can be used as a component in various materials and compounds, such as sulfur concrete, sulfur dyes, and sulfur polymers. Sulfur is known for its distinctive yellow color and strong odor.",Information is not available.
http://ontology.dumontierlab.com/SulfurAtom,Target,Class,sulfur atom,"In materials science, a Sulfur Atom refers to an atom of the element sulfur. Sulfur is a chemical element with the symbol S and atomic number 16. It is commonly used in various materials science applications, such as in the production of sulfuric acid, rubber vulcanization, and as a component in certain types of batteries. Understanding the properties and behavior of sulfur atoms is important in the study and development of materials with specific characteristics and functionalities.",Information is not available.
http://ontology.dumontierlab.com/SuperFluidPhase,Target,Class,super fluid phase,"In materials science, the term ""SuperFluidPhase"" refers to a state of matter where a substance exhibits zero viscosity and flows without any resistance. This phenomenon is typically observed in certain liquids and gases at extremely low temperatures, where quantum effects dominate. The superfluid phase is characterized by unique properties such as the ability to flow through extremely small spaces and climb up walls against gravity.",Information is not available.
http://ontology.dumontierlab.com/SuperSolidPhase,Target,Class,super solid phase,"In materials science, the term ""SuperSolidPhase"" refers to a state of matter that exhibits both solid and superfluid properties. This unique phase of matter is characterized by its ability to flow without any viscosity, similar to a superfluid, while also maintaining a rigid, solid-like structure. This phenomenon is still being studied and researched to better understand its properties and potential applications in various fields.",Information is not available.
http://ontology.dumontierlab.com/SurfaceTension,Target,Class,surface tension,Surface tension is a measure of the attraction between molecules at the surface of a liquid. It is a property of materials that is studied in the field of materials science.,Information is not available.
http://ontology.dumontierlab.com/SurfaceTensionUnit,Target,Class,surface tension unit,SurfaceTensionUnit refers to a standard measure used in materials science to quantify surface tension. It is a unit of measurement that helps researchers and scientists accurately describe and compare the surface tension of different materials.,Information is not available.
http://ontology.dumontierlab.com/SynConformation,Target,Class,syn conformation,"In materials science, the term SynConformation refers to a specific chemical conformation where the torsion angle falls between -90 and 90 degrees. This conformation is characterized by the alignment of certain atoms or groups in a molecule in a specific orientation.",Information is not available.
http://ontology.dumontierlab.com/SynperiplanarConformation,Target,Class,synperiplanar conformation,"In materials science, a synperiplanar conformation refers to a specific chemical conformation where the torsion angle is between 0 to 30 degrees. This conformation is important in understanding the structure and properties of materials at the molecular level.",Information is not available.
http://ontology.dumontierlab.com/SynthesisReaction,Target,Class,synthesis reaction,"In materials science, a Synthesis Reaction refers to an inorganic reaction where two or more reagents are combined and chemically bonded together to create a single product. This type of reaction is commonly used to create new materials with specific properties or characteristics.",Information is not available.
http://ontology.dumontierlab.com/SystematicName,Target,Class,systematic name,"In materials science, the term Systematic Name refers to a unique identifier given to a specific entity, such as a chemical compound or material. This name is used to distinguish the entity from others and provide a standardized way of referring to it within the field. It helps researchers and scientists easily identify and communicate about different materials or compounds in a systematic manner.",Information is not available.
http://ontology.dumontierlab.com/Tantalum,Target,Class,tantalum,"Tantalum is a chemical element with the symbol Ta and atomic number 73. It is a rare, hard, blue-gray, lustrous transition metal that is highly corrosion-resistant. In materials science, tantalum is often used in the production of capacitors, high-temperature alloys, and other high-tech applications due to its excellent properties.",Information is not available.
http://ontology.dumontierlab.com/TantalumAtom,Target,Class,tantalum atom,"In the context of materials science, a Tantalum Atom refers to an atom of the element tantalum. Tantalum is a rare, hard, blue-gray, lustrous transition metal that is highly corrosion-resistant. It is often used in the production of electronic components, such as capacitors and high-power resistors, due to its ability to form stable oxide layers. Tantalum atoms have 73 protons and 73 electrons in their atomic structure.",Information is not available.
http://ontology.dumontierlab.com/TautomerCount,Target,Class,tautomer count,"In the context of materials science, TautomerCount refers to the count of the number of tautomers present in a molecule. Tautomers are structural isomers of a molecule that can rapidly interconvert by a chemical reaction called tautomerization. Therefore, TautomerCount is a measure of the different possible forms a molecule can exist in due to tautomerization.",Information is not available.
http://ontology.dumontierlab.com/Technetium,Target,Class,technetium,"Technetium is a chemical element with the symbol Tc and atomic number 43. It is a silvery-gray metal that is commonly used in materials science for various applications, such as in nuclear medicine and as a catalyst in chemical reactions. The name ""Technetium"" comes from the Greek word ""technetos,"" meaning ""artificial,"" as it was the first element to be artificially produced.",Information is not available.
http://ontology.dumontierlab.com/TechnetiumAtom,Target,Class,technetium atom,"The Technetium Atom refers to an atom of the element technetium, which is a synthetic element with the atomic number 43. Technetium is commonly used in materials science for various applications, such as in nuclear medicine, catalysts, and corrosion-resistant alloys. The Technetium Atom plays a crucial role in understanding the properties and behavior of technetium-based materials in different scientific and industrial settings.",Information is not available.
http://ontology.dumontierlab.com/Tellurium,Target,Class,tellurium,"Tellurium is a chemical element with the symbol Te and atomic number 52. In materials science, tellurium is often used in the production of semiconductors, thermoelectric materials, and in the manufacturing of certain types of glass and ceramics. It is a brittle, silver-white metalloid that is commonly found in combination with gold and other metals. Tellurium has unique properties that make it valuable in various industrial applications.",Information is not available.
http://ontology.dumontierlab.com/TelluriumAtom,Target,Class,tellurium atom,"In materials science, a Tellurium Atom refers to an atom of the element tellurium. Tellurium is a rare metalloid element with the atomic number 52 and symbol Te. It is often used in various applications such as in the production of semiconductors, alloys, and as a component in certain types of solar panels. The Tellurium Atom plays a crucial role in the properties and behavior of materials in which it is present.",Information is not available.
http://ontology.dumontierlab.com/Temperature,Target,Class,temperature,"Temperature is a measure of the average kinetic energy of particles in a sample of matter. In materials science, temperature is an important factor that affects the behavior and properties of materials. By understanding the temperature of a material, scientists can predict how it will respond to different conditions and make informed decisions about its use in various applications.",Information is not available.
http://ontology.dumontierlab.com/TemperatureUnit,Target,Class,temperature unit,"TemperatureUnit refers to a standard measure used in materials science to quantify temperature. It is a unit of measurement specifically designed for temperature, allowing scientists and researchers to accurately and consistently measure and compare temperatures in their experiments and studies.",Information is not available.
http://ontology.dumontierlab.com/TeraScaledUnit,Target,Class,tera scaled unit,"In the context of materials science, a TeraScaledUnit refers to a unit that has been scaled by a factor of 10^12. This means that the quantity being measured is 1 trillion times larger than the base unit. This term is used to describe extremely large quantities or measurements in the field of materials science.",Information is not available.
http://ontology.dumontierlab.com/Terbium,Target,Class,terbium,"Terbium is a chemical element with the symbol Tb and atomic number 65. It is a rare earth metal that is often used in materials science for its unique magnetic and optical properties. Terbium is commonly found in phosphors, which are materials that emit light when exposed to certain stimuli. In materials science, terbium is used in various applications such as in electronic devices, lasers, and fluorescent lamps.",Information is not available.
http://ontology.dumontierlab.com/TerbiumAtom,Target,Class,terbium atom,"TerbiumAtom refers to a single atom of the element terbium. Terbium is a rare earth metal commonly used in materials science for its unique magnetic and optical properties. By studying the behavior of a TerbiumAtom, researchers can gain insights into the characteristics and potential applications of terbium-based materials.",Information is not available.
