entity,source_or_target,entity_type,initial_matching,lexical_matching,graphical_matching
target:OperatingTopicsystems,Target,Class,Operating Topic Systems,Operating Topic Systems refers to the various topics or themes that are being discussed or presented at a conference. These topics can range from specific industry trends and developments to broader issues and challenges facing a particular field or sector. Conference organizers often categorize presentations and sessions based on these operating topics to help attendees navigate the event and choose sessions that are most relevant to their interests and needs.,Operating Topic systems disjoint with CAD Topic. Operating Topic systems disjoint with Performance Topic. Operating Topic systems disjoint with Microelectronics Topic. Operating Topic systems disjoint with Parallel And Distributed Computing Topic. Operating Topic systems disjoint with Computer Architecture Topic. Operating Topic systems disjoint with Mobile Computing Topic. Operating Topic systems disjoint with Communications Topic. Operating Topic systems disjoint with Computer Networks Topic. Operating Topic systems disjoint with Cryptography Topic. Operating Topic systems disjoint with Wireless Communications Topic. Operating Topic systems disjoint with Signal Processing Topic. Operating Topic systems disjoint with Test Only Topic. Operating Topic systems disjoint with Antennas Topic. Operating Topic systems disjoint with Powerline Transmission Topic. Operating Topic systems disjoint with Radio Communications Topic. Operating Topic systems disjoint with Communication Theory Topic. Operating Topic systems disjoint with Multimedia Topic. Operating Topic systems disjoint with Security Topic. Operating Topic systems disjoint with Satellite and Space Communications Topic. Operating Topic systems disjoint with Medicine Topic. OperatingTopicsystems subClassOf Topic. Parallel and Distributed Computing Topic disjoint with Operating System Topics. Computer Networks Topic disjoint with Operating System. Communication Theory Topic disjoint with Operating Topic systems. Security Topic disjoint with Operating Topic systems. Wireless Communications Topic disjoint with Operating System. Medicine topic disjoint with operating topic systems. Antennas topic disjoint with operating topic systems. Performance topic disjoint with operating topic systems. Communications topic disjoint with operating topic systems. Signal Processing Topic disjoint with Operating Topic systems. Mobile Computing Topic disjoint with Operating System. CADTopic is disjoint with OperatingTopicsystems. Computer Architecture Topic disjoint with Operating System. Multimedia Topic disjoint with Operating Topic systems. Satellite and space communications topic disjoint with operating topic systems. Cryptography topic is disjoint with operating system topics. Microelectronics topic disjoint with operating topic systems. Powerline Transmission Topic disjoint with Operating Topic systems. Test Only Topic disjoint with Operating Topic systems. Radio Communications Topic disjoint with Operating Topic systems.
target:ComputerNetworksTopic,Target,Class,Computer Networks Topic,"ComputerNetworksTopic refers to the specific subject or theme that is being discussed or presented at a conference related to computer networks. This could include topics such as network security, data communication protocols, network design and implementation, wireless networking, and other related subjects. Presentations, discussions, and workshops at the conference would focus on various aspects of computer networks within the chosen topic.",Computer Networks Topic disjoint with Antennas Topic. Computer Networks Topic disjoint with Radio Communications Topic. Computer Networks Topic disjoint with Test Only Topic. Computer Networks Topic disjoint with Performance Topic. Computer Networks Topic is disjoint with Communication Theory Topic. Computer Networks Topic disjoint with Satellite and Space Communications Topic. Computer Networks Topic disjoint with Wireless Communications Topic. Computer Networks Topic disjoint with Cryptography Topic. Computer Networks Topic disjoint with Signal Processing Topic. Computer Networks Topic disjoint with Microelectronics Topic. Computer Networks Topic disjoint with Multimedia Topic. Computer Networks Topic disjoint with Powerline Transmission Topic. Computer Networks Topic disjoint with Medicine Topic. Computer Networks Topic disjoint with Security Topic. Computer Networks Topic disjoint with Communications Topic. Computer Networks Topic disjoint with Parallel and Distributed Computing Topic. Computer Networks Topic disjoint with Computer Architecture Topic. Computer Networks Topic disjoint with Operating System. Computer Networks Topic disjoint with CAD Topic. Computer Networks Topic disjoint with Mobile Computing Topic. Computer Networks Topic is a subclass of Topic. Parallel and Distributed Computing Topic disjoint with Computer Networks Topic. Communication Theory Topic disjoint with Computer Networks Topic. Computer Networks Enterprise Topic is a subclass of Computer Networks Topic. Security Topic disjoint with Computer Networks Topic. Wireless Communications Topic disjoint with Computer Networks Topic. Medicine topic disjoint with computer networks topic. Antennas topic disjoint with computer networks topic. Performance topic is disjoint with computer networks topic. Communications Topic disjoint with Computer Networks Topic. Signal Processing Topic disjoint with Computer Networks Topic. Mobile Computing Topic is disjoint with Computer Networks Topic. Computer Networks Optical Topic is a subclass of Computer Networks Topic. Computer Networks Measurements Topic is a subclass of Computer Networks Topic. Computer Networks Management Topic is a subclass of Computer Networks Topic. CADTopic is disjoint with ComputerNetworksTopic. Computer Networks Switching Topic is a subclass of Computer Networks Topic. Operating Topic systems disjoint with Computer Networks Topic. Computer Networks Sensor Topic is a subclass of Computer Networks Topic. Computer Architecture Topic is disjoint with Computer Networks Topic. MultimediaTopic disjointWith ComputerNetworksTopic. Computer Networks Security Topic is a subclass of Computer Networks Topic. Computer Networks Applications Topic is a subclass of Computer Networks Topic. Satellite and Space Communications Topic disjoint with Computer Networks Topic. Cryptography topic is disjoint with Computer Networks topic. Microelectronics topic disjoint with Computer Networks topic. Powerline Transmission Topic disjoint with Computer Networks Topic. Test Only Topic disjoint with Computer Networks Topic. Radio Communications Topic disjoint with Computer Networks Topic.
target:SatelliteAndSpaceCommunicationsTopic,Target,Class,Satellite And Space Communications Topic,"Satellite and Space Communications Topic refers to a specific area of discussion or presentation within a conference that focuses on the use of satellites and space technology for communication purposes. This topic may cover various aspects such as satellite communication systems, space-based internet services, satellite broadcasting, remote sensing, and other related technologies and applications. Participants in this topic may discuss the latest developments, challenges, and opportunities in the field of satellite and space communications.",Satellite and Space Communications Topic disjoint with Antennas Topic. Satellite and Space Communications Topic disjoint with Test Only Topic. Satellite and Space Communications Topic disjoint with Computer Architecture Topic. Satellite and Space Communications Topic disjoint with Security Topic. Satellite and Space Communications Topic disjoint with Computer Networks Topic. Satellite and Space Communications Topic disjoint with Radio Communications Topic. Satellite and Space Communications Topic disjoint with Performance Topic. Satellite and Space Communications Topic disjoint with Medicine Topic. Satellite and Space Communications Topic disjoint with Mobile Computing Topic. Satellite and Space Communications Topic disjoint with Microelectronics Topic. Satellite and Space Communications Topic disjoint with Powerline Transmission Topic. Satellite and Space Communications Topic disjoint with Operating Topic systems. Satellite and space communications topic disjoint with wireless communications topic. Satellite and Space Communications Topic disjoint with Communication Theory Topic. Satellite and Space Communications Topic disjoint with CAD Topic. Satellite and Space Communications Topic disjoint with Parallel and Distributed Computing Topic. Satellite and Space Communications Topic disjoint with Cryptography Topic. Satellite and Space Communications Topic disjoint with Signal Processing Topic. Satellite and Space Communications Topic disjoint with Multimedia Topic. Satellite and Space Communications Topic disjoint with Communications Topic. Satellite and Space Communications Topic is a subclass of Topic. Parallel and Distributed Computing Topic disjoint with Satellite and Space Communications Topic. Computer Networks Topic disjoint with Satellite and Space Communications Topic. Communication Theory Topic disjoint with Satellite and Space Communications Topic. Security Topic disjoint with Satellite and Space Communications Topic. Wireless Communications Topic disjoint with Satellite and Space Communications Topic. Medicine topic disjoint with satellite and space communications topic. Antennas topic disjoint with Satellite and Space Communications topic. Performance topic disjoint with Satellite and Space Communications topic. Communications Topic disjoint with Satellite and Space Communications Topic. Signal Processing Topic is disjoint with Satellite and Space Communications Topic. Mobile Computing Topic is disjoint with Satellite and Space Communications Topic. CADTopic is disjoint with SatelliteAndSpaceCommunicationsTopic. Operating Topic systems disjoint with Satellite and Space Communications Topic. Computer Architecture Topic disjoint with Satellite and Space Communications Topic. Multimedia Topic disjoint with Satellite And Space Communications Topic. Cryptography topic disjoint with Satellite and Space Communications topic. Microelectronics topic disjoint with satellite and space communications topic. Powerline Transmission Topic disjoint with Satellite and Space Communications Topic. Test Only Topic disjoint with Satellite and Space Communications Topic. Radio Communications Topic disjoint with Satellite and Space Communications Topic.
target:CADTopic,Target,Class,CAD Topic,"CADTopic refers to the specific subject or theme that is being discussed or presented at a conference related to Computer-Aided Design (CAD). This could include topics such as new software developments, best practices in CAD design, case studies, or emerging trends in the field. The CADTopic helps to focus the discussions and presentations at the conference and provides attendees with a clear idea of what to expect.",CADTopic is disjoint with MultimediaTopic. CADTopic is disjoint with ParallelAndDistributedComputingTopic. CADTopic is disjoint with CommunicationsTopic. CADTopic is disjoint with PerformanceTopic. CADTopic is disjoint with MedicineTopic. CADTopic is disjoint with CommunicationTheoryTopic. CADTopic is disjoint with SignalProcessingTopic. CADTopic disjointWith OperatingTopicsystems. CADTopic is disjoint with AntennasTopic. CADTopic is disjoint with RadioCommunicationsTopic. CADTopic disjointWith TestOnlyTopic. CADTopic is disjoint with MobileComputingTopic. CADTopic is disjoint with ComputerNetworksTopic. CADTopic is disjoint with ComputerArchitectureTopic. CADTopic is disjoint with MicroelectronicsTopic. CADTopic is disjoint with PowerlineTransmissionTopic. CADTopic disjointWith SatelliteAndSpaceCommunicationsTopic. CADTopic is disjoint with SecurityTopic. CADTopic is disjoint with WirelessCommunicationsTopic. CADTopic is disjoint with CryptographyTopic. CADTopic is a subclass of Topic. Parallel and Distributed Computing Topic disjoint with CAD Topic. Computer Networks Topic disjoint with CAD Topic. Communication Theory Topic disjoint with CAD Topic. SecurityTopic disjointWith CADTopic. Wireless Communications Topic disjoint with CAD Topic. MedicineTopic is disjoint with CADTopic. AntennasTopic disjointWith CADTopic. Performance Topic disjoint with CAD Topic. Communications Topic disjoint with CAD Topic. Signal Processing Topic disjoint with CAD Topic. Mobile Computing Topic disjoint with CAD Topic. Operating Topic systems disjoint with CAD Topic. Computer Architecture Topic disjoint with CAD Topic. MultimediaTopic disjointWith CADTopic. Satellite and Space Communications Topic disjoint with CAD Topic. CryptographyTopic disjointWith CADTopic. Microelectronics topic disjoint with CAD topic. Powerline Transmission Topic is disjoint with CAD Topic. Test Only Topic is disjoint with CAD Topic. Radio Communications Topic disjoint with CAD Topic.
target:MultimediaTopic,Target,Class,Multimedia Topic,"MultimediaTopic refers to a specific subject or theme within the field of multimedia that is being discussed or presented at a conference. This could include topics such as digital media, interactive technology, virtual reality, animation, video production, and more. Presentations, workshops, and discussions at the conference would focus on various aspects of this MultimediaTopic.",MultimediaTopic disjointWith MicroelectronicsTopic. MultimediaTopic disjointWith SecurityTopic. MultimediaTopic disjointWith CryptographyTopic. Multimedia Topic disjoint with Communication Theory Topic. Multimedia Topic disjoint with Radio Communications Topic. MultimediaTopic disjointWith TestOnlyTopic. MultimediaTopic disjointWith ComputerNetworksTopic. Multimedia Topic disjoint with Operating Topic systems. Multimedia Topic disjoint with Signal Processing Topic. MultimediaTopic disjointWith AntennasTopic. MultimediaTopic disjointWith CADTopic. MultimediaTopic disjointWith ComputerArchitectureTopic. MultimediaTopic is disjoint with CommunicationsTopic. Multimedia Topic disjoint with Wireless Communications Topic. Multimedia Topic disjoint with Powerline Transmission Topic. Multimedia Topic disjoint with Satellite And Space Communications Topic. MultimediaTopic disjointWith MedicineTopic. Multimedia Topic disjoint with Parallel And Distributed Computing Topic. MultimediaTopic disjointWith PerformanceTopic. MultimediaTopic disjointWith MobileComputingTopic. MultimediaTopic is a subclass of Topic. Parallel and Distributed Computing Topic disjoint with Multimedia Topic. Computer Networks Topic disjoint with Multimedia Topic. Communication Theory Topic is disjoint with Multimedia Topic. Security Topic disjoint with Multimedia Topic. Wireless Communications Topic disjoint with Multimedia Topic. MedicineTopic is disjoint with MultimediaTopic. AntennasTopic disjointWith MultimediaTopic. PerformanceTopic is disjoint with MultimediaTopic. CommunicationsTopic disjointWith MultimediaTopic. Signal Processing Topic disjoint with Multimedia Topic. Mobile Computing Topic is disjoint with Multimedia Topic. CADTopic is disjoint with MultimediaTopic. Operating Topic systems disjoint with Multimedia Topic. Computer Architecture Topic disjoint with Multimedia Topic. Satellite and Space Communications Topic disjoint with Multimedia Topic. CryptographyTopic disjointWith MultimediaTopic. Microelectronics topic disjoint with Multimedia topic. Powerline Transmission Topic disjoint with Multimedia Topic. Test Only Topic disjoint with Multimedia Topic. Radio Communications Topic disjoint with Multimedia Topic.
target:CommunicationsTopic,Target,Class,Communications Topic,"CommunicationsTopic refers to the specific subject or theme that is being discussed or presented at a conference related to communication. This could include topics such as public relations, marketing, social media, journalism, advertising, or any other aspect of communication. Presentations, panels, and discussions at the conference would focus on this particular topic.",Communications Topic disjoint with Performance Topic. Communications Topic disjoint with CAD Topic. Communications Topic disjoint with Radio Communications Topic. Communications Topic disjoint with Antennas Topic. Communications Topic disjoint with Satellite and Space Communications Topic. Communications topic disjoint with operating topic systems. Communications Topic disjoint with Computer Architecture Topic. Communications topic disjoint with parallel and distributed computing topic. Communications Topic disjoint with Wireless Communications Topic. Communications Topic disjoint with Test Only Topic. CommunicationsTopic disjointWith MicroelectronicsTopic. CommunicationsTopic disjointWith CryptographyTopic. CommunicationsTopic disjoint with MedicineTopic. CommunicationsTopic disjointWith MultimediaTopic. Communications Topic disjoint with Powerline Transmission Topic. Communications Topic disjoint with Communication Theory Topic. Communications Topic disjoint with Computer Networks Topic. Communications Topic disjoint with Signal Processing Topic. Communications Topic disjoint with Mobile Computing Topic. CommunicationsTopic disjointWith SecurityTopic. CommunicationsTopic is a subclass of Topic. Parallel and Distributed Computing Topic disjoint with Communications Topic. Computer Networks Topic disjoint with Communications Topic. Communication Theory Topic disjoint with Communications Topic. SecurityTopic disjointWith CommunicationsTopic. Wireless Communications Topic disjoint with Communications Topic. MedicineTopic disjointWith CommunicationsTopic. AntennasTopic disjointWith CommunicationsTopic. Performance Topic disjoint with Communications Topic. Signal Processing disjoint with Communications Topic. Mobile Computing Topic is disjoint with Communications Topic. CADTopic is disjoint with CommunicationsTopic. Operating Topic systems disjoint with Communications Topic. Computer Architecture Topic disjoint with Communications Topic. MultimediaTopic is disjoint with CommunicationsTopic. Satellite and Space Communications Topic disjoint with Communications Topic. CryptographyTopic disjointWith CommunicationsTopic. Microelectronics topic disjoint with Communications topic. Powerline Transmission Topic disjoint with Communications Topic. Test Only Topic disjoint with Communications Topic. Radio Communications Topic disjoint with Communications Topic.
target:PowerlineTransmissionTopic,Target,Class,Powerline Transmission Topic,"Powerline Transmission Topic refers to a specific subject or theme related to the transmission of electrical power through power lines. This topic may include discussions on technologies, challenges, advancements, regulations, and best practices in the field of powerline transmission. It is a key area of focus in conferences and events related to the energy sector.",Powerline Transmission Topic disjoint with Security Topic. Powerline Transmission Topic is disjoint with Signal Processing Topic. Powerline Transmission Topic is disjoint with Communication Theory Topic. Powerline Transmission Topic disjoint with Medicine Topic. Powerline Transmission Topic disjoint with Multimedia Topic. Powerline Transmission Topic disjoint with Operating Topic systems. Powerline Transmission Topic is disjoint with Mobile Computing Topic. Powerline Transmission Topic disjoint with Satellite and Space Communications Topic. Powerline Transmission Topic disjoint with Communications Topic. Powerline Transmission Topic disjoint with Parallel and Distributed Computing Topic. Powerline Transmission Topic disjoint with Computer Networks Topic. Powerline Transmission Topic is disjoint with Radio Communications Topic. Powerline Transmission Topic disjoint with Performance Topic. Powerline Transmission Topic disjoint with CAD Topic. Powerline Transmission Topic is disjoint with Microelectronics Topic. Powerline Transmission Topic is disjoint with Wireless Communications Topic. Powerline Transmission Topic is disjoint with Cryptography Topic. Powerline Transmission Topic disjoint with Test Only Topic. Powerline Transmission Topic disjoint with Antennas Topic. Powerline Transmission Topic is disjoint with Computer Architecture Topic. Powerline Transmission Topic is a subclass of Topic. Parallel and Distributed Computing Topic is disjoint with Powerline Transmission Topic. Computer Networks Topic disjoint with Powerline Transmission Topic. Communication Theory Topic is disjoint with Powerline Transmission Topic. Security Topic is disjoint with Powerline Transmission Topic. Wireless Communications Topic disjoint with Powerline Transmission Topic. Medicine topic is disjoint with powerline transmission topic. Antennas topic disjoint with Powerline Transmission topic. Performance topic is disjoint with powerline transmission topic. Communications Topic disjoint with Powerline Transmission Topic. Signal Processing Topic disjoint with Powerline Transmission Topic. Mobile Computing Topic is disjoint with Powerline Transmission Topic. CADTopic is disjoint with PowerlineTransmissionTopic. Operating Topic systems disjoint with Powerline Transmission Topic. Computer Architecture Topic disjoint with Powerline Transmission Topic. Multimedia Topic disjoint with Powerline Transmission Topic. Satellite and Space Communications Topic disjoint with Powerline Transmission Topic. Cryptography topic is disjoint with Powerline Transmission topic. Microelectronics topic is disjoint with Powerline Transmission topic. Test Only Topic disjoint with Powerline Transmission Topic. Radio Communications Topic disjoint with Powerline Transmission Topic.
target:AntennasTopic,Target,Class,Antennas Topic,"AntennasTopic refers to a specific subject or theme related to antennas that is being discussed or presented at a conference. This could include topics such as antenna design, optimization, testing, applications, or emerging technologies in the field of antennas. Presentations, workshops, and discussions related to AntennasTopic would focus on advancements, challenges, and innovations within the field of antennas.",Antennas topic disjoint with radio communications topic. Antennas topic disjoint with computer architecture topic. AntennasTopic disjointWith SecurityTopic. Antennas topic disjoint with communication theory topic. AntennasTopic disjointWith MicroelectronicsTopic. AntennasTopic disjointWith CADTopic. AntennasTopic disjointWith MedicineTopic. Antennas topic disjoint with computer networks topic. Antennas topic disjoint with Satellite and Space Communications topic. Antennas topic disjoint with operating topic systems. AntennasTopic disjointWith CommunicationsTopic. AntennasTopic disjointWith PowerlineTransmissionTopic. AntennasTopic disjointWith PerformanceTopic. AntennasTopic disjointWith SignalProcessingTopic. AntennasTopic disjointWith MultimediaTopic. Antennas topic disjoint with parallel and distributed computing topic. AntennasTopic disjointWith CryptographyTopic. AntennasTopic disjointWith TestOnlyTopic. AntennasTopic disjointWith MobileComputingTopic. Antennas topic disjoint with Wireless Communications topic. Antennas are a subclass of topic. Parallel and Distributed Computing Topic disjoint with Antennas Topic. Computer Networks Topic disjoint with Antennas Topic. Communication Theory Topic is disjoint with Antennas Topic. Security Topic disjoint with Antennas Topic. Wireless Communications Topic disjoint with Antennas Topic. Medicine topic is disjoint with antennas topic. Performance topic disjoint with antennas topic. Communications Topic disjoint with Antennas Topic. Signal Processing Topic is disjoint with Antennas Topic. Mobile Computing Topic is disjoint with Antennas Topic. CADTopic is disjoint with AntennasTopic. Operating Topic systems disjoint with Antennas Topic. Computer Architecture Topic disjoint with Antennas Topic. MultimediaTopic is disjoint with AntennasTopic. Satellite and Space Communications Topic disjoint with Antennas Topic. CryptographyTopic disjointWith AntennasTopic. Microelectronics topic disjoint with Antennas topic. Powerline Transmission Topic disjoint with Antennas Topic. Test Only Topic disjoint with Antennas Topic. Radio Communications Topic disjoint with Antennas Topic.
