entity,source_or_target,entity_type,initial_matching,lexical_matching,graphical_matching
source:Place,Source,Class,place,"In the context of a conference, 'Place' refers to the location or venue where the conference is being held. This could be a specific building, city, or even a virtual platform if the conference is being held online.",The place is completely separate from the document. The place is completely separate from the person. The place is not the same as the country. The place is not the same as the organization. The place is not the same as the review rating. The category of 'Place' is completely separate from the category of 'Topic'. The place is not the same as the conference event. The place is completely separate from contact information. The place is completely separate and has no overlap with personal history. The place is completely separate from sponsorship. The place is completely separate from the call. The place is completely separate and has no overlap with the review form. The place is completely separate and has no overlap with the review question. The place is not the same as the conference session. The place is not the same as the conference. The topic is completely separate and has no overlap with the place. Contact Information and Place are completely separate from each other. A dining place is a subclass of a place. The entity 'ReviewQuestion' is disjoint with the entity 'Place'. The concept of a Document is completely separate and does not overlap with the concept of a Place. Sponsorship and Place are completely separate and do not overlap. The entity 'Call' is disjoint with the entity 'Place'. The concept of a ConferenceEvent is completely separate and does not overlap with the concept of a Place. The category of 'Conference' is completely separate and does not overlap with the category of 'Place'. The concept of a Conference Session is completely separate and does not overlap with the concept of a Place. ReviewRating and Place are completely separate and do not overlap. The conference venue place is a subclass of place. The concept of a ReviewForm is completely separate and does not overlap with the concept of a Place. Personal history is completely separate and has no overlap with place. A person is completely separate and different from a place. The meeting room place is a subclass of place. The category of 'Country' is completely separate and does not overlap with the category of 'Place'. AccommodationPlace is a subclass of Place. The organization is completely separate and has no overlap with the place. The place is the location of. The 'hasLocation' has a range of 'Place'.
source:WeekRejectRating,Source,Class,week reject rating,"The term 'WeekRejectRating' is not a standard term used in the context of conferences. It could potentially refer to a rating system for rejected proposals or presentations within a week, but without specific context, it's difficult to provide an accurate definition. It's best to refer to the specific guidelines or context where the term is used.",WeekRejectRating is a subclass of ReviewRating. The category of Week Reject Rating is completely separate and has no overlap with the category of Accept Rating. The category of WeekRejectRating is completely separate and has no overlap with the category of AccpetIfRoomRating. The category 'WeekRejectRating' is completely separate and has no overlap with the category 'RejectRating'. The entity 'RejectRating' is disjoint with the entity 'WeekRejectRating'. The concept of 'AcceptIfRoomRating' is completely separate and has no overlap with the concept of 'WeekRejectRating'. The entity 'AcceptRating' is disjoint with the entity 'WeekRejectRating'.
source:AcceptRating,Source,Class,accept rating consider,"In the context of a conference, 'AcceptRating.Consider' typically refers to a rating given to a paper or presentation submission. This rating suggests that the submission should be 'considered' for inclusion in the conference. It's generally a middle-ground rating, indicating that the submission has potential but may require some revisions or improvements. The final decision will be made by the conference committee or reviewers.",
source:AccpetIfRoomRating,Source,Class,accpet if room rating,"The term 'AcceptIfRoomRating' is not a standard term in the context of conferences. It could potentially refer to a system or criteria where a presentation, speaker, or attendee is accepted if there is enough room or if they meet a certain rating or standard. However, without specific context, it's difficult to provide an accurate definition. It's best to refer to the specific guidelines or rules of the conference in question.",AccpetIfRoomRating is a subclass of ReviewRating. The concept of 'AcceptIfRoomRating' is completely separate and has no overlap with the concept of 'AcceptRating'. The concept of 'Accept If Room Rating' is completely separate and has no overlap with 'Reject Rating'. The concept of 'AcceptIfRoomRating' is completely separate and has no overlap with the concept of 'WeekRejectRating'. The category of WeekRejectRating is completely separate and has no overlap with the category of AccpetIfRoomRating. The category of 'RejectRating' is completely separate and has no overlap with the category of 'AcceptIfRoomRating'. AcceptRating and AcceptIfRoomRating are mutually exclusive.
source:RejectRating,Source,Class,reject rating,"In the context of a conference, 'RejectRating' typically refers to a score or rating given by reviewers to a submitted paper or presentation proposal that determines whether it is rejected or accepted for the conference. A high reject rating would indicate that the submission is not suitable or does not meet the standards or requirements of the conference.",The category of 'RejectRating' is completely separate and has no overlap with the category of 'AcceptRating'. The category of 'RejectRating' is completely separate and has no overlap with the category of 'AcceptIfRoomRating'. The entity 'RejectRating' is disjoint with the entity 'WeekRejectRating'. RejectRating is a subclass of ReviewRating. The category 'WeekRejectRating' is completely separate and has no overlap with the category 'RejectRating'. The concept of 'AcceptIfRoomRating' is completely separate and does not overlap with the concept of 'RejectRating'. The category 'AcceptRating' is completely separate and has no overlap with the category 'RejectRating'.
source:MealEvent,Source,Class,meal event,"A MealEvent in the context of a conference refers to a scheduled event where attendees gather to eat. This could be breakfast, lunch, dinner, or even a coffee break. These events are often used for networking, informal discussions, or as a break from the main conference activities.",A MealEvent is a subclass of a NonAcademicEvent. The event of a meal is completely separate and has no overlap with the event of a break. The event of breaking is disjointed with the event of having a meal. A Conference Dinner is a subclass of Meal Event. The domain of 'hasMenu' is 'MealEvent'. The term 'isMenuOf' is in the range of 'MealEvent'.
source:NonAcademicEvent,Source,Class,non academic event,"A NonAcademicEvent in the context of a conference refers to an event or activity that is not directly related to the academic or scholarly content of the conference. This could include social events, networking opportunities, recreational activities, cultural tours, or entertainment programs. These events are often designed to provide attendees with a break from the academic sessions, to facilitate informal interactions and networking, or to showcase the local culture or attractions.",NonAcademicEvent is a subclass of ConferenceEvent. NonAcademicEvent is completely separate and has no overlap with AcademicEvent. A MealEvent is a subclass of a NonAcademicEvent. The class 'BreakEvent' is a subclass of 'NonAcademicEvent'. Academic events are completely separate and have no overlap with non-academic events. A Social Event is a subclass of a Non-Academic Event.
source:BreakEvent,Source,Class,break event,"A BreakEvent in the context of a conference refers to a scheduled period of rest or pause in the conference proceedings. This could be a coffee break, lunch break, or any other short interval where attendees can relax, network, or attend to personal needs. It's a time when no sessions, workshops, or presentations are taking place.",A BreakEvent is a subclass of a NonAcademicEvent. The event of a break is disjointed with the event of a meal. The event of having a meal is completely separate and has no overlap with the event of taking a break. FreeTimeBreak is a subclass of BreakEvent. MealBreak is a subclass of BreakEvent. A Coffee Break is a subclass of Break Event.
source:ParallelAndDistributedComputingTopic,Source,Class,parallel and distributed computing topic,"Parallel and Distributed Computing Topic in the context of a conference refers to a specific subject or theme that focuses on the study and discussion of parallel and distributed computing systems. This can include topics like algorithms, applications, architectures, and technologies related to parallel and distributed computing. These systems involve multiple processors or computers working together to solve a common task or problem.",The topic of Parallel and Distributed Computing is completely separate from the topic of Wireless Communications. The topic of Parallel and Distributed Computing is disjoint with Operating Systems topics. The topic of Parallel and Distributed Computing is completely separate from the topic of Computer Networks. The topic of Parallel and Distributed Computing is completely separate from the topic of Satellite and Space Communications. The topic of Parallel and Distributed Computing is completely separate from the topic of CAD. The topic of Parallel and Distributed Computing is completely separate from the topic of Multimedia. The topic of Parallel and Distributed Computing is disjoint with the topic of Communications. The topic of Parallel and Distributed Computing is completely separate from the topic of Powerline Transmission. The topic of Parallel and Distributed Computing is completely separate from the topic of Antennas. The topic of Parallel and Distributed Computing is disjoint with the topic of Performance. The topic of Parallel and Distributed Computing is disjoint with the topic of Signal Processing. The topic of Parallel and Distributed Computing is completely separate from the topic of Microelectronics. The topic of Parallel and Distributed Computing is disjoint with the topic of Test Only. The topic of Parallel and Distributed Computing is completely separate from the topic of Radio Communications. The topic of Parallel and Distributed Computing is disjoint with the topic of Computer Architecture. The topic of Parallel and Distributed Computing is completely separate from the topic of Medicine. The topic of Parallel and Distributed Computing is disjoint with the topic of Security. The topic of Parallel and Distributed Computing is completely separate from the topic of Mobile Computing. The topic of Parallel and Distributed Computing is completely separate from the topic of Cryptography. The topic of Parallel and Distributed Computing is completely separate from the topic of Communication Theory. The topic of Parallel and Distributed Computing is a subclass of the general category of Topics.
source:WirelessCommunicationsTopic,Source,Class,wireless communications topic,"In the context of a conference, a WirelessCommunicationsTopic would refer to a subject or theme of discussion that revolves around wireless communications. This could include areas such as mobile communication, wireless networking, wireless technology advancements, wireless data transmission, etc. It's a specific area of focus within the broader field of telecommunications.",The topic of Wireless Communications is completely separate from the topic of Operating Systems. The topic of Wireless Communications is completely separate and has no overlap with the topic of Performance. The topic of Wireless Communications is completely separate and has no overlap with the topic of Medicine. The topic of Wireless Communications is completely separate from the topic of Microelectronics. The topic of Wireless Communications is completely separate and has no overlap with the topic of Communications. The topic of Wireless Communications is completely separate from the topic of Communication Theory. The topic of Wireless Communications is completely separate from the topic of Computer-Aided Design. The topic of Wireless Communications is completely separate from the topic of Parallel and Distributed Computing. The topic of Wireless Communications is completely separate and has no overlap with the topic of Powerline Transmission. The topic of Wireless Communications is completely separate from the topic of Radio Communications. The topic of Wireless Communications is completely separate and has no overlap with the topic of Test Only. The topic of Wireless Communications is completely separate from the topic of Mobile Computing. The topic of Wireless Communications is completely separate from the topic of Signal Processing. The topic of Wireless Communications is completely separate and has no overlap with the topic of Satellite and Space Communications. The topic of Wireless Communications is completely separate from the topic of Computer Networks. The topic of Wireless Communications is completely separate from the topic of Security. The topic of Wireless Communications is completely separate from the topic of Antennas. The topic of Wireless Communications is completely separate from the topic of Computer Architecture. The topic of Wireless Communications is completely separate and has no overlap with the topic of Multimedia. The topic of Wireless Communications is completely separate from the topic of Cryptography. The topic of Wireless Communications is a subclass of the general category of Topics.
source:OperatingTopicsystems,Source,Class,operating topicsystems,"It appears there may be a typo in your question. 'OperatingTopicsystems' doesn't seem to be a recognized term in the context of conferences or elsewhere. If you're asking about 'Operating Systems' as a conference topic, it would refer to discussions or presentations about various aspects of computer operating systems, such as their design, use, or recent advancements in the field.",The topic of Operating Systems is completely separate and has no overlap with the topic of CAD (Computer-Aided Design). The topic of Operating Systems is completely separate and has no overlap with the topic of Performance. The topic of Operating Systems is disjoint with the topic of Microelectronics. The topic of Operating Systems is disjoint with the topic of Parallel and Distributed Computing. The topic of Operating Systems is completely separate from the topic of Computer Architecture. The topic of Operating Systems is disjoint with the topic of Mobile Computing. The topic of Operating Systems is completely separate and has no overlap with the topic of Communications. The topic of Operating Systems is disjoint with the topic of Computer Networks. The topic of Operating Systems is completely separate and has no overlap with the topic of Cryptography. The topic of Operating Systems is completely separate and has no overlap with the topic of Wireless Communications. The topic of Operating Systems is completely separate and has no overlap with the topic of Signal Processing. The topic of Operating Systems is completely separate and has no overlap with the topic of Test Only. The topic of Operating Systems is completely separate and has no overlap with the topic of Antennas. The topic of Operating Systems is disjoint with the topic of Powerline Transmission. The topic of Operating Systems is completely separate and has no overlap with the topic of Radio Communications. The topic of Operating Systems is disjoint with the topic of Communication Theory. The topic of Operating Systems is completely separate and has no overlap with the topic of Multimedia. The topic of Operating Systems is completely separate and has no overlap with the topic of Security. The topic of Operating Systems is completely separate and has no overlap with the topic of Satellite and Space Communications. The topic of Operating Systems is completely separate and has no overlap with the topic of Medicine. Operating Topic systems is a subclass of Topic. The topic of Parallel and Distributed Computing is disjoint with Operating Systems topics. The topic of Computer Networks is completely separate from the topic of Operating Systems. The topic of Communication Theory is completely separate from the topic of Operating Systems. The topic of Security is completely separate and has no overlap with the topic of Operating Systems. The topic of Wireless Communications is completely separate from the topic of Operating Systems. The topic of Medicine is completely separate and has no overlap with the topic of Operating Systems. The topic of Antennas is completely separate from the topic of Operating Systems. The topic of Performance is completely separate and has no overlap with the topic of Operating Systems. The topic of Communications is completely separate and has no overlap with the topic of Operating Systems. The topic of Signal Processing is completely separate and has no overlap with the topic of Operating Systems. The topic of Mobile Computing is completely separate from the topic of Operating Systems. The topic of CAD is disjointed with the topic of Operating Systems. The topic of Computer Architecture is completely separate and has no overlap with the topic of Operating Systems. The topic of Multimedia is completely separate and has no overlap with the topic of Operating Systems. The topic of Satellite and Space Communications is completely separate from the topic of Operating Systems. The topic of Cryptography is completely separate and has no overlap with the topic of Operating Systems. The topic of Microelectronics is completely separate from the topic of Operating Systems. The topic of Powerline Transmission is completely separate and has no overlap with the topic of Operating Systems. The topic 'TestOnlyTopic' is disjoint with 'OperatingTopicsystems'. The topic of Radio Communications is completely separate and has no overlap with the topic of Operating Systems.
source:ComputerNetworksTopic,Source,Class,computer networks topic,"ComputerNetworksTopic in the context of a conference refers to a specific subject or theme related to computer networks that will be discussed or presented during the event. This could include various aspects such as network architecture, protocols, security, data transmission, wireless networking, etc.",The topic of Computer Networks is completely separate from the topic of Antennas. The topic of Computer Networks is completely separate from the topic of Radio Communications. The topic of Computer Networks is completely separate from the topic of Test Only. The topic of Computer Networks is completely separate from the topic of Performance. The topic of Computer Networks is completely separate from the topic of Communication Theory. The topic of Computer Networks is completely separate from the topic of Satellite and Space Communications. The topic of Computer Networks is completely separate from the topic of Wireless Communications. The topic of Computer Networks is completely separate from the topic of Cryptography. The topic of Computer Networks is completely separate from the topic of Signal Processing. The topic of Computer Networks is completely separate from the topic of Microelectronics. The topic of Computer Networks is completely separate from the topic of Multimedia. The topic of Computer Networks is completely separate from the topic of Powerline Transmission. The topic of Computer Networks is completely separate and has no overlap with the topic of Medicine. The topic of Computer Networks is completely separate from the topic of Security. The topic of Computer Networks is completely separate from the topic of Communications. The topic of Computer Networks is completely separate from the topic of Parallel and Distributed Computing. The topic of Computer Networks is completely separate from the topic of Computer Architecture. The topic of Computer Networks is completely separate from the topic of Operating Systems. The topic of Computer Networks is completely separate from the topic of Computer-Aided Design. The topic of Computer Networks is completely separate from the topic of Mobile Computing. The topic of Computer Networks is a subclass of the general Topic. The topic of Parallel and Distributed Computing is completely separate from the topic of Computer Networks. The topic of Communication Theory is completely separate and has no overlap with the topic of Computer Networks. The topic of Computer Networks Enterprise is a subcategory of the topic of Computer Networks. The topic of Security is completely separate and has no overlap with the topic of Computer Networks. The topic of Wireless Communications is completely separate from the topic of Computer Networks. The topic of Medicine is completely separate and has no overlap with the topic of Computer Networks. The topic of Antennas is completely separate from the topic of Computer Networks. The topic of Performance is completely separate and has no overlap with the topic of Computer Networks. The topic of Communications is completely separate and has no overlap with the topic of Computer Networks. The topic of Signal Processing is completely separate and has no overlap with the topic of Computer Networks. The topic of Mobile Computing is completely separate from the topic of Computer Networks. The topic of Optical in Computer Networks is a subcategory of the topic of Computer Networks. The topic of Computer Networks Measurements is a subcategory of the topic of Computer Networks. The topic of Computer Networks Management is a subcategory of the topic of Computer Networks. The topic of CAD is completely separate and has no overlap with the topic of Computer Networks. The topic of Switching in Computer Networks is a subcategory of the topic of Computer Networks. The topic of Operating Systems is completely separate from the topic of Computer Networks. The topic of Computer Networks Sensor is a subclass of the topic of Computer Networks. The topic of Computer Architecture is completely separate and has no overlap with the topic of Computer Networks. The topic of Multimedia is completely separate and has no overlap with the topic of Computer Networks. The topic of Computer Networks Security is a subcategory of the topic of Computer Networks. The topic of 'Computer Networks Applications' is a subcategory of the topic 'Computer Networks'. The topic of Satellite and Space Communications is completely separate from the topic of Computer Networks. The topic of Cryptography is completely separate from the topic of Computer Networks. The topic of Microelectronics is completely separate from the topic of Computer Networks. The topic of Powerline Transmission is completely separate from the topic of Computer Networks. The topic of Test Only is completely separate from the topic of Computer Networks. The topic of Radio Communications is completely separate and has no overlap with the topic of Computer Networks.
