entity,source_or_target,entity_type,initial_matching,lexical_matching,graphical_matching
source:has_an_ISBN,Source,Property,has an ISBN,"In the context of a conference, ""has_an_ISBN"" likely refers to whether a publication or document associated with the conference has an International Standard Book Number (ISBN). An ISBN is a unique identifier assigned to books, e-books, and other publications to facilitate their identification and ordering. Having an ISBN can make it easier for researchers, scholars, and attendees to locate and reference the publication.",Has an ISBN range string. Has an ISBN domain conference proceedings.
source:has_a_date_of_issue,Source,Property,has a date of issue,"In the context of a conference, ""has_a_date_of_issue"" typically refers to the date on which a particular document or item was officially issued or published. This could include conference proceedings, certificates of attendance, badges, or any other materials related to the conference. Having a clear date of issue helps to establish the validity and timeliness of the document or item.",Has a date of issue domain Conference document. Has a date of issue range date.
source:has_a_URL,Source,Property,has a URL,"In the context of a conference, ""has_a_URL"" typically refers to a feature or attribute of a presentation or session that includes a link to a website or online resource. This could be a reference to a speaker's presentation slides, additional materials, or related content that can be accessed online through a specific URL. Having a URL associated with a presentation can provide attendees with easy access to further information or resources related to the topic being discussed.",Has a URL domain Conference www. Has a URL range string.
source:has_the_last_name,Source,Property,has the last name,"In the context of a conference, ""has_the_last_name"" likely refers to a function or attribute that determines or stores the last name of a person attending the conference. This could be used for organizing attendees alphabetically, creating name tags, or other administrative purposes related to identifying individuals by their last name.",Has the last name Range string. Person has the last name domain.
source:is_an_ending_date,Source,Property,is an ending date,"In the context of a conference, ""is_an_ending_date"" refers to the specific date on which the conference is scheduled to conclude or end. This date is typically included in the conference schedule or program to inform attendees of when the event will officially come to a close.",Is an ending date range date. Is an ending date domain Important dates.
source:has_a_volume,Source,Property,has a volume,"In the context of a conference, ""has_a_volume"" typically refers to the availability of a physical space or room with a certain capacity or size. It indicates that the conference venue has a specific volume or capacity to accommodate a certain number of attendees or participants. This term is often used when discussing logistics and planning for conferences, such as determining the appropriate size of the venue for the expected number of attendees.",Has a volume range int. Has a volume domain conference proceedings.
source:is_a_date_of_acceptance_announcement,Source,Property,is a date of acceptance announcement,"The term ""is_a_date_of_acceptance_announcement"" likely refers to the specific date on which the acceptance of a conference presentation or paper is officially announced to the author(s). This date is important as it marks the confirmation of the submission being accepted for presentation at the conference.",Is a date of acceptance announcement domain Important dates. Is a date of acceptance announcement range date.
source:has_an_expertise,Source,Property,has an expertise,"In the context of a conference, ""has_an_expertise"" typically refers to a person who possesses specialized knowledge, skills, or experience in a particular subject or field. This term is often used to describe individuals who are considered experts in their respective areas and are invited to speak, present, or participate in discussions at the conference due to their expertise.",Has an expertise domain Review expertise.
source:is_a_date_of_camera_ready_paper_submission,Source,Property,is a date of camera ready paper submission,"""Is_a_date_of_camera_ready_paper_submission"" refers to the deadline by which authors must submit their final, camera-ready versions of their papers for inclusion in the conference proceedings. This version of the paper should address any feedback or revisions requested during the initial paper submission and review process.",Is a date of camera ready paper submission range date. Is a date of camera ready paper submission domain important dates.
source:is_a_starting_date,Source,Property,is a starting date,"In the context of a conference, ""is_a_starting_date"" likely refers to the specific date on which the conference is scheduled to begin. This term is used to indicate the starting point of the conference and is important for attendees, organizers, and speakers to plan their schedules accordingly.",Is a starting date domain Important dates. Is a starting date range date.
target:Presenter_house,Target,Class,Presenter house,"Presenter_house typically refers to the designated area or room where the presenter or speakers of a conference are located during their presentations. This area is usually equipped with a podium, microphone, and any necessary audiovisual equipment for the presenter to effectively communicate their message to the audience. It is a space where the presenter can deliver their presentation and engage with the attendees.",The presenter house is a subclass of building.
target:Building,Target,Class,Building,"In the context of a conference, ""building"" typically refers to the process of creating or developing something, such as relationships, partnerships, networks, or knowledge. It can also refer to the physical structure where the conference is taking place. Building relationships and connections with other attendees, speakers, and sponsors is often a key goal of conferences.",Building is a subclass of Place. The presenter house is a subclass of building. The conference restaurant is a subclass of building. Conference_airport is a subclass of Building. Conference building is a subclass of building. The conference hotel is a subclass of building. Sponsor company house is a subclass of building. The presenter university is a subclass of building. Is paid in range building.
target:Presenter_state,Target,Class,Presenter state,"Presenter_state typically refers to the current location or state of the presenter at a conference. This could include whether the presenter is currently on stage, preparing to speak, or in a designated area for presenters. It may also refer to the mental or emotional state of the presenter, such as feeling nervous or confident before presenting.",Presenter state is a subclass of State.
target:Delegate,Target,Class,Delegate,"In the context of a conference, a delegate is a person who is chosen or elected to represent a group of people or an organization at the conference. Delegates typically attend the conference to participate in discussions, vote on resolutions, and make decisions on behalf of the group they represent. They may also be responsible for communicating information back to their group or organization after the conference.",Delegate is a subclass of Person. Technical committee is a subclass of delegate. Session chair is a subclass of delegate. Speaker is a subclass of Delegate. IASTED_non_member is a subclass of Delegate. One day presenter is a subclass of delegate. Non-speaker is a subclass of delegate. The hotel presenter is a subclass of delegate. I A S T E D member sub Class Of Delegate. Listener is a subclass of Delegate. Conference_Hiker is a subclass of Delegate.
target:Presenter_city,Target,Class,Presenter city,Presenter_city refers to the city where the presenter of a conference is located or based. This information is typically included in the conference program or schedule to provide attendees with background information about the presenter and their location. It can also be used to help attendees identify presenters who may be local to the conference location or who have traveled from a different city to present at the conference.,The presenter city is a subclass of city.
target:Hotel_registration_form,Target,Class,Hotel registration form,"A hotel registration form is a document that attendees of a conference must fill out in order to reserve a room at the designated hotel for the duration of the event. This form typically includes information such as the attendee's name, contact details, check-in and check-out dates, room preferences, and payment information. It is used by the conference organizers to coordinate accommodations for all attendees and ensure a smooth check-in process at the hotel.",Hotel registration form is a subclass of form.
target:Deadline_hotel_reservation,Target,Class,Deadline hotel reservation,Deadline_hotel_reservation refers to the date by which attendees or participants of a conference must make their hotel reservations in order to secure a room at a designated hotel for the duration of the event. This deadline is typically set by the conference organizers to ensure that all attendees have accommodations during the conference. Failure to make a reservation before the deadline may result in limited availability or higher prices for hotel rooms.,Deadline hotel reservation is a subclass of Deadline.
target:Form,Target,Class,Form,"In the context of a conference, ""form"" typically refers to the structure or format of the event. This can include the schedule of presentations, panels, and workshops, as well as the overall layout and organization of the conference. The form of a conference can also refer to the specific rules and guidelines that participants are expected to follow, such as presentation formats, time limits, and discussion protocols.",Form is a subclass of Document. Hotel registration form is a subclass of form. Registration form is a subclass of Form. Author information form is a subclass of form.
target:Car,Target,Class,Car,"In the context of a conference, ""Car"" could refer to a session or workshop that is part of the conference program. It could also refer to a specific topic or theme that is being discussed or presented at the conference.",Car is a subclass of transport vehicle.
target:Transport_vehicle,Target,Class,Transport vehicle,"A transport vehicle in the context of a conference refers to a vehicle used to transport attendees, speakers, or staff to and from the conference venue, hotels, airports, or other locations related to the event. This can include buses, shuttles, vans, or other modes of transportation arranged by the conference organizers to ensure smooth and efficient movement of participants. Transport vehicles are often used to provide convenience and logistics support for attendees during the conference.",Transport vehicle is a subclass of item. Car is a subclass of Transport_vehicle. Taxi is a subclass of transport vehicle. Shuttle bus is a subclass of transport vehicle. Van is a subclass of transport vehicle.
target:Mailing_list,Target,Class,Mailing list,"A mailing list is a list of email addresses used by an individual or organization to send out information, updates, announcements, or other communications to a group of people who have subscribed to receive these messages. In the context of a conference, a mailing list may be used to communicate important details about the event, such as schedule changes, speaker announcements, registration deadlines, and more. Participants can subscribe to the mailing list to stay informed and engaged with the conference.",Mailing list is a subclass of Document.
target:Document,Target,Class,Document,"In the context of a conference, a document refers to any written or printed material that is used for reference, information, or communication during the event. This can include agendas, schedules, presentations, reports, handouts, and any other materials that are distributed to attendees or used by speakers during the conference. Documents are an important part of a conference as they help to provide structure, information, and support for the various sessions and activities that take place.",
target:Renting,Target,Class,Renting,"In the context of a conference, renting typically refers to the process of paying for the use of a venue or space for the event. This could include renting a conference room, exhibition space, or other facilities needed for the conference. Renting may also refer to the hiring of equipment or services needed for the conference, such as audiovisual equipment, furniture, or catering services.",Renting is a subclass of activity before conference.
target:Activity_before_conference,Target,Class,Activity before conference,"Activity_before_conference refers to any tasks, preparations, or events that need to be completed or organized before the actual conference takes place. This could include things like setting up the venue, arranging speakers and presentations, promoting the event, registering attendees, and finalizing logistical details. These activities are essential for ensuring that the conference runs smoothly and successfully.",Activity before conference is a subclass of activity. Renting is a subclass of activity before conference. Refusing manuscript is a subclass of activity before conference. Accepting manuscript is a subclass of activity before conference. Receiving manuscript is a subclass of activity before conference. Research is a subclass of Activity before conference.
target:Dinner_banquet,Target,Class,Dinner banquet,"A dinner banquet is a formal meal that is typically held as part of a conference or event. It usually involves multiple courses and is served in a formal setting, such as a hotel ballroom or banquet hall. The dinner banquet is often a highlight of the conference, providing attendees with an opportunity to network, socialize, and enjoy a delicious meal together.",The dinner banquet is a subclass of social program.
target:One_day_presenter,Target,Class,One day presenter,"One_day_presenter refers to a speaker or presenter who is scheduled to present at a conference for only one day. This could be a keynote speaker, workshop facilitator, panelist, or any other individual who is invited to present at the conference for a specific day or session.",One day presenter is a subclass of delegate.
target:Social_program,Target,Class,Social program,"A social program at a conference refers to activities or events organized outside of the main conference sessions that provide opportunities for attendees to network, socialize, and engage with each other in a more informal setting. This can include things like welcome receptions, networking lunches, evening social events, and organized outings or tours. Social programs are designed to enhance the overall conference experience by fostering connections and building relationships among attendees.",Social program is a subclass of conference activity. Dinner banquet is a subclass of social program.
target:Activity,Target,Class,Activity,"In the context of a conference, an activity refers to a specific event or task that is organized as part of the conference program. Activities can include workshops, presentations, panel discussions, networking sessions, team-building exercises, and social events. These activities are designed to engage participants, provide opportunities for learning and collaboration, and enhance the overall conference experience.",
target:Person,Target,Class,Person,"In the context of a conference, a person refers to an individual who is attending or participating in the event. This could include speakers, presenters, attendees, organizers, and any other individuals involved in the conference. Each person plays a role in contributing to the overall success and experience of the conference.","Delegate is a subclass of Person. Sponsor is a subclass of Person. The range is occupied by Person. Prepare domain Person. Person occupies domain. Is signed by range Person. Is present in domain Person. Write domain Person. Person range is needed for. Obtain domain Person. Send domain Person. Person range is paid by. Speak in domain Person. The range Person is given by. Person is prepared by range. Person, pay domain. Person range is used by. Sign domain Person. Is present domain Person. Person is visited by range. Give domain Person. Person need domain. Person range is given to. Is sent by range Person. Is written by range Person."
target:PowerPoint_presentation,Target,Class,PowerPoint presentation,"A PowerPoint presentation is a visual presentation created using Microsoft PowerPoint software. It typically consists of slides that contain text, images, and other multimedia elements to convey information to an audience during a conference or meeting. The presenter uses the slides to guide the audience through the key points of the presentation.",PowerPoint presentation is a subclass of Presentation.
target:Presentation,Target,Class,Presentation,"In the context of a conference, a presentation refers to a formal talk or speech given by a speaker to an audience on a specific topic. Presentations are typically accompanied by visual aids such as slides, charts, or videos to help convey information and engage the audience. Presentations are a common format for sharing research findings, discussing ideas, or showcasing projects at conferences.",
target:Conference_restaurant,Target,Class,Conference restaurant,"A conference restaurant is a dining facility located within or near a conference venue that caters to conference attendees and provides meals, snacks, and beverages during breaks and meal times. It is a convenient option for conference participants to grab a quick bite to eat or have a sit-down meal without having to leave the conference venue.",Conference restaurant is a subclass of building.
target:Conference_city,Target,Class,Conference city,"Conference_city refers to the city where a conference is taking place. It is the location where attendees gather to participate in the conference sessions, workshops, and networking events. The conference city may be chosen based on factors such as accessibility, amenities, and the relevance of the location to the conference theme or industry.",Conference city is a subclass of city.
target:Conference_state,Target,Class,Conference state,"In the context of a conference, ""Conference_state"" typically refers to the current status or condition of the conference. This could include information such as whether the conference is ongoing, completed, postponed, or cancelled. It may also refer to the overall atmosphere or mood of the conference, such as whether it is running smoothly or facing challenges.",Conference state is a subclass of State.
target:Submissions_deadline,Target,Class,Submissions deadline,"Submissions_deadline refers to the deadline by which all submissions, such as abstracts, papers, or proposals, must be submitted for consideration for presentation at a conference. This deadline is typically set by the conference organizers to allow for proper review and selection of submissions before the conference takes place.",Submissions deadline is a subclass of Deadline.
target:Deadline,Target,Class,Deadline,"In the context of a conference, a deadline refers to the date by which a certain task or action must be completed. This could include submitting a paper or presentation proposal, registering for the conference, or making a payment. Missing a deadline may result in being unable to participate in the conference or facing additional fees.",Deadline is a subclass of Time. Submissions deadline is a subclass of Deadline. Deadline for notification of acceptance is a subclass of Deadline. Registration deadline is a subclass of deadline. Deadline hotel reservation is a subclass of Deadline. Camera ready manuscript deadline is a subclass of deadline. Done till domain deadline.
target:Simulating,Target,Class,Simulating,"Simulating in the context of a conference refers to the act of creating a virtual or simulated version of an event, presentation, or scenario. This can involve using technology to replicate real-life situations or environments in order to provide a realistic and interactive experience for participants. Simulation can be used in various aspects of a conference, such as training sessions, demonstrations, or interactive workshops.",Simulating subClassOf Research.
target:Research,Target,Class,Research,"Research in the context of a conference refers to the systematic investigation or study of a particular topic or issue in order to discover new information, insights, or solutions. Researchers present their findings at conferences to share their work with others in the field, receive feedback, and contribute to the advancement of knowledge in their respective areas of study.",Research is a subclass of Activity before conference. Simulating subClassOf Research.
target:Technic_activity,Target,Class,Technic activity,"Technic_activity in the context of a conference refers to a specific technical or hands-on activity that is part of the conference program. This could include workshops, demonstrations, simulations, or other interactive sessions that allow participants to engage with and learn about a particular technology or technique. These activities are designed to provide practical, hands-on experience and enhance the learning and networking opportunities for conference attendees.",Technic_activity is a subclass of Conference_activity.
target:Conference_activity,Target,Class,Conference activity,"Conference_activity refers to any type of event, session, workshop, presentation, or discussion that takes place during a conference. This can include keynote speeches, panel discussions, networking sessions, breakout sessions, poster presentations, and other activities designed to engage attendees and facilitate learning, collaboration, and networking opportunities.",Conference activity is a subclass of activity. Technic_activity is a subclass of Conference_activity. Presentation is a subclass of conference activity. Introduction is a subclass of Conference activity. Welcome address is a subclass of conference activity. Social program is a subclass of conference activity. Registration is a subclass of Conference_activity. Coffee break is a subclass of conference activity. Lecture is a subclass of Conference_activity. Cocktail reception is a subclass of conference activity.
target:Technical_commitee,Target,Class,Technical committee,"A Technical Committee is a group of experts or professionals in a specific field or industry who are responsible for reviewing and evaluating technical content, proposals, and submissions related to the conference. They play a crucial role in ensuring the quality and relevance of the technical program of the conference by providing feedback, recommendations, and guidance to the conference organizers. The Technical Committee may also be involved in selecting speakers, organizing sessions, and shaping the overall technical content of the conference.",Technical committee is a subclass of delegate.
target:Place,Target,Class,Place,"In the context of a conference, ""place"" refers to the physical location where the conference is being held. This could be a hotel, convention center, university campus, or any other venue that has been chosen to host the event. The choice of place can impact the overall experience of attendees, as well as logistical considerations such as transportation, accommodations, and accessibility.",
target:Author_cd_proceedings_included,Target,Class,Author CD Proceedings Included,Author_cd_proceedings_included refers to an author who has contributed to a conference by submitting a paper or presentation that has been included in the conference proceedings. This designation typically indicates that the author's work has been accepted and published as part of the official documentation of the conference.,Author_cd_proceedings_included subClassOf Author.
target:Author,Target,Class,Author,"In the context of a conference, an author refers to an individual who has written and submitted a paper or presentation for consideration and inclusion in the conference program. The author is typically the primary creator of the content being presented and is responsible for the research, writing, and development of the work being presented at the conference.",Author is a subclass of Speaker. Author_cd_proceedings_included subClassOf Author. Author book proceedings included is a subclass of Author. Plenary lecture speaker is a subclass of author. Tutorial speaker is a subclass of author. Lecturer is a subclass of Author.
target:Cd_proceening,Target,Class,Cd proceening,"Cd_proceening is not a commonly used term in the context of conferences. It is possible that it may be a typo or a specific term used in a particular field or organization. Without more context, it is difficult to determine the exact meaning of Cd_proceening.",CD processing is a subclass of Publication.
target:Trip_day,Target,Class,Trip day,Trip_day refers to the specific day or days during a conference when attendees may have the opportunity to participate in organized trips or excursions to nearby attractions or landmarks. These trips are often optional and provide attendees with a chance to explore the local area and network with other conference participants in a more relaxed setting.,Trip day is a subclass of time.
