entity,source_or_target,entity_type,initial_matching,lexical_matching,graphical_matching
target:Time,Target,Class,Time,"In the context of a conference, time refers to the schedule or agenda of the event, including the specific times at which sessions, presentations, and activities are scheduled to take place. Time management is crucial in ensuring that the conference runs smoothly and that all participants are able to attend the sessions they are interested in.",Trip day is a subclass of time. Deadline is a subclass of Time. Conference days are a subclass of time. Is held before range Time. Is sent after range Time. Is the range Time sent before. Time is held after range. Time range is present.
target:Record_of_attendance,Target,Class,Record of attendance,"Record of attendance refers to a document or list that records the names of individuals who have attended a conference or event. This record is typically used for tracking attendance, verifying participation, and keeping a record of who was present at the event. It may also be used for administrative purposes, such as issuing certificates of attendance or tracking continuing education credits.",Record of attendance is a subclass of document.
target:Listener,Target,Class,Listener,"In the context of a conference, a listener refers to an individual who attends the conference to listen to the presentations, discussions, and speeches without actively participating in the discussions or presenting their own work. Listeners typically attend conferences to gain knowledge, insights, and information from the speakers and presenters. They may also have the opportunity to ask questions during Q&A sessions or engage in networking with other attendees.",Listener is a subclass of Delegate.
target:Session_room,Target,Class,Session room,"A session room is a designated space within a conference venue where specific presentations, discussions, or workshops take place. It is where attendees gather to listen to speakers, participate in panel discussions, or engage in interactive sessions related to the conference theme or topic. Each session room is typically equipped with audiovisual equipment, seating arrangements, and other necessary resources to facilitate the smooth running of the session.",Session room is a subclass of Place.
target:Brief_introduction_for_Session_chair,Target,Class,Brief introduction for Session chair,"A brief introduction for the session chair is a short overview or summary of the responsibilities and role of the session chair at a conference. This may include information on how the session chair should facilitate the session, introduce speakers, manage time, and engage with the audience. It is typically provided to the session chair before the start of the session to ensure they are prepared and understand their duties.",Brief introduction for Session chair is a subclass of Document.
target:Session_chair,Target,Class,Session chair,"A session chair is a person responsible for moderating and facilitating a specific session or panel discussion during a conference. They introduce speakers, keep track of time, facilitate audience participation, and ensure that the session runs smoothly and according to schedule. The session chair plays a crucial role in maintaining the flow and organization of the conference program.",Session chair is a subclass of delegate.
target:Invitation_letter,Target,Class,Invitation letter,"An invitation letter is a formal document that is sent to individuals or organizations inviting them to attend a conference or event. It typically includes details such as the date, time, location, and purpose of the conference, as well as any special instructions or requirements for attendees. The invitation letter serves as a formal invitation and can be used by recipients to secure any necessary travel arrangements or accommodations.",Invitation letter is a subclass of Document.
target:Registration_form,Target,Class,Registration form,"A registration form is a document or online form that individuals must fill out in order to officially sign up for a conference. It typically includes fields for personal information such as name, contact details, organization, and payment information. By completing a registration form, attendees are able to secure their spot at the conference and receive important information about the event.",Registration form is a subclass of Form.
target:Viza,Target,Class,Viza,"In the context of a conference, ""Viza"" likely refers to a visa, which is an official document issued by a country's government that allows a foreign individual to enter, stay, or work in that country for a specified period of time. Attendees of conferences may need to obtain a visa in order to travel to a different country to attend the event.",Viza is a subclass of Document.
target:Registration,Target,Class,Registration,"Registration in the context of a conference refers to the process of signing up or enrolling to attend the conference. This typically involves providing personal information, selecting sessions or workshops to attend, and paying any registration fees. Registration is necessary for organizers to plan for the number of attendees, allocate resources, and ensure a smooth and organized event.",Registration is a subclass of Conference_activity.
target:Conference_days,Target,Class,Conference days,"Conference_days refers to the specific days on which a conference is scheduled to take place. This term is used to indicate the duration of the conference and the days on which attendees are expected to participate in various sessions, workshops, presentations, and networking events.",Conference days are a subclass of time. One conference day is a subclass of conference days.
target:Conference_building,Target,Class,Conference building,"Conference building refers to the process of organizing and planning a conference, including selecting a venue, setting an agenda, inviting speakers, promoting the event, and managing logistics such as registration and accommodations. It also involves creating a positive and engaging atmosphere for attendees to network, learn, and collaborate.",Conference building is a subclass of building.
target:Registration_fee,Target,Class,Registration fee,"Registration fee refers to the amount of money that attendees are required to pay in order to participate in a conference. This fee typically covers the cost of organizing the event, including venue rental, catering, materials, and other expenses. Attendees are usually required to pay the registration fee in advance in order to secure their spot at the conference.",Registration fee is a subclass of fee. Author attendee book registration fee is a subclass of registration fee. Nonmember registration fee is a subclass of registration fee. Author attendee CD registration fee is a subclass of registration fee. Nonauthor registration fee is a subclass of registration fee. Member registration fee is a subclass of registration fee. Student registration fee is a subclass of registration fee.
target:Departure,Target,Class,Departure,"In the context of a conference, ""departure"" typically refers to the act of leaving the conference venue or location. This could refer to attendees leaving the conference at the end of the event, or speakers and participants leaving before the conference has concluded. Departure may also refer to the scheduled time for attendees to leave the conference venue.",Departure is a subclass of activity after conference.
target:Activity_after_conference,Target,Class,Activity after conference,"Activity_after_conference refers to any planned events, meetings, or tasks that will take place following the conclusion of a conference. This could include networking opportunities, follow-up meetings with potential partners or clients, feedback sessions, or any other activities designed to continue the momentum and impact of the conference.",Activity after conference is a subclass of activity. Departure is a subclass of Activity after conference. Full day tour is a subclass of activity after conference.
target:Conference_airport,Target,Class,Conference airport,"Conference_airport refers to an airport that is designated as the main airport for a specific conference or event. It is the airport where most attendees are expected to arrive and depart from, and may have special arrangements or services in place to accommodate the influx of conference participants.",Conference_airport is a subclass of Building.
target:Worker_lecturer,Target,Class,Worker lecturer,"A worker_lecturer is a person who is both an employee or worker in a particular field or industry, and also serves as a lecturer or presenter at a conference or seminar related to that field. This individual has practical experience and expertise in their field, and is able to share their knowledge and insights with others in a teaching or educational setting.",Worker_lecturer is a subclass of Lecturer.
target:Lecturer,Target,Class,Lecturer,A lecturer is a person who gives lectures or talks on a particular subject at a conference or academic institution. They are typically experts in their field and are responsible for delivering information and knowledge to an audience.,Lecturer is a subclass of Author. Worker_lecturer is a subclass of Lecturer. Student_lecturer is a subclass of Lecturer.
target:Transparency,Target,Class,Transparency,"Transparency in the context of a conference refers to the openness and honesty in communication and decision-making processes. It involves providing clear and accurate information to all stakeholders, including attendees, speakers, sponsors, and organizers. Transparency helps to build trust, credibility, and accountability within the conference community. This can include sharing financial information, disclosing conflicts of interest, and being open about the goals and objectives of the conference.",Transparency is a subclass of Document.
target:Speaker,Target,Class,Speaker,"In the context of a conference, a speaker is an individual who presents information, ideas, or opinions on a specific topic to an audience. Speakers are typically experts in their field and are invited to share their knowledge and insights with conference attendees. They may deliver keynote speeches, lead workshops or panel discussions, or participate in Q&A sessions. Speakers play a crucial role in shaping the content and overall experience of a conference.",
target:City,Target,Class,City,"In the context of a conference, ""City"" typically refers to the location where the conference is being held. It could also refer to the specific city or region that is the focus of the conference, such as a conference on urban planning in a particular city.","The presenter city is a subclass of city. ""Sponsor_city is a subclass of City."" Conference city is a subclass of City. ""Trip city is a subclass of city."""
target:Card,Target,Class,Card,"In the context of a conference, a card typically refers to a small piece of paper or cardstock that contains information about a specific topic, speaker, or session. These cards are often used for networking purposes, as attendees can exchange cards to share contact information or details about their work. Cards may also be used to provide attendees with schedules, maps, or other important information about the conference.",
target:Item,Target,Class,Item,"In the context of a conference, an item typically refers to a specific topic, issue, or agenda item that will be discussed, presented, or addressed during the conference. It could be a presentation, a discussion point, a decision to be made, or any other matter that is on the agenda for the conference. Each item on the agenda is usually numbered or listed in order to help keep the conference organized and on track.",Card is a subclass of Item. Audiovisual equipment is a subclass of item. Publication is a subclass of Item. Document is a subclass of Item. Transport vehicle is a subclass of item. Item range is paid with. Go through domain Item. Item is equipped by range. Prepare range item. Item is used for domain. Is signed by domain Item. Is made from domain Item. Item is made from range. Is sent after domain item. Write range Item. Is needed for domain Item. Obtain range Item. Send range item. Is sent before domain Item. Item is prepared by domain. Is used by domain Item. Item range sign. Item range needed. Item is given to domain. Item is sent by domain. The domain Item is written by.
target:Author_attendee_book_registration_fee,Target,Class,Author attendee book registration fee,"Author_attendee_book_registration_fee refers to the fee that authors or attendees must pay in order to register for the conference and receive a book or materials related to the conference. This fee typically covers the cost of the book or materials, as well as other conference expenses.",Author attendee book registration fee is a subclass of registration fee.
target:Book_proceeding,Target,Class,Book proceeding,"A book proceeding is a publication that contains the papers, presentations, and discussions from a conference or symposium. It typically includes the abstracts or full papers of the presentations given at the event, as well as any additional information or materials related to the conference. Book proceedings are often used as a way to disseminate the research and findings presented at a conference to a wider audience.",Book proceeding is a subclass of Publication.
target:Video_cassette_player,Target,Class,Video cassette player,"A video cassette player is a device used to play video recordings stored on VHS tapes. It allows users to watch movies, TV shows, or other recorded content on a television screen by inserting a VHS tape into the player and pressing play. In the context of a conference, a video cassette player may be used to show pre-recorded presentations, training videos, or other visual content to attendees.",Video cassette player is a subclass of audiovisual equipment.
target:Audiovisual_equipment,Target,Class,Audiovisual equipment,"Audiovisual equipment refers to devices and tools used to present information both visually and audibly during a conference or presentation. This can include items such as projectors, screens, microphones, speakers, and video cameras. Audiovisual equipment is essential for ensuring that all attendees can see and hear the information being presented clearly.",Audiovisual equipment is a subclass of item. Video cassette player is a subclass of audiovisual equipment. LCD projector is a subclass of audiovisual equipment. Computer is a subclass of Audiovisual_equipment. Overhead projector is a subclass of audiovisual equipment.
target:Video_presentation,Target,Class,Video presentation,"A video presentation in the context of a conference refers to a pre-recorded video that is played during a session or presentation. This video may contain information, visuals, or demonstrations related to the topic being discussed. Video presentations are often used to enhance the content of a presentation and provide a more engaging and dynamic experience for the audience.",Video presentation is a subclass of presentation.
target:Hotel_room,Target,Class,Hotel room,"In the context of a conference, a hotel room refers to a room in a hotel where conference attendees can stay during the event. These rooms are typically booked by the conference organizers for participants who are traveling from out of town. Hotel rooms provide a comfortable and convenient accommodation option for conference attendees, allowing them to rest and relax between conference sessions and activities.",A hotel room is a subclass of place. Single hotel room is a subclass of hotel room. Double hotel room is a subclass of hotel room.
target:Hotel_presenter,Target,Class,Hotel presenter,"Hotel_presenter typically refers to a person who is presenting or speaking at a conference that is being held at a hotel. This individual may be a keynote speaker, panelist, workshop leader, or any other type of presenter at the conference. The term ""hotel_presenter"" is used to specify that the presentation is taking place within a hotel setting.",The hotel presenter is a subclass of delegate.
target:Conference_hotel,Target,Class,Conference hotel,"A conference hotel is a hotel that is specifically designed to cater to the needs of conference attendees. These hotels typically have large meeting rooms, conference facilities, and other amenities that are suitable for hosting conferences, meetings, and other business events. Conference hotels often offer packages and services tailored to the needs of conference organizers and attendees, such as audiovisual equipment, catering services, and accommodations for out-of-town guests.",The conference hotel is a subclass of building.
target:Money,Target,Class,Money,"In the context of a conference, money refers to the funds or financial resources that are required to organize and host the event. This can include expenses such as venue rental, catering, speaker fees, marketing and promotional costs, and any other expenses associated with planning and executing the conference. Money may also refer to registration fees paid by attendees to participate in the conference. Proper budgeting and financial management are essential aspects of conference planning to ensure that the event is successful and sustainable.",Tip is a subclass of Money. Fee is a subclass of money. Tax is a subclass of Money. Sponzorship is a subclass of money. Is paid with domain Money. Money is paid by domain. Is paid in domain Money. Money pay range. Money is paid for domain. Money has amount of domain.
target:State,Target,Class,State,"In the context of a conference, the term ""State"" typically refers to a specific geographical or political entity, such as a country or nation. It can also refer to the condition or status of something, such as the state of affairs in a particular region or the state of a particular industry. Additionally, ""State"" can also refer to a formal announcement or declaration made by a representative of a government or organization during a conference.",Conference state is a subclass of State. Sponsor state is a subclass of State. The presenter state is a subclass of state.
target:Introduction,Target,Class,Introduction,"In the context of a conference, an introduction refers to the opening remarks or presentation that sets the tone for the event and introduces the speakers, topics, and objectives of the conference. It is typically delivered by the host or moderator of the conference to provide an overview of what attendees can expect and to welcome everyone to the event. The introduction may also include any necessary logistical information, such as the schedule, location, and rules of the conference.",Introduction is a subclass of Conference activity. Introduction of speaker is a subclass of Introduction.
target:Welcome_address,Target,Class,Welcome address,"A welcome address is a speech given at the beginning of a conference or event to welcome attendees, introduce the purpose of the event, and set the tone for the proceedings. It is typically delivered by a host or organizer of the event and is meant to make attendees feel welcome and engaged.",Welcome address is a subclass of conference activity.
target:Value_added_tax,Target,Class,Value Added Tax,"Value Added Tax (VAT) is a type of indirect tax that is imposed at each stage of the production and distribution process. It is based on the value added to a product or service at each stage of production or distribution. VAT is ultimately borne by the end consumer, as businesses collect the tax on behalf of the government and remit it to the tax authorities. In the context of a conference, VAT may be applicable on registration fees, merchandise sales, and other services provided during the event.",Value added tax is a subclass of tax.
target:Tax,Target,Class,Tax,"In the context of a conference, tax refers to the amount of money that individuals or businesses are required to pay to the government based on their income, profits, or other financial activities. Taxes are used by governments to fund public services and infrastructure. Discussions about tax at a conference may involve topics such as tax policy, tax reform, tax compliance, and tax planning.",Tax is a subclass of Money. Value added tax is a subclass of tax. Departure tax is a subclass of tax.
target:Refusing_manuscript,Target,Class,Refusing manuscript,"Refusing manuscript refers to the decision made by a conference committee or editorial board to reject a submitted manuscript for presentation or publication. This decision may be based on various factors such as the quality of the research, relevance to the conference theme, originality of the work, or adherence to submission guidelines.",Refusing manuscript is a subclass of activity before conference.
target:Final_manuscript,Target,Class,Final manuscript,"Final manuscript refers to the completed and revised version of a paper or presentation that is ready to be submitted for publication or presentation at a conference. This version has undergone all necessary revisions, edits, and formatting changes as required by the conference guidelines.",Final manuscript is a subclass of submission.
target:Accepting_manuscript,Target,Class,Accepting manuscript,"Accepting manuscript in the context of a conference refers to the process of reviewing and approving a submitted paper or research work for presentation at the conference. This typically involves a peer review process where experts in the field evaluate the quality, relevance, and originality of the manuscript before accepting it for presentation. Once a manuscript is accepted, the author is usually notified and provided with further instructions on how to prepare and present their work at the conference.",Accepting manuscript is a subclass of activity before conference.
target:Submission,Target,Class,Submission,"In the context of a conference, submission refers to the act of submitting a paper, abstract, proposal, or other type of work for consideration to be presented at the conference. This typically involves following specific guidelines and deadlines set by the conference organizers. Submissions are usually reviewed by a committee or panel of experts to determine if they meet the criteria for acceptance and presentation at the conference.",
target:Sponsor_city,Target,Class,Sponsor city,Sponsor_city refers to the city where a particular sponsor of a conference is based or located. This information is often included in conference materials to provide attendees with background information about the sponsors and their geographical presence. It can also be used to highlight local businesses or organizations that are supporting the conference.,Sponsor_city is a subclass of City.
target:Sponsor,Target,Class,Sponsor,"In the context of a conference, a sponsor is an individual or organization that provides financial or in-kind support for the event in exchange for promotional opportunities and visibility. Sponsors may contribute funds, products, services, or other resources to help cover the costs of organizing and hosting the conference. In return, sponsors typically receive recognition, branding, and exposure to the conference attendees through various marketing and promotional activities.",Sponsor is a subclass of Person.
target:Time_zone,Target,Class,Time zone,"In the context of a conference, a time zone refers to a region of the world where the same standard time is used. This is important for scheduling conference calls or virtual meetings with participants from different parts of the world, as it helps ensure that everyone is aware of the correct time for the event based on their location. Time zones are typically designated by a specific offset from Coordinated Universal Time (UTC) and may also observe daylight saving time changes.",
target:Introduction_of_speaker,Target,Class,Introduction of speaker,"Introduction of speaker refers to the act of providing background information about the individual who will be speaking at a conference. This typically includes their name, title, expertise, and any relevant accomplishments or qualifications that establish their credibility and expertise on the topic they will be discussing. The introduction of the speaker is usually done by the host or moderator of the event before the speaker takes the stage.",The introduction of the speaker is a subclass of introduction.
target:Conference_hall,Target,Class,Conference hall,"A conference hall is a large room or space specifically designed for hosting conferences, meetings, seminars, and other similar events. It typically includes seating arrangements, audiovisual equipment, and other amenities to accommodate a large number of attendees.",The conference hall is a subclass of place.
target:Plenary_lecture,Target,Class,Plenary lecture,"A plenary lecture is a presentation or speech that is delivered to all attendees of a conference or meeting. It is typically a keynote address given by a prominent speaker or expert in the field, and is intended to provide a comprehensive overview of a specific topic or issue. Plenary lectures are usually scheduled at the beginning or end of a conference, and are designed to set the tone for the rest of the event or to summarize key points and takeaways.",Plenary lecture is a subclass of lecture.
