entity,source_or_target,entity_type,initial_matching,lexical_matching,graphical_matching
source:Conference_participant,Source,Class,Conference participant,"A conference participant is an individual who attends and takes part in a conference or meeting. This person may be a speaker, presenter, panelist, attendee, or any other role involved in the conference. They are actively engaged in the discussions, presentations, and networking opportunities at the conference.",Conference participant is a subclass of Person. Active conference participant is a subclass of conference participant. Passive conference participant is a subclass of conference participant.
source:Active_conference_participant,Source,Class,Active conference participant,"Active_conference_participant refers to an individual who is actively engaged in a conference, participating in discussions, asking questions, networking with other attendees, and generally being involved in the event. This term is used to distinguish those who are actively participating from those who may be more passive or disengaged during the conference.",Active conference participant is a subclass of conference contributor. Active conference participant is a subclass of conference participant. Active conference participant disjoint with Passive conference participant. Passive conference participant disjoint with Active conference participant. Gives presentations domain Active conference participant. Active conference participant is given by range.
source:Passive_conference_participant,Source,Class,Passive conference participant,"A Passive_conference_participant refers to an individual who attends a conference but does not actively participate in discussions, presentations, or other activities. They may simply observe or listen to the proceedings without actively engaging with the content or other participants.",Passive conference participant is a subclass of conference participant. Passive conference participant disjoint with Active conference participant. Active conference participant disjoint with Passive conference participant.
source:Person,Source,Class,Person,"In the context of a conference, a person refers to an individual who is attending or participating in the event. This could include speakers, presenters, attendees, organizers, and any other individuals involved in the conference. Each person plays a role in contributing to the overall success and experience of the conference.",Conference participant is a subclass of Person. Conference applicant is a subclass of Person. Committee member is a subclass of Person. Conference contributor is a subclass of Person. Reviewer is a subclass of Person. Track workshop chair is a subclass of person. Person contributes domain. Has authors range person. Person has an email domain. Person has the first name domain. Has gender domain Person. Person has the last name domain.
source:Review_expertise,Source,Class,Review expertise,"Review_expertise refers to the level of knowledge, experience, and skill that an individual or group possesses in evaluating and providing feedback on academic papers, research projects, or presentations submitted for review at a conference. Review expertise is important in ensuring that the review process is thorough, fair, and constructive, and that high-quality work is selected for presentation at the conference.",Has a submitted contribution domain Review expertise. Has an expertise domain Review expertise. Has a review expertise range Review expertise.
source:Submitted_contribution,Source,Class,Submitted Contribution,"Submitted_contribution refers to a piece of work, such as a paper, presentation, or poster, that has been submitted by an individual or group for consideration at a conference. This contribution is typically reviewed by the conference organizers or a committee to determine if it meets the criteria for acceptance and inclusion in the conference program.",Submitted contribution is a subclass of written contribution. Reviewed contribution is a subclass of submitted contribution. Has a submitted contribution range submitted contribution. Has a review expertise domain submitted contribution.
source:Reviewer,Source,Class,Reviewer,"A reviewer in the context of a conference is an individual who evaluates and provides feedback on research papers or proposals submitted for presentation at the conference. Reviewers are typically experts in the field related to the conference topic and are responsible for assessing the quality, relevance, and originality of the submissions. Their feedback helps conference organizers make decisions on which submissions to accept for presentation.",Reviewer is a subclass of Person. Invites co-reviewers domain Reviewer. Invites co-reviewers range Reviewer. Belongs to reviewers range Reviewer. Invited by Range Reviewer. Invited by domain Reviewer. Reviewer has a review reference or expertise domain.
source:Regular_author,Source,Class,Regular author,A Regular_author in the context of a conference refers to an individual who has submitted a paper or presentation for consideration at the conference and is not a keynote speaker or invited guest. Regular authors typically present their work during a specific session or panel at the conference.,Regular author is a subclass of conference contributor. Contribution by the first author is a subclass of regular author. Contribution co-author is a subclass of regular author.
source:Conference_contributor,Source,Class,Conference contributor,"A conference_contributor is an individual who has made a contribution to a conference, such as presenting a paper, participating in a panel discussion, or organizing a workshop. They are actively involved in the conference proceedings and play a role in shaping the content and discussions at the event.",Conference contributor is a subclass of Person. Regular author is a subclass of conference contributor. Active conference participant is a subclass of conference contributor. Invited speaker is a subclass of conference contributor.
source:Contribution_1th-author,Source,Class,Contribution 1th author,Contribution_1th-author refers to the first author of a paper or presentation who has made a significant contribution to the research or work being presented at the conference. This designation is often used to highlight the primary author's role in the project and their level of involvement in the research.,Contribution by the first author is a subclass of regular author. Contribution by first author is disjoint with contribution by co-author. Contribution co-author disjoint with Contribution 1th-author.
source:Contribution_co-author,Source,Class,Contribution co author,"Contribution_co-author refers to a person who has contributed to a research paper, presentation, or project alongside the main author. They may have provided input, data, analysis, or other forms of support to the primary author. Their contribution is acknowledged in the conference proceedings or presentation materials.",Contribution co-author is a subclass of regular author. Contribution co-author disjointWith Contribution 1th-author. Contribution by first author is disjoint with Contribution by co-author.
source:Conference_contribution,Source,Class,Conference Contribution,"Conference_contribution refers to the specific contribution or presentation that an individual or group makes at a conference. This can include presenting research findings, sharing insights or expertise on a particular topic, leading a workshop or panel discussion, or participating in a poster session. Conference contributions are an important aspect of academic and professional conferences, as they allow attendees to share knowledge, collaborate with others in their field, and contribute to the overall body of research and knowledge in their respective fields.",Conference contribution is a subclass of conference document. Written contribution is a subclass of conference contribution. Poster is a subclass of Conference_contribution. Presentation is a subclass of Conference_contribution. Is submitted at domain Conference contribution. Has contributions range conference contribution.
source:Co-chair,Source,Class,Co chair,"In the context of a conference, a co-chair refers to an individual who shares the responsibilities and duties of leading and organizing the conference with another person. Co-chairs typically work together to plan the agenda, select speakers, coordinate logistics, and oversee the overall execution of the conference. They may also serve as moderators or facilitators during conference sessions. Having co-chairs can help distribute the workload and ensure that different perspectives and expertise are represented in the planning and decision-making process.",Co-chair is a subclass of Committee_member. Has a committee co-chair range co-chair. Was a committee co-chair of domain Co-chair.
source:Committee,Source,Class,Committee,"In the context of a conference, a committee is a group of individuals who are appointed or elected to oversee specific tasks or responsibilities related to the planning, organization, and execution of the conference. Committees may be responsible for various aspects of the conference, such as program development, logistics, marketing, sponsorship, and budgeting. Each committee typically has a chairperson or leader who is responsible for coordinating the efforts of committee members and reporting back to the larger conference organizing team. Committees play a crucial role in ensuring that the conference runs smoothly and successfully.",Program committee is a subclass of committee. Steering committee is a subclass of Committee. The organizing committee is a subclass of committee. Committee has members. Committee has a range Committee. Was a member of Range Committee. Committee was a committee of domain Committee. Has a committee co-chair domain Committee. Has a committee chair domain Committee. Was a committee co-chair of Range Committee. Was a committee chair of Range Committee.
source:Committee_member,Source,Class,Committee member,"A committee member is an individual who is part of a group of people appointed or elected to perform a specific task or function within an organization or event, such as a conference. Committee members are responsible for making decisions, planning and organizing activities, and overseeing the overall operation of the committee. They may also be involved in reviewing proposals, setting agendas, and representing the committee to external stakeholders.",Committee member is a subclass of Person. Co-chair is a subclass of Committee_member. Chair is a subclass of Committee member. Has members range Committee member. Was a member of domain Committee member.
source:Abstract,Source,Class,Abstract,"In the context of a conference, an abstract is a brief summary of a research paper, presentation, or project that is submitted for consideration to be included in the conference program. It typically includes the purpose of the study, the methodology used, the results obtained, and the conclusions drawn. Abstracts are used by conference organizers to evaluate the quality and relevance of submissions and to help attendees decide which presentations to attend.",Abstract is a subclass of Extended_abstract. Has an abstract range abstract. Is the first part of domain Abstract.
source:Extended_abstract,Source,Class,Extended Abstract,"An extended abstract is a summary of a research paper or project that provides more detailed information than a regular abstract. It typically includes a brief introduction, methodology, results, and conclusions of the research, as well as any relevant figures or tables. Extended abstracts are often used in academic conferences to give attendees a more in-depth understanding of the research being presented.",Extended abstract disjoint with Paper. Extended abstract is a subclass of regular contribution. Abstract is a subclass of Extended_abstract. Paper disjointWith Extended_abstract.
source:Important_dates,Source,Class,Important dates,"Important_dates in the context of a conference refer to specific dates that are significant for the conference organizers, presenters, attendees, and other stakeholders. These dates typically include deadlines for submitting abstracts, papers, or proposals, early bird registration deadlines, notification of acceptance dates, final paper submission deadlines, and the actual dates of the conference itself. It is important for participants to be aware of these important dates in order to ensure they meet deadlines and make necessary arrangements to attend the conference.",Has important dates range important dates. Is an abstract submission date domain important dates. Is a full paper submission date domain Important dates. Is an ending date domain Important_dates. Is a date of acceptance announcement domain Important_dates. Is a date of camera ready paper submission domain Important dates. Is a starting date domain Important dates. Belong to a conference volume domain important dates.
source:Invited_speaker,Source,Class,Invited speaker,"An invited speaker is a person who has been specifically asked to speak at a conference or event. They are typically experts in their field and are invited to share their knowledge, insights, and expertise with the audience. Invited speakers are often chosen for their reputation, experience, and ability to engage and educate the audience.",Invited speaker is a subclass of conference contributor.
source:Conference_proceedings,Source,Class,Conference proceedings,"Conference proceedings refer to a collection of academic papers or presentations that are presented at a conference. These proceedings typically include abstracts, papers, posters, or slides from the presentations given at the conference. They are often published in a book or online format after the conference has taken place, allowing attendees and others in the field to access and reference the information presented at the conference.",Has an ISBN domain conference proceedings. Has a publisher domain conference proceedings. Has a volume domain Conference proceedings. Issues range conference proceedings.
source:Information_for_participants,Source,Class,Information for participants,"Information for participants refers to any relevant details, instructions, or resources provided to individuals attending a conference. This may include schedules, agendas, speaker bios, venue information, registration details, and any other information that participants may need to know in order to fully participate in the conference. It is typically distributed before the event to ensure that attendees are well-prepared and informed.",Information for participants is a subclass of conference document.
source:Conference_document,Source,Class,Conference document,"A conference document is a written or digital material that is prepared for or distributed at a conference. It can include agendas, schedules, presentations, reports, research papers, and other relevant information related to the conference. These documents are typically used to provide attendees with important information, facilitate discussions, and serve as a reference for future use.",Information for participants is a subclass of conference document. Call for paper is a subclass of conference document. Conference announcement is a subclass of conference document. Conference contribution is a subclass of conference document. Review is a subclass of Conference_document. Call for participation is a subclass of conference document. Conference_www is a subClassOf Conference_document. Contributes range Conference_document. The domain Conference_document has authors. Has a date of issue domain Conference document.
source:Organization,Source,Class,Organization,"In the context of a conference, organization refers to the planning, coordination, and management of the event. This includes tasks such as setting the agenda, securing speakers, arranging logistics such as venue, catering, and accommodations, promoting the conference, and ensuring that everything runs smoothly during the event. The organization of a conference is crucial for its success and effectiveness in achieving its goals.",
source:Regular_contribution,Source,Class,Regular contribution,"Regular contribution refers to a scheduled or recurring submission of content, such as papers, presentations, or articles, to a conference or event. This could be in the form of regular presentations, workshops, or panel discussions that a participant or speaker is expected to contribute on a consistent basis throughout the duration of the conference.",Regular contribution disjoint with invited talk. Regular contribution is disjoint with Poster. Regular contribution is a subclass of written contribution. Poster disjointWith Regular contribution. Invited talk disjoint with Regular contribution. Extended abstract is a subclass of regular contribution. Paper is a subclass of regular contribution.
source:Poster,Source,Class,Poster,"In the context of a conference, a poster refers to a visual presentation of research or information that is displayed on a large board or wall for attendees to view. Posters typically include a combination of text, images, and graphs to convey key points and findings of a study or project. Presenters often stand by their posters during designated poster sessions to discuss their work with conference attendees and answer questions. Posters are a common format for presenting research at academic and professional conferences.",
source:Written_contribution,Source,Class,Written Contribution,"A written contribution in the context of a conference refers to a document or paper that is submitted by a participant for presentation or discussion at the conference. This written contribution could be a research paper, a case study, a report, or any other type of document that contributes to the overall theme or topic of the conference. Written contributions are typically reviewed by the conference organizers or a committee before being accepted for presentation at the conference.",Written contribution is a subclass of conference contribution. Submitted contribution is a subclass of written contribution. Regular contribution is a subclass of written contribution.
source:Conference_applicant,Source,Class,Conference applicant,A conference applicant refers to an individual who has applied to attend a conference. This person has expressed interest in participating in the conference and has submitted an application to be considered for attendance.,Conference applicant is a subclass of Person. Registered applicant is a subclass of Conference applicant.
source:Camera_ready_contribution,Source,Class,Camera ready contribution,A camera-ready contribution refers to a final version of a paper or presentation that is ready to be published or presented at a conference. This version has been revised and formatted according to the conference guidelines and is considered the final version that will be included in the conference proceedings.,Camera ready contribution is a subclass of accepted contribution.
source:Accepted_contribution,Source,Class,Accepted Contribution,"Accepted_contribution refers to a submission, such as a paper, presentation, or poster, that has been reviewed and approved by the conference organizers for inclusion in the conference program. This means that the contribution has met the criteria set by the conference committee and is deemed to be of high quality and relevance to the conference theme. Accepted contributions are typically presented at the conference either orally or in poster format.",Accepted contribution disjointWith Rejected contribution. Accepted contribution is a subclass of reviewed contribution. Camera ready contribution is a subclass of accepted contribution. Rejected contribution disjoint with Accepted contribution.
source:Program_committee,Source,Class,Program committee,"A Program Committee is a group of individuals responsible for selecting and organizing the presentations, panels, workshops, and other activities that will be included in a conference program. They review submissions, evaluate the quality and relevance of proposed content, and make decisions on which submissions to accept or reject. The Program Committee plays a crucial role in shaping the overall agenda and content of the conference.",Program committee is a subclass of committee. Program committee disjointWith Organizing committee. Program committee is disjoint with Steering committee. Steering committee disjoint with Program committee. The organizing committee is disjoint with the program committee. There was a program committee of domain Program_committee. Has a program committee range program committee.
source:Organizing_committee,Source,Class,Organizing committee,"The organizing committee of a conference is responsible for planning, coordinating, and overseeing all aspects of the event. This includes selecting the venue, setting the agenda, inviting speakers, managing registrations, and ensuring that the conference runs smoothly. The organizing committee is typically made up of a group of individuals who have expertise in the subject matter of the conference and who are dedicated to ensuring its success.",The organizing committee is a subclass of committee. The organizing committee is disjoint with the program committee. Organizing committee disjointWith Steering committee. Program committee disjointWith Organizing committee. Steering committee disjointWith Organizing committee. There was an organizing committee of domain Organizing_committee. Has an organizing committee range Organizing committee.
source:Steering_committee,Source,Class,Steering committee,"A steering committee is a group of individuals responsible for setting the overall direction and goals of a conference. They provide guidance and oversight to ensure that the conference stays on track and meets its objectives. The steering committee may be made up of key stakeholders, organizers, sponsors, and other relevant parties who have a vested interest in the success of the conference. They typically meet regularly to make decisions, allocate resources, and address any issues that may arise during the planning and execution of the conference.",Steering committee disjointWith Program committee. Steering committee disjointWith Organizing committee. Steering committee is a subclass of Committee. Program committee disjoint with Steering committee. Organizing committee disjointWith Steering committee. Has a steering committee range steering committee. There was a steering committee of domain Steering committee.
source:Conference_volume,Source,Class,Conference volume,"In the context of a conference, a conference volume refers to a collection of papers or presentations that were presented at the conference. These volumes are typically published after the conference and serve as a record of the research and discussions that took place during the event. They are often used by researchers and scholars in the field to stay updated on the latest developments and findings in their area of study.",Conference volume is a subclass of Conference. There was an organizing committee of range Conference volume. Was a program committee of range Conference volume. Has parts domain Conference volume. Has workshops domain conference volume. Is submitted at range Conference volume. Has tracks domain conference volume. Has tutorials domain conference volume. Has a committee domain Conference volume. Has a steering committee domain Conference volume. There was a steering committee of range Conference volume. Has an organizing committee domain conference volume. Was a committee of range Conference volume. Has important dates domain conference volume. Has contributions domain Conference volume. Is part of conference volumes range conference volume. Has a location domain conference volume. Has a program committee domain Conference volume. Belong to a conference volume range conference volume.
source:Conference,Source,Class,Conference,"A conference is a formal meeting where individuals gather to discuss a particular topic, share information, exchange ideas, and make decisions. Conferences can be held for various purposes such as academic, business, professional development, or networking. They typically involve presentations, workshops, panel discussions, and networking opportunities.",Conference volume is a subclass of Conference.
source:Call_for_paper,Source,Class,Call for paper,"Call for papers is a formal invitation for researchers, scholars, and experts to submit their research papers or proposals for presentation at a conference. It outlines the theme of the conference, the topics of interest, and the submission guidelines for potential presenters. This call is typically distributed through various channels such as academic journals, websites, and email lists to attract a diverse range of submissions from different fields of study.",Call for paper is a subclass of conference document.
source:Conference_announcement,Source,Class,Conference announcement,"A conference announcement is a formal communication or notification that is sent out to inform individuals about an upcoming conference. It typically includes details such as the date, location, theme, speakers, agenda, registration information, and any other relevant details about the conference. The purpose of a conference announcement is to generate interest and encourage individuals to attend the conference.",Conference announcement is a subclass of conference document.
