entity,source_or_target,entity_type,initial_matching,lexical_matching,graphical_matching
source:Administrator,Source,Class,administrator,"In the context of a conference, an Administrator is a person who is responsible for managing and organizing the event. This can include tasks such as scheduling, coordinating with speakers and attendees, managing registration, overseeing technical aspects, and handling any issues or problems that arise. They ensure the smooth running of the conference and are key to its success.",An Administrator is a subclass of User. The action of finalizing paper assignment is within the domain of an Administrator. The domain of runPaperAssignmentTools is Administrator. The domain of enabling a virtual meeting is an Administrator. The domain of startReviewerBidding is Administrator. The finalization of paper assignment is in the range of an Administrator. The domain of 'assignReviewer' is 'Administrator'. The review criteria is entered by someone in the range of an Administrator. The domain of rejectPaper is Administrator. The property 'assignedByAdministrator' has a range of 'Administrator'. The range of tools run by paper assignment is Administrator. The virtual meeting is enabled by the range of the Administrator. The hardcopy mailing manifests are printed by the range administrator. The domain of entering conference details is the Administrator. The action of printing hardcopy mailing manifests is within the domain of an Administrator. The domain of setMaxPapers is Administrator. The details are entered by someone who falls within the range of an Administrator. The reviewer bidding started by is in the range of Administrator. The domain of 'enterReviewCriteria' is 'Administrator'. The domain of 'acceptPaper' is 'Administrator'. The 'addedBy' is in the range of 'Administrator'. The term 'acceptedBy' has a range that includes 'Administrator'. The term 'rejectedBy' has a range that includes 'Administrator'. An Administrator can add a Program Committee Member.
source:Meta-Review,Source,Class,meta review,"A Meta-Review in the context of a conference is a summary or overview of multiple reviews of a particular paper or presentation. It is typically written by a senior reviewer or the program chair and provides an overall assessment of the work, taking into account the feedback from all the individual reviewers. This helps in making the final decision about the acceptance or rejection of the paper or presentation for the conference.",Meta-Review is a subclass of Review.
source:assignedByReviewer,Source,Property,assigned by reviewer,"In the context of a conference, 'assignedByReviewer' typically refers to tasks, papers, or responsibilities that have been assigned by a reviewer. This could be a reviewer assigning a paper to another reviewer for evaluation, or assigning tasks related to the conference proceedings. The specific meaning can vary depending on the context and the specific conference's procedures.",The property 'assignedByReviewer' has a range of 'Reviewer'. The action of being assigned by a reviewer is the inverse of assigning an external reviewer. The domain of 'assignedByReviewer' is 'ExternalReviewer'. The action of assigning an external reviewer is the inverse of being assigned by a reviewer.
source:hasDecision,Source,Property,has decision,"In the context of a conference, 'hasDecision' typically refers to the status of a submission or proposal. It means a decision has been made regarding the submission, such as whether it has been accepted, rejected, or requires revisions.",The domain of 'hasDecision' is 'Paper'. The range of 'hasDecision' is 'Decision'.
source:readByReviewer,Source,Property,read by reviewer,"In the context of a conference, 'readByReviewer' typically refers to a paper or abstract that has been read and evaluated by a reviewer. This is part of the peer review process, where experts in the field assess the quality and validity of the research before it is presented at the conference.",The property 'readByReviewer' has a range of 'Reviewer'. The domain of 'readByReviewer' is 'Paper'. The reviewer who read is the inverse of the paper that was read. The action of reading a paper is the inverse of being read by a reviewer.
source:hasConflictOfInterest,Source,Property,has conflict of interest,"In the context of a conference, 'hasConflictOfInterest' typically refers to a situation where a person or entity involved in the conference (such as a speaker, organizer, or sponsor) has a personal or financial interest that could potentially influence their decisions or actions related to the conference. This could include things like a financial stake in a company whose products are being discussed, a personal relationship with a speaker, or a bias towards a particular viewpoint or topic. It's generally considered important to disclose any potential conflicts of interest to maintain transparency and integrity.",A person has a domain of conflict of interest. The range of 'hasConflictOfInterest' is 'Document'.
source:finalizePaperAssignment,Source,Property,finalize paper assignment,"FinalizePaperAssignment in the context of a conference refers to the process of assigning each submitted paper or presentation to a specific reviewer or panel. This is typically done after all submissions have been received and the review process is about to begin. The assignment is usually based on the reviewer's expertise or interest in the topic of the paper. Once the assignment is finalized, it means no further changes can be made.",The action of finalizing paper assignment is within the domain of an Administrator. Finalize paper assignment is the inverse of paper assignment finalized by. The action of finalizing paper assignment is applicable to the range of a conference. The paper assignment is finalized by someone is the inverse of someone finalizes the paper assignment.
source:paperAssignmentFinalizedBy,Source,Property,paper assignment finalized by,"In the context of a conference, 'paperAssignmentFinalizedBy' likely refers to the date or person by whom the final assignment of papers to reviewers or sessions was completed. This could be a deadline by which all papers must be assigned for review, or the individual who is responsible for finalizing these assignments.",The paper assignment is finalized by someone in the range of an Administrator. The domain of 'paperAssignmentFinalizedBy' is 'Conference'. The paper assignment is finalized by someone is the inverse of someone finalizes the paper assignment. Finalize paper assignment is the inverse of paper assignment finalized by.
source:hasConferenceMember,Source,Property,has conference member,"In the context of a conference, 'hasConferenceMember' typically refers to a function or property in a data model or software system that indicates whether a particular person or entity is a member or participant of the conference. It could be used to check if a person is registered, has paid the conference fee, or has any role in the conference such as a speaker, attendee, organizer, etc.",The property 'hasConferenceMember' has a range of 'ConferenceMember'. The domain of 'hasConferenceMember' is 'Conference'. The entity 'hasConferenceMember' is the inverse of 'memberOfConference'. Being a member of a conference is the inverse of having a conference member.
source:memberOfConference,Source,Property,member of conference,"In the context of a conference, 'memberOfConference' typically refers to an individual or entity that is part of the conference in some capacity. This could mean they are a speaker, attendee, sponsor, organizer, or have some other role within the conference.",A member of a conference is in the domain of a conference member. Being a member of a conference is the inverse of having a conference member. The member of a conference is within the range of the conference. The entity 'hasConferenceMember' is the inverse of 'memberOfConference'.
source:runPaperAssignmentTools,Source,Property,run paper assignment tools,"In the context of a conference, 'runPaperAssignmentTools' likely refers to a software or program used to assign academic papers or presentations to specific sessions or reviewers. This tool would help in organizing the conference by ensuring that each paper or presentation is properly scheduled and assigned for review or presentation. It could also help in matching papers with appropriate reviewers based on their expertise.",The range of the tool 'runPaperAssignmentTools' is 'Conference'. The domain of runPaperAssignmentTools is Administrator. The tool 'runPaperAssignmentTools' is operated by 'paperAssignmentToolsRunBy'. The tools that run the paper assignment are run by the paper assignment tools.
source:paperAssignmentToolsRunBy,Source,Property,paper assignment tools run by,"The term 'paperAssignmentToolsRunBy' is not a standard term used in the context of conferences. It could potentially refer to the person or system responsible for assigning academic papers or presentations to specific sessions or panels during a conference, but without more context, its meaning is unclear. It's possible that this could be a specific term used by a certain conference management software.",The tools that run the paper assignment are run by the paper assignment tools. The tools for paper assignment are run by an entity in the range of an Administrator. The domain of paperAssignmentToolsRunBy is Conference. The tool 'runPaperAssignmentTools' is the inverse of 'paperAssignmentToolsRunBy'.
source:enableVirtualMeeting,Source,Property,enable virtual meeting,"EnableVirtualMeeting typically refers to a setting or feature that allows a conference to be held online or in a virtual environment. This could involve the use of video conferencing tools, chat platforms, or other digital communication technologies. When this feature is enabled, participants can join the conference remotely from their own locations.",The domain of enabling a virtual meeting is an Administrator. The range of enabling a virtual meeting is a conference. Enabling a virtual meeting is the inverse of a virtual meeting being enabled by something. Virtual meeting is enabled by is the inverse of enable virtual meeting.
source:virtualMeetingEnabledBy,Source,Property,virtual meeting enabled by,"In the context of a conference, 'virtualMeetingEnabledBy' likely refers to the platform or service that is enabling the virtual meeting to take place. This could be a video conferencing software like Zoom, Microsoft Teams, Google Meet, etc. It could also refer to the individual or group who set up the virtual meeting capabilities for the conference.",The domain of 'virtualMeetingEnabledBy' is 'Conference'. The virtual meeting is enabled by the range of the Administrator. Virtual meeting is enabled by is the inverse of enable virtual meeting. Enabling a virtual meeting is the inverse of a virtual meeting being enabled by something.
source:hasProgramCommitteeMember,Source,Property,has program committee member,"In the context of a conference, 'hasProgramCommitteeMember' refers to a person who is a member of the program committee. The program committee is responsible for planning and coordinating the various sessions and events that make up the conference. This can include selecting speakers, deciding on the schedule, and overseeing the overall content of the conference.",The domain of 'hasProgramCommitteeMember' is 'ProgramCommittee'. Having a program committee member is the inverse of being a member of a program committee. The range of 'hasProgramCommitteeMember' is 'ProgramCommitteeMember'. Being a member of a program committee is the inverse of having a program committee member.
source:memberOfProgramCommittee,Source,Property,member of program committee,"In the context of a conference, a member of the Program Committee is an individual who is part of a group responsible for selecting and organizing the presentations, workshops, and sessions that will take place during the conference. They review submissions, decide on the conference agenda, and may also be involved in other aspects such as inviting keynote speakers.",Being a member of a program committee is the inverse of having a program committee member. A member of the program committee is in the domain of the program committee member. A member of the program committee is within the range of the program committee. Having a program committee member is the inverse of being a member of a program committee.
source:startReviewerBidding,Source,Property,start reviewer bidding,"StartReviewerBidding is a phase in the conference review process where reviewers are allowed to bid or express their interest in reviewing specific papers or topics. This process helps in assigning papers to reviewers who have expertise or interest in the paper's subject, thereby ensuring a more accurate and thorough review.",The domain of startReviewerBidding is Administrator. The range of the start of reviewer bidding is related to the conference. The process of 'startReviewerBidding' is the inverse of the process 'reviewerBiddingStartedBy'. The event of reviewer bidding being started is initiated by the action of starting reviewer bidding.
source:reviewerBiddingStartedBy,Source,Property,reviewer bidding started by,"In the context of a conference, 'reviewerBiddingStartedBy' likely refers to the individual or entity that initiated the process of reviewer bidding. Reviewer bidding is a process where reviewers (usually academics or professionals in the field) express their interest or preference in reviewing certain papers or topics. This helps in assigning reviewers to papers that match their expertise.",The domain of 'reviewerBiddingStartedBy' is 'Conference'. The event of 'reviewerBiddingStartedBy' is the inverse of 'startReviewerBidding'. The reviewer bidding started by is in the range of Administrator. The process of 'startReviewerBidding' is the inverse of the process 'reviewerBiddingStartedBy'.
source:assignReviewer,Source,Property,assign reviewer,"In the context of a conference, 'assignReviewer' typically refers to the process of selecting or appointing a specific individual to review a submitted paper or presentation. This person is responsible for evaluating the content for quality, relevance, and adherence to the conference's guidelines. They provide feedback and recommendations on whether the submission should be accepted, revised, or rejected.",The action 'assignReviewer' is the inverse of the action 'assignedByAdministrator'. The action 'assignReviewer' can have a range of 'Reviewer'. The domain of 'assignReviewer' is 'Administrator'. The action of being assigned by an administrator is the inverse of assigning a reviewer.
source:assignedByAdministrator,Source,Property,assigned by administrator,"AssignedByAdministrator typically refers to tasks, roles, permissions, or responsibilities that are given or assigned to a particular individual or group by an administrator or organizer of the conference. This could include things like moderating a panel, overseeing a workshop, managing technical aspects, etc.",The property 'assignedByAdministrator' has a range of 'Administrator'. The action of being assigned by an administrator is the inverse of assigning a reviewer. The domain of 'assignedByAdministrator' is 'Reviewer'. The action 'assignReviewer' is the inverse of the action 'assignedByAdministrator'.
source:reviewCriteriaEnteredBy,Source,Property,review criteria entered by,"In the context of a conference, 'reviewCriteriaEnteredBy' likely refers to the specific criteria or guidelines entered by a particular individual or group (such as a conference organizer or committee) that will be used to review and evaluate submissions or presentations. This could include factors like relevance to the conference theme, originality, quality of research, etc.",The review criteria is entered by someone in the range of an Administrator. The review criteria is entered by someone is the inverse of someone enters the review criteria. The review criteria is entered by the domain of the conference. The action 'enterReviewCriteria' is the inverse of 'reviewCriteriaEnteredBy'.
source:enterReviewCriteria,Source,Property,enter review criteria,"In the context of a conference, 'enterReviewCriteria' likely refers to the process of inputting or establishing the criteria or standards that will be used to review and evaluate presentations, papers, or proposals. This could include factors such as relevance to the conference theme, originality, quality of research, clarity of presentation, etc. This is typically done by the conference organizers or a review committee.",The action 'enterReviewCriteria' is the inverse of 'reviewCriteriaEnteredBy'. The domain of 'enterReviewCriteria' is 'Administrator'. The range of 'enterReviewCriteria' is 'Conference'. The review criteria is entered by someone is the inverse of someone enters the review criteria.
source:hasCo-author,Source,Property,has co-author,"In the context of a conference, 'hasCo-author' refers to a situation where a particular paper or presentation has been written or prepared by more than one author. It indicates a collaborative effort in producing the work that is being presented.",Having a co-author is the inverse of co-writing a paper. The range of 'hasCo-author' is 'Co-author'. A paper has a co-author. Co-writing a paper is the inverse of having a co-author.
source:co-writePaper,Source,Property,co write paper,"In the context of a conference, co-writePaper refers to the act of two or more individuals collaborating to write a research paper or academic article. This paper is often presented at the conference and may be published in the conference proceedings. The co-authors share responsibility for the content and findings of the paper.",Co-writing a paper is the inverse of having a co-author. The range of co-writing a paper is a paper. The domain of co-writing a paper is a co-author. Having a co-author is the inverse of co-writing a paper.
source:rejectPaper,Source,Property,reject paper,"In the context of a conference, 'rejectPaper' refers to the decision made by the conference committee or reviewers to not accept a submitted paper for presentation or publication. This could be due to various reasons such as the paper not meeting the required standards, not being relevant to the conference theme, or not being of sufficient quality.",The range of the action 'rejectPaper' is 'Paper'. The action 'rejectPaper' is the inverse of being 'rejectedBy'. The domain of rejectPaper is Administrator. The entity 'rejectedBy' is the inverse of 'rejectPaper'.
source:endReview,Source,Property,end review,"In the context of a conference, 'endReview' typically refers to the conclusion of a process where presentations, papers, or proposals have been evaluated or critiqued. This could be done by a panel or committee to determine the suitability or quality of the content for the conference. Once the review process is completed, they may provide feedback or decisions regarding the acceptance of the content.",The domain of endReview is ProgramCommitteeChair. The range of 'endReview' is 'Review'.
source:hasBid,Source,Property,has bid,"In the context of a conference, 'hasBid' typically refers to a system where reviewers or committee members can express their interest or preference in reviewing certain papers or proposals. They 'bid' on the ones they are interested in or feel qualified to review. This helps in the assignment process of papers to reviewers.",The domain of 'hasBid' is 'Paper'. The range of 'hasBid' is 'Bid'.
source:adjustBid,Source,Property,adjust bid,"In the context of a conference, 'adjustBid' doesn't seem to have a specific meaning. It might be related to bidding on conference-related items or services, such as sponsorship opportunities or vendor spaces. In this case, 'adjustBid' would mean to change the amount of money one is willing to pay for these opportunities. However, without more specific context, it's hard to provide a precise definition. It's also possible that 'adjustBid' could be a term specific to a certain conference or industry, in which case its meaning would depend on that specific context.",The action 'adjustBid' is the inverse of being 'adjustedBy'. The domain of 'adjustBid' is 'Reviewer'. The range of adjustBid is Bid. The term 'adjustedBy' is the inverse of 'adjustBid'.
source:adjustedBy,Source,Property,adjusted by,"In the context of a conference, 'adjusted by' could refer to changes or modifications made by a particular person or entity. For example, the schedule or agenda of the conference might be 'adjusted by' the conference organizers to accommodate a new speaker or event. It could also refer to changes in the conference's budget, venue, or other aspects. The specific meaning would depend on the context in which the term is used.",The domain of 'adjustedBy' is 'Bid'. The term 'adjustedBy' has a range that includes the entity 'Reviewer'. The term 'adjustedBy' is the inverse of 'adjustBid'. The action 'adjustBid' is the inverse of 'adjustedBy'.
source:readPaper,Source,Property,read paper,"In the context of a conference, 'readPaper' typically refers to the act of presenting a scholarly paper or research findings. The presenter would read out their paper, often accompanied by a slide presentation, to the audience. This allows for the sharing of research, ideas, and findings with peers and colleagues.",The action of reading a paper is the inverse of being read by a reviewer. The action of reading a paper is applicable to the range of Paper. The action of reading a paper is within the domain of a Reviewer. The reviewer who read is the inverse of the paper that was read.
source:hardcopyMailingManifestsPrintedBy,Source,Property,hardcopy mailing manifests printed by,"The term 'hardcopyMailingManifestsPrintedBy' is not a standard term in the context of conferences. However, it seems to refer to the physical (hardcopy) mailing lists or manifests (documents listing passengers or cargo) that are printed by a specific individual or organization. In a conference setting, this could be a list of attendees or participants that is printed and mailed out for various purposes.",Hardcopy mailing manifests are printed by is the inverse of print hardcopy mailing manifests. The hardcopy mailing manifests are printed by the domain conference. Hardcopy mailing manifests are printed by the range administrator. Printing hardcopy mailing manifests is the inverse of hardcopy mailing manifests being printed by.
source:printHardcopyMailingManifests,Source,Property,print hardcopy mailing manifests,"PrintHardcopyMailingManifests likely refers to the action of printing a physical list or document that contains the mailing addresses of all the attendees or participants of a conference. This list can be used for sending out physical mail such as invitations, tickets, promotional materials, or other conference-related information.",The action of printing hardcopy mailing manifests is applicable to the context of a conference. Printing hardcopy mailing manifests is the inverse of hardcopy mailing manifests being printed by. The action of printing hardcopy mailing manifests is within the domain of an Administrator. Hardcopy mailing manifests are printed by is the inverse of print hardcopy mailing manifests.
source:markConflictOfInterest,Source,Property,mark conflict of interest,"In the context of a conference, markConflictOfInterest refers to the process of identifying and indicating a conflict of interest between a reviewer and a specific paper. This could be due to a variety of reasons such as personal, professional, or financial relationships that could potentially influence the reviewer's objectivity. Once a conflict of interest is marked, the reviewer is prohibited from bidding on, being assigned to, or viewing review submissions for that paper to ensure the fairness and integrity of the review process.",The term 'markConflictOfInterest' has a range of 'Paper'.
source:enterConferenceDetails,Source,Property,enter conference details,"In the context of a conference, 'enterConferenceDetails' typically refers to the action of inputting specific information about the conference into a system or form. This could include details such as the conference name, date, time, location, topics to be discussed, names of speakers, and other relevant information. This is often done during the planning stages of the conference, and the details entered may be used for scheduling, promotion, and other organizational purposes.",The domain of entering conference details is the Administrator. The action of entering conference details is the inverse of the details being entered by someone. The action 'enterConferenceDetails' has a range of 'Conference'. The details entered by someone is the inverse of someone entering conference details.
source:detailsEnteredBy,Source,Property,details entered by,"In the context of a conference, 'detailsEnteredBy' likely refers to the person who entered the details or information about the conference into a system or database. This could include information such as the date and time of the conference, the location, the speakers, the topics to be discussed, etc.",The details were entered by the domain of the Conference. The details entered by someone is the inverse of someone entering conference details. The details are entered by someone in the range of an Administrator. Entering conference details is the inverse of details being entered by someone.
