entity,source_or_target,entity_type,initial_matching,lexical_matching,graphical_matching
source:hasBeenAssigned,Source,Property,has been assigned,"In the context of a conference, 'hasBeenAssigned' typically refers to a task, role, presentation, or responsibility that has been given or allocated to a specific person or group. For example, a speaker may have been assigned a time slot to present their research, or a team may have been assigned to handle the logistics of the event.",Has been assigned is the inverse of assigned to. The range of 'hasBeenAssigned' is 'Paper'. The domain of 'hasBeenAssigned' is 'Reviewer'. AssignedTo is the inverse of HasBeenAssigned.
source:assignedTo,Source,Property,assigned to,"In the context of a conference, 'assignedTo' typically refers to tasks, roles, or responsibilities that have been allocated to a specific individual, group, or team. This could include tasks like managing a specific session, handling registration, overseeing technical support, etc.",The domain of 'assignedTo' is 'Paper'. The entity 'assignedTo' is the inverse of 'hasBeenAssigned'. The property 'assignedTo' has a range of 'Reviewer'. Has been assigned is the inverse of assigned to.
source:setMaxPapers,Source,Property,set max papers,"In the context of a conference, 'setMaxPapers' is likely a function or command used in a conference management software. It sets the maximum number of papers or presentations that can be accepted or scheduled for the conference. This could be due to time constraints, space limitations, or to maintain a certain level of quality and relevance.",The domain of setMaxPapers is Administrator. The range of 'setMaxPapers' is 'ProgramCommitteeMember'.
source:hasSubjectArea,Source,Property,has subject area,"In the context of a conference, 'hasSubjectArea' refers to the specific topic or field of study that the conference is focused on. This could be anything from computer science, to psychology, to environmental science, depending on the nature of the conference. It's the main theme or subject matter that the conference's presentations, discussions, and workshops will revolve around.",The 'hasSubjectArea' is in the range of 'SubjectArea'. The subject area of a paper is its domain.
source:submitPaper,Source,Property,submit paper,"In the context of a conference, 'submitPaper' typically refers to the action of sending in a research paper or academic article for consideration to be presented at the conference. This process often involves a review by a panel or committee, who decide whether or not the paper is suitable for the conference.",The domain of submitting a paper is the author. The range of submitting a paper is a paper.
source:acceptPaper,Source,Property,accept paper,"In the context of a conference, 'acceptPaper' refers to the decision made by the conference organizers or committee to accept a submitted paper for presentation or publication in the conference proceedings. This usually follows a review process where the paper's relevance, quality, and contribution to the field are evaluated.",The action 'acceptPaper' is the inverse of 'acceptedBy'. The domain of accepting a paper is an Administrator. The range of accepting a paper is a paper. The term 'acceptedBy' is the inverse of 'acceptPaper'.
source:hasAuthor,Source,Property,has author,"In the context of a conference, 'hasAuthor' typically refers to a tag or label used in databases or digital systems to indicate that a particular paper, presentation, or piece of research has a specific person or group of people as its author(s). It's a way of attributing the work to its creator(s).",The author of a paper is the inverse of the paper being written by the author. The property 'hasAuthor' has a range of 'Author'. The domain of 'hasAuthor' is 'Paper'. Writing a paper is the inverse of having an author.
source:addedBy,Source,Property,added by,"In the context of a conference, 'addedBy' typically refers to the individual or system that added a particular piece of information or a specific participant to the conference. For example, if a new speaker is added to the conference schedule, the 'addedBy' would be the person who made that update.",The domain of 'addedBy' is 'ProgramCommitteeMember'. The action 'addedBy' is the inverse of the action 'addProgramCommitteeMember'. The 'addedBy' is within the range of 'Administrator'. The action of adding a program committee member is the inverse of being added by someone.
source:acceptedBy,Source,Property,accepted by,"In the context of a conference, 'acceptedBy' typically refers to the individual, committee, or organization that has approved or accepted a proposal, abstract, paper, or presentation for inclusion in the conference. This could be a panel of reviewers, a conference chair, or a specific committee dedicated to reviewing submissions.",The term 'acceptedBy' has a range that includes 'Administrator'. The domain of 'acceptedBy' is 'Paper'. The term 'acceptedBy' is the inverse of 'acceptPaper'. The action 'acceptPaper' is the inverse of 'acceptedBy'.
source:rejectedBy,Source,Property,rejected by,"In the context of a conference, 'rejectedBy' typically refers to the person, committee, or system that decided not to accept a particular submission, proposal, or application. This could be due to various reasons such as the submission not meeting the required standards, being off-topic, or there being limited slots available.",The domain of 'rejectedBy' is 'Paper'. The range of 'rejectedBy' is 'Administrator'. Being rejected by is the inverse of rejecting a paper. The action 'rejectPaper' is the inverse of being 'rejectedBy'.
source:readByMeta-Reviewer,Source,Property,read by meta reviewer,"In the context of a conference, 'readByMeta-Reviewer' typically refers to a paper or submission that has been read and evaluated by a meta-reviewer. A meta-reviewer is a person who reviews the reviews made by other reviewers, ensuring the quality and consistency of the reviews. They play a crucial role in the decision-making process of which papers or submissions are accepted or rejected for the conference.",The property 'readByMeta-Reviewer' has a range of 'Meta-Reviewer'. The domain of 'readByMeta-Reviewer' is 'Paper'.
source:writtenBy,Source,Property,written by,"In the context of a conference, 'writtenBy' typically refers to the author or authors of a particular paper, study, or presentation that is being shared or discussed at the conference. It indicates who is responsible for the work being presented.","The domain of 'writtenBy' is 'Review'. The property 'writtenBy' has a range of 'Reviewer'. If something is written by someone, then that person writes a review of it. Writing a review is the inverse of being written by."
source:writeReview,Source,Property,write review,"In the context of a conference, writeReview typically refers to the process of evaluating and providing feedback on a presentation, research paper, or poster that has been shared at the conference. This could be done by attendees or by a panel of experts. The review might assess the quality of the research, the clarity of the presentation, the relevance to the conference theme, and other factors.","The action 'writeReview' has a range of 'Review'. The action of writing a review is within the domain of a reviewer. Writing a review is the inverse of being written by. If something is written by someone, then that person writes a review of it."
source:assignExternalReviewer,Source,Property,assign external reviewer,"In the context of a conference, assignExternalReviewer refers to the process of assigning a person who is not directly involved with the conference to review the content of a presentation, paper, or research. This could be for the purpose of ensuring the quality and accuracy of the content, or to provide an unbiased evaluation. External reviewers are typically experts in the field related to the content they are reviewing.",The action of assigning an external reviewer is the inverse of being assigned by a reviewer. The range of 'assignExternalReviewer' is 'ExternalReviewer'. The domain of assigning an external reviewer is a reviewer. The action of being assigned by a reviewer is the inverse of assigning an external reviewer.
source:writePaper,Source,Property,write paper,"In the context of a conference, 'writePaper' typically refers to the process of creating a research paper or scholarly article to be presented. This often involves conducting original research or compiling existing research on a particular topic, then writing a paper that presents the findings or arguments in a structured, academic format. This paper may then be submitted to the conference organizers for consideration to be presented or discussed at the conference.",The domain of writing a paper is an Author. Writing a paper is the inverse of having an author. The range of 'writePaper' is 'Paper'. The author of a paper is the inverse of the paper being written by the author.
source:addProgramCommitteeMember,Source,Property,add program committee member,"In the context of a conference, addProgramCommitteeMember refers to the action of adding a new member to the program committee. The program committee is responsible for organizing and managing the various aspects of the conference, including selecting speakers, setting the agenda, and overseeing the execution of the event. Adding a member to this committee would involve giving them these responsibilities and including them in the planning and decision-making process.",The domain of adding a program committee member is an administrator. The range of 'addProgramCommitteeMember' is 'ProgramCommitteeMember'. The action 'addProgramCommitteeMember' is the inverse of the action 'addedBy'. The action 'addedBy' is the inverse of the action 'addProgramCommitteeMember'.
source:name,Source,Property,name,"In the context of a conference, the term 'name' typically refers to the title or theme of the conference. It could also refer to the name of the person presenting or attending the conference.",The name of the entity has a range that is a string.
source:date,Source,Property,date,"In the context of a conference, the 'date' refers to the specific day or range of days when the event is scheduled to take place.",The date is a domain of the Conference. The date range is from one specific date to another.
source:reviewsPerPaper,Source,Property,reviews per paper,"In the context of a conference, 'reviewsPerPaper' refers to the number of reviews each submitted paper or presentation receives. This typically involves different reviewers or peers in the same field evaluating the content, methodology, and findings of the paper. The number of reviews per paper can vary depending on the conference or the field of study.",The domain of reviews per paper is a conference. The range of reviews per paper is an integer.
source:paperID,Source,Property,paper id,A paperID is a unique identifier assigned to a specific paper or research submission for a conference. This ID is used to track and manage the paper during the review and publication process. It helps in easily locating and referencing the paper in the conference's database.,The range of the paper ID is an unsigned long integer. The domain of the paperID is Paper.
source:maxPapers,Source,Property,max papers,"In the context of a conference, maxPapers typically refers to the maximum number of papers that an individual participant or presenter is allowed to submit for consideration. This limit is often set to ensure a diverse range of topics and presenters.",The domain of maxPapers is ProgramCommitteeMember. The maximum number of papers has a range that is an integer.
source:email,Source,Property,e mail,"In the context of a conference, an email could refer to a few things:

1) Invitation Email: This is an email sent to potential attendees to invite them to the conference. It usually includes details about the conference such as the date, time, location, speakers, and topics.

2) Confirmation Email: After a person has registered for the conference, they may receive a confirmation email. This email confirms their registration and may also include additional details about the event.

3) Follow-up Email: After the conference, organizers might send a follow-up email to attendees. This email might thank them for attending, provide a summary of the conference, or ask for feedback.

4) Informational Email: This is any email sent to attendees to provide information about the conference. This could include updates, changes, reminders, or any other relevant information.

5) Networking Email: Attendees might exchange emails for networking purposes. This could be to discuss the conference, share ideas, or establish professional connections.",The email domain is associated with the person. The range of the email is a string.
source:logoURL,Source,Property,logo url,"LogoURL in the context of a conference refers to the web address (URL) where the logo of the conference can be found. This is often used in digital materials or online platforms related to the conference, allowing for easy access and display of the conference's logo.",The range of logoURL is anyURI. The logo URL is the domain of the Conference.
source:acceptsHardcopySubmissions,Source,Property,accepts hardcopy submissions,"In the context of a conference, acceptsHardcopySubmissions refers to whether or not the conference organizers will accept submissions of papers, proposals, or other required documents in a physical, printed format. Some conferences may prefer or require digital submissions, while others may still accept or even prefer hard copies.",The range of accepting hardcopy submissions is a boolean. The domain of acceptsHardcopySubmissions is Conference.
source:title,Source,Property,title,"In the context of a conference, the title refers to the name or heading of the conference. It often reflects the main theme or topic that will be discussed or explored during the event. For example, a conference on climate change might have a title like 'Global Solutions for Climate Change: A Conference on Sustainability and Innovation.'",The title is in the domain of the Paper. The range of the title is a string.
source:siteURL,Source,Property,site url,"In the context of a conference, the siteURL refers to the website address where information about the conference is hosted. This could include details about the conference schedule, speakers, registration, venue, accommodations, sponsors, etc. It is the online location where attendees and interested parties can find all the necessary information about the conference.",The range of the site URL is any URI. The site URL domain is related to the Conference.
target:Conference_participant,Target,Class,conference participant,"A conference participant is an individual who attends or takes part in the conference. This can include speakers, attendees, exhibitors, sponsors, or organizers. They participate in the discussions, presentations, workshops, or other activities that take place during the conference.",A conference participant is a subclass of a person. An active conference participant is a subclass of a conference participant. A passive conference participant is a subclass of a conference participant.
target:Active_conference_participant,Target,Class,active conference participant,"An active conference participant refers to an individual who actively engages in the conference activities. This can include asking questions, participating in discussions, presenting papers, or contributing to workshops or panels. They are not just passive attendees, but take an active role in the proceedings of the conference.",An active conference participant is a subclass of a conference contributor. An active conference participant is a subclass of a conference participant. Active conference participant is disjoint with passive conference participant. A passive conference participant cannot be an active conference participant at the same time. Active conference participants give presentations. The range of 'Active_conference_participant' is given by 'is_given_by'.
target:Passive_conference_participant,Target,Class,passive conference participant,"A passive conference participant refers to an individual who attends a conference but does not actively contribute to the discussions or presentations. They are there to listen, learn, and absorb information rather than to present or engage in active discussions.",A passive conference participant is a subclass of a conference participant. Passive conference participants are completely separate and distinct from active conference participants. Active conference participant is disjoint with passive conference participant.
target:Person,Target,Class,person,"In the context of a conference, a person usually refers to an individual who is participating in the event. This could be a speaker, attendee, organizer, sponsor, or exhibitor. The person could be there in any capacity, such as to learn, network, present, or promote a product or service.",A conference participant is a subclass of a person. A conference applicant is a subclass of a person. A committee member is a subclass of a person. A conference contributor is a subclass of a person. A reviewer is a subclass of a person. A track-workshop chair is a type of person. A person contributes to the domain. The 'has_authors' is in the range of 'Person'. A person has an email domain. The domain of 'has_the_first_name' is 'Person'. The domain of 'has_gender' is 'Person'. The person has the last name.
target:Review_expertise,Target,Class,review expertise,"Review expertise refers to the level of knowledge or proficiency a reviewer has in a specific subject or field. In a conference setting, this could refer to the ability of a person to critically evaluate and provide feedback on the research papers, presentations, or topics that will be discussed during the conference. This expertise is crucial in ensuring the quality and relevance of the content presented at the conference.",A Review expertise has a submitted contribution. Has an expertise in the domain of Review expertise. The range of 'has_a_review_expertise' is 'Review_expertise'.
target:Submitted_contribution,Target,Class,submitted contribution,"In the context of a conference, a 'submitted contribution' refers to any work, research, findings, or ideas that an individual or group has submitted to be considered for presentation or discussion. This could be in the form of a paper, a poster, a panel discussion, a workshop, or any other format that the conference accepts. The contribution is typically reviewed by a committee before being accepted or rejected for inclusion in the conference program.",A submitted contribution is a type of written contribution. A reviewed contribution is a subclass of a submitted contribution. The range of 'has a submitted contribution' is 'Submitted contribution'. The domain of having a review expertise has submitted a contribution.
target:Reviewer,Target,Class,reviewer,"A reviewer in the context of a conference is a person or a group of people who evaluate or assess the quality, relevance, and merit of submitted papers or presentations. They play a crucial role in maintaining the standards of the conference by ensuring that only high-quality and relevant content is presented. They provide feedback and recommendations on whether a paper or presentation should be accepted, revised, or rejected.",A reviewer is a subclass of a person. A reviewer invites co-reviewers. The range of invites co-reviewers is a reviewer. The property 'belongs_to_reviewers' has a range of 'Reviewer'. The range of 'invited_by' is 'Reviewer'. The domain of 'invited_by' is 'Reviewer'. The domain Reviewer has a review reference or expertise.
target:Regular_author,Target,Class,regular author,"A Regular Author in the context of a conference is an individual who submits their research or findings to be reviewed and potentially presented at the conference. They are not part of the conference's organizing committee or invited speakers, but rather, they participate in the conference by presenting their own work.",A regular author is a subclass of a conference contributor. The first author of a contribution is a subclass of a regular author. A co-author of a contribution is a subclass of a regular author.
target:Conference_contributor,Target,Class,conference contributor,"A Conference Contributor refers to an individual or group who participates in a conference by providing content, such as presenting a paper, leading a workshop, or participating in a panel discussion. They contribute to the overall content and discussions of the conference.",A conference contributor is a subclass of a person. A regular author is a subclass of a conference contributor. An active conference participant is a subclass of a conference contributor. An invited speaker is a subclass of a conference contributor.
target:Contribution_1th-author,Target,Class,contribution 1th author,"In the context of a conference, 'Contribution_1th-author' likely refers to the main contribution made by the first author of a presented paper or study. In academic papers, the first author is typically the person who has made the most significant intellectual contribution to the work, including the conception and design of the project, analysis and interpretation of data, and drafting the article.",The first author of a contribution is a subclass of a regular author. The contribution of the first author is disjoint with the contribution of the co-author. The contribution of a co-author is disjoint with the contribution of a first author.
target:Contribution_co-author,Target,Class,contribution co-author,"In the context of a conference, a Contribution_co-author refers to an individual who has collaboratively worked on and contributed to the research or study being presented, but is not the primary author or speaker. They have significantly contributed to the work, such as in the research, analysis, or writing process, and share responsibility and credit for the results or findings.",A co-author of a contribution is a subclass of a regular author. The contribution of a co-author is disjoint with the contribution of a first author. The contribution of the first author is disjoint with the contribution of the co-author.
target:Conference_contribution,Target,Class,conference contribution,"Conference contribution refers to any form of participation in a conference. This could be presenting a paper, leading a workshop, participating in a panel discussion, or even just attending. It can also refer to any research, findings, or ideas that are shared during the conference. This contribution is often published in the conference proceedings.",A conference contribution is a subclass of a conference document. A written contribution is a subclass of a conference contribution. A poster is a subclass of a conference contribution. A presentation is a subclass of a conference contribution. The domain of 'is_submitted_at' is 'Conference_contribution'. The range of 'has_contributions' is 'Conference_contribution'.
target:Co-chair,Target,Class,co chair,"A Co-chair in the context of a conference is a person who shares the responsibility of chairing or leading the conference with another person. They work together in planning, organizing, and managing the conference, including setting the agenda, facilitating discussions, and ensuring the conference runs smoothly.",A Co-chair is a subclass of a Committee member. The range of having a committee co-chair is a Co-chair. Was a committee co-chair of is a domain of Co-chair.
target:Committee,Target,Class,committee,"In the context of a conference, a committee refers to a group of people who are chosen to organize, manage, and make decisions related to the conference. This can include tasks such as selecting speakers, determining the conference schedule, overseeing logistics, and more. The committee is responsible for ensuring the conference runs smoothly and achieves its objectives.",The program committee is a subclass of the committee. The steering committee is a subclass of the committee. The organizing committee is a subclass of the committee. The domain of 'has_members' is 'Committee'. The range of 'has_a_committee' is 'Committee'. The range of 'was a member of' is 'Committee'. The domain of 'was a committee of' is Committee. A Committee has a co-chair. A Committee has a committee chair. The subject was a committee co-chair of a specific committee. Was a committee chair of has the range of Committee.
target:Committee_member,Target,Class,committee member,"A Committee Member in the context of a conference is a person who is part of a group responsible for planning, organizing, and executing the conference. They may be in charge of various tasks such as selecting speakers, reviewing abstracts or papers, deciding on the conference agenda, managing logistics, and more.",A committee member is a subclass of a person. A Co-chair is a subclass of a Committee member. A chair is a subclass of a committee member. The 'has_members' range includes 'Committee_member'. The domain of 'was a member of' is 'Committee member'.
target:Abstract,Target,Class,abstract,"In the context of a conference, an abstract is a brief summary of a research paper, thesis, review, or other detailed document that is presented. It provides a concise overview of the objectives, methodology, findings, and conclusion of the work. This allows attendees to understand the main points and focus of the presentation, helping them decide whether it aligns with their interests or research.",An abstract is a subclass of an extended abstract. The range of 'has_an_abstract' is 'Abstract'. The 1st part of the domain is abstract.
