entity,source_or_target,entity_type,initial_matching,lexical_matching,graphical_matching
source:Meta-Reviewer,Source,Class,meta reviewer,"In the context of a conference, a Meta-Reviewer is a person who oversees and reviews the evaluations made by other reviewers on a particular paper. They ensure that the reviews are consistent, fair, and of high quality. They also have the ability to submit their own review. The use of a Meta-Reviewer is optional and must be decided before the paper assignment process begins.",A Meta-Reviewer is a subclass of Reviewer. The range of being read by a Meta-Reviewer is a Meta-Reviewer.
source:Reviewer,Source,Class,reviewer,"A reviewer in the context of a conference is a person or a group of people who evaluate or assess the quality, relevance, and merit of submitted papers or presentations. They play a crucial role in deciding which papers or topics are accepted for presentation or publication in the conference.","Reviewer is completely separate from AuthorNotReviewer. A reviewer is not the same as an external reviewer. A Reviewer is a subclass of a Conference Member. A reviewer is a subclass of a user. Meta-Reviewer is a subclass of Reviewer. External Reviewer and Reviewer are completely separate, they do not overlap. The entity 'AuthorNotReviewer' is disjoint with the entity 'Reviewer'. The range of 'assignReviewer' is 'Reviewer'. The domain of 'assignedByAdministrator' is 'Reviewer'. The domain of 'adjustBid' is 'Reviewer'. The action of reading a paper is within the domain of a Reviewer. The term 'adjustedBy' has a range that includes the entity 'Reviewer'. The domain of 'hasBeenAssigned' is 'Reviewer'. The property 'assignedByReviewer' has a range of 'Reviewer'. The property 'assignedTo' has a range of 'Reviewer'. The property 'readByReviewer' has a range of 'Reviewer'. The range of 'writtenBy' is 'Reviewer'. The action of writing a review is within the domain of a Reviewer. The domain of assigning an external reviewer is a reviewer."
source:Decision,Source,Class,decision,"In the context of a conference, a decision refers to the determination or resolution made by the conference organizers or participants regarding a particular issue, topic, or action. This could be related to the conference's agenda, policies, future events, or any other matter that requires a collective agreement or judgement. For example, the decision to accept or reject a paper or presentation, the decision on the conference's date and location, etc.",The concept of 'Decision' is completely separate and has no overlap with the concept of 'Person'. The concept of 'Decision' is completely separate and does not overlap with the concept of 'Document'. The concept of 'Decision' is completely separate and does not overlap with the concept of 'Preference'. The entity 'Decision' is disjoint with the entity 'ProgramCommittee'. The concept of 'Decision' is completely separate and has no overlap with the concept of 'Bid'. The concept of 'Decision' is completely separate and does not overlap with the concept of 'Conference'. The entity 'ProgramCommittee' is disjoint with the entity 'Decision'. The concept of 'Preference' is completely separate and does not overlap with the concept of 'Decision'. Acceptance is a subclass of Decision. The entity 'Bid' is disjoint with the entity 'Decision'. A person is completely separate and distinct from a decision. The entity 'Document' is disjoint with the entity 'Decision'. The concept of a Conference is completely separate and has no overlap with the concept of a Decision. Rejection is a subclass of Decision. The range of 'hasDecision' is 'Decision'.
source:Person,Source,Class,person,"In the context of a conference, a person refers to an individual who is participating in the event. This could be a speaker, attendee, organizer, sponsor, exhibitor, or any other role involved in the conference.",The category of 'Person' is completely separate and does not overlap with the category of 'Preference'. A person is completely separate from a program committee. A person cannot be a bid. A person cannot be a conference. A person is completely separate and distinct from a decision. A person is completely separate and different from a document. The concept of 'Decision' is completely separate and has no overlap with the concept of 'Person'. A Program Committee Member is a subclass of a Person. A Conference Member is a subclass of a Person. An External Reviewer is a subclass of a Person. The entity 'ProgramCommittee' is disjoint with the entity 'Person'. The category of Preference is completely separate and does not overlap with the category of Person. A Chairman is a subclass of a Person. The category 'Bid' is completely separate and has no overlap with the category 'Person'. A user is a subclass of a person. A document is completely separate and has no overlap with a person. A conference is completely separate and has no overlap with a person. A person has a domain of conflict of interest. The email domain of a person.
source:Document,Source,Class,document,"In the context of a conference, a document refers to any written or digital material that provides information or evidence or that serves as an official record. This could include conference schedules, research papers, presentations, transcripts of speeches, meeting minutes, or any other materials distributed or used during the conference.",The concept of a Document is completely separate and does not overlap with the concept of a Bid. The document is completely separate and has no overlap with the decision. The entity 'Document' is disjoint with the entity 'ProgramCommittee'. The category 'Document' is completely separate and has no overlap with the category 'Conference'. The entity 'Document' is disjoint with the entity 'Person'. The entity 'Document' is disjoint with the entity 'Preference'. The concept of 'Decision' is completely separate and does not overlap with the concept of 'Document'. The entity 'ProgramCommittee' is disjoint with the entity 'Document'. The category of Preference is completely separate from the category of Document. A review is a subclass of a document. The entity 'Bid' is disjoint with the entity 'Document'. Paper is a subclass of Document. A person is completely separate and different from a document. The category of 'Conference' is completely separate and has no overlap with the category of 'Document'. The range of 'hasConflictOfInterest' is 'Document'.
source:Preference,Source,Class,preference,"In the context of a conference, preference often refers to the choices or selections made by attendees or organizers. This could include preferences for specific topics, speakers, sessions, or workshops to attend. It could also refer to dietary preferences for meals provided, or preferences for dates, locations, or formats (such as in-person or virtual) of the conference. These preferences help to shape the conference program and logistics to best meet the needs and interests of the participants.",The preference is not the same as the program committee. The category of Preference is completely separate and does not overlap with the category of Person. The concept of 'Preference' is completely separate and does not overlap with the concept of 'Decision'. The category of Preference is completely separate and has no overlap with the category of Document. The category of Preference is completely separate and has no overlap with the category of Conference. The concept of Preference is disjoint with the concept of Bid. The concept of 'Decision' is completely separate and does not overlap with the concept of 'Preference'. The entity 'ProgramCommittee' is disjoint with the entity 'Preference'. The entity 'Bid' is disjoint with the entity 'Preference'. The entity 'Person' is disjoint with the entity 'Preference'. The entity 'Document' is disjoint with the entity 'Preference'. The concept of a Conference is completely separate and does not overlap with the concept of a Preference.
source:ProgramCommittee,Source,Class,program committee,"A Program Committee in the context of a conference is a group of individuals who are responsible for selecting and organizing the content of the conference. This includes reviewing and selecting presentations, arranging speakers, and setting the schedule of events. The committee members are usually experts in the field related to the conference topic.",The entity 'ProgramCommittee' is disjoint with the entity 'Person'. The entity 'ProgramCommittee' is disjoint with the entity 'Conference'. The entity 'ProgramCommittee' is disjoint with the entity 'Preference'. The entity 'ProgramCommittee' is disjoint with the entity 'Decision'. The entity 'ProgramCommittee' is disjoint with the entity 'Bid'. The entity 'ProgramCommittee' is disjoint with the entity 'Document'. The entity 'Decision' is disjoint with the entity 'ProgramCommittee'. The preference is not the same as the program committee. The entity 'Bid' is disjoint with the entity 'ProgramCommittee'. A person is completely separate from a program committee. The entity 'Document' is disjoint with the entity 'ProgramCommittee'. The entity 'Conference' is disjoint with the entity 'ProgramCommittee'. The domain of 'hasProgramCommitteeMember' is 'ProgramCommittee'. The member of program committee is within the range of the program committee.
source:Bid,Source,Class,bid,"In the context of a conference, a bid refers to a proposal or application submitted by an individual, group, or city to host the event. This bid often includes details such as the proposed venue, accommodations, budget, and other logistical arrangements. The organization or committee in charge of the conference will then review these bids and select the most suitable one.",The category of 'Bid' is completely separate from the category of 'Document'. The concept of 'Bid' is completely separate and has no overlap with the concept of 'Preference'. The entity 'Bid' is disjoint with the entity 'ProgramCommittee'. The category 'Bid' is completely separate and has no overlap with the category 'Conference'. The entity 'Bid' is disjoint with the entity 'Decision'. The entity 'Bid' is disjoint with the entity 'Person'. The concept of 'Decision' is completely separate and does not overlap with the concept of 'Bid'. The entity 'ProgramCommittee' is disjoint with the entity 'Bid'. The concept of Preference is disjoint with the concept of Bid. A person cannot be a bid. The entity 'Document' is disjoint with the entity 'Bid'. The concept of a Conference is completely separate and does not overlap with the concept of a Bid. The range of 'hasBid' is 'Bid'. The range of adjustBid is Bid. The domain of 'adjustedBy' is 'Bid'.
source:Conference,Source,Class,conference,"A conference is a formal meeting where participants gather to discuss specific topics or issues. It usually involves presentations, discussions, workshops, and networking opportunities. Conferences can be held for various fields such as academia, business, science, technology, and more. They can be conducted in person, virtually, or in a hybrid format.",The category of 'Conference' is completely separate and has no overlap with the category of 'Preference'. The concept of a Conference is completely separate and has no overlap with the concept of a Decision. A conference is completely separate and has no overlap with a person. The category of 'Conference' is completely separate and has no overlap with the category of 'Bid'. The entity 'Conference' is disjoint with the entity 'ProgramCommittee'. The category of 'Conference' is completely separate and has no overlap with the category of 'Document'. The concept of 'Decision' is completely separate and has no overlap with the concept of 'Conference'. The entity 'ProgramCommittee' is disjoint with the entity 'Conference'. The category of Preference is completely separate and does not overlap with the category of Conference. The category of 'Bid' is completely separate from the category of 'Conference'. A person cannot be a conference. The entity 'Document' is disjoint with the entity 'Conference'. The range of finalizing paper assignment is a conference. The domain of 'hasConferenceMember' is 'Conference'. The range of the runPaperAssignmentTools is Conference. The range of enabling a virtual meeting is a conference. The range of the startReviewerBidding is Conference. The domain of 'paperAssignmentFinalizedBy' is 'Conference'. The review criteria is entered by the domain of the conference. The domain of paperAssignmentToolsRunBy is Conference. The domain of 'virtualMeetingEnabledBy' is 'Conference'. The hardcopy mailing manifests are printed by the domain conference. The action 'enterConferenceDetails' has a range of 'Conference'. The member of a conference is within the range of a conference. The action of printing hardcopy mailing manifests is applicable to the context of a conference. The details are entered by the domain of the Conference. The domain of 'reviewerBiddingStartedBy' is 'Conference'. The range of 'enterReviewCriteria' is 'Conference'. The date is a domain related to the Conference. The domain of reviewsPerPaper is Conference. The logo URL is the domain of the Conference. The domain of acceptsHardcopySubmissions is Conference. The site URL domain is related to the Conference.
source:ConferenceChair,Source,Class,conference chair,"A Conference Chair is the person who leads or presides over a conference. They are responsible for planning and organizing the event, coordinating speakers and sessions, and ensuring that the conference runs smoothly. They may also play a role in fundraising, marketing, and other administrative tasks related to the event.",A Conference Chair is a subclass of Conference Member. The role of Conference Chair is completely separate and distinct from the role of Associated Chair. The entity 'AssociatedChair' is disjoint with the entity 'ConferenceChair'.
source:ConferenceMember,Source,Class,conference member,"A ConferenceMember refers to an individual who is participating in the conference. This could be a speaker, attendee, organizer, or any other person who is part of the event. They may participate in discussions, presentations, networking, and other activities during the conference.",A ConferenceMember is a subclass of a Person. A Conference Chair is a subclass of Conference Member. A Program Committee Member is a subclass of a Conference Member. An Author is a subclass of a Conference Member. A Reviewer is a subclass of ConferenceMember. An Associated Chair is a subclass of a Conference Member. The property 'hasConferenceMember' has a range of 'ConferenceMember'. A member of a conference is a domain of a conference member.
source:AssociatedChair,Source,Class,associated chair,"In the context of a conference, an Associated Chair is typically a person who assists the main chairperson or conference chair in organizing and managing the event. Their responsibilities may include coordinating with speakers, managing sessions, overseeing logistics, and other tasks related to the successful execution of the conference. The exact role can vary depending on the specific conference and its structure.",An Associated Chair is a subclass of a Conference Member. The entity 'AssociatedChair' is disjoint with the entity 'ConferenceChair'. The entity 'Conference Chair' is disjoint with the entity 'Associated Chair'.
source:ProgramCommitteeMember,Source,Class,program committee member,"A ProgramCommitteeMember in the context of a conference refers to an individual who is part of the program committee. This committee is responsible for planning and organizing the conference program. This includes selecting the papers to be presented, arranging the schedule, deciding on the keynote speakers, and other related tasks. These members are not just authors of papers, but also reviewers who evaluate the quality and relevance of the papers submitted to the conference.",A Program Committee Member is a subclass of a Person. A Program Committee Member is a subclass of a Conference Member. A Program Committee Member cannot be an Author who is not a Reviewer. A Program Committee Chair is a subclass of a Program Committee Member. The entity 'AuthorNotReviewer' is disjoint with the entity 'ProgramCommitteeMember'. The range of 'hasProgramCommitteeMember' is 'ProgramCommitteeMember'. A member of program committee is in the domain of program committee member. The range of 'setMaxPapers' is 'ProgramCommitteeMember'. The domain of maxPapers is ProgramCommitteeMember. The domain of 'addedBy' is 'ProgramCommitteeMember'. The range of 'addProgramCommitteeMember' is 'ProgramCommitteeMember'.
source:AuthorNotReviewer,Source,Class,author not reviewer,AuthorNotReviewer typically refers to a role or rule in a conference setting where an individual who is an author of a paper or presentation is not allowed to be a reviewer of other papers or presentations. This is to ensure impartiality and avoid any potential conflicts of interest.,The entity 'AuthorNotReviewer' is disjoint with the entity 'ProgramCommitteeMember'. The entity 'AuthorNotReviewer' is disjoint with the entity 'Reviewer'. The class 'AuthorNotReviewer' is a subclass of 'Author'. A Program Committee Member cannot be an Author who is not a Reviewer. Reviewer is completely separate from AuthorNotReviewer.
source:SubjectArea,Source,Class,subject area,"In the context of a conference, Subject Area refers to the specific field or topic that the conference is focused on. This could be anything from artificial intelligence, climate change, healthcare, education, etc. It helps potential attendees, speakers, and sponsors understand the relevance and focus of the conference.",The 'hasSubjectArea' is in the range of 'SubjectArea'.
source:ExternalReviewer,Source,Class,external reviewer,"In the context of a conference, an External Reviewer refers to an individual who is not part of the conference's organizing or review committee but is invited to evaluate and provide feedback on submitted papers or presentations. This person is usually an expert in the field related to the conference's theme. Their role is to ensure the quality and relevance of the content presented at the conference.","An external reviewer is a subclass of a person. External Reviewer and Reviewer are completely separate, they do not overlap. Reviewer and ExternalReviewer are completely separate, they do not overlap. The domain of 'assignedByReviewer' is 'ExternalReviewer'. The range of 'assignExternalReviewer' is 'ExternalReviewer'."
source:Chairman,Source,Class,chairman,"In the context of a conference, a Chairman is the person who leads or prescribes the order of events. They are responsible for guiding the discussion, ensuring the agenda is followed, and managing the time. They may also introduce speakers, facilitate questions, and summarize discussions.",A Chairman is a subclass of a Person.
source:ProgramCommitteeChair,Source,Class,program committee chair,"A Program Committee Chair is a person who leads the program committee for a conference. This committee is responsible for planning and organizing the content of the conference, including selecting keynote speakers, arranging panel discussions, and reviewing and accepting papers or presentations. The chairperson oversees these activities and ensures that the conference program aligns with the event's goals and objectives.",A Program Committee Chair is a subclass of a Program Committee Member. The endReview is within the domain of ProgramCommitteeChair.
source:Acceptance,Source,Class,acceptance,"In the context of a conference, acceptance refers to the approval of a proposal, abstract, or paper submitted by researchers or participants for presentation. It means that the conference organizers or committee have reviewed the submission and deemed it suitable and relevant for inclusion in the conference program.",Acceptance and Rejection are mutually exclusive. Acceptance is a subclass of Decision. Rejection is completely separate from Acceptance.
source:Rejection,Source,Class,rejection,"In the context of a conference, 'rejection' typically refers to a proposal, abstract, or paper submitted for presentation that has not been accepted by the conference organizers or review committee. This could be due to a variety of reasons such as lack of originality, poor quality of work, irrelevance to the conference theme, etc.",Rejection is completely separate from Acceptance. Rejection is a subclass of Decision. Acceptance is completely separate from Rejection.
source:Review,Source,Class,review,"In the context of a conference, a review typically refers to the process of evaluating or assessing the content of presentations, abstracts, papers, or proposals that have been submitted for inclusion in the conference. This is usually done by a panel of experts or peers in the field to ensure the quality and relevance of the content. The review process can determine whether the submission is accepted, rejected, or requires revisions.",The category of 'Review' is completely separate from the category of 'Paper'. A review is a subclass of a document. Paper is completely separate from Review. Meta-Review is a subclass of Review. The range of 'endReview' is 'Review'. The domain of 'writtenBy' is 'Review'. The action 'writeReview' has a range of 'Review'.
source:Paper,Source,Class,paper,"In the context of a conference, a paper refers to a scholarly article or study that is written by researchers or experts in the field. It presents original research, findings, or a review of existing work. These papers are often presented at conferences as a way for professionals to share their work, receive feedback, and engage in discussions with their peers.",Paper is a subclass of Document. Paper is completely separate from Review. The category 'Review' is completely separate from the category 'Paper'. A paper abstract is a subclass of a paper. The full version of a paper is a subclass of paper. A paper has a co-author. The range of 'rejectPaper' is 'Paper'. The domain of 'hasBid' is 'Paper'. The range of reading a paper is a paper. The term 'markConflictOfInterest' is in the range of 'Paper'. The range of 'co-writePaper' is 'Paper'. The range of 'hasBeenAssigned' is 'Paper'. The domain of 'hasDecision' is 'Paper'. The domain of 'assignedTo' is 'Paper'. The subject area of a paper is its domain. The range of submitting a paper is a paper. The domain of 'readByReviewer' is 'Paper'. The domain of the paperID is Paper. The title is in the domain of the Paper. The range of accepting a paper is a paper. The domain of 'hasAuthor' is 'Paper'. The domain of 'acceptedBy' is 'Paper'. The domain of 'rejectedBy' is 'Paper'. The domain of 'readByMeta-Reviewer' is 'Paper'. The range of 'writePaper' is 'Paper'.
source:Author,Source,Class,author,"In the context of a conference, an author is typically the person who has written or contributed to a research paper, study, or presentation that is being shared or discussed at the conference. They are responsible for the content and findings of the work being presented.",An Author is a subclass of a Conference Member. The author is a subclass of the user. A co-author is a subclass of an author. The class 'AuthorNotReviewer' is a subclass of 'Author'. The domain of submitting a paper is the author. The property 'hasAuthor' has a range of 'Author'. The domain of writing a paper is an Author.
source:User,Source,Class,user,"In the context of a conference, a user refers to an individual who is participating or interacting with the conference in some way. This could be through attending in person, watching a live stream, using an app or website associated with the conference, or engaging with conference content on social media. Users can include attendees, speakers, exhibitors, organizers, and others involved in the conference.",A user is a subclass of a person. An Author is a subclass of User. A reviewer is a subclass of a user. An Administrator is a subclass of User.
source:Co-author,Source,Class,co author,"A co-author is a person who contributes to the creation or development of a conference paper, presentation, or research study along with one or more other authors. They share responsibility and credit for the work.",A co-author is a subclass of an author. The range of 'hasCo-author' is 'Co-author'. The domain of co-writing a paper is a co-author.
source:PaperAbstract,Source,Class,paper abstract,"In the context of a conference, a Paper Abstract refers to a brief summary of a research paper that is going to be presented. It provides a concise overview of the research, including the purpose of the study, the methodology used, the main findings, and the conclusions. This allows attendees to understand the key points of the paper without reading the whole document. It's often used to help attendees decide which presentations they want to attend.",The abstract of a paper is a subclass of the paper.
source:PaperFullVersion,Source,Class,paper full version,"In the context of a conference, 'PaperFullVersion' refers to the complete and detailed version of a research paper or study. This is the comprehensive document that includes all aspects of the research, including the introduction, methodology, results, discussion, and conclusion. It is typically the version that is submitted for peer review and potential publication in the conference proceedings.",The full version of a paper is a subclass of paper.
