entity,source_or_target,entity_type,syntactic_matching,lexical_matching,graphical_matching
http://cmt#Acceptance,Source,Class,acceptance,"In the context of a conference, acceptance refers to the approval or acknowledgment of a presentation, paper, or proposal to be included in the conference program. It signifies that the submission has met the criteria and standards set by the conference organizers and has been deemed suitable for presentation to the attendees. Acceptance in this context is a positive outcome for the submitter, as it allows them to share their work and ideas with a wider audience at the conference.",Acceptance disjointWith Rejection. Acceptance is a subclass of Decision. Rejection disjointWith Acceptance.
http://cmt#Administrator,Source,Class,administrator,"In the context of a conference, an administrator is typically someone who is responsible for organizing and managing the logistics of the event. This may include tasks such as coordinating schedules, booking venues, handling registrations, and overseeing the overall operation of the conference. The administrator plays a crucial role in ensuring that the conference runs smoothly and efficiently.","Administrator is a subclass of User. Finalize paper assignment domain administrator. Run Paper Assignment Tools domain Administrator. Enable virtual meeting domain administrator. Start reviewer bidding domain administrator. Paper assignment finalized by Range Administrator. Assign reviewer domain administrator. Review criteria entered by range administrator. Reject paper domain administrator. Assigned by administrator, range administrator. Paper assignment tools run by Range Administrator. Virtual meeting enabled by Range Administrator. Hardcopy mailing manifests printed by Range Administrator. Enter conference details domain administrator. Print hardcopy mailing manifests domain administrator. Set max papers domain administrator. Details entered by the range administrator. Reviewer bidding started by Range Administrator. Enter Review Criteria domain Administrator. Accept paper domain administrator. Added by Range Administrator. Accepted by Range Administrator. Rejected by range Administrator. Add Program Committee Member domain Administrator."
http://cmt#AssociatedChair,Source,Class,associated chair,"In the context of a conference, an AssociatedChair is a position held by an individual who assists the Chairperson in organizing and running the conference. They may help with tasks such as coordinating speakers, managing logistics, and overseeing various aspects of the event. The AssociatedChair plays a key role in ensuring the smooth operation of the conference.",AssociatedChair is a subclass of ConferenceMember. AssociatedChair disjointWith ConferenceChair. ConferenceChair is disjoint with AssociatedChair.
http://cmt#Author,Source,Class,author,"In the context of a conference, an author refers to an individual who has written a paper, article, or presentation that is being presented at the conference. The author is typically the person responsible for the content and research presented in the work.",Author is a subclass of ConferenceMember. Author is a subclass of User. Co-author is a subclass of Author. AuthorNotReviewer is a subclass of Author. Submit paper domain author. The property hasAuthor has a range of Author. Write paper domain author.
http://cmt#AuthorNotReviewer,Source,Class,author not reviewer,"In the context of a conference, AuthorNotReviewer likely refers to someone who has submitted a paper or presentation for the conference but is not serving as a reviewer for other submissions. This term distinguishes between individuals who are contributing content to the conference and those who are evaluating and providing feedback on the submissions of others.",AuthorNotReviewer disjointWith ProgramCommitteeMember. AuthorNotReviewer disjointWith Reviewer. AuthorNotReviewer is a subclass of Author. Program Committee Member disjoint with Author Not Reviewer. Reviewer disjointWith AuthorNotReviewer.
http://cmt#Bid,Source,Class,bid,"In the context of a conference, a bid refers to a formal proposal submitted by a city or organization to host a future conference or event. The bid typically includes details such as the proposed location, venue, dates, and any additional benefits or incentives for attendees. The conference organizers will review the bids and select the most suitable option for the event.",Bid disjointWith Document. Bid disjointWith Preference. Bid disjointWith ProgramCommittee. Bid disjointWith Conference. Bid disjointWith Decision. Bid disjointWith Person. Decision disjointWith Bid. Program Committee disjoint with Bid. Preference disjointWith Bid. Person is disjoint with Bid. Document disjointWith Bid. Conference disjointWith Bid. Has bid range bid. Adjust bid range bid. Adjusted by domain bid.
http://cmt#Chairman,Source,Class,chairman,"In the context of a conference, the Chairman is typically the person who presides over the meeting, ensuring that the agenda is followed, facilitating discussions, and maintaining order. The Chairman is responsible for leading the conference and ensuring that all participants have the opportunity to contribute and that decisions are made in an organized and efficient manner.",Chairman is a subclass of Person.
http://cmt#Co-author,Source,Class,co author,"In the context of a conference, a co-author refers to someone who has collaborated with another individual or group of individuals in writing a research paper, article, or presentation. Co-authors typically share credit for the work and are listed as authors on the publication or presentation.",Co-author is a subclass of Author. Has co-author range co-author. Co-write Paper domain Co-author.
http://cmt#Conference,Source,Class,conference,"A conference is a formal meeting where people come together to discuss a particular topic, share ideas, and make decisions. It can also refer to a large event where experts in a certain field give presentations and hold discussions.",Conference disjointWith Preference. Conference disjointWith Decision. Conference is disjoint with Person. Conference disjointWith Bid. Conference disjointWith ProgramCommittee. Conference disjointWith Document. Decision disjointWith Conference. Program Committee disjoint with Conference. Preference is disjoint with Conference. Bid disjointWith Conference. Person is disjoint with Conference. Document disjointWith Conference. Finalize paper assignment for the conference. The domain Conference has ConferenceMember. Run Paper Assignment Tools range Conference. Enable virtual meeting range conference. Start reviewer bidding range conference. Paper assignment finalized by domain conference. Review criteria entered by the domain conference. Paper assignment tools run by Domain Conference. Virtual meeting enabled by Domain Conference. Hardcopy mailing manifests printed by Domain Conference. Enter conference details range conference. Member of conference range conference. Print hard copy mailing manifests for the range conference. Details entered by the domain Conference. Reviewer bidding started by Domain Conference. Enter review criteria range conference. Date domain Conference. Reviews per paper domain conference. Logo URL domain Conference. Accepts hard copy submissions for the conference. The site URL for the domain is Conference.
http://cmt#ConferenceChair,Source,Class,conference chair,"In the context of a conference, a ConferenceChair refers to the individual who is responsible for overseeing and organizing the conference. This person typically leads the conference planning committee, coordinates with speakers and presenters, manages the schedule and logistics of the event, and ensures that everything runs smoothly. The ConferenceChair plays a crucial role in the success of the conference and is often seen as the main point of contact for attendees and participants.",ConferenceChair is a subclass of ConferenceMember. ConferenceChair is disjoint with AssociatedChair. AssociatedChair disjointWith ConferenceChair.
http://cmt#ConferenceMember,Source,Class,conference member,"In the context of a conference, a ConferenceMember refers to an individual who is participating in or attending the conference. This could include speakers, presenters, attendees, organizers, sponsors, or any other individuals involved in the conference in some capacity.",ConferenceMember is a subclass of Person. ConferenceChair is a subclass of ConferenceMember. ProgramCommitteeMember is a subclass of ConferenceMember. Author is a subclass of ConferenceMember. Reviewer is a subclass of ConferenceMember. AssociatedChair is a subclass of ConferenceMember. Has conference member range conference member. Member of Conference domain Conference Member.
http://cmt#Decision,Source,Class,decision,"In the context of a conference, a decision refers to a conclusion or resolution reached after discussing and considering various options or opinions. It is a choice made by the participants or organizers of the conference in order to move forward with a particular course of action or plan. Decisions made at a conference can have a significant impact on the outcomes and goals of the event.",Decision is disjoint with Person. Decision disjointWith Document. Decision disjointWith Preference. Decision disjointWith ProgramCommittee. Decision disjointWith Bid. Decision disjointWith Conference. Program Committee disjoint with Decision. Preference disjointWith Decision. Acceptance is a subclass of Decision. Bid disjointWith Decision. Person disjointWith Decision. Document disjointWith Decision. Conference disjointWith Decision. Rejection is a subclass of Decision. Has decision range decision.
http://cmt#Document,Source,Class,document,"In the context of a conference, a document refers to any written or digital material that contains information relevant to the conference proceedings. This can include research papers, presentations, agendas, schedules, and other materials that are distributed to attendees for reference. Documents play a crucial role in ensuring that information is effectively communicated and shared among conference participants.",Document disjointWith Bid. Document disjointWith Decision. Document disjointWith ProgramCommittee. Document disjointWith Conference. Document disjointWith Person. Document disjointWith Preference. Decision is disjoint with Document. Program Committee disjoint with Document. Preference disjointWith Document. Review is a subclass of Document. Bid disjointWith Document. Paper is a subclass of Document. Person disjointWith Document. Conference disjointWith Document. Has conflict of interest range document.
http://cmt#ExternalReviewer,Source,Class,external reviewer,"In the context of a conference, an External Reviewer is a person who has been designated to review a paper on behalf of another Reviewer. They are not officially recognized as a Reviewer for the conference, but they are still responsible for evaluating the paper and providing feedback.",ExternalReviewer is a subclass of Person. ExternalReviewer disjointWith Reviewer. Reviewer disjointWith ExternalReviewer. assigned by reviewer domain external reviewer. Assign external reviewer range external reviewer.
http://cmt#Meta-Review,Source,Class,meta review,"In the context of a conference, a meta-review refers to a review that evaluates and synthesizes multiple reviews of a particular research paper or study. It involves analyzing and summarizing the feedback and comments provided by multiple reviewers to provide an overall assessment of the quality and significance of the work. Meta-reviews are often conducted by program committee members or chairs to make final decisions on the acceptance or rejection of submissions.",Meta-Review is a subclass of Review.
http://cmt#Meta-Reviewer,Source,Class,meta reviewer,"In the context of a conference, a Meta-Reviewer is a special type of reviewer who has the ability to review all the reviews submitted for a particular paper and then provide their own review. The role of the Meta-Reviewer is to ensure that the reviews are of high quality and consistent. Unlike regular reviewers, the Meta-Reviewer may have different questions or criteria for evaluating the paper. The decision to use Meta-Reviewers is optional and must be determined before assigning papers for review.",Meta-Reviewer is a subclass of Reviewer. Read by Meta-Reviewer range Meta-Reviewer.
http://cmt#Paper,Source,Class,paper,"In the context of a conference, a paper typically refers to a written document that presents research findings, analysis, or ideas on a specific topic. Presenting a paper at a conference allows researchers to share their work with others in the field, receive feedback, and contribute to the advancement of knowledge in their area of study.",Paper is a subclass of Document. Paper disjointWith Review. Review disjointWith Paper. PaperAbstract is a subclass of Paper. PaperFullVersion is a subclass of Paper. Has co-author domain paper. Reject paper range paper. Has bid domain paper. Read paper range paper. Mark Conflict of Interest Range Paper. Co-write paper range paper. Has been assigned range paper. Has Decision domain Paper. Assigned to domain Paper. The domain Paper has subject area. Submit paper range paper. Read by reviewer domain paper. PaperID domain Paper. Title domain paper. Accept paper range paper. The domain Paper hasAuthor. The domain Paper is accepted. The domain Paper rejectedBy. Read by meta-reviewer domain paper. Write paper range paper.
http://cmt#PaperAbstract,Source,Class,paper abstract,"In the context of a conference, a PaperAbstract refers to a brief summary or description of a research paper or presentation that is submitted to the conference organizers for review. The PaperAbstract typically includes key points, objectives, methodology, and findings of the research paper, providing a snapshot of the content to help conference organizers determine its relevance and quality for inclusion in the conference program.",PaperAbstract is a subclass of Paper.
http://cmt#PaperFullVersion,Source,Class,paper full version,"In the context of a conference, 'PaperFullVersion' likely refers to a complete and detailed version of a research paper or presentation that has been submitted or presented at the conference. This term may be used to distinguish the full version of the paper from a shorter abstract or summary that may have been initially submitted. The PaperFullVersion would contain all the necessary details, data, analysis, and conclusions of the research study.",PaperFullVersion is a subclass of Paper.
http://cmt#Person,Source,Class,person,"In the context of a conference, a person refers to an individual attending or participating in the event. This could include speakers, attendees, organizers, and staff members. Each person plays a role in contributing to the overall success and experience of the conference.",Person disjointWith Preference. Person is disjoint with ProgramCommittee. Person is disjoint with Bid. Person is disjoint with Conference. Person disjointWith Decision. Person is disjoint with Document. Decision disjointWith Person. ProgramCommitteeMember is a subclass of Person. ConferenceMember is a subclass of Person. ExternalReviewer is a subclass of Person. Program Committee is disjoint with Person. Preference disjointWith Person. Chairman is a subclass of Person. Bid disjointWith Person. User is a subclass of Person. Document disjointWith Person. Conference disjointWith Person. 'has Conflict Of Interest domain Person.' Email domain Person.
http://cmt#Preference,Source,Class,preference,"In the context of a conference, preference refers to the act of choosing or favoring one option over another. This could include preferences for session topics, presentation styles, networking opportunities, or even food and beverage choices. Understanding the preferences of conference attendees can help organizers tailor the event to better meet the needs and interests of participants.",Preference disjointWith ProgramCommittee. Preference is disjoint with Person. Preference disjointWith Decision. Preference is disjoint with Document. Preference is disjoint with Conference. Preference disjointWith Bid. Decision disjointWith Preference. Program Committee disjoint with Preference. Bid disjointWith Preference. Person disjointWith Preference. Document disjointWith Preference. Conference disjointWith Preference.
http://cmt#ProgramCommittee,Source,Class,program committee,"In the context of a conference, a Program Committee is a group of individuals responsible for selecting and organizing the presentations, panels, workshops, and other activities that will take place at the conference. The Program Committee plays a crucial role in shaping the overall content and structure of the conference program, ensuring that it is relevant, engaging, and of high quality for attendees. Members of the Program Committee typically have expertise in the subject matter of the conference and may come from academia, industry, or other relevant fields.","Program Committee is disjoint with Person. Program Committee disjoint with Conference. Program Committee disjoint with Preference. Program Committee disjoint with Decision. Program Committee disjoint with Bid. Program Committee is disjoint with Document. Decision disjointWith ProgramCommittee. Preference disjointWith ProgramCommittee. Bid disjointWith ProgramCommittee. Person is disjoint with ProgramCommittee. Document disjointWith ProgramCommittee. Conference is disjoint with ProgramCommittee. ""hasProgramCommitteeMember domain ProgramCommittee."" Member of Program Committee range Program Committee."
http://cmt#ProgramCommitteeChair,Source,Class,program committee chair,"The Program Committee Chair is responsible for overseeing the selection and organization of presentations, panels, and workshops at a conference. They work closely with the program committee to review submissions, create the conference schedule, and ensure that the content aligns with the conference theme and goals. The Program Committee Chair plays a crucial role in shaping the overall program and ensuring a successful and engaging conference experience for attendees.",ProgramCommitteeChair is a subclass of ProgramCommitteeMember. End review domain program committee chair.
http://cmt#ProgramCommitteeMember,Source,Class,program committee member,"A Program Committee Member is a member of the conference who is responsible for reviewing submissions and selecting which papers will be presented at the conference. They are part of the Program Committee, which includes all conference members except for Authors who are not also Reviewers.","ProgramCommitteeMember is a subclass of Person. ProgramCommitteeMember is a subclass of ConferenceMember. Program Committee Member disjoint with Author Not Reviewer. ProgramCommitteeChair is a subclass of ProgramCommitteeMember. AuthorNotReviewer disjointWith ProgramCommitteeMember. ""hasProgramCommitteeMember range ProgramCommitteeMember."" Member of Program Committee domain ProgramCommitteeMember. Set max papers range program committee member. Max Papers domain ProgramCommitteeMember. Added by domain ProgramCommitteeMember. Add Program Committee Member range ProgramCommitteeMember."
http://cmt#Rejection,Source,Class,rejection,"In the context of a conference, rejection refers to the act of denying a proposal, paper, or presentation from being accepted for inclusion in the conference program. This could be due to various reasons such as lack of relevance, poor quality, or not meeting the criteria set by the conference organizers. Rejection can be disappointing for the submitter, but it is a common part of the selection process in conferences to ensure the quality and relevance of the content presented.",Rejection disjointWith Acceptance. Rejection is a subclass of Decision. Acceptance disjointWith Rejection.
http://cmt#Review,Source,Class,review,"In the context of a conference, a review typically refers to a critical assessment or evaluation of a presentation, paper, or session that took place during the conference. Reviews are often conducted by peers, experts, or attendees to provide feedback on the quality, relevance, and impact of the content presented. These reviews can help organizers improve future conferences and help presenters refine their work.",Review disjointWith Paper. Review is a subclass of Document. Paper disjointWith Review. Meta-Review subClassOf Review. End review range review. Written by domain Review. Write review range review.
http://cmt#Reviewer,Source,Class,reviewer,"In the context of a conference, a reviewer is someone who evaluates and provides feedback on research papers or proposals submitted for presentation at the conference. Reviewers play a crucial role in ensuring the quality and relevance of the content presented at the conference. They assess the originality, methodology, significance, and overall quality of the submissions to help the conference organizers make informed decisions on which papers to accept for presentation.",Reviewer disjointWith AuthorNotReviewer. Reviewer disjointWith ExternalReviewer. Reviewer is a subclass of ConferenceMember. Reviewer is a subclass of User. Meta-Reviewer is a subclass of Reviewer. ExternalReviewer disjointWith Reviewer. AuthorNotReviewer disjointWith Reviewer. Assign reviewer range reviewer. Assigned by administrator domain reviewer. Adjust bid domain reviewer. Read paper domain reviewer. Adjusted by range reviewer. Has been assigned domain Reviewer. assigned By Reviewer range Reviewer. Assigned to range Reviewer. Read by reviewer range reviewer. Written by Range Reviewer. Write review domain reviewer. Assign external reviewer domain reviewer.
http://cmt#SubjectArea,Source,Class,subject area,"In the context of a conference, the term 'SubjectArea' refers to the specific topic or field of study that a presentation, paper, or discussion is focused on. It helps to categorize and organize the various sessions and presentations at the conference based on their subject matter. This allows attendees to easily identify and attend sessions that align with their interests and expertise.",The hasSubjectArea range SubjectArea.
http://cmt#User,Source,Class,user,"In the context of a conference, a user refers to an individual who is attending or participating in the conference. This could include attendees, speakers, organizers, and any other individuals involved in the event. Users may interact with conference materials, engage in discussions, network with others, and contribute to the overall experience of the conference.",User is a subclass of Person. Author is a subclass of User. Reviewer is a subclass of User. Administrator is a subclass of User.
http://cmt#acceptPaper,Source,Property,accept paper,"In the context of a conference, 'acceptPaper' refers to the decision made by the conference organizers or reviewers to approve a submitted paper for presentation at the conference. This decision is typically based on the quality, relevance, and originality of the paper in relation to the conference theme and criteria.",The paper is accepted by the inverse of accepted by. Accept paper domain administrator. Accept paper range paper. The property acceptedBy is the inverse of the property acceptPaper.
http://cmt#acceptedBy,Source,Property,accepted by,"In the context of a conference, 'acceptedBy' typically refers to the individuals or committee members who have reviewed and approved a submission, such as a paper or presentation, for inclusion in the conference program. These individuals or committee members are responsible for evaluating the quality and relevance of the submission and determining whether it meets the criteria for acceptance at the conference.",Accepted by Range Administrator. The domain Paper is accepted. The property acceptedBy is the inverse of the property acceptPaper. The paper is accepted by the inverse of accepted by.
http://cmt#acceptsHardcopySubmissions,Source,Property,accepts hardcopy submissions,The meaning of acceptsHardcopySubmissions in the context of a conference is whether or not the conference organizers will accept physical copies of submissions (such as papers or proposals) rather than only accepting electronic submissions. This information is important for participants who may prefer to submit their work in hardcopy format.,Accepts hard copy submissions range boolean. Accepts hard copy submissions for the conference.
http://cmt#addProgramCommitteeMember,Source,Property,add program committee member,The meaning of addProgramCommitteeMember in the context of a conference is to include a new member in the committee responsible for selecting and organizing the program for the conference. This individual would typically be an expert in the field related to the conference topic and would contribute their knowledge and expertise to ensure a successful and informative event.,Add Program Committee Member domain Administrator. Add Program Committee Member range Program Committee Member. Add Program Committee Member is the inverse of Added By. The inverse of addProgramCommitteeMember is addedBy.
http://cmt#addedBy,Source,Property,added by,"In the context of a conference, 'addedBy' typically refers to the person who added a particular item or information to the conference agenda, schedule, or platform. This could be a conference organizer, speaker, moderator, or any other individual involved in planning or managing the event.",Added by domain ProgramCommitteeMember. The program committee member was added by the inverse of adding a program committee member. Added by Range Administrator. The addProgramCommitteeMember is the inverseOf addedBy.
