entity,source_or_target,entity_type,initial_matching,lexical_matching,graphical_matching
source:Meta-Reviewer,Source,Class,meta reviewer,"In the context of a conference, a Meta-Reviewer is a person who oversees and reviews the evaluations made by other reviewers on a particular paper. They ensure that the reviews are consistent, fair, and of high quality. They also have the ability to submit their own review. The use of a Meta-Reviewer is optional and must be decided before the paper assignment process begins.",Meta-Reviewer is a subclass of Reviewer. The range of being read by a Meta-Reviewer is a Meta-Reviewer.
source:Reviewer,Source,Class,reviewer,"A reviewer in the context of a conference is a person or a group of people who evaluate or assess the quality, relevance, and merit of submitted papers or presentations. They provide feedback and recommendations on whether the submissions should be accepted, revised, or rejected. Reviewers play a crucial role in maintaining the academic or professional standards of a conference.","Reviewer and AuthorNotReviewer are completely separate, they do not overlap. Reviewer and ExternalReviewer are completely separate, they do not overlap. A Reviewer is a subclass of a Conference Member. A reviewer is a subclass of a user. Meta-Reviewer is a subclass of Reviewer. External Reviewer and Reviewer are completely separate, they do not overlap. The entity 'AuthorNotReviewer' is completely separate and does not overlap with the entity 'Reviewer'. The range of 'assignReviewer' is 'Reviewer'. The administrator assigns the domain to the reviewer. The domain of 'adjustBid' is 'Reviewer'. The action of reading a paper is within the domain of a Reviewer. The term 'adjustedBy' has a range of 'Reviewer'. The domain of 'hasBeenAssigned' is 'Reviewer'. The property 'assignedByReviewer' has a range of 'Reviewer'. The 'assignedTo' is in the range of 'Reviewer'. The action 'readByReviewer' is applicable to the range of 'Reviewer'. The range of 'writtenBy' is 'Reviewer'. The action of writing a review is within the domain of a Reviewer. The domain of assigning an external reviewer is a reviewer."
source:Decision,Source,Class,decision,"In the context of a conference, a decision refers to the determination or resolution made by the conference organizers or participants regarding a particular issue, topic, or action. This could be related to the conference's agenda, policies, future events, or any other matter that requires a collective agreement or judgement. For example, the decision to accept or reject a paper or presentation, the decision on the conference's date and venue, etc.",The concept of 'Decision' is completely separate and has no overlap with the concept of 'Person'. The concept of 'Decision' is completely separate and has no overlap with the concept of 'Document'. The concept of 'Decision' is completely separate and does not overlap with the concept of 'Preference'. The entity 'Decision' is disjoint with the entity 'ProgramCommittee'. The concept of 'Decision' is completely separate and does not overlap with the concept of 'Bid'. The concept of 'Decision' is completely separate and does not overlap with the concept of 'Conference'. The entity 'ProgramCommittee' is disjoint with the entity 'Decision'. The concept of 'Preference' is completely separate and does not overlap with the concept of 'Decision'. Acceptance is a subclass of Decision. The entity 'Bid' is disjoint with the entity 'Decision'. A person is completely separate and distinct from a decision. The document is completely separate and has no overlap with the decision. The concept of a Conference is completely separate and has no overlap with the concept of a Decision. Rejection is a subclass of Decision. The range of 'hasDecision' is 'Decision'.
source:Person,Source,Class,person,"In the context of a conference, a person usually refers to an individual who is participating in the event. This could be a speaker, attendee, organizer, sponsor, exhibitor, or any other role involved in the conference.",A person is completely separate and has no overlap with a preference. A person cannot be a program committee. A person cannot be a bid. A person cannot be a conference. A person is completely separate and distinct from a decision. A person is completely separate and different from a document. The concept of 'Decision' is completely separate and has no overlap with the concept of 'Person'. A Program Committee Member is a subclass of a Person. A Conference Member is a subclass of a Person. An External Reviewer is a subclass of a Person. The entity 'ProgramCommittee' is disjoint with the entity 'Person'. The category of Preference is completely separate and does not overlap with the category of Person. A Chairman is a subclass of a Person. The category 'Bid' is completely separate and has no overlap with the category 'Person'. A user is a subclass of a person. The entity 'Document' is disjoint with the entity 'Person'. The category of 'Conference' is completely separate and has no overlap with the category of 'Person'. A person has a domain of conflict of interest. The email domain of a person.
source:Document,Source,Class,document,"In the context of a conference, a document refers to any written, printed, or electronic material that provides information or evidence about a particular topic. This could include research papers, presentations, reports, agendas, minutes of meetings, or any other form of record related to the conference. These documents are often shared or presented during the conference for discussion or reference.",The document is completely separate and has no overlap with the bid. The document is completely separate and has no overlap with the decision. The entity 'Document' is disjoint with the entity 'ProgramCommittee'. The category 'Document' is completely separate and has no overlap with the category 'Conference'. The category 'Document' is completely separate and has no overlap with the category 'Person'. The entity 'Document' is disjoint with the entity 'Preference'. The concept of 'Decision' is completely separate and does not overlap with the concept of 'Document'. The entity 'ProgramCommittee' is disjoint with the entity 'Document'. The category of Preference is completely separate and does not overlap with the category of Document. A review is a subclass of a document. The category of 'Bid' is completely separate and has no overlap with the category of 'Document'. Paper is a subclass of Document. A person is completely separate and distinct from a document. The category of 'Conference' is completely separate and does not overlap with the category of 'Document'. The range of 'hasConflictOfInterest' is 'Document'.
source:Preference,Source,Class,preference,"In the context of a conference, preference often refers to the choices or selections made by attendees or organizers. This could include preferences for certain topics, speakers, sessions, or scheduling. For example, an attendee might have a preference for attending workshops over panel discussions, or an organizer might have a preference for scheduling certain popular sessions at prime times.",The category of Preference is completely separate and has no overlap with the category of ProgramCommittee. The concept of 'Preference' is completely separate and does not overlap with the concept of 'Person'. The concept of 'Preference' is completely separate and does not overlap with the concept of 'Decision'. The category of 'Preference' is completely separate and has no overlap with the category of 'Document'. The category of Preference is completely separate and has no overlap with the category of Conference. The category of Preference is completely separate and has no overlap with the category of Bid. The concept of 'Decision' is completely separate and does not overlap with the concept of 'Preference'. The entity 'ProgramCommittee' is disjoint with the entity 'Preference'. The category of 'Bid' is completely separate and has no overlap with the category of 'Preference'. The entity 'Person' is completely separate and has no overlap with the entity 'Preference'. The concept of a Document is completely separate and does not overlap with the concept of a Preference. The concept of a Conference is completely separate and does not overlap with the concept of Preference.
source:ProgramCommittee,Source,Class,program committee,"A Program Committee in the context of a conference is a group of individuals who are responsible for selecting and organizing the content of the conference. This includes reviewing and selecting presentations, arranging speakers, and setting the schedule for the conference. The committee members are usually experts in the field related to the conference topic.",The entity 'ProgramCommittee' is disjoint with the entity 'Person'. The entity 'ProgramCommittee' is disjoint with the entity 'Conference'. The entity 'ProgramCommittee' is disjoint with the entity 'Preference'. The entity 'ProgramCommittee' is disjoint with the entity 'Decision'. The entity 'ProgramCommittee' is disjoint with the entity 'Bid'. The entity 'ProgramCommittee' is disjoint with the entity 'Document'. The entity 'Decision' is disjoint with the entity 'ProgramCommittee'. The category of Preference is completely separate from the category of ProgramCommittee. The entity 'Bid' is disjoint with the entity 'ProgramCommittee'. A person is completely separate from a program committee. The entity 'Document' is disjoint with the entity 'ProgramCommittee'. The entity 'Conference' is disjoint with the entity 'ProgramCommittee'. The domain of 'hasProgramCommitteeMember' is 'ProgramCommittee'. The member of program committee is within the range of the program committee.
source:Bid,Source,Class,bid,"In the context of a conference, a bid refers to a proposal or application submitted by an individual, group, or city to host the event. This bid often includes details such as the proposed venue, accommodations, budget, and other logistical arrangements. The organization or committee in charge will then review these bids and select the most suitable one.",The category 'Bid' is completely separate and has no overlap with the category 'Document'. Bid is disjoint with Preference. The entity 'Bid' is disjoint with the entity 'ProgramCommittee'. The entity 'Bid' is disjoint with the entity 'Conference'. The entity 'Bid' is disjoint with the entity 'Decision'. The category 'Bid' is completely separate and has no overlap with the category 'Person'. The concept of 'Decision' is completely separate and does not overlap with the concept of 'Bid'. The entity 'ProgramCommittee' is disjoint with the entity 'Bid'. The concept of Preference is disjoint with the concept of Bid. A person cannot be a bid. The concept of a Document is completely separate and does not overlap with the concept of a Bid. The concept of a Conference is completely separate and has no overlap with the concept of a Bid. The range of 'hasBid' is 'Bid'. The range of adjustBid is Bid. The domain of 'adjustedBy' is 'Bid'.
source:Conference,Source,Class,conference,"A conference is a formal meeting where participants gather to discuss or exchange ideas, information, and views on a specific topic. It can be held in a physical location or virtually, and can involve a small group or thousands of participants. Conferences are often organized by professional associations, academic institutions, or businesses, and may feature presentations, workshops, panel discussions, and networking opportunities.",The concept of a Conference is completely separate and has no overlap with the concept of Preference. The concept of a Conference is completely separate and does not overlap with the concept of a Decision. The category of 'Conference' is completely separate and has no overlap with the category of 'Person'. The concept of a Conference is completely separate and has no overlap with the concept of a Bid. The entity 'Conference' is disjoint with the entity 'ProgramCommittee'. The category of 'Conference' is completely separate and does not overlap with the category of 'Document'. The concept of 'Decision' is completely separate and has no overlap with the concept of 'Conference'. The entity 'ProgramCommittee' is disjoint with the entity 'Conference'. The category of Preference is completely separate from the category of Conference. The category of 'Bid' is completely separate from the category of 'Conference'. A person cannot be a conference. The entity 'Document' is disjoint with the entity 'Conference'. The range of finalizing paper assignment is a conference. The domain of 'hasConferenceMember' is 'Conference'. The range of the runPaperAssignmentTools is a Conference. The range of 'enableVirtualMeeting' is 'Conference'. The range of the start of reviewer bidding for the conference. The domain of 'paperAssignmentFinalizedBy' is 'Conference'. The review criteria is entered by the domain of the conference. The domain of paper assignment tools run by is a conference. The domain of virtual meeting enabled by is Conference. The hardcopy mailing manifests are printed by the domain conference. The action 'enterConferenceDetails' has a range of 'Conference'. A member of a conference is within the range of the conference. The action of printing hardcopy mailing manifests is applicable to the context of a conference. The details are entered by the domain of the Conference. The domain of 'reviewerBiddingStartedBy' is 'Conference'. The 'enterReviewCriteria' is in the range of 'Conference'. The date is a domain of the Conference. The domain of reviews per paper is a conference. The logo URL is the domain of the Conference. The domain of 'acceptsHardcopySubmissions' is 'Conference'. The site URL domain is related to the Conference.
source:ConferenceChair,Source,Class,conference chair,"A Conference Chair is the person who leads or presides over a conference. They are responsible for planning and organizing the event, coordinating speakers and sessions, and ensuring that the conference runs smoothly. They may also play a role in fundraising, marketing, and other administrative tasks related to the event.",A Conference Chair is a subclass of Conference Member. The role of Conference Chair is completely separate and distinct from the role of Associated Chair. The entity 'AssociatedChair' is disjoint with the entity 'ConferenceChair'.
source:ConferenceMember,Source,Class,conference member,"A ConferenceMember refers to an individual who is part of a conference. This could be a participant, speaker, organizer, or attendee who is involved in the conference in some way. They may contribute to discussions, present papers, or simply attend to learn and network.",A ConferenceMember is a subclass of a Person. A Conference Chair is a subclass of Conference Member. A Program Committee Member is a subclass of a Conference Member. An Author is a subclass of a Conference Member. A Reviewer is a subclass of a Conference Member. An Associated Chair is a subclass of a Conference Member. The property 'hasConferenceMember' has a range of 'ConferenceMember'. A member of a conference is a domain of a conference member.
source:AssociatedChair,Source,Class,associated chair,"In the context of a conference, an Associated Chair is a person who assists the main chairperson in organizing and managing the conference. They may be responsible for specific tasks such as coordinating certain sessions, managing the review process for submitted papers, or handling logistical aspects of the conference. The exact role can vary depending on the specific conference and its structure.",An Associated Chair is a subclass of a Conference Member. The entity 'AssociatedChair' is disjoint with the entity 'ConferenceChair'. The entity 'Conference Chair' is disjoint with the entity 'Associated Chair'.
source:ProgramCommitteeMember,Source,Class,program committee member,"A ProgramCommitteeMember in the context of a conference refers to an individual who is part of the committee responsible for planning and organizing the conference program. This includes tasks such as selecting the topics, choosing speakers, reviewing submitted papers, and deciding on the schedule of events. These members are typically experts in the field and are not just authors of papers, but also reviewers who evaluate the quality and relevance of the submissions.",A Program Committee Member is a subclass of a Person. A Program Committee Member is a subclass of a Conference Member. A Program Committee Member cannot be an Author who is not a Reviewer. A Program Committee Chair is a subclass of a Program Committee Member. The entity 'AuthorNotReviewer' is disjoint with the entity 'ProgramCommitteeMember'. The range of 'hasProgramCommitteeMember' is 'ProgramCommitteeMember'. A member of program committee is in the domain of program committee member. The range of 'setMaxPapers' is 'ProgramCommitteeMember'. The domain of maxPapers is ProgramCommitteeMember. The domain of 'addedBy' is 'ProgramCommitteeMember'. The range of 'addProgramCommitteeMember' is 'ProgramCommitteeMember'.
source:AuthorNotReviewer,Source,Class,author not reviewer,AuthorNotReviewer typically refers to a role or rule in a conference setting where an individual who is an author of a paper or presentation is not allowed to be a reviewer of other papers or presentations. This is to ensure impartiality and avoid any potential conflicts of interest.,"The entity 'AuthorNotReviewer' is disjoint with the entity 'ProgramCommitteeMember'. The entity 'AuthorNotReviewer' is disjoint with the entity 'Reviewer'. The class 'AuthorNotReviewer' is a subclass of 'Author'. A Program Committee Member cannot be an Author who is not a Reviewer. Reviewer and AuthorNotReviewer are completely separate, they do not overlap."
source:SubjectArea,Source,Class,subject area,"In the context of a conference, Subject Area refers to the specific field or topic that the conference is focused on. This could be anything from artificial intelligence, climate change, medical research, to literature, depending on the nature of the conference. It helps potential attendees understand the content and relevance of the conference to their own work or interests.",The subject area range has a subject area.
source:ExternalReviewer,Source,Class,external reviewer,"In the context of a conference, an External Reviewer refers to an individual who is not part of the conference's organizing or review committee but is invited to evaluate and provide feedback on submitted papers or presentations. This person is usually an expert in the field related to the conference's theme. Their role is to ensure the quality and relevance of the content presented at the conference.","An External Reviewer is a subclass of a Person. External Reviewer and Reviewer are completely separate, they do not overlap. Reviewer is not the same as ExternalReviewer. The domain of 'assignedByReviewer' is 'ExternalReviewer'. The range of 'assignExternalReviewer' is 'ExternalReviewer'."
source:Chairman,Source,Class,chairman,"In the context of a conference, a Chairman is the person who leads or prescribes the order of events. They are responsible for guiding the discussion, maintaining order, and ensuring that the conference runs smoothly. They may also introduce speakers, facilitate question and answer sessions, and summarize the proceedings.",A Chairman is a subclass of a Person.
source:ProgramCommitteeChair,Source,Class,program committee chair,"A Program Committee Chair is a person who leads the program committee for a conference. This committee is responsible for planning and organizing the content of the conference, including selecting speakers, arranging sessions, and overseeing the review process for submitted papers or presentations. The chairperson typically makes final decisions and ensures everything runs smoothly.",A Program Committee Chair is a subclass of a Program Committee Member. The endReview is a domain of ProgramCommitteeChair.
source:Acceptance,Source,Class,acceptance,"In the context of a conference, acceptance usually refers to the approval of a proposal, abstract, or paper submitted by researchers or participants for presentation. Once reviewed and accepted by the conference committee, the authors are invited to present their work at the conference.",Acceptance and Rejection are mutually exclusive. Acceptance is a subclass of Decision. Rejection is completely separate from Acceptance.
source:Rejection,Source,Class,rejection,"In the context of a conference, rejection refers to the decision made by the conference organizers or committee not to accept a particular submission. This could be a proposal for a presentation, a research paper, a workshop, etc. The reasons for rejection can vary, including but not limited to, lack of originality, poor quality, irrelevance to the conference theme, or lack of space in the conference schedule.",Rejection is completely separate from Acceptance. Rejection is a subclass of Decision. Acceptance is completely separate from Rejection.
source:Review,Source,Class,review,"In the context of a conference, a review typically refers to the process of evaluating or assessing the content of presentations, papers, or proposals submitted for inclusion in the conference. This is often done by a panel of experts or peers in the field. The review process helps to ensure that the content presented at the conference is of high quality and relevance to the conference's theme or topic.",The category of 'Review' is completely separate from the category of 'Paper'. A review is a subclass of a document. Paper is completely separate from Review. Meta-Review is a subclass of Review. The range of 'endReview' is 'Review'. The domain of 'writtenBy' is 'Review'. The action 'writeReview' has a range of 'Review'.
source:Paper,Source,Class,paper,"In the context of a conference, a paper refers to a scholarly article or study that is written by researchers or experts in the field. It presents original research, findings, or a review of existing work. These papers are often presented at conferences as a way of sharing the information with others in the field. They are usually peer-reviewed and may be published in academic journals.",Paper is a subclass of Document. Paper is completely separate from Review. The category of 'Review' is completely separate from the category of 'Paper'. A paper abstract is a subclass of a paper. The full version of a paper is a subclass of paper. A paper has a co-author. The range of the action 'rejectPaper' is 'Paper'. The domain of 'hasBid' is 'Paper'. The action of reading a paper is applicable to the range of Paper. The term 'markConflictOfInterest' has a range of 'Paper'. The range of co-writing a paper is a paper. The range of 'hasBeenAssigned' is 'Paper'. The domain of 'hasDecision' is 'Paper'. The domain of 'assignedTo' is 'Paper'. The subject area of a paper is its domain. The range of the action 'submitPaper' is 'Paper'. The domain of 'readByReviewer' is 'Paper'. The domain of the paperID is Paper. The title is in the domain of the Paper. The range of 'acceptPaper' is 'Paper'. The domain of 'hasAuthor' is 'Paper'. The domain of 'acceptedBy' is 'Paper'. The domain of 'rejectedBy' is 'Paper'. The domain of 'readByMeta-Reviewer' is 'Paper'. The range of 'writePaper' is 'Paper'.
source:Author,Source,Class,author,"In the context of a conference, an author is typically the person who has written or contributed to a research paper, study, or presentation that is being shared or discussed at the conference. They are responsible for the content and findings of the work being presented.",An Author is a subclass of a Conference Member. The author is a subclass of the user. A co-author is a subclass of an author. The class 'AuthorNotReviewer' is a subclass of 'Author'. The domain of submitting a paper is the author. The property 'hasAuthor' has the range 'Author'. The domain of writing a paper is the author.
source:User,Source,Class,user,"In the context of a conference, a user refers to an individual who is utilizing or participating in the conference services. This could be an attendee, a speaker, or an organizer who is using the conference platform or tools for communication, presentation, networking, etc.",A user is a subclass of a person. An author is a subclass of a user. A Reviewer is a subclass of User. An Administrator is a subclass of User.
source:Co-author,Source,Class,co author,A co-author is a person who contributes to the creation or development of a conference paper or presentation along with one or more other individuals. They share the credit for the work and are often listed on the publication or presentation materials.,A co-author is a subclass of an author. The range of 'hasCo-author' is 'Co-author'. The domain of co-writing a paper is a co-author.
source:PaperAbstract,Source,Class,paper abstract,"In the context of a conference, a Paper Abstract refers to a brief summary of a research paper that is going to be presented. It provides a concise overview of the research, including the purpose of the study, methodology used, main findings, and conclusion. This allows attendees to understand the key points of the paper without reading the whole document. It's often used to help attendees decide which presentations they want to attend.",A paper abstract is a subclass of a paper.
source:PaperFullVersion,Source,Class,paper full version,"In the context of a conference, 'PaperFullVersion' refers to the complete and detailed version of a research paper that is submitted for review and presentation. This is typically a comprehensive document that includes the research question, methodology, data, analysis, results, and conclusion. It is more detailed than an abstract or a short paper.",The full version of a paper is a subclass of paper.
